timestamp	file	round	quality	density	status	description
2026-04-07 12:24:32	C:\Users\PC\AppData\Local\Temp\pytest-of-PC\pytest-2397\test_budget_stops_loop0\test_artifact.md	1	5.0	0.95	discard	small change
2026-04-07 12:28:32	C:\Users\PC\AppData\Local\Temp\pytest-of-PC\pytest-2398\test_already_at_target0\scored.md	0	9.2	1.00	skip	already at target
2026-04-07 12:28:33	C:\Users\PC\AppData\Local\Temp\pytest-of-PC\pytest-2398\test_returns_dict0\test_artifact.md	1	8.7	0.97	keep	polished formatting (whitespace cleanup)
2026-04-07 12:28:33	C:\Users\PC\AppData\Local\Temp\pytest-of-PC\pytest-2398\test_skips_already_at_target0\test_artifact.md	0	9.5	0.97	skip	already at target
2026-04-07 12:28:33	C:\Users\PC\AppData\Local\Temp\pytest-of-PC\pytest-2398\test_keep_on_improvement0\test_artifact.md	1	8.5	0.95	keep	added examples
2026-04-07 12:28:33	C:\Users\PC\AppData\Local\Temp\pytest-of-PC\pytest-2398\test_discard_on_no_improvement0\test_artifact.md	1	6.5	0.95	discard	tried something
2026-04-07 12:28:33	C:\Users\PC\AppData\Local\Temp\pytest-of-PC\pytest-2398\test_budget_stops_loop0\test_artifact.md	1	5.0	0.95	discard	small change
2026-04-07 15:43:03	C:\Users\PC\Documents\GitHub\cex\.cex\runtime\plans\mission_infinite_bootstrap.md	1	8.6	1.00	keep	added density_score: 1.0
2026-04-07 15:43:03	C:\Users\PC\Documents\GitHub\cex\.cex\runtime\plans\mission_infinite_bootstrap.md	2	8.6	1.00	discard	tldr flagged for manual review
2026-04-07 15:43:04	C:\Users\PC\Documents\GitHub\cex\.cex\runtime\plans\mission_infinite_bootstrap.md	3	8.6	1.00	discard	tldr flagged for manual review
2026-04-07 15:43:04	C:\Users\PC\Documents\GitHub\cex\.cex\runtime\plans\mission_quality_sweep.md	1	8.5	1.00	keep	added density_score: 1.0
2026-04-07 15:43:05	C:\Users\PC\Documents\GitHub\cex\.cex\runtime\plans\mission_quality_sweep.md	2	8.5	1.00	discard	tldr flagged for manual review
2026-04-07 15:43:05	C:\Users\PC\Documents\GitHub\cex\.cex\runtime\plans\mission_quality_sweep.md	3	8.5	1.00	discard	tldr flagged for manual review
2026-04-07 15:43:06	C:\Users\PC\Documents\GitHub\cex\.cex\runtime\plans\mission_remaining_gaps.md	1	8.7	1.00	keep	added density_score: 1.0
2026-04-07 15:43:06	C:\Users\PC\Documents\GitHub\cex\.cex\runtime\plans\mission_remaining_gaps.md	2	8.7	1.00	discard	tldr flagged for manual review
2026-04-07 15:43:06	C:\Users\PC\Documents\GitHub\cex\.cex\runtime\plans\mission_remaining_gaps.md	3	8.7	1.00	discard	tldr flagged for manual review
2026-04-07 15:43:07	C:\Users\PC\Documents\GitHub\cex\archetypes\builders\citation-builder\bld_quality_gate_citation.md	1	8.9	1.00	keep	polished formatting (whitespace cleanup)
2026-04-07 15:43:07	C:\Users\PC\Documents\GitHub\cex\archetypes\builders\citation-builder\bld_quality_gate_citation.md	2	8.9	1.00	discard	polished formatting (whitespace cleanup)
2026-04-07 15:43:07	C:\Users\PC\Documents\GitHub\cex\archetypes\builders\citation-builder\bld_quality_gate_citation.md	3	8.9	1.00	discard	polished formatting (whitespace cleanup)
2026-04-07 15:43:08	C:\Users\PC\Documents\GitHub\cex\archetypes\builders\citation-builder\bld_system_prompt_citation.md	1	8.9	0.79	keep	analyzed: increase_density: remove filler words, compress prose into tables
2026-04-07 15:43:08	C:\Users\PC\Documents\GitHub\cex\archetypes\builders\citation-builder\bld_system_prompt_citation.md	2	8.9	0.79	discard	analyzed: increase_density: remove filler words, compress prose into tables
2026-04-07 15:43:09	C:\Users\PC\Documents\GitHub\cex\archetypes\builders\citation-builder\bld_system_prompt_citation.md	3	8.9	0.79	discard	analyzed: increase_density: remove filler words, compress prose into tables
2026-04-07 15:43:09	C:\Users\PC\Documents\GitHub\cex\archetypes\builders\context-window-config-builder\bld_quality_gate_context_window_config.md	1	8.9	1.00	keep	polished formatting (whitespace cleanup)
2026-04-07 15:43:10	C:\Users\PC\Documents\GitHub\cex\archetypes\builders\context-window-config-builder\bld_quality_gate_context_window_config.md	2	8.9	1.00	discard	polished formatting (whitespace cleanup)
2026-04-07 15:43:10	C:\Users\PC\Documents\GitHub\cex\archetypes\builders\context-window-config-builder\bld_quality_gate_context_window_config.md	3	8.9	1.00	discard	polished formatting (whitespace cleanup)
2026-04-07 15:43:11	C:\Users\PC\Documents\GitHub\cex\archetypes\builders\context-window-config-builder\bld_system_prompt_context_window_config.md	1	8.9	0.86	keep	analyzed: increase_density: remove filler words, compress prose into tables
2026-04-07 15:43:11	C:\Users\PC\Documents\GitHub\cex\archetypes\builders\context-window-config-builder\bld_system_prompt_context_window_config.md	2	8.9	0.86	discard	analyzed: increase_density: remove filler words, compress prose into tables
2026-04-07 15:43:11	C:\Users\PC\Documents\GitHub\cex\archetypes\builders\context-window-config-builder\bld_system_prompt_context_window_config.md	3	8.9	0.86	discard	analyzed: increase_density: remove filler words, compress prose into tables
2026-04-07 15:43:12	C:\Users\PC\Documents\GitHub\cex\archetypes\builders\multi-modal-config-builder\bld_quality_gate_multi_modal_config.md	1	8.9	1.00	keep	polished formatting (whitespace cleanup)
2026-04-07 15:43:12	C:\Users\PC\Documents\GitHub\cex\archetypes\builders\multi-modal-config-builder\bld_quality_gate_multi_modal_config.md	2	8.9	1.00	discard	polished formatting (whitespace cleanup)
2026-04-07 15:43:13	C:\Users\PC\Documents\GitHub\cex\archetypes\builders\multi-modal-config-builder\bld_quality_gate_multi_modal_config.md	3	8.9	1.00	discard	polished formatting (whitespace cleanup)
2026-04-07 15:43:13	C:\Users\PC\Documents\GitHub\cex\archetypes\builders\multi-modal-config-builder\bld_system_prompt_multi_modal_config.md	1	8.9	0.86	keep	analyzed: increase_density: remove filler words, compress prose into tables
2026-04-07 15:43:14	C:\Users\PC\Documents\GitHub\cex\archetypes\builders\multi-modal-config-builder\bld_system_prompt_multi_modal_config.md	2	8.9	0.86	discard	analyzed: increase_density: remove filler words, compress prose into tables
2026-04-07 15:43:14	C:\Users\PC\Documents\GitHub\cex\archetypes\builders\multi-modal-config-builder\bld_system_prompt_multi_modal_config.md	3	8.9	0.86	discard	analyzed: increase_density: remove filler words, compress prose into tables
2026-04-07 15:43:15	C:\Users\PC\Documents\GitHub\cex\archetypes\builders\prompt-cache-builder\bld_quality_gate_prompt_cache.md	1	8.9	1.00	keep	polished formatting (whitespace cleanup)
2026-04-07 15:43:15	C:\Users\PC\Documents\GitHub\cex\archetypes\builders\prompt-cache-builder\bld_quality_gate_prompt_cache.md	2	8.9	1.00	discard	polished formatting (whitespace cleanup)
2026-04-07 15:43:15	C:\Users\PC\Documents\GitHub\cex\archetypes\builders\prompt-cache-builder\bld_quality_gate_prompt_cache.md	3	8.9	1.00	discard	polished formatting (whitespace cleanup)
2026-04-07 15:43:16	C:\Users\PC\Documents\GitHub\cex\archetypes\builders\prompt-cache-builder\bld_system_prompt_prompt_cache.md	1	8.9	0.82	keep	analyzed: increase_density: remove filler words, compress prose into tables
2026-04-07 15:43:16	C:\Users\PC\Documents\GitHub\cex\archetypes\builders\prompt-cache-builder\bld_system_prompt_prompt_cache.md	2	8.9	0.82	discard	analyzed: increase_density: remove filler words, compress prose into tables
2026-04-07 15:43:16	C:\Users\PC\Documents\GitHub\cex\archetypes\builders\prompt-cache-builder\bld_system_prompt_prompt_cache.md	3	8.9	0.82	discard	analyzed: increase_density: remove filler words, compress prose into tables
2026-04-07 15:43:17	C:\Users\PC\Documents\GitHub\cex\N04_knowledge\architecture\task_queue_spec.md	1	9.2	1.00	keep	analyzed: reduce_prose: convert long prose sections into tables or bullet lists
2026-04-07 15:43:18	C:\Users\PC\Documents\GitHub\cex\N07_admin\memory\deep_architecture_audit.md	1	9.1	1.00	keep	analyzed: reduce_prose: convert long prose sections into tables or bullet lists
2026-04-07 15:43:19	C:\Users\PC\Documents\GitHub\cex\N07_admin\memory\industry_terminology_audit.md	1	9.1	1.00	keep	polished formatting (whitespace cleanup)
2026-04-07 15:43:19	C:\Users\PC\Documents\GitHub\cex\N07_admin\memory\terminology_standardization.md	1	9.1	1.00	keep	analyzed: reduce_prose: convert long prose sections into tables or bullet lists
2026-04-07 15:43:20	C:\Users\PC\Documents\GitHub\cex\N07_admin\memory\user_directive_technical_authority.md	1	9.0	1.00	keep	polished formatting (whitespace cleanup)
2026-04-07 15:43:21	C:\Users\PC\Documents\GitHub\cex\P01_knowledge\library\domain\meta\kc_brand_variable_audit.md	1	9.1	1.00	keep	added density_score: 1.0
2026-04-07 15:43:21	C:\Users\PC\Documents\GitHub\cex\P01_knowledge\library\domain\_reference\kc_terminology_anthropic_canonical.md	1	9.1	1.00	keep	tldr flagged for manual review
2026-04-07 15:43:22	C:\Users\PC\Documents\GitHub\cex\P01_knowledge\library\domain\_reference\kc_terminology_google_mcp_canonical.md	1	9.1	1.00	keep	polished formatting (whitespace cleanup)
2026-04-07 15:43:23	C:\Users\PC\Documents\GitHub\cex\P01_knowledge\library\domain\_reference\kc_terminology_openai_canonical.md	1	9.1	1.00	keep	polished formatting (whitespace cleanup)
2026-04-07 15:43:23	C:\Users\PC\Documents\GitHub\cex\P01_knowledge\library\domain\_reference\kc_terminology_rosetta_stone.md	1	9.2	1.00	keep	tldr flagged for manual review
2026-04-07 15:43:24	C:\Users\PC\Documents\GitHub\cex\P01_knowledge\library\kind\kc_citation.md	1	9.1	1.00	keep	analyzed: reduce_prose: convert long prose sections into tables or bullet lists
2026-04-07 15:43:25	C:\Users\PC\Documents\GitHub\cex\P01_knowledge\library\kind\kc_context_window_config.md	1	9.1	1.00	keep	analyzed: reduce_prose: convert long prose sections into tables or bullet lists
2026-04-07 15:43:25	C:\Users\PC\Documents\GitHub\cex\P01_knowledge\library\kind\kc_multi_modal_config.md	1	9.1	1.00	keep	analyzed: reduce_prose: convert long prose sections into tables or bullet lists
2026-04-07 15:43:26	C:\Users\PC\Documents\GitHub\cex\P01_knowledge\library\kind\kc_prompt_cache.md	1	9.1	1.00	keep	analyzed: reduce_prose: convert long prose sections into tables or bullet lists
2026-04-07 15:43:27	C:\Users\PC\Documents\GitHub\cex\_docs\specs\spec_infinite_bootstrap_loop.md	1	9.0	1.00	keep	added density_score: 1.0
2026-04-07 15:43:28	C:\Users\PC\Documents\GitHub\cex\_docs\specs\spec_n07_bootstrap_context.md	1	8.9	1.00	keep	tldr flagged for manual review
2026-04-07 15:43:28	C:\Users\PC\Documents\GitHub\cex\_docs\specs\spec_n07_bootstrap_context.md	2	8.9	1.00	discard	tldr flagged for manual review
2026-04-07 15:43:28	C:\Users\PC\Documents\GitHub\cex\_docs\specs\spec_n07_bootstrap_context.md	3	8.9	1.00	discard	tldr flagged for manual review
2026-04-07 16:06:57	archetypes\builders\citation-builder\bld_quality_gate_citation.md	1	8.9	1.00	discard	polished formatting (whitespace cleanup)
2026-04-07 16:06:57	archetypes\builders\citation-builder\bld_quality_gate_citation.md	2	8.9	1.00	discard	polished formatting (whitespace cleanup)
2026-04-07 16:06:58	archetypes\builders\citation-builder\bld_quality_gate_citation.md	3	8.9	1.00	discard	polished formatting (whitespace cleanup)
2026-04-07 16:06:59	archetypes\builders\citation-builder\bld_quality_gate_citation.md	4	8.9	1.00	discard	polished formatting (whitespace cleanup)
2026-04-07 16:07:00	archetypes\builders\citation-builder\bld_quality_gate_citation.md	5	8.9	1.00	discard	polished formatting (whitespace cleanup)
2026-04-13 10:34:20	C:\Users\CEX\Documents\GitHub\cex\.cex\archive\examples\p02_agent_petshop_crm.md	1	9.1	1.00	keep	analyzed: reduce_prose: convert long prose sections into tables or bullet lists
2026-04-13 10:34:21	C:\Users\CEX\Documents\GitHub\cex\.cex\archive\examples\p03_pt_instagram_content_v1.md	1	9.0	1.00	keep	analyzed: reduce_prose: convert long prose sections into tables or bullet lists
2026-04-13 10:34:21	C:\Users\CEX\Documents\GitHub\cex\.cex\archive\examples\p05_lp_pet_crm_v1.md	1	9.1	0.98	keep	added density_score: 0.98
2026-04-13 10:34:21	C:\Users\CEX\Documents\GitHub\cex\.cex\archive\examples\p12_sc_instagram_content_weekly.md	1	8.7	1.00	keep	added density_score: 1.0
2026-04-13 10:34:22	C:\Users\CEX\Documents\GitHub\cex\.cex\archive\reports\self_audit_2026_04_11.md	1	9.1	1.00	keep	added density_score: 1.0
2026-04-13 10:34:22	C:\Users\CEX\Documents\GitHub\cex\.cex\archive\reports\self_audit_codex_2026_04_11.md	1	9.0	1.00	keep	added density_score: 1.0
2026-04-13 10:34:22	C:\Users\CEX\Documents\GitHub\cex\.cex\archive\reports\self_audit_gemini_2026_04_11.md	1	8.6	0.90	keep	added density_score: 0.9
2026-04-13 10:34:23	C:\Users\CEX\Documents\GitHub\cex\archetypes\builders\prompt-compiler-builder\bld_architecture_prompt_compiler.md	1	9.1	1.00	keep	polished formatting (whitespace cleanup)
2026-04-13 10:34:23	C:\Users\CEX\Documents\GitHub\cex\archetypes\builders\prompt-compiler-builder\bld_collaboration_prompt_compiler.md	1	9.0	1.00	keep	polished formatting (whitespace cleanup)
2026-04-13 10:34:23	C:\Users\CEX\Documents\GitHub\cex\archetypes\builders\prompt-compiler-builder\bld_config_prompt_compiler.md	1	9.0	1.00	keep	polished formatting (whitespace cleanup)
2026-04-13 10:34:24	C:\Users\CEX\Documents\GitHub\cex\archetypes\builders\prompt-compiler-builder\bld_examples_prompt_compiler.md	1	9.0	1.00	keep	analyzed: reduce_prose: convert long prose sections into tables or bullet lists
2026-04-13 10:34:24	C:\Users\CEX\Documents\GitHub\cex\archetypes\builders\prompt-compiler-builder\bld_instruction_prompt_compiler.md	1	9.1	1.00	keep	analyzed: reduce_prose: convert long prose sections into tables or bullet lists
2026-04-13 10:34:24	C:\Users\CEX\Documents\GitHub\cex\archetypes\builders\prompt-compiler-builder\bld_knowledge_card_prompt_compiler.md	1	9.0	1.00	keep	polished formatting (whitespace cleanup)
2026-04-13 10:34:24	C:\Users\CEX\Documents\GitHub\cex\archetypes\builders\prompt-compiler-builder\bld_manifest_prompt_compiler.md	1	9.0	1.00	keep	analyzed: reduce_prose: convert long prose sections into tables or bullet lists
2026-04-13 10:34:25	C:\Users\CEX\Documents\GitHub\cex\archetypes\builders\prompt-compiler-builder\bld_memory_prompt_compiler.md	1	8.9	0.77	keep	analyzed: reduce_prose: convert long prose sections into tables or bullet lists
2026-04-13 10:34:25	C:\Users\CEX\Documents\GitHub\cex\archetypes\builders\prompt-compiler-builder\bld_output_template_prompt_compiler.md	1	9.1	1.00	keep	polished formatting (whitespace cleanup)
2026-04-13 10:34:25	C:\Users\CEX\Documents\GitHub\cex\archetypes\builders\prompt-compiler-builder\bld_quality_gate_prompt_compiler.md	1	9.0	1.00	keep	analyzed: add_tags: minimum 3 tags required
2026-04-13 10:34:26	C:\Users\CEX\Documents\GitHub\cex\archetypes\builders\prompt-compiler-builder\bld_schema_prompt_compiler.md	1	9.1	1.00	keep	analyzed: reduce_prose: convert long prose sections into tables or bullet lists
2026-04-13 10:34:26	C:\Users\CEX\Documents\GitHub\cex\archetypes\builders\prompt-compiler-builder\bld_system_prompt_prompt_compiler.md	1	9.0	0.86	keep	analyzed: reduce_prose: convert long prose sections into tables or bullet lists
2026-04-13 10:34:26	C:\Users\CEX\Documents\GitHub\cex\archetypes\builders\prompt-compiler-builder\bld_tools_prompt_compiler.md	1	9.1	1.00	keep	polished formatting (whitespace cleanup)
2026-04-13 10:34:27	C:\Users\CEX\Documents\GitHub\cex\N06_commercial\architecture\agent_card_commercial.md	1	9.1	1.00	keep	tldr flagged for manual review
2026-04-13 10:34:27	C:\Users\CEX\Documents\GitHub\cex\P01_knowledge\examples\p01_ctx_cex_project.md	1	9.0	1.00	keep	analyzed: fix_frontmatter: missing title
2026-04-13 10:34:27	C:\Users\CEX\Documents\GitHub\cex\P01_knowledge\examples\p01_kc_cex_project_overview.md	1	9.1	1.00	keep	polished formatting (whitespace cleanup)
2026-04-13 10:34:28	C:\Users\CEX\Documents\GitHub\cex\P01_knowledge\examples\p01_kc_system_testing_patterns.md	1	9.1	1.00	keep	tldr flagged for manual review
2026-04-13 10:34:28	C:\Users\CEX\Documents\GitHub\cex\P01_knowledge\library\domain\kc_input_intent_resolution.md	1	9.1	1.00	keep	tldr flagged for manual review
2026-04-13 10:34:28	C:\Users\CEX\Documents\GitHub\cex\P01_knowledge\library\domain\kc_template_catalog.md	1	9.1	1.00	keep	tldr flagged for manual review
2026-04-13 10:34:29	C:\Users\CEX\Documents\GitHub\cex\P01_knowledge\library\domain\meta\kc_instance_variable_registry.md	1	9.1	1.00	keep	analyzed: reduce_prose: convert long prose sections into tables or bullet lists
2026-04-13 10:34:29	C:\Users\CEX\Documents\GitHub\cex\P01_knowledge\library\kind\kc_batch_config.md	1	9.1	1.00	keep	analyzed: reduce_prose: convert long prose sections into tables or bullet lists
2026-04-13 10:34:29	C:\Users\CEX\Documents\GitHub\cex\P01_knowledge\library\kind\kc_cost_budget.md	1	9.1	1.00	keep	analyzed: reduce_prose: convert long prose sections into tables or bullet lists
2026-04-13 10:34:30	C:\Users\CEX\Documents\GitHub\cex\P01_knowledge\library\kind\kc_env_config.md	1	8.7	1.00	keep	added density_score: 1.0
2026-04-13 10:34:30	C:\Users\CEX\Documents\GitHub\cex\P01_knowledge\library\kind\kc_experiment_config.md	1	9.1	1.00	keep	analyzed: reduce_prose: convert long prose sections into tables or bullet lists
2026-04-13 10:34:30	C:\Users\CEX\Documents\GitHub\cex\P01_knowledge\library\kind\kc_finetune_config.md	1	9.1	1.00	keep	analyzed: reduce_prose: convert long prose sections into tables or bullet lists
2026-04-13 10:34:31	C:\Users\CEX\Documents\GitHub\cex\P01_knowledge\library\kind\kc_guardrail.md	1	8.8	1.00	keep	added density_score: 1.0
2026-04-13 10:34:31	C:\Users\CEX\Documents\GitHub\cex\P01_knowledge\library\kind\kc_hitl_config.md	1	9.1	1.00	keep	analyzed: reduce_prose: convert long prose sections into tables or bullet lists
2026-04-13 10:34:31	C:\Users\CEX\Documents\GitHub\cex\P01_knowledge\library\kind\kc_knowledge_graph.md	1	9.1	1.00	keep	analyzed: reduce_prose: convert long prose sections into tables or bullet lists
2026-04-13 10:34:32	C:\Users\CEX\Documents\GitHub\cex\P01_knowledge\library\kind\kc_multi_model_orchestration.md	1	8.7	1.00	keep	added density_score: 1.0
2026-04-13 10:34:32	C:\Users\CEX\Documents\GitHub\cex\P01_knowledge\library\kind\kc_n07_orchestrator.md	1	8.8	0.95	keep	added density_score: 0.95
2026-04-13 10:34:32	C:\Users\CEX\Documents\GitHub\cex\P01_knowledge\library\kind\kc_ontology.md	1	8.7	1.00	keep	added density_score: 1.0
2026-04-13 10:34:33	C:\Users\CEX\Documents\GitHub\cex\P01_knowledge\library\kind\kc_prompt_compiler.md	1	9.2	1.00	keep	analyzed: reduce_prose: convert long prose sections into tables or bullet lists
2026-04-13 10:34:33	C:\Users\CEX\Documents\GitHub\cex\P01_knowledge\library\kind\kc_streaming_config.md	1	8.9	1.00	keep	added density_score: 1.0
2026-04-13 10:34:34	C:\Users\CEX\Documents\GitHub\cex\P01_knowledge\library\kind\kc_system_prompt.md	1	8.8	0.99	keep	added density_score: 0.99
2026-04-13 10:34:34	C:\Users\CEX\Documents\GitHub\cex\P03_prompt\layers\p03_ins_action_protocol.md	1	9.1	0.98	keep	analyzed: reduce_prose: convert long prose sections into tables or bullet lists
2026-04-13 10:34:34	C:\Users\CEX\Documents\GitHub\cex\P03_prompt\layers\p03_ins_doing_tasks.md	1	8.9	0.95	keep	analyzed: reduce_prose: convert long prose sections into tables or bullet lists
2026-04-13 10:34:35	C:\Users\CEX\Documents\GitHub\cex\P03_prompt\layers\p03_pc_cex_universal.md	1	9.2	1.00	keep	analyzed: reduce_prose: convert long prose sections into tables or bullet lists
2026-04-13 10:34:35	C:\Users\CEX\Documents\GitHub\cex\P03_prompt\layers\p03_sp_cex_core_identity.md	1	8.8	0.92	keep	polished formatting (whitespace cleanup)
2026-04-13 10:34:35	C:\Users\CEX\Documents\GitHub\cex\P03_prompt\layers\p03_sp_verification_agent.md	1	9.1	1.00	keep	analyzed: reduce_prose: convert long prose sections into tables or bullet lists
2026-04-13 10:34:36	C:\Users\CEX\Documents\GitHub\cex\P04_tools\layers\p04_skill_compact.md	1	8.8	1.00	keep	polished formatting (whitespace cleanup)
2026-04-13 10:34:36	C:\Users\CEX\Documents\GitHub\cex\P04_tools\layers\p04_skill_memory_extract.md	1	9.0	0.98	keep	polished formatting (whitespace cleanup)
2026-04-13 10:34:36	C:\Users\CEX\Documents\GitHub\cex\P04_tools\layers\p04_skill_simplify.md	1	8.8	0.94	keep	polished formatting (whitespace cleanup)
2026-04-13 10:34:37	C:\Users\CEX\Documents\GitHub\cex\P04_tools\layers\p04_skill_verify.md	1	8.8	0.98	keep	polished formatting (whitespace cleanup)
2026-04-13 10:34:37	C:\Users\CEX\Documents\GitHub\cex\P04_tools\templates\tpl_retriever_business_intel.md	1	9.1	1.00	keep	added updated: 2026-04-13
2026-04-13 10:34:37	C:\Users\CEX\Documents\GitHub\cex\P04_tools\templates\tpl_search_tool_business_discovery.md	1	9.1	1.00	keep	added updated: 2026-04-13
2026-04-13 10:34:38	C:\Users\CEX\Documents\GitHub\cex\P08_architecture\layers\p08_ac_explore.md	1	8.9	1.00	keep	polished formatting (whitespace cleanup)
2026-04-13 10:34:38	C:\Users\CEX\Documents\GitHub\cex\P08_architecture\layers\p08_ac_plan.md	1	8.9	1.00	keep	polished formatting (whitespace cleanup)
2026-04-13 10:34:38	C:\Users\CEX\Documents\GitHub\cex\P08_architecture\layers\p08_ac_verification.md	1	8.9	1.00	keep	polished formatting (whitespace cleanup)
2026-04-13 10:34:39	C:\Users\CEX\Documents\GitHub\cex\P08_architecture\layers\p08_pat_context_compaction.md	1	9.1	1.00	keep	analyzed: reduce_prose: convert long prose sections into tables or bullet lists
2026-04-13 10:34:39	C:\Users\CEX\Documents\GitHub\cex\P11_feedback\layers\p11_gr_action_reversibility.md	1	9.0	1.00	keep	polished formatting (whitespace cleanup)
2026-04-13 10:34:39	C:\Users\CEX\Documents\GitHub\cex\P11_feedback\layers\p11_gr_cyber_risk.md	1	9.1	1.00	keep	analyzed: reduce_prose: convert long prose sections into tables or bullet lists
2026-04-13 10:34:40	C:\Users\CEX\Documents\GitHub\cex\P11_feedback\templates\tpl_learning_record_autonomy.md	1	9.1	1.00	keep	added updated: 2026-04-13
2026-04-13 10:34:40	C:\Users\CEX\Documents\GitHub\cex\P12_orchestration\templates\tpl_brand_context_nucleus.md	1	8.7	1.00	keep	added updated: 2026-04-13
