timestamp	file	round	quality	density	status	description
2026-04-01 20:07:36	C:\Users\PC\Documents\GitHub\cex\P01_knowledge\examples\p03_prompt_template_create_prompt_template_for_creation_tasks.md	1	9.0	1.00	keep	analyzed: reduce_prose: convert long prose sections into tables or bullet lists
2026-04-01 20:07:39	C:\Users\PC\Documents\GitHub\cex\P01_knowledge\examples\p03_prompt_template_create_prompt_template_for_creation_tasks.md	1	8.9	0.98	keep	analyzed: reduce_prose: convert long prose sections into tables or bullet lists
2026-04-01 20:09:02	C:\Users\PC\Documents\GitHub\cex\P01_knowledge\examples\p01_bld_sp_manifest_software_project_create_agent_for_engineering_nucleus.md	1	8.6	0.99	keep	added density_score: 0.99
2026-04-01 20:09:05	C:\Users\PC\Documents\GitHub\cex\P01_knowledge\examples\p01_bld_sp_manifest_software_project_create_agent_for_engineering_nucleus.md	1	8.7	0.97	keep	added density_score: 0.97
2026-04-01 20:09:54	C:\Users\PC\Documents\GitHub\cex\P01_knowledge\examples\p03_system_prompt_create_system_prompt_for_engineering_nucleus.md	1	8.8	0.95	keep	analyzed: reduce_prose: convert long prose sections into tables or bullet lists
2026-04-01 20:10:01	C:\Users\PC\Documents\GitHub\cex\P01_knowledge\examples\p03_system_prompt_create_system_prompt_for_engineering_nucleus.md	1	8.7	0.93	keep	analyzed: reduce_prose: convert long prose sections into tables or bullet lists
2026-04-01 20:10:52	C:\Users\PC\Documents\GitHub\cex\P01_knowledge\examples\p01_knowledge_card_create_knowledge_card_about_engineering_best_practices.md	1	8.9	1.00	keep	analyzed: reduce_prose: convert long prose sections into tables or bullet lists
2026-04-01 20:10:55	C:\Users\PC\Documents\GitHub\cex\P01_knowledge\examples\p01_knowledge_card_create_knowledge_card_about_engineering_best_practices.md	1	0.0	0.00	crash	compile fail after: tldr flagged for manual review
2026-04-01 20:10:56	C:\Users\PC\Documents\GitHub\cex\P01_knowledge\examples\p01_knowledge_card_create_knowledge_card_about_engineering_best_practices.md	2	8.9	1.00	keep	analyzed: reduce_prose: convert long prose sections into tables or bullet lists
2026-04-01 20:11:24	C:\Users\PC\Documents\GitHub\cex\P01_knowledge\examples\p01_bld_sp_manifest_software_project_create_agent_card_for_engineering_nucleus.md	1	8.6	1.00	keep	added density_score: 1.0
2026-04-01 20:11:37	C:\Users\PC\Documents\GitHub\cex\P01_knowledge\examples\p01_bld_sp_manifest_software_project_create_agent_card_for_engineering_nucleus.md	0	9.2	1.00	skip	already at target
2026-04-01 20:12:16	C:\Users\PC\Documents\GitHub\cex\P01_knowledge\examples\p12_workflow_create_workflow_for_engineering_pipeline.md	1	8.7	0.99	keep	polished formatting (whitespace cleanup)
2026-04-01 20:12:20	C:\Users\PC\Documents\GitHub\cex\P01_knowledge\examples\p12_workflow_create_workflow_for_engineering_pipeline.md	1	8.7	1.00	keep	polished formatting (whitespace cleanup)
2026-04-01 20:13:12	C:\Users\PC\Documents\GitHub\cex\P01_knowledge\examples\p11_quality_gate_create_quality_gate_for_engineering_artifacts.md	1	8.9	1.00	keep	polished formatting (whitespace cleanup)
2026-04-01 20:13:17	C:\Users\PC\Documents\GitHub\cex\P01_knowledge\examples\p11_quality_gate_create_quality_gate_for_engineering_artifacts.md	1	8.9	1.00	keep	analyzed: reduce_prose: convert long prose sections into tables or bullet lists
2026-04-01 20:14:05	C:\Users\PC\Documents\GitHub\cex\P01_knowledge\examples\p07_scoring_rubric_create_scoring_rubric_for_engineering_evaluation.md	1	8.9	1.00	keep	polished formatting (whitespace cleanup)
2026-04-01 20:14:12	C:\Users\PC\Documents\GitHub\cex\P01_knowledge\examples\p07_scoring_rubric_create_scoring_rubric_for_engineering_evaluation.md	1	8.9	1.00	keep	polished formatting (whitespace cleanup)
2026-04-01 20:14:52	C:\Users\PC\Documents\GitHub\cex\P01_knowledge\examples\p12_dispatch_rule_create_dispatch_rule_for_engineering_routing.md	0	8.5	0.80	skip	already at target
2026-04-01 20:14:52	C:\Users\PC\Documents\GitHub\cex\P01_knowledge\examples\p12_dispatch_rule_create_dispatch_rule_for_engineering_routing.md	1	8.5	0.80	keep	added density_score: 0.8
2026-04-01 20:15:46	C:\Users\PC\Documents\GitHub\cex\P01_knowledge\examples\p06_input_schema_create_schema_contract_for_engineering_data_model.md	1	8.9	1.00	keep	analyzed: reduce_prose: convert long prose sections into tables or bullet lists
2026-04-01 20:15:47	C:\Users\PC\Documents\GitHub\cex\P01_knowledge\examples\p06_input_schema_create_schema_contract_for_engineering_data_model.md	1	8.9	0.99	keep	analyzed: reduce_prose: convert long prose sections into tables or bullet lists
2026-04-01 20:17:02	C:\Users\PC\Documents\GitHub\cex\P01_knowledge\examples\p05_formatter_create_output_template_for_engineering_reports.md	1	8.8	1.00	keep	analyzed: reduce_prose: convert long prose sections into tables or bullet lists
2026-04-01 20:17:04	C:\Users\PC\Documents\GitHub\cex\P01_knowledge\examples\p05_formatter_create_output_template_for_engineering_reports.md	1	8.9	1.00	keep	analyzed: reduce_prose: convert long prose sections into tables or bullet lists
2026-04-01 20:18:10	C:\Users\PC\Documents\GitHub\cex\P01_knowledge\examples\p03_prompt_template_create_prompt_template_for_engineering_tasks.md	1	8.9	0.98	keep	analyzed: reduce_prose: convert long prose sections into tables or bullet lists
2026-04-01 20:18:12	C:\Users\PC\Documents\GitHub\cex\P01_knowledge\examples\p03_prompt_template_create_prompt_template_for_engineering_tasks.md	1	8.9	1.00	keep	analyzed: reduce_prose: convert long prose sections into tables or bullet lists
2026-04-01 20:19:58	C:\Users\PC\Documents\GitHub\cex\P01_knowledge\examples\p02_agent_create_agent_for_brand_nucleus.md	1	9.0	1.00	keep	analyzed: reduce_prose: convert long prose sections into tables or bullet lists
2026-04-01 20:20:06	C:\Users\PC\Documents\GitHub\cex\P01_knowledge\examples\p02_agent_create_agent_for_brand_nucleus.md	1	8.9	1.00	keep	analyzed: reduce_prose: convert long prose sections into tables or bullet lists
2026-04-01 20:20:48	C:\Users\PC\Documents\GitHub\cex\P01_knowledge\examples\p03_system_prompt_create_system_prompt_for_brand_nucleus.md	1	8.8	0.98	keep	analyzed: reduce_prose: convert long prose sections into tables or bullet lists
2026-04-01 20:20:59	C:\Users\PC\Documents\GitHub\cex\P01_knowledge\examples\p03_system_prompt_create_system_prompt_for_brand_nucleus.md	1	8.8	0.97	keep	analyzed: reduce_prose: convert long prose sections into tables or bullet lists
2026-04-01 20:21:47	C:\Users\PC\Documents\GitHub\cex\P01_knowledge\examples\p01_knowledge_card_create_knowledge_card_about_brand_best_practices.md	1	0.0	0.00	crash	compile fail after: tldr flagged for manual review
2026-04-01 20:21:47	C:\Users\PC\Documents\GitHub\cex\P01_knowledge\examples\p01_knowledge_card_create_knowledge_card_about_brand_best_practices.md	2	0.0	0.00	crash	compile fail after: tldr flagged for manual review
2026-04-01 20:21:47	C:\Users\PC\Documents\GitHub\cex\P01_knowledge\examples\p01_knowledge_card_create_knowledge_card_about_brand_best_practices.md	3	0.0	0.00	crash	compile fail after: tldr flagged for manual review
2026-04-01 20:21:52	C:\Users\PC\Documents\GitHub\cex\P01_knowledge\examples\p01_knowledge_card_create_knowledge_card_about_brand_best_practices.md	1	8.9	1.00	keep	analyzed: reduce_prose: convert long prose sections into tables or bullet lists
2026-04-01 20:22:18	C:\Users\PC\Documents\GitHub\cex\P01_knowledge\examples\p01_knowledge_card_create_knowledge_card_about_brand_best_practices.md	1	9.0	1.00	keep	Convert Key Concepts section from bullet points to dense table format for better information density
2026-04-01 20:22:51	C:\Users\PC\Documents\GitHub\cex\P01_knowledge\examples\p08_agent_card_create_agent_card_for_brand_nucleus.md	1	8.8	1.00	keep	added density_score: 1.0
2026-04-01 20:23:06	C:\Users\PC\Documents\GitHub\cex\P01_knowledge\examples\p08_agent_card_create_agent_card_for_brand_nucleus.md	1	8.8	1.00	keep	added density_score: 1.0
2026-04-01 20:23:41	C:\Users\PC\Documents\GitHub\cex\P01_knowledge\examples\p12_workflow_create_workflow_for_brand_pipeline.md	1	8.8	1.00	keep	polished formatting (whitespace cleanup)
2026-04-01 20:23:53	C:\Users\PC\Documents\GitHub\cex\P01_knowledge\examples\p12_workflow_create_workflow_for_brand_pipeline.md	1	8.8	0.99	keep	polished formatting (whitespace cleanup)
2026-04-01 20:24:32	C:\Users\PC\Documents\GitHub\cex\P01_knowledge\examples\p11_quality_gate_create_quality_gate_for_brand_artifacts.md	1	0.0	0.00	crash	compile fail after: tldr flagged for manual review
2026-04-01 20:24:33	C:\Users\PC\Documents\GitHub\cex\P01_knowledge\examples\p11_quality_gate_create_quality_gate_for_brand_artifacts.md	2	0.0	0.00	crash	compile fail after: tldr flagged for manual review
2026-04-01 20:24:33	C:\Users\PC\Documents\GitHub\cex\P01_knowledge\examples\p11_quality_gate_create_quality_gate_for_brand_artifacts.md	3	0.0	0.00	crash	compile fail after: tldr flagged for manual review
2026-04-01 20:24:34	C:\Users\PC\Documents\GitHub\cex\P01_knowledge\examples\p11_quality_gate_create_quality_gate_for_brand_artifacts.md	1	8.9	1.00	keep	polished formatting (whitespace cleanup)
2026-04-01 20:24:57	C:\Users\PC\Documents\GitHub\cex\P01_knowledge\examples\p11_quality_gate_create_quality_gate_for_brand_artifacts.md	1	8.9	1.00	keep	Add missing `when_to_use` field to frontmatter for better actionability and completeness
2026-04-01 20:25:38	C:\Users\PC\Documents\GitHub\cex\P01_knowledge\examples\p07_scoring_rubric_create_scoring_rubric_for_brand_evaluation.md	1	8.9	1.00	keep	polished formatting (whitespace cleanup)
2026-04-01 20:25:40	C:\Users\PC\Documents\GitHub\cex\P01_knowledge\examples\p11_quality_gate_create_quality_gate_for_brand_artifacts.md	2	8.9	1.00	discard	Replace generic scoring methods with specific actionable criteria for each SOFT dimension
2026-04-01 20:26:12	C:\Users\PC\Documents\GitHub\cex\P01_knowledge\examples\p11_quality_gate_create_quality_gate_for_brand_artifacts.md	3	8.9	1.00	discard	Add Anti-Patterns section to improve actionability by showing what NOT to do when creating brand artifacts
2026-04-01 20:26:31	C:\Users\PC\Documents\GitHub\cex\P01_knowledge\examples\p12_dispatch_rule_create_dispatch_rule_for_brand_routing.md	1	8.5	0.80	keep	added density_score: 0.8
2026-04-01 20:26:48	C:\Users\PC\Documents\GitHub\cex\P01_knowledge\examples\p11_quality_gate_create_quality_gate_for_brand_artifacts.md	4	8.9	1.00	discard	Add specific feedback criteria to the REVIEW action to improve actionability and clarity of the quality gate process
2026-04-01 20:27:18	C:\Users\PC\Documents\GitHub\cex\P01_knowledge\examples\p11_quality_gate_create_quality_gate_for_brand_artifacts.md	5	8.9	1.00	discard	Make H06 gate more specific by listing exact required frontmatter fields instead of generic "all required fields"
2026-04-01 20:27:33	C:\Users\PC\Documents\GitHub\cex\P01_knowledge\examples\p06_input_schema_create_schema_contract_for_brand_data_model.md	1	8.9	1.00	keep	analyzed: reduce_prose: convert long prose sections into tables or bullet lists
2026-04-01 20:28:08	C:\Users\PC\Documents\GitHub\cex\P01_knowledge\examples\p07_scoring_rubric_create_scoring_rubric_for_brand_evaluation.md	1	0.0	0.00	crash	compile fail after: tldr flagged for manual review
2026-04-01 20:28:09	C:\Users\PC\Documents\GitHub\cex\P01_knowledge\examples\p07_scoring_rubric_create_scoring_rubric_for_brand_evaluation.md	2	8.9	1.00	keep	polished formatting (whitespace cleanup)
2026-04-01 20:28:46	C:\Users\PC\Documents\GitHub\cex\P01_knowledge\examples\p05_formatter_create_output_template_for_brand_reports.md	1	8.9	1.00	keep	analyzed: reduce_prose: convert long prose sections into tables or bullet lists
2026-04-01 20:28:47	C:\Users\PC\Documents\GitHub\cex\P01_knowledge\examples\p12_dispatch_rule_create_dispatch_rule_for_brand_routing.md	1	0.0	0.00	crash	compile fail after: added density_score: 0.83
2026-04-01 20:28:47	C:\Users\PC\Documents\GitHub\cex\P01_knowledge\examples\p12_dispatch_rule_create_dispatch_rule_for_brand_routing.md	2	8.5	0.80	keep	analyzed: fix_frontmatter: missing title
2026-04-01 20:29:30	C:\Users\PC\Documents\GitHub\cex\P01_knowledge\examples\p06_input_schema_create_schema_contract_for_brand_data_model.md	1	8.9	1.00	keep	analyzed: reduce_prose: convert long prose sections into tables or bullet lists
2026-04-01 20:29:56	C:\Users\PC\Documents\GitHub\cex\P01_knowledge\examples\p03_prompt_template_create_prompt_template_for_brand_tasks.md	1	9.0	1.00	keep	analyzed: reduce_prose: convert long prose sections into tables or bullet lists
2026-04-01 20:30:19	C:\Users\PC\Documents\GitHub\cex\P01_knowledge\examples\p05_formatter_create_output_template_for_brand_reports.md	1	8.9	1.00	keep	analyzed: reduce_prose: convert long prose sections into tables or bullet lists
2026-04-01 20:31:15	C:\Users\PC\Documents\GitHub\cex\P01_knowledge\examples\p03_prompt_template_create_prompt_template_for_brand_tasks.md	1	8.9	1.00	keep	analyzed: reduce_prose: convert long prose sections into tables or bullet lists
2026-04-01 20:31:40	C:\Users\PC\Documents\GitHub\cex\P01_knowledge\examples\p12_workflow_create_agent_for_orchestration_nucleus.md	1	8.7	0.99	keep	polished formatting (whitespace cleanup)
2026-04-01 20:32:03	C:\Users\PC\Documents\GitHub\cex\P01_knowledge\examples\p12_workflow_create_agent_for_orchestration_nucleus.md	1	8.7	0.98	keep	polished formatting (whitespace cleanup)
2026-04-01 20:32:35	C:\Users\PC\Documents\GitHub\cex\P01_knowledge\examples\p03_system_prompt_create_system_prompt_for_orchestration_nucleus.md	1	8.7	0.87	keep	analyzed: reduce_prose: convert long prose sections into tables or bullet lists
2026-04-01 20:32:49	C:\Users\PC\Documents\GitHub\cex\P01_knowledge\examples\p03_system_prompt_create_system_prompt_for_orchestration_nucleus.md	1	8.8	0.94	keep	analyzed: reduce_prose: convert long prose sections into tables or bullet lists
2026-04-01 20:33:28	C:\Users\PC\Documents\GitHub\cex\P01_knowledge\examples\p01_knowledge_card_create_knowledge_card_about_orchestration_best_practices.md	1	0.0	0.00	crash	compile fail after: tldr flagged for manual review
2026-04-01 20:33:28	C:\Users\PC\Documents\GitHub\cex\P01_knowledge\examples\p01_knowledge_card_create_knowledge_card_about_orchestration_best_practices.md	2	0.0	0.00	crash	compile fail after: tldr flagged for manual review
2026-04-01 20:33:28	C:\Users\PC\Documents\GitHub\cex\P01_knowledge\examples\p01_knowledge_card_create_knowledge_card_about_orchestration_best_practices.md	3	0.0	0.00	crash	compile fail after: tldr flagged for manual review
2026-04-01 20:33:36	C:\Users\PC\Documents\GitHub\cex\P01_knowledge\examples\p01_knowledge_card_create_knowledge_card_about_orchestration_best_practices.md	1	8.9	1.00	keep	polished formatting (whitespace cleanup)
2026-04-01 20:34:02	C:\Users\PC\Documents\GitHub\cex\P01_knowledge\examples\p01_knowledge_card_create_knowledge_card_about_orchestration_best_practices.md	1	0.0	0.00	crash	compile fail: Convert wordy Key Concepts section to dense table format to improve body density
2026-04-01 20:34:34	C:\Users\PC\Documents\GitHub\cex\P01_knowledge\examples\p01_knowledge_card_create_knowledge_card_about_orchestration_best_practices.md	2	8.9	1.00	keep	Add Anti-Patterns section with concrete examples of what NOT to do for better actionability
2026-04-01 20:34:40	C:\Users\PC\Documents\GitHub\cex\P01_knowledge\examples\p08_agent_card_create_agent_card_for_orchestration_nucleus.md	1	8.8	1.00	keep	added density_score: 1.0
2026-04-01 20:35:06	C:\Users\PC\Documents\GitHub\cex\P01_knowledge\examples\p01_knowledge_card_create_knowledge_card_about_orchestration_best_practices.md	3	8.9	1.00	discard	Replace generic Quick Reference YAML with actionable configuration patterns and key commands
2026-04-01 20:35:31	C:\Users\PC\Documents\GitHub\cex\P01_knowledge\examples\p12_workflow_create_workflow_for_orchestration_pipeline.md	1	8.8	0.99	keep	polished formatting (whitespace cleanup)
2026-04-01 20:35:33	C:\Users\PC\Documents\GitHub\cex\P01_knowledge\examples\p01_knowledge_card_create_knowledge_card_about_orchestration_best_practices.md	4	8.9	1.00	discard	Convert wordy Strategy Phases section to dense table format for improved body density
2026-04-01 20:36:09	C:\Users\PC\Documents\GitHub\cex\P01_knowledge\examples\p01_knowledge_card_create_knowledge_card_about_orchestration_best_practices.md	5	8.9	1.00	discard	Replace abstract Flow section with concrete kubectl commands demonstrating orchestration workflow
2026-04-01 20:36:30	C:\Users\PC\Documents\GitHub\cex\P01_knowledge\examples\p11_quality_gate_create_quality_gate_for_orchestration_artifacts.md	1	8.9	1.00	keep	polished formatting (whitespace cleanup)
2026-04-01 20:36:55	C:\Users\PC\Documents\GitHub\cex\P01_knowledge\examples\p08_agent_card_create_agent_card_for_orchestration_nucleus.md	1	8.8	1.00	keep	added density_score: 1.0
2026-04-01 20:37:28	C:\Users\PC\Documents\GitHub\cex\P01_knowledge\examples\p07_scoring_rubric_create_scoring_rubric_for_orchestration_evaluation.md	1	8.9	1.00	keep	polished formatting (whitespace cleanup)
2026-04-01 20:37:45	C:\Users\PC\Documents\GitHub\cex\P01_knowledge\examples\p12_workflow_create_workflow_for_orchestration_pipeline.md	1	8.8	0.99	keep	polished formatting (whitespace cleanup)
2026-04-01 20:38:16	C:\Users\PC\Documents\GitHub\cex\P01_knowledge\examples\p12_dispatch_rule_create_dispatch_rule_for_orchestration_routing.md	1	8.5	0.81	keep	added density_score: 0.81
2026-04-01 20:38:26	C:\Users\PC\Documents\GitHub\cex\P01_knowledge\examples\p11_quality_gate_create_quality_gate_for_orchestration_artifacts.md	1	8.9	1.00	keep	analyzed: reduce_prose: convert long prose sections into tables or bullet lists
2026-04-01 20:39:08	C:\Users\PC\Documents\GitHub\cex\P01_knowledge\examples\p06_input_schema_create_schema_contract_for_orchestration_data_model.md	1	0.0	0.00	crash	compile fail after: tldr flagged for manual review
2026-04-01 20:39:08	C:\Users\PC\Documents\GitHub\cex\P01_knowledge\examples\p06_input_schema_create_schema_contract_for_orchestration_data_model.md	2	0.0	0.00	crash	compile fail after: tldr flagged for manual review
2026-04-01 20:39:09	C:\Users\PC\Documents\GitHub\cex\P01_knowledge\examples\p06_input_schema_create_schema_contract_for_orchestration_data_model.md	3	0.0	0.00	crash	compile fail after: tldr flagged for manual review
2026-04-01 20:39:19	C:\Users\PC\Documents\GitHub\cex\P01_knowledge\examples\p07_scoring_rubric_create_scoring_rubric_for_orchestration_evaluation.md	1	8.9	1.00	keep	polished formatting (whitespace cleanup)
2026-04-01 20:39:41	C:\Users\PC\Documents\GitHub\cex\P01_knowledge\examples\p06_input_schema_create_schema_contract_for_orchestration_data_model.md	1	8.9	1.00	keep	Add missing frontmatter fields `title` and `when_to_use` to improve front matter completeness
2026-04-01 20:39:57	C:\Users\PC\Documents\GitHub\cex\P01_knowledge\examples\p12_dispatch_rule_create_dispatch_rule_for_orchestration_routing.md	1	8.6	0.81	keep	added density_score: 0.81
2026-04-01 20:40:14	C:\Users\PC\Documents\GitHub\cex\P01_knowledge\examples\p06_input_schema_create_schema_contract_for_orchestration_data_model.md	2	8.9	1.00	discard	Add anti-patterns section to improve actionability by showing common mistakes to avoid
2026-04-01 20:40:39	C:\Users\PC\Documents\GitHub\cex\P01_knowledge\examples\p06_input_schema_create_schema_contract_for_orchestration_data_model.md	1	8.9	1.00	keep	analyzed: reduce_prose: convert long prose sections into tables or bullet lists
2026-04-01 20:40:53	C:\Users\PC\Documents\GitHub\cex\P01_knowledge\examples\p06_input_schema_create_schema_contract_for_orchestration_data_model.md	3	8.9	1.00	discard	Add validation scenarios section to improve actionability with concrete validation examples and error conditions
2026-04-01 20:41:25	C:\Users\PC\Documents\GitHub\cex\P01_knowledge\examples\p06_input_schema_create_schema_contract_for_orchestration_data_model.md	4	8.9	1.00	discard	Add missing frontmatter fields `title` and `when_to_use` to complete front matter structure
2026-04-01 20:42:00	C:\Users\PC\Documents\GitHub\cex\P01_knowledge\examples\p05_formatter_create_output_template_for_orchestration_reports.md	1	8.9	1.00	keep	analyzed: reduce_prose: convert long prose sections into tables or bullet lists
2026-04-01 20:42:14	C:\Users\PC\Documents\GitHub\cex\P01_knowledge\examples\p06_input_schema_create_schema_contract_for_orchestration_data_model.md	5	8.9	1.00	discard	Add missing frontmatter fields `title` and `when_to_use` to complete front matter structure
2026-04-01 20:43:00	C:\Users\PC\Documents\GitHub\cex\P01_knowledge\examples\p05_formatter_create_output_template_for_orchestration_reports.md	1	8.9	1.00	keep	analyzed: reduce_prose: convert long prose sections into tables or bullet lists
2026-04-01 20:43:18	C:\Users\PC\Documents\GitHub\cex\P01_knowledge\examples\p03_prompt_template_create_prompt_template_for_orchestration_tasks.md	1	9.0	0.99	keep	analyzed: reduce_prose: convert long prose sections into tables or bullet lists
2026-04-01 20:43:45	C:\Users\PC\Documents\GitHub\cex\P01_knowledge\examples\p03_prompt_template_create_prompt_template_for_orchestration_tasks.md	1	9.0	1.00	keep	analyzed: reduce_prose: convert long prose sections into tables or bullet lists
2026-04-01 20:45:37	C:\Users\PC\Documents\GitHub\cex\P01_knowledge\examples\p04_research_pipeline_create_agent_for_intelligence_nucleus.md	1	8.9	1.00	keep	added density_score: 1.0
2026-04-01 20:45:51	C:\Users\PC\Documents\GitHub\cex\P01_knowledge\examples\p04_research_pipeline_create_agent_for_intelligence_nucleus.md	1	9.0	1.00	keep	analyzed: reduce_prose: convert long prose sections into tables or bullet lists
2026-04-01 20:46:34	C:\Users\PC\Documents\GitHub\cex\P01_knowledge\examples\p03_system_prompt_create_system_prompt_for_intelligence_nucleus.md	1	8.8	0.94	keep	analyzed: reduce_prose: convert long prose sections into tables or bullet lists
