timestamp	file	round	quality	density	status	description
2026-04-15 22:04:12	C:\Users\CEX\Documents\GitHub\cex\archetypes\builders\ai-rmf-profile-builder\bld_architecture_ai_rmf_profile.md	1	9.0	1.00	keep	polished formatting (whitespace cleanup)
2026-04-15 22:04:13	C:\Users\CEX\Documents\GitHub\cex\archetypes\builders\ai-rmf-profile-builder\bld_collaboration_ai_rmf_profile.md	1	8.9	1.00	keep	polished formatting (whitespace cleanup)
2026-04-15 22:04:13	C:\Users\CEX\Documents\GitHub\cex\archetypes\builders\ai-rmf-profile-builder\bld_config_ai_rmf_profile.md	1	8.6	0.92	keep	polished formatting (whitespace cleanup)
2026-04-15 22:04:13	C:\Users\CEX\Documents\GitHub\cex\archetypes\builders\ai-rmf-profile-builder\bld_examples_ai_rmf_profile.md	1	9.1	1.00	keep	analyzed: reduce_prose: convert long prose sections into tables or bullet lists
2026-04-15 22:04:13	C:\Users\CEX\Documents\GitHub\cex\archetypes\builders\ai-rmf-profile-builder\bld_instruction_ai_rmf_profile.md	1	8.9	0.93	keep	analyzed: reduce_prose: convert long prose sections into tables or bullet lists
2026-04-15 22:04:14	C:\Users\CEX\Documents\GitHub\cex\archetypes\builders\ai-rmf-profile-builder\bld_knowledge_card_ai_rmf_profile.md	1	9.2	1.00	keep	polished formatting (whitespace cleanup)
2026-04-15 22:04:14	C:\Users\CEX\Documents\GitHub\cex\archetypes\builders\ai-rmf-profile-builder\bld_manifest_ai_rmf_profile.md	1	8.9	0.86	keep	analyzed: increase_density: remove filler words, compress prose into tables
2026-04-15 22:04:14	C:\Users\CEX\Documents\GitHub\cex\archetypes\builders\ai-rmf-profile-builder\bld_memory_ai_rmf_profile.md	1	8.7	0.95	keep	polished formatting (whitespace cleanup)
2026-04-15 22:04:15	C:\Users\CEX\Documents\GitHub\cex\archetypes\builders\ai-rmf-profile-builder\bld_output_template_ai_rmf_profile.md	1	9.1	1.00	keep	analyzed: reduce_prose: convert long prose sections into tables or bullet lists
2026-04-15 22:04:15	C:\Users\CEX\Documents\GitHub\cex\archetypes\builders\ai-rmf-profile-builder\bld_quality_gate_ai_rmf_profile.md	1	9.0	1.00	keep	polished formatting (whitespace cleanup)
2026-04-15 22:04:15	C:\Users\CEX\Documents\GitHub\cex\archetypes\builders\ai-rmf-profile-builder\bld_schema_ai_rmf_profile.md	1	9.1	1.00	keep	polished formatting (whitespace cleanup)
2026-04-15 22:04:16	C:\Users\CEX\Documents\GitHub\cex\archetypes\builders\ai-rmf-profile-builder\bld_system_prompt_ai_rmf_profile.md	1	9.0	0.84	keep	analyzed: reduce_prose: convert long prose sections into tables or bullet lists
2026-04-15 22:04:16	C:\Users\CEX\Documents\GitHub\cex\archetypes\builders\ai-rmf-profile-builder\bld_tools_ai_rmf_profile.md	1	8.9	1.00	keep	polished formatting (whitespace cleanup)
2026-04-15 22:04:16	C:\Users\CEX\Documents\GitHub\cex\archetypes\builders\analyst-briefing-builder\bld_architecture_analyst_briefing.md	1	9.0	1.00	keep	polished formatting (whitespace cleanup)
2026-04-15 22:04:17	C:\Users\CEX\Documents\GitHub\cex\archetypes\builders\analyst-briefing-builder\bld_collaboration_analyst_briefing.md	1	9.0	0.97	keep	polished formatting (whitespace cleanup)
2026-04-15 22:04:17	C:\Users\CEX\Documents\GitHub\cex\archetypes\builders\analyst-briefing-builder\bld_config_analyst_briefing.md	1	8.6	0.89	keep	analyzed: increase_density: remove filler words, compress prose into tables
2026-04-15 22:04:17	C:\Users\CEX\Documents\GitHub\cex\archetypes\builders\analyst-briefing-builder\bld_examples_analyst_briefing.md	1	9.1	1.00	keep	analyzed: reduce_prose: convert long prose sections into tables or bullet lists
2026-04-15 22:04:18	C:\Users\CEX\Documents\GitHub\cex\archetypes\builders\analyst-briefing-builder\bld_instruction_analyst_briefing.md	1	8.9	0.98	keep	analyzed: reduce_prose: convert long prose sections into tables or bullet lists
2026-04-15 22:04:18	C:\Users\CEX\Documents\GitHub\cex\archetypes\builders\analyst-briefing-builder\bld_knowledge_card_analyst_briefing.md	1	9.2	1.00	keep	analyzed: reduce_prose: convert long prose sections into tables or bullet lists
2026-04-15 22:04:18	C:\Users\CEX\Documents\GitHub\cex\archetypes\builders\analyst-briefing-builder\bld_manifest_analyst_briefing.md	1	8.9	0.82	keep	analyzed: reduce_prose: convert long prose sections into tables or bullet lists
2026-04-15 22:04:19	C:\Users\CEX\Documents\GitHub\cex\archetypes\builders\analyst-briefing-builder\bld_memory_analyst_briefing.md	1	8.8	0.91	keep	polished formatting (whitespace cleanup)
2026-04-15 22:04:19	C:\Users\CEX\Documents\GitHub\cex\archetypes\builders\analyst-briefing-builder\bld_output_template_analyst_briefing.md	1	9.1	1.00	keep	analyzed: reduce_prose: convert long prose sections into tables or bullet lists
2026-04-15 22:04:19	C:\Users\CEX\Documents\GitHub\cex\archetypes\builders\analyst-briefing-builder\bld_quality_gate_analyst_briefing.md	1	9.0	1.00	keep	polished formatting (whitespace cleanup)
2026-04-15 22:04:19	C:\Users\CEX\Documents\GitHub\cex\archetypes\builders\analyst-briefing-builder\bld_schema_analyst_briefing.md	1	9.1	1.00	keep	analyzed: reduce_prose: convert long prose sections into tables or bullet lists
2026-04-15 22:04:20	C:\Users\CEX\Documents\GitHub\cex\archetypes\builders\analyst-briefing-builder\bld_system_prompt_analyst_briefing.md	1	9.0	0.83	keep	analyzed: increase_density: remove filler words, compress prose into tables
2026-04-15 22:04:20	C:\Users\CEX\Documents\GitHub\cex\archetypes\builders\analyst-briefing-builder\bld_tools_analyst_briefing.md	1	8.9	1.00	keep	polished formatting (whitespace cleanup)
2026-04-15 22:04:20	C:\Users\CEX\Documents\GitHub\cex\archetypes\builders\api-reference-builder\bld_architecture_api_reference.md	1	9.0	1.00	keep	polished formatting (whitespace cleanup)
2026-04-15 22:04:21	C:\Users\CEX\Documents\GitHub\cex\archetypes\builders\api-reference-builder\bld_collaboration_api_reference.md	1	8.9	0.86	keep	analyzed: increase_density: remove filler words, compress prose into tables
2026-04-15 22:04:21	C:\Users\CEX\Documents\GitHub\cex\archetypes\builders\api-reference-builder\bld_config_api_reference.md	1	8.6	0.95	keep	polished formatting (whitespace cleanup)
2026-04-15 22:04:21	C:\Users\CEX\Documents\GitHub\cex\archetypes\builders\api-reference-builder\bld_examples_api_reference.md	1	8.9	1.00	keep	polished formatting (whitespace cleanup)
2026-04-15 22:04:22	C:\Users\CEX\Documents\GitHub\cex\archetypes\builders\api-reference-builder\bld_instruction_api_reference.md	1	8.8	0.84	keep	analyzed: reduce_prose: convert long prose sections into tables or bullet lists
2026-04-15 22:04:22	C:\Users\CEX\Documents\GitHub\cex\archetypes\builders\api-reference-builder\bld_knowledge_card_api_reference.md	1	9.1	1.00	keep	polished formatting (whitespace cleanup)
2026-04-15 22:04:22	C:\Users\CEX\Documents\GitHub\cex\archetypes\builders\api-reference-builder\bld_manifest_api_reference.md	1	8.8	0.81	keep	analyzed: increase_density: remove filler words, compress prose into tables
2026-04-15 22:04:23	C:\Users\CEX\Documents\GitHub\cex\archetypes\builders\api-reference-builder\bld_memory_api_reference.md	1	8.7	0.95	keep	polished formatting (whitespace cleanup)
2026-04-15 22:04:23	C:\Users\CEX\Documents\GitHub\cex\archetypes\builders\api-reference-builder\bld_output_template_api_reference.md	1	8.8	1.00	keep	analyzed: reduce_prose: convert long prose sections into tables or bullet lists
2026-04-15 22:04:23	C:\Users\CEX\Documents\GitHub\cex\archetypes\builders\api-reference-builder\bld_quality_gate_api_reference.md	1	9.0	1.00	keep	polished formatting (whitespace cleanup)
2026-04-15 22:04:24	C:\Users\CEX\Documents\GitHub\cex\archetypes\builders\api-reference-builder\bld_schema_api_reference.md	1	9.1	1.00	keep	analyzed: reduce_prose: convert long prose sections into tables or bullet lists
2026-04-15 22:04:24	C:\Users\CEX\Documents\GitHub\cex\archetypes\builders\api-reference-builder\bld_system_prompt_api_reference.md	1	8.8	0.83	keep	analyzed: increase_density: remove filler words, compress prose into tables
2026-04-15 22:04:24	C:\Users\CEX\Documents\GitHub\cex\archetypes\builders\api-reference-builder\bld_tools_api_reference.md	1	8.9	1.00	keep	polished formatting (whitespace cleanup)
2026-04-15 22:04:25	C:\Users\CEX\Documents\GitHub\cex\archetypes\builders\app-directory-entry-builder\bld_architecture_app_directory_entry.md	1	9.0	1.00	keep	polished formatting (whitespace cleanup)
2026-04-15 22:04:25	C:\Users\CEX\Documents\GitHub\cex\archetypes\builders\app-directory-entry-builder\bld_collaboration_app_directory_entry.md	1	8.9	0.83	keep	analyzed: increase_density: remove filler words, compress prose into tables
2026-04-15 22:04:25	C:\Users\CEX\Documents\GitHub\cex\archetypes\builders\app-directory-entry-builder\bld_config_app_directory_entry.md	1	8.7	0.82	keep	analyzed: increase_density: remove filler words, compress prose into tables
2026-04-15 22:04:25	C:\Users\CEX\Documents\GitHub\cex\archetypes\builders\app-directory-entry-builder\bld_examples_app_directory_entry.md	1	8.8	0.98	keep	analyzed: reduce_prose: convert long prose sections into tables or bullet lists
2026-04-15 22:04:26	C:\Users\CEX\Documents\GitHub\cex\archetypes\builders\app-directory-entry-builder\bld_instruction_app_directory_entry.md	1	8.8	0.87	keep	analyzed: reduce_prose: convert long prose sections into tables or bullet lists
2026-04-15 22:04:26	C:\Users\CEX\Documents\GitHub\cex\archetypes\builders\app-directory-entry-builder\bld_knowledge_card_app_directory_entry.md	1	9.2	0.97	keep	analyzed: reduce_prose: convert long prose sections into tables or bullet lists
2026-04-15 22:04:26	C:\Users\CEX\Documents\GitHub\cex\archetypes\builders\app-directory-entry-builder\bld_manifest_app_directory_entry.md	1	8.8	0.84	keep	analyzed: increase_density: remove filler words, compress prose into tables
2026-04-15 22:04:27	C:\Users\CEX\Documents\GitHub\cex\archetypes\builders\app-directory-entry-builder\bld_memory_app_directory_entry.md	1	8.7	0.96	keep	polished formatting (whitespace cleanup)
2026-04-15 22:04:27	C:\Users\CEX\Documents\GitHub\cex\archetypes\builders\app-directory-entry-builder\bld_output_template_app_directory_entry.md	1	8.7	1.00	keep	analyzed: reduce_prose: convert long prose sections into tables or bullet lists
2026-04-15 22:04:27	C:\Users\CEX\Documents\GitHub\cex\archetypes\builders\app-directory-entry-builder\bld_quality_gate_app_directory_entry.md	1	9.0	1.00	keep	polished formatting (whitespace cleanup)
2026-04-15 22:04:28	C:\Users\CEX\Documents\GitHub\cex\archetypes\builders\app-directory-entry-builder\bld_schema_app_directory_entry.md	1	9.1	1.00	keep	analyzed: reduce_prose: convert long prose sections into tables or bullet lists
2026-04-15 22:04:28	C:\Users\CEX\Documents\GitHub\cex\archetypes\builders\app-directory-entry-builder\bld_system_prompt_app_directory_entry.md	1	8.9	0.81	keep	analyzed: increase_density: remove filler words, compress prose into tables
2026-04-15 22:04:28	C:\Users\CEX\Documents\GitHub\cex\archetypes\builders\app-directory-entry-builder\bld_tools_app_directory_entry.md	1	8.9	1.00	keep	polished formatting (whitespace cleanup)
2026-04-15 22:04:29	C:\Users\CEX\Documents\GitHub\cex\archetypes\builders\audit-log-builder\bld_architecture_audit_log.md	1	9.0	1.00	keep	polished formatting (whitespace cleanup)
2026-04-15 22:04:29	C:\Users\CEX\Documents\GitHub\cex\archetypes\builders\audit-log-builder\bld_collaboration_audit_log.md	1	8.9	0.84	keep	analyzed: increase_density: remove filler words, compress prose into tables
2026-04-15 22:04:29	C:\Users\CEX\Documents\GitHub\cex\archetypes\builders\audit-log-builder\bld_config_audit_log.md	1	8.6	0.95	keep	polished formatting (whitespace cleanup)
2026-04-15 22:04:30	C:\Users\CEX\Documents\GitHub\cex\archetypes\builders\audit-log-builder\bld_examples_audit_log.md	1	8.8	1.00	keep	polished formatting (whitespace cleanup)
2026-04-15 22:04:30	C:\Users\CEX\Documents\GitHub\cex\archetypes\builders\audit-log-builder\bld_instruction_audit_log.md	1	8.9	0.84	keep	analyzed: reduce_prose: convert long prose sections into tables or bullet lists
2026-04-15 22:04:30	C:\Users\CEX\Documents\GitHub\cex\archetypes\builders\audit-log-builder\bld_knowledge_card_audit_log.md	1	9.2	0.99	keep	polished formatting (whitespace cleanup)
2026-04-15 22:04:30	C:\Users\CEX\Documents\GitHub\cex\archetypes\builders\audit-log-builder\bld_manifest_audit_log.md	1	8.8	0.84	keep	analyzed: increase_density: remove filler words, compress prose into tables
2026-04-15 22:04:31	C:\Users\CEX\Documents\GitHub\cex\archetypes\builders\audit-log-builder\bld_memory_audit_log.md	1	8.7	1.00	keep	polished formatting (whitespace cleanup)
2026-04-15 22:04:31	C:\Users\CEX\Documents\GitHub\cex\archetypes\builders\audit-log-builder\bld_output_template_audit_log.md	1	8.7	1.00	keep	analyzed: reduce_prose: convert long prose sections into tables or bullet lists
2026-04-15 22:04:32	C:\Users\CEX\Documents\GitHub\cex\archetypes\builders\audit-log-builder\bld_quality_gate_audit_log.md	1	9.0	1.00	keep	polished formatting (whitespace cleanup)
2026-04-15 22:04:32	C:\Users\CEX\Documents\GitHub\cex\archetypes\builders\audit-log-builder\bld_schema_audit_log.md	1	9.1	0.98	keep	analyzed: reduce_prose: convert long prose sections into tables or bullet lists
2026-04-15 22:04:32	C:\Users\CEX\Documents\GitHub\cex\archetypes\builders\audit-log-builder\bld_system_prompt_audit_log.md	1	8.8	0.81	keep	analyzed: increase_density: remove filler words, compress prose into tables
2026-04-15 22:04:32	C:\Users\CEX\Documents\GitHub\cex\archetypes\builders\audit-log-builder\bld_tools_audit_log.md	1	8.7	1.00	keep	polished formatting (whitespace cleanup)
2026-04-15 22:04:33	C:\Users\CEX\Documents\GitHub\cex\archetypes\builders\batch-config-builder\bld_architecture_batch_config.md	1	9.1	1.00	keep	analyzed: reduce_prose: convert long prose sections into tables or bullet lists
2026-04-15 22:04:33	C:\Users\CEX\Documents\GitHub\cex\archetypes\builders\batch-config-builder\bld_collaboration_batch_config.md	1	9.1	1.00	keep	polished formatting (whitespace cleanup)
2026-04-15 22:04:33	C:\Users\CEX\Documents\GitHub\cex\archetypes\builders\batch-config-builder\bld_config_batch_config.md	1	9.1	1.00	keep	polished formatting (whitespace cleanup)
2026-04-15 22:04:34	C:\Users\CEX\Documents\GitHub\cex\archetypes\builders\batch-config-builder\bld_examples_batch_config.md	1	9.2	1.00	keep	analyzed: reduce_prose: convert long prose sections into tables or bullet lists
2026-04-15 22:04:34	C:\Users\CEX\Documents\GitHub\cex\archetypes\builders\batch-config-builder\bld_instruction_batch_config.md	1	9.0	0.80	keep	analyzed: reduce_prose: convert long prose sections into tables or bullet lists
2026-04-15 22:04:34	C:\Users\CEX\Documents\GitHub\cex\archetypes\builders\batch-config-builder\bld_knowledge_card_batch_config.md	1	9.2	1.00	keep	analyzed: reduce_prose: convert long prose sections into tables or bullet lists
2026-04-15 22:04:35	C:\Users\CEX\Documents\GitHub\cex\archetypes\builders\batch-config-builder\bld_manifest_batch_config.md	1	9.1	1.00	keep	analyzed: reduce_prose: convert long prose sections into tables or bullet lists
2026-04-15 22:04:35	C:\Users\CEX\Documents\GitHub\cex\archetypes\builders\batch-config-builder\bld_memory_batch_config.md	1	9.2	0.99	keep	analyzed: add_tags: minimum 3 tags required
2026-04-15 22:04:35	C:\Users\CEX\Documents\GitHub\cex\archetypes\builders\batch-config-builder\bld_output_template_batch_config.md	1	9.1	1.00	keep	analyzed: reduce_prose: convert long prose sections into tables or bullet lists
2026-04-15 22:04:36	C:\Users\CEX\Documents\GitHub\cex\archetypes\builders\batch-config-builder\bld_quality_gate_batch_config.md	1	9.1	1.00	keep	polished formatting (whitespace cleanup)
2026-04-15 22:04:36	C:\Users\CEX\Documents\GitHub\cex\archetypes\builders\batch-config-builder\bld_schema_batch_config.md	1	9.2	1.00	keep	polished formatting (whitespace cleanup)
2026-04-15 22:04:36	C:\Users\CEX\Documents\GitHub\cex\archetypes\builders\batch-config-builder\bld_system_prompt_batch_config.md	1	9.0	0.78	keep	analyzed: reduce_prose: convert long prose sections into tables or bullet lists
2026-04-15 22:04:37	C:\Users\CEX\Documents\GitHub\cex\archetypes\builders\batch-config-builder\bld_tools_batch_config.md	1	9.1	1.00	keep	polished formatting (whitespace cleanup)
2026-04-15 22:04:37	C:\Users\CEX\Documents\GitHub\cex\archetypes\builders\benchmark-suite-builder\bld_architecture_benchmark_suite.md	1	9.0	1.00	keep	polished formatting (whitespace cleanup)
2026-04-15 22:04:37	C:\Users\CEX\Documents\GitHub\cex\archetypes\builders\benchmark-suite-builder\bld_collaboration_benchmark_suite.md	1	8.9	0.89	keep	analyzed: increase_density: remove filler words, compress prose into tables
2026-04-15 22:04:38	C:\Users\CEX\Documents\GitHub\cex\archetypes\builders\benchmark-suite-builder\bld_config_benchmark_suite.md	1	8.6	0.93	keep	polished formatting (whitespace cleanup)
2026-04-15 22:04:38	C:\Users\CEX\Documents\GitHub\cex\archetypes\builders\benchmark-suite-builder\bld_examples_benchmark_suite.md	1	8.9	0.98	keep	analyzed: reduce_prose: convert long prose sections into tables or bullet lists
2026-04-15 22:04:38	C:\Users\CEX\Documents\GitHub\cex\archetypes\builders\benchmark-suite-builder\bld_instruction_benchmark_suite.md	1	8.9	0.94	keep	analyzed: reduce_prose: convert long prose sections into tables or bullet lists
2026-04-15 22:04:38	C:\Users\CEX\Documents\GitHub\cex\archetypes\builders\benchmark-suite-builder\bld_knowledge_card_benchmark_suite.md	1	9.2	0.98	keep	polished formatting (whitespace cleanup)
2026-04-15 22:04:39	C:\Users\CEX\Documents\GitHub\cex\archetypes\builders\benchmark-suite-builder\bld_manifest_benchmark_suite.md	1	8.8	0.82	keep	analyzed: increase_density: remove filler words, compress prose into tables
2026-04-15 22:04:39	C:\Users\CEX\Documents\GitHub\cex\archetypes\builders\benchmark-suite-builder\bld_memory_benchmark_suite.md	1	8.7	0.98	keep	polished formatting (whitespace cleanup)
2026-04-15 22:04:39	C:\Users\CEX\Documents\GitHub\cex\archetypes\builders\benchmark-suite-builder\bld_output_template_benchmark_suite.md	1	8.8	1.00	keep	analyzed: reduce_prose: convert long prose sections into tables or bullet lists
2026-04-15 22:04:40	C:\Users\CEX\Documents\GitHub\cex\archetypes\builders\benchmark-suite-builder\bld_quality_gate_benchmark_suite.md	1	9.1	1.00	keep	polished formatting (whitespace cleanup)
2026-04-15 22:04:40	C:\Users\CEX\Documents\GitHub\cex\archetypes\builders\benchmark-suite-builder\bld_schema_benchmark_suite.md	1	9.1	0.97	keep	analyzed: reduce_prose: convert long prose sections into tables or bullet lists
2026-04-15 22:04:40	C:\Users\CEX\Documents\GitHub\cex\archetypes\builders\benchmark-suite-builder\bld_system_prompt_benchmark_suite.md	1	8.9	0.79	keep	analyzed: increase_density: remove filler words, compress prose into tables
2026-04-15 22:04:41	C:\Users\CEX\Documents\GitHub\cex\archetypes\builders\benchmark-suite-builder\bld_tools_benchmark_suite.md	1	8.9	1.00	keep	polished formatting (whitespace cleanup)
2026-04-15 22:04:41	C:\Users\CEX\Documents\GitHub\cex\archetypes\builders\bias-audit-builder\bld_architecture_bias_audit.md	1	8.9	1.00	keep	polished formatting (whitespace cleanup)
2026-04-15 22:04:41	C:\Users\CEX\Documents\GitHub\cex\archetypes\builders\bias-audit-builder\bld_collaboration_bias_audit.md	1	8.9	0.85	keep	analyzed: increase_density: remove filler words, compress prose into tables
2026-04-15 22:04:42	C:\Users\CEX\Documents\GitHub\cex\archetypes\builders\bias-audit-builder\bld_config_bias_audit.md	1	8.6	1.00	keep	polished formatting (whitespace cleanup)
2026-04-15 22:04:42	C:\Users\CEX\Documents\GitHub\cex\archetypes\builders\bias-audit-builder\bld_examples_bias_audit.md	1	9.1	1.00	keep	polished formatting (whitespace cleanup)
2026-04-15 22:04:42	C:\Users\CEX\Documents\GitHub\cex\archetypes\builders\bias-audit-builder\bld_instruction_bias_audit.md	1	8.9	0.83	keep	analyzed: reduce_prose: convert long prose sections into tables or bullet lists
2026-04-15 22:04:43	C:\Users\CEX\Documents\GitHub\cex\archetypes\builders\bias-audit-builder\bld_knowledge_card_bias_audit.md	1	9.2	1.00	keep	polished formatting (whitespace cleanup)
2026-04-15 22:04:43	C:\Users\CEX\Documents\GitHub\cex\archetypes\builders\bias-audit-builder\bld_manifest_bias_audit.md	1	9.0	0.89	keep	analyzed: increase_density: remove filler words, compress prose into tables
2026-04-15 22:04:43	C:\Users\CEX\Documents\GitHub\cex\archetypes\builders\bias-audit-builder\bld_memory_bias_audit.md	1	8.8	1.00	keep	polished formatting (whitespace cleanup)
2026-04-15 22:04:44	C:\Users\CEX\Documents\GitHub\cex\archetypes\builders\bias-audit-builder\bld_output_template_bias_audit.md	1	8.9	1.00	keep	analyzed: reduce_prose: convert long prose sections into tables or bullet lists
2026-04-15 22:04:44	C:\Users\CEX\Documents\GitHub\cex\archetypes\builders\bias-audit-builder\bld_quality_gate_bias_audit.md	1	9.1	1.00	keep	polished formatting (whitespace cleanup)
2026-04-15 22:04:44	C:\Users\CEX\Documents\GitHub\cex\archetypes\builders\bias-audit-builder\bld_schema_bias_audit.md	1	9.2	1.00	keep	analyzed: reduce_prose: convert long prose sections into tables or bullet lists
2026-04-15 22:04:44	C:\Users\CEX\Documents\GitHub\cex\archetypes\builders\bias-audit-builder\bld_system_prompt_bias_audit.md	1	8.8	0.80	keep	analyzed: increase_density: remove filler words, compress prose into tables
2026-04-15 22:04:45	C:\Users\CEX\Documents\GitHub\cex\archetypes\builders\bias-audit-builder\bld_tools_bias_audit.md	1	8.9	1.00	keep	polished formatting (whitespace cleanup)
2026-04-15 22:04:45	C:\Users\CEX\Documents\GitHub\cex\archetypes\builders\c2pa-manifest-builder\bld_architecture_c2pa_manifest.md	1	9.0	1.00	keep	polished formatting (whitespace cleanup)
2026-04-15 22:04:45	C:\Users\CEX\Documents\GitHub\cex\archetypes\builders\c2pa-manifest-builder\bld_collaboration_c2pa_manifest.md	1	8.9	1.00	keep	polished formatting (whitespace cleanup)
2026-04-15 22:04:46	C:\Users\CEX\Documents\GitHub\cex\archetypes\builders\c2pa-manifest-builder\bld_config_c2pa_manifest.md	1	8.6	0.92	keep	polished formatting (whitespace cleanup)
