timestamp	file	round	quality	density	status	description
2026-04-01 20:46:35	C:\Users\PC\Documents\GitHub\cex\P01_knowledge\examples\p03_system_prompt_create_system_prompt_for_intelligence_nucleus.md	1	8.8	0.93	keep	analyzed: reduce_prose: convert long prose sections into tables or bullet lists
2026-04-01 20:47:31	C:\Users\PC\Documents\GitHub\cex\P01_knowledge\examples\p01_knowledge_card_create_knowledge_card_about_intelligence_best_practices.md	1	0.0	0.00	crash	compile fail after: tldr flagged for manual review
2026-04-01 20:47:31	C:\Users\PC\Documents\GitHub\cex\P01_knowledge\examples\p01_knowledge_card_create_knowledge_card_about_intelligence_best_practices.md	2	0.0	0.00	crash	compile fail after: tldr flagged for manual review
2026-04-01 20:47:31	C:\Users\PC\Documents\GitHub\cex\P01_knowledge\examples\p01_knowledge_card_create_knowledge_card_about_intelligence_best_practices.md	3	0.0	0.00	crash	compile fail after: tldr flagged for manual review
2026-04-01 20:47:38	C:\Users\PC\Documents\GitHub\cex\P01_knowledge\examples\p01_knowledge_card_create_knowledge_card_about_intelligence_best_practices.md	1	0.0	0.00	crash	compile fail after: tldr flagged for manual review
2026-04-01 20:47:38	C:\Users\PC\Documents\GitHub\cex\P01_knowledge\examples\p01_knowledge_card_create_knowledge_card_about_intelligence_best_practices.md	2	0.0	0.00	crash	compile fail after: tldr flagged for manual review
2026-04-01 20:47:38	C:\Users\PC\Documents\GitHub\cex\P01_knowledge\examples\p01_knowledge_card_create_knowledge_card_about_intelligence_best_practices.md	3	0.0	0.00	crash	compile fail after: tldr flagged for manual review
2026-04-01 20:48:06	C:\Users\PC\Documents\GitHub\cex\P01_knowledge\examples\p01_knowledge_card_create_knowledge_card_about_intelligence_best_practices.md	1	8.9	1.00	keep	Add Anti-Patterns section to improve actionability and provide concrete examples of what NOT to do
2026-04-01 20:48:15	C:\Users\PC\Documents\GitHub\cex\P01_knowledge\examples\p01_knowledge_card_create_knowledge_card_about_intelligence_best_practices.md	1	0.0	0.00	crash	compile fail: Convert Strategy Phases from bullet list to detailed table with tools, outputs, and pitfalls for higher density
2026-04-01 20:48:42	C:\Users\PC\Documents\GitHub\cex\P01_knowledge\examples\p01_knowledge_card_create_knowledge_card_about_intelligence_best_practices.md	2	9.0	1.00	keep	Convert Key Concepts from bullet list to structured table format to increase density and scannability
2026-04-01 20:48:50	C:\Users\PC\Documents\GitHub\cex\P01_knowledge\examples\p01_knowledge_card_create_knowledge_card_about_intelligence_best_practices.md	2	9.0	1.00	keep	Convert Key Concepts section from bullet list to table format with concept, description, and application columns for higher content density
2026-04-01 20:49:44	C:\Users\PC\Documents\GitHub\cex\P01_knowledge\examples\p08_agent_card_create_agent_card_for_intelligence_nucleus.md	1	8.8	1.00	keep	added density_score: 1.0
2026-04-01 20:50:00	C:\Users\PC\Documents\GitHub\cex\P01_knowledge\examples\p08_agent_card_create_agent_card_for_intelligence_nucleus.md	1	8.9	1.00	keep	added density_score: 1.0
2026-04-01 20:50:35	C:\Users\PC\Documents\GitHub\cex\P01_knowledge\examples\p12_workflow_create_workflow_for_intelligence_pipeline.md	1	8.7	1.00	keep	polished formatting (whitespace cleanup)
2026-04-01 20:50:39	C:\Users\PC\Documents\GitHub\cex\P01_knowledge\examples\p12_workflow_create_workflow_for_intelligence_pipeline.md	1	8.8	0.98	keep	polished formatting (whitespace cleanup)
2026-04-01 20:51:33	C:\Users\PC\Documents\GitHub\cex\P01_knowledge\examples\p11_quality_gate_create_quality_gate_for_intelligence_artifacts.md	1	8.9	1.00	keep	polished formatting (whitespace cleanup)
2026-04-01 20:51:35	C:\Users\PC\Documents\GitHub\cex\P01_knowledge\examples\p11_quality_gate_create_quality_gate_for_intelligence_artifacts.md	1	8.9	1.00	keep	polished formatting (whitespace cleanup)
2026-04-01 20:52:38	C:\Users\PC\Documents\GitHub\cex\P01_knowledge\examples\p07_scoring_rubric_create_scoring_rubric_for_intelligence_evaluation.md	1	8.9	1.00	keep	polished formatting (whitespace cleanup)
2026-04-01 20:52:40	C:\Users\PC\Documents\GitHub\cex\P01_knowledge\examples\p07_scoring_rubric_create_scoring_rubric_for_intelligence_evaluation.md	1	8.9	1.00	keep	polished formatting (whitespace cleanup)
2026-04-01 20:53:20	C:\Users\PC\Documents\GitHub\cex\P01_knowledge\examples\p12_dispatch_rule_create_dispatch_rule_for_intelligence_routing.md	1	0.0	0.00	crash	compile fail after: added density_score: 0.88
2026-04-01 20:53:20	C:\Users\PC\Documents\GitHub\cex\P01_knowledge\examples\p12_dispatch_rule_create_dispatch_rule_for_intelligence_routing.md	2	0.0	0.00	crash	compile fail after: added density_score: 0.88
2026-04-01 20:53:20	C:\Users\PC\Documents\GitHub\cex\P01_knowledge\examples\p12_dispatch_rule_create_dispatch_rule_for_intelligence_routing.md	3	0.0	0.00	crash	compile fail after: added density_score: 0.88
2026-04-01 20:53:30	C:\Users\PC\Documents\GitHub\cex\P01_knowledge\examples\p12_dispatch_rule_create_dispatch_rule_for_intelligence_routing.md	1	8.5	0.83	keep	added density_score: 0.83
2026-04-01 20:53:34	C:\Users\PC\Documents\GitHub\cex\P01_knowledge\examples\p12_dispatch_rule_create_dispatch_rule_for_intelligence_routing.md	1	0.0	0.00	crash	compile fail: Add missing 'title' field to frontmatter for completeness
2026-04-01 20:53:53	C:\Users\PC\Documents\GitHub\cex\P01_knowledge\examples\p12_dispatch_rule_create_dispatch_rule_for_intelligence_routing.md	2	8.8	0.99	keep	Add structured "When to Use" section with specific triggers and examples for better actionability
2026-04-01 20:54:13	C:\Users\PC\Documents\GitHub\cex\P01_knowledge\examples\p12_dispatch_rule_create_dispatch_rule_for_intelligence_routing.md	3	8.8	1.00	discard	Add explicit "When NOT to Use" section with specific anti-patterns for clearer routing boundaries
2026-04-01 20:54:28	C:\Users\PC\Documents\GitHub\cex\P01_knowledge\examples\p06_input_schema_create_schema_contract_for_intelligence_data_model.md	1	8.9	1.00	keep	analyzed: reduce_prose: convert long prose sections into tables or bullet lists
2026-04-01 20:54:34	C:\Users\PC\Documents\GitHub\cex\P01_knowledge\examples\p12_dispatch_rule_create_dispatch_rule_for_intelligence_routing.md	4	8.8	1.00	discard	Convert keyword rationale section to structured table format for higher density and clarity
2026-04-01 20:54:53	C:\Users\PC\Documents\GitHub\cex\P01_knowledge\examples\p12_dispatch_rule_create_dispatch_rule_for_intelligence_routing.md	5	8.8	0.99	discard	Add missing 'title' field to frontmatter for schema compliance and completeness
2026-04-01 20:55:35	C:\Users\PC\Documents\GitHub\cex\P01_knowledge\examples\p05_formatter_create_output_template_for_intelligence_reports.md	1	8.9	1.00	keep	analyzed: reduce_prose: convert long prose sections into tables or bullet lists
2026-04-01 20:55:35	C:\Users\PC\Documents\GitHub\cex\P01_knowledge\examples\p06_input_schema_create_schema_contract_for_intelligence_data_model.md	1	8.9	1.00	keep	analyzed: reduce_prose: convert long prose sections into tables or bullet lists
2026-04-01 20:56:24	C:\Users\PC\Documents\GitHub\cex\P01_knowledge\examples\p05_formatter_create_output_template_for_intelligence_reports.md	1	8.9	1.00	keep	analyzed: reduce_prose: convert long prose sections into tables or bullet lists
2026-04-01 20:56:46	C:\Users\PC\Documents\GitHub\cex\P01_knowledge\examples\p03_prompt_template_create_prompt_template_for_intelligence_tasks.md	1	8.9	1.00	keep	analyzed: reduce_prose: convert long prose sections into tables or bullet lists
2026-04-01 20:57:37	C:\Users\PC\Documents\GitHub\cex\N04_knowledge\quality\scoring_rubric_knowledge.md	0	8.5	1.00	skip	already at target
2026-04-01 20:57:38	C:\Users\PC\Documents\GitHub\cex\N04_knowledge\output\output_sql_migration.md	0	8.5	0.93	skip	already at target
2026-04-01 20:57:39	C:\Users\PC\Documents\GitHub\cex\N04_knowledge\output\output_embedding_batch.md	0	8.5	1.00	skip	already at target
2026-04-01 20:57:39	C:\Users\PC\Documents\GitHub\cex\N01_intelligence\memory\embedding_config_intelligence.md	0	8.5	0.88	skip	already at target
2026-04-01 20:57:40	C:\Users\PC\Documents\GitHub\cex\N01_intelligence\output\output_source_dossier.md	0	8.6	1.00	skip	already at target
2026-04-01 20:57:41	C:\Users\PC\Documents\GitHub\cex\N04_knowledge\schemas\database_schema_contract.md	0	8.6	1.00	skip	already at target
2026-04-01 20:57:41	C:\Users\PC\Documents\GitHub\cex\N01_intelligence\output\output_research_brief.md	0	8.6	1.00	skip	already at target
2026-04-01 20:57:42	C:\Users\PC\Documents\GitHub\cex\N01_intelligence\schemas\source_quality_contract.md	0	8.6	1.00	skip	already at target
2026-04-01 20:57:43	C:\Users\PC\Documents\GitHub\cex\N01_intelligence\schemas\trend_detection_contract.md	0	8.6	1.00	skip	already at target
2026-04-01 20:57:43	C:\Users\PC\Documents\GitHub\cex\N04_knowledge\feedback\quality_gate_knowledge.md	0	8.6	1.00	skip	already at target
2026-04-01 20:57:44	C:\Users\PC\Documents\GitHub\cex\N04_knowledge\output\output_finetune_dataset.md	0	8.6	0.99	skip	already at target
2026-04-01 20:57:45	C:\Users\PC\Documents\GitHub\cex\N01_intelligence\quality\scoring_rubric_intelligence.md	0	8.6	1.00	skip	already at target
2026-04-01 20:57:45	C:\Users\PC\Documents\GitHub\cex\N01_intelligence\schemas\research_depth_levels.md	0	8.6	1.00	skip	already at target
2026-04-01 20:57:46	C:\Users\PC\Documents\GitHub\cex\N04_knowledge\schemas\export_format_contract.md	0	8.6	1.00	skip	already at target
2026-04-01 20:57:47	C:\Users\PC\Documents\GitHub\cex\N01_intelligence\quality\quality_gate_intelligence.md	0	8.7	0.92	skip	already at target
2026-04-01 20:57:47	C:\Users\PC\Documents\GitHub\cex\N01_intelligence\schemas\research_brief_contract.md	0	8.7	1.00	skip	already at target
2026-04-01 20:57:48	C:\Users\PC\Documents\GitHub\cex\N01_intelligence\schemas\competitive_analysis_contract.md	0	8.7	1.00	skip	already at target
2026-04-01 20:57:49	C:\Users\PC\Documents\GitHub\cex\N04_knowledge\output\output_gap_report.md	0	8.7	1.00	skip	already at target
2026-04-01 20:57:49	C:\Users\PC\Documents\GitHub\cex\N02_marketing\orchestration\p12_wf_weekly_fashion_content.md	0	8.7	1.00	skip	already at target
2026-04-01 20:57:50	C:\Users\PC\Documents\GitHub\cex\N04_knowledge\orchestration\workflow_knowledge.md	0	8.7	1.00	skip	already at target
2026-04-01 20:57:50	C:\Users\PC\Documents\GitHub\cex\N04_knowledge\knowledge\rag_source_knowledge.md	0	8.7	0.85	skip	already at target
2026-04-01 20:57:51	C:\Users\PC\Documents\GitHub\cex\N04_knowledge\prompts\system_prompt_knowledge.md	0	8.7	0.88	skip	already at target
2026-04-01 20:57:52	C:\Users\PC\Documents\GitHub\cex\N04_knowledge\output\output_taxonomy_map.md	0	8.7	1.00	skip	already at target
2026-04-01 20:57:52	C:\Users\PC\Documents\GitHub\cex\N04_knowledge\output\output_knowledge_card.md	0	8.7	1.00	skip	already at target
2026-04-01 20:57:53	C:\Users\PC\Documents\GitHub\cex\N01_intelligence\memory\rag_source_intelligence.md	0	8.7	0.93	skip	already at target
2026-04-01 20:57:54	C:\Users\PC\Documents\GitHub\cex\N04_knowledge\schemas\freshness_contract.md	0	8.7	1.00	skip	already at target
2026-04-01 20:57:54	C:\Users\PC\Documents\GitHub\cex\N04_knowledge\schemas\embedding_contract.md	0	8.7	1.00	skip	already at target
2026-04-01 20:57:55	C:\Users\PC\Documents\GitHub\cex\N01_intelligence\schemas\citation_format_contract.md	0	8.7	1.00	skip	already at target
2026-04-01 20:57:55	C:\Users\PC\Documents\GitHub\cex\N04_knowledge\quality\scoring_rubric_knowledge.md	0	8.5	1.00	skip	already at target
2026-04-01 20:57:56	C:\Users\PC\Documents\GitHub\cex\N01_intelligence\feedback\quality_gate_intelligence.md	0	8.7	1.00	skip	already at target
2026-04-01 20:57:56	C:\Users\PC\Documents\GitHub\cex\N04_knowledge\output\output_sql_migration.md	0	8.5	0.93	skip	already at target
2026-04-01 20:57:56	C:\Users\PC\Documents\GitHub\cex\N01_intelligence\architecture\agent_card_intelligence.md	0	8.7	1.00	skip	already at target
2026-04-01 20:57:57	C:\Users\PC\Documents\GitHub\cex\N04_knowledge\output\output_embedding_batch.md	0	8.5	1.00	skip	already at target
2026-04-01 20:57:57	C:\Users\PC\Documents\GitHub\cex\N04_knowledge\schemas\kc_structure_contract.md	0	8.7	1.00	skip	already at target
2026-04-01 20:57:58	C:\Users\PC\Documents\GitHub\cex\N01_intelligence\memory\embedding_config_intelligence.md	0	8.5	0.88	skip	already at target
2026-04-01 20:57:58	C:\Users\PC\Documents\GitHub\cex\N01_intelligence\knowledge\embedding_config_intelligence.md	0	8.7	0.93	skip	already at target
2026-04-01 20:57:58	C:\Users\PC\Documents\GitHub\cex\N01_intelligence\output\output_source_dossier.md	0	8.6	1.00	skip	already at target
2026-04-01 20:57:58	C:\Users\PC\Documents\GitHub\cex\N01_intelligence\orchestration\workflow_intelligence.md	0	8.7	1.00	skip	already at target
2026-04-01 20:57:59	C:\Users\PC\Documents\GitHub\cex\N04_knowledge\schemas\database_schema_contract.md	0	8.6	1.00	skip	already at target
2026-04-01 20:57:59	C:\Users\PC\Documents\GitHub\cex\N01_intelligence\output\output_trend_report.md	0	8.7	1.00	skip	already at target
2026-04-01 20:58:00	C:\Users\PC\Documents\GitHub\cex\N01_intelligence\output\output_research_brief.md	0	8.6	1.00	skip	already at target
2026-04-01 20:58:00	C:\Users\PC\Documents\GitHub\cex\N01_intelligence\prompts\system_prompt_intelligence.md	0	8.7	0.89	skip	already at target
2026-04-01 20:58:00	C:\Users\PC\Documents\GitHub\cex\N01_intelligence\schemas\source_quality_contract.md	0	8.6	1.00	skip	already at target
2026-04-01 20:58:00	C:\Users\PC\Documents\GitHub\cex\N01_intelligence\orchestration\dispatch_rule_intelligence.md	0	8.7	0.89	skip	already at target
2026-04-01 20:58:01	C:\Users\PC\Documents\GitHub\cex\N01_intelligence\schemas\trend_detection_contract.md	0	8.6	1.00	skip	already at target
2026-04-01 20:58:01	C:\Users\PC\Documents\GitHub\cex\N01_intelligence\output\output_swot_analysis.md	0	8.7	1.00	skip	already at target
2026-04-01 20:58:01	C:\Users\PC\Documents\GitHub\cex\N04_knowledge\feedback\quality_gate_knowledge.md	0	8.6	1.00	skip	already at target
2026-04-01 20:58:01	C:\Users\PC\Documents\GitHub\cex\N01_intelligence\output\output_benchmark_report.md	0	8.7	1.00	skip	already at target
2026-04-01 20:58:02	C:\Users\PC\Documents\GitHub\cex\N04_knowledge\output\output_finetune_dataset.md	0	8.6	0.99	skip	already at target
2026-04-01 20:58:02	C:\Users\PC\Documents\GitHub\cex\N01_intelligence\output\output_executive_summary.md	0	8.7	1.00	skip	already at target
2026-04-01 20:58:03	C:\Users\PC\Documents\GitHub\cex\N01_intelligence\quality\scoring_rubric_intelligence.md	0	8.6	1.00	skip	already at target
2026-04-01 20:58:03	C:\Users\PC\Documents\GitHub\cex\N01_intelligence\output\output_market_snapshot.md	0	8.7	1.00	skip	already at target
2026-04-01 20:58:03	C:\Users\PC\Documents\GitHub\cex\N01_intelligence\schemas\research_depth_levels.md	0	8.6	1.00	skip	already at target
2026-04-01 20:58:03	C:\Users\PC\Documents\GitHub\cex\N04_knowledge\knowledge\retriever_config_knowledge.md	0	8.8	0.86	skip	already at target
2026-04-01 20:58:04	C:\Users\PC\Documents\GitHub\cex\N04_knowledge\schemas\export_format_contract.md	0	8.6	1.00	skip	already at target
2026-04-01 20:58:04	C:\Users\PC\Documents\GitHub\cex\N04_knowledge\knowledge\rag_source_supabase.md	0	8.8	1.00	skip	already at target
2026-04-01 20:58:05	C:\Users\PC\Documents\GitHub\cex\N01_intelligence\quality\quality_gate_intelligence.md	0	8.7	0.92	skip	already at target
2026-04-01 20:58:05	C:\Users\PC\Documents\GitHub\cex\N04_knowledge\architecture\agent_card_knowledge.md	0	8.8	1.00	skip	already at target
2026-04-01 20:58:05	C:\Users\PC\Documents\GitHub\cex\N01_intelligence\schemas\research_brief_contract.md	0	8.7	1.00	skip	already at target
2026-04-01 20:58:05	C:\Users\PC\Documents\GitHub\cex\N04_knowledge\agents\agent_knowledge.md	0	8.8	1.00	skip	already at target
2026-04-01 20:58:06	C:\Users\PC\Documents\GitHub\cex\N01_intelligence\schemas\competitive_analysis_contract.md	0	8.7	1.00	skip	already at target
2026-04-01 20:58:06	C:\Users\PC\Documents\GitHub\cex\N02_marketing\schemas\tailwind_palette_contract.md	0	8.8	1.00	skip	already at target
2026-04-01 20:58:07	C:\Users\PC\Documents\GitHub\cex\N04_knowledge\output\output_gap_report.md	0	8.7	1.00	skip	already at target
2026-04-01 20:58:07	C:\Users\PC\Documents\GitHub\cex\N04_knowledge\orchestration\dispatch_rule_knowledge.md	0	8.8	0.88	skip	already at target
2026-04-01 20:58:07	C:\Users\PC\Documents\GitHub\cex\N02_marketing\orchestration\p12_wf_weekly_fashion_content.md	0	8.7	1.00	skip	already at target
2026-04-01 20:58:07	C:\Users\PC\Documents\GitHub\cex\N04_knowledge\tools\supabase_data_layer_tool.md	0	8.8	1.00	skip	already at target
2026-04-01 20:58:08	C:\Users\PC\Documents\GitHub\cex\N04_knowledge\orchestration\workflow_knowledge.md	0	8.7	1.00	skip	already at target
2026-04-01 20:58:08	C:\Users\PC\Documents\GitHub\cex\N04_knowledge\quality\quality_gate_knowledge.md	0	8.8	0.90	skip	already at target
2026-04-01 20:58:09	C:\Users\PC\Documents\GitHub\cex\N04_knowledge\knowledge\rag_source_knowledge.md	0	8.7	0.85	skip	already at target
2026-04-01 20:58:09	C:\Users\PC\Documents\GitHub\cex\N04_knowledge\schemas\taxonomy_contract.md	0	8.8	1.00	skip	already at target
2026-04-01 20:58:09	C:\Users\PC\Documents\GitHub\cex\N04_knowledge\prompts\system_prompt_knowledge.md	0	8.7	0.88	skip	already at target
2026-04-01 20:58:09	C:\Users\PC\Documents\GitHub\cex\N04_knowledge\output\output_knowledge_graph.md	0	8.8	1.00	skip	already at target
2026-04-01 20:58:10	C:\Users\PC\Documents\GitHub\cex\N04_knowledge\output\output_taxonomy_map.md	0	8.7	1.00	skip	already at target
2026-04-01 20:58:10	C:\Users\PC\Documents\GitHub\cex\N04_knowledge\orchestration\dispatch_rule_supabase.md	0	8.8	1.00	skip	already at target
2026-04-01 20:58:11	C:\Users\PC\Documents\GitHub\cex\N04_knowledge\orchestration\workflow_supabase_setup.md	0	8.8	1.00	skip	already at target
2026-04-01 20:58:11	C:\Users\PC\Documents\GitHub\cex\N04_knowledge\output\output_knowledge_card.md	0	8.7	1.00	skip	already at target
2026-04-01 20:58:11	C:\Users\PC\Documents\GitHub\cex\N04_knowledge\output\output_kc_audit_report.md	0	8.8	1.00	skip	already at target
2026-04-01 20:58:11	C:\Users\PC\Documents\GitHub\cex\N01_intelligence\memory\rag_source_intelligence.md	0	8.7	0.93	skip	already at target
2026-04-01 20:58:12	C:\Users\PC\Documents\GitHub\cex\N02_marketing\output\landing_page_template.md	0	8.8	0.99	skip	already at target
2026-04-01 20:58:12	C:\Users\PC\Documents\GitHub\cex\N04_knowledge\schemas\freshness_contract.md	0	8.7	1.00	skip	already at target
2026-04-01 20:58:13	C:\Users\PC\Documents\GitHub\cex\N01_intelligence\knowledge\rag_source_intelligence.md	0	8.8	0.94	skip	already at target
2026-04-01 20:58:13	C:\Users\PC\Documents\GitHub\cex\N04_knowledge\schemas\embedding_contract.md	0	8.7	1.00	skip	already at target
2026-04-01 20:58:13	C:\Users\PC\Documents\GitHub\cex\N01_intelligence\output\output_competitive_grid.md	0	8.8	1.00	skip	already at target
2026-04-01 20:58:13	C:\Users\PC\Documents\GitHub\cex\N01_intelligence\schemas\citation_format_contract.md	0	8.7	1.00	skip	already at target
2026-04-01 20:58:14	C:\Users\PC\Documents\GitHub\cex\N02_marketing\output\output_email_template.md	0	8.8	1.00	skip	already at target
2026-04-01 20:58:14	C:\Users\PC\Documents\GitHub\cex\N01_intelligence\feedback\quality_gate_intelligence.md	0	8.7	1.00	skip	already at target
2026-04-01 20:58:14	C:\Users\PC\Documents\GitHub\cex\N02_marketing\knowledge\kc_accessibility_a11y.md	0	8.8	1.00	skip	already at target
2026-04-01 20:58:15	C:\Users\PC\Documents\GitHub\cex\N01_intelligence\architecture\agent_card_intelligence.md	0	8.7	1.00	skip	already at target
2026-04-01 20:58:15	C:\Users\PC\Documents\GitHub\cex\N01_intelligence\knowledge\knowledge_card_intelligence.md	0	8.8	0.93	skip	already at target
2026-04-01 20:58:15	C:\Users\PC\Documents\GitHub\cex\N04_knowledge\schemas\kc_structure_contract.md	0	8.7	1.00	skip	already at target
2026-04-01 20:58:16	C:\Users\PC\Documents\GitHub\cex\N01_intelligence\agents\agent_intelligence.md	0	8.8	1.00	skip	already at target
2026-04-01 20:58:16	C:\Users\PC\Documents\GitHub\cex\N01_intelligence\knowledge\embedding_config_intelligence.md	0	8.7	0.93	skip	already at target
2026-04-01 20:58:16	C:\Users\PC\Documents\GitHub\cex\N02_marketing\output\component_template.md	0	8.8	0.97	skip	already at target
2026-04-01 20:58:16	C:\Users\PC\Documents\GitHub\cex\N01_intelligence\orchestration\workflow_intelligence.md	0	8.7	1.00	skip	already at target
2026-04-01 20:58:17	C:\Users\PC\Documents\GitHub\cex\N02_marketing\knowledge\kc_html_component_library.md	0	8.8	1.00	skip	already at target
2026-04-01 20:58:17	C:\Users\PC\Documents\GitHub\cex\N01_intelligence\output\output_trend_report.md	0	8.7	1.00	skip	already at target
2026-04-01 20:58:18	C:\Users\PC\Documents\GitHub\cex\N02_marketing\architecture\agent_card_marketing.md	0	8.9	1.00	skip	already at target
2026-04-01 20:58:18	C:\Users\PC\Documents\GitHub\cex\N01_intelligence\prompts\system_prompt_intelligence.md	0	8.7	0.89	skip	already at target
2026-04-01 20:58:18	C:\Users\PC\Documents\GitHub\cex\N02_marketing\feedback\quality_gate_marketing.md	0	8.9	1.00	skip	already at target
2026-04-01 20:58:18	C:\Users\PC\Documents\GitHub\cex\N01_intelligence\orchestration\dispatch_rule_intelligence.md	0	8.7	0.89	skip	already at target
2026-04-01 20:58:19	C:\Users\PC\Documents\GitHub\cex\N02_marketing\knowledge\knowledge_card_social_publishing.md	0	8.9	1.00	skip	already at target
2026-04-01 20:58:19	C:\Users\PC\Documents\GitHub\cex\N01_intelligence\output\output_swot_analysis.md	0	8.7	1.00	skip	already at target
2026-04-01 20:58:20	C:\Users\PC\Documents\GitHub\cex\N01_intelligence\knowledge\knowledge_card_source_catalog.md	0	8.9	1.00	skip	already at target
2026-04-01 20:58:20	C:\Users\PC\Documents\GitHub\cex\N01_intelligence\output\output_benchmark_report.md	0	8.7	1.00	skip	already at target
