timestamp	file	round	quality	density	status	description
2026-04-01 21:53:05	C:\Users\PC\Documents\GitHub\cex\N04_knowledge\output\output_finetune_dataset.md	5	8.8	1.00	discard	Enhance Generation Rules with specific technical details and validation criteria to improve actionability
2026-04-01 21:53:06	C:\Users\PC\Documents\GitHub\cex\N01_intelligence\quality\scoring_rubric_intelligence.md	1	8.6	1.00	discard	polished formatting (whitespace cleanup)
2026-04-01 21:53:06	C:\Users\PC\Documents\GitHub\cex\N01_intelligence\quality\scoring_rubric_intelligence.md	2	8.6	1.00	discard	polished formatting (whitespace cleanup)
2026-04-01 21:53:07	C:\Users\PC\Documents\GitHub\cex\N01_intelligence\quality\scoring_rubric_intelligence.md	3	8.6	1.00	discard	polished formatting (whitespace cleanup)
2026-04-01 21:53:25	C:\Users\PC\Documents\GitHub\cex\N01_intelligence\quality\scoring_rubric_intelligence.md	1	8.7	1.00	keep	Add Usage Guidelines section with when-to-use scenarios and anti-patterns to improve actionability
2026-04-01 21:53:51	C:\Users\PC\Documents\GitHub\cex\N01_intelligence\quality\scoring_rubric_intelligence.md	2	8.8	1.00	keep	Add "Scoring Examples" section with concrete mini-examples for each scoring dimension to improve practical actionability
2026-04-01 21:54:21	C:\Users\PC\Documents\GitHub\cex\N01_intelligence\quality\scoring_rubric_intelligence.md	3	8.8	1.00	discard	Expand Score Thresholds section with specific remediation actions for each score range to improve actionability
2026-04-01 21:54:52	C:\Users\PC\Documents\GitHub\cex\N01_intelligence\quality\scoring_rubric_intelligence.md	4	8.8	1.00	discard	Enhance scoring table with specific measurable criteria and concrete thresholds for more consistent evaluation
2026-04-01 21:55:27	C:\Users\PC\Documents\GitHub\cex\N01_intelligence\quality\scoring_rubric_intelligence.md	5	8.8	1.00	discard	Add a "Quick Assessment Checklist" section with scannable yes/no questions for faster evaluation
2026-04-01 21:55:28	C:\Users\PC\Documents\GitHub\cex\N01_intelligence\schemas\research_depth_levels.md	1	8.6	1.00	discard	analyzed: add_field_table: schemas need a field/type/description table
2026-04-01 21:55:28	C:\Users\PC\Documents\GitHub\cex\N01_intelligence\schemas\research_depth_levels.md	2	8.6	1.00	discard	analyzed: add_field_table: schemas need a field/type/description table
2026-04-01 21:55:28	C:\Users\PC\Documents\GitHub\cex\N01_intelligence\schemas\research_depth_levels.md	3	8.6	1.00	discard	analyzed: add_field_table: schemas need a field/type/description table
2026-04-01 21:55:50	C:\Users\PC\Documents\GitHub\cex\N01_intelligence\schemas\research_depth_levels.md	1	8.8	1.00	keep	Add concrete examples section showing real research outputs for each depth level to improve actionability
2026-04-01 21:56:18	C:\Users\PC\Documents\GitHub\cex\N01_intelligence\schemas\research_depth_levels.md	2	8.8	1.00	discard	Add Quality Gates section with specific success criteria for each research depth level
2026-04-01 21:56:44	C:\Users\PC\Documents\GitHub\cex\N01_intelligence\schemas\research_depth_levels.md	3	8.8	1.00	discard	Add Anti-Patterns section showing common mistakes to avoid for each research depth level to improve actionability
2026-04-01 21:57:21	C:\Users\PC\Documents\GitHub\cex\N01_intelligence\schemas\research_depth_levels.md	4	8.8	1.00	discard	Add Research Methodology section with step-by-step workflows for each depth level to improve actionability
2026-04-01 21:57:49	C:\Users\PC\Documents\GitHub\cex\N01_intelligence\schemas\research_depth_levels.md	5	8.8	1.00	discard	Add Selection Guide section with clear decision criteria for choosing the appropriate research depth level to improve actionability
2026-04-01 21:57:50	C:\Users\PC\Documents\GitHub\cex\N04_knowledge\schemas\export_format_contract.md	1	8.6	1.00	discard	polished formatting (whitespace cleanup)
2026-04-01 21:57:51	C:\Users\PC\Documents\GitHub\cex\N04_knowledge\schemas\export_format_contract.md	2	8.6	1.00	discard	polished formatting (whitespace cleanup)
2026-04-01 21:57:51	C:\Users\PC\Documents\GitHub\cex\N04_knowledge\schemas\export_format_contract.md	3	8.6	1.00	discard	polished formatting (whitespace cleanup)
2026-04-01 21:58:10	C:\Users\PC\Documents\GitHub\cex\N04_knowledge\schemas\export_format_contract.md	1	8.7	1.00	keep	Add Usage Guidelines section with when-to-use scenarios and implementation guidance to improve actionability
2026-04-01 21:58:34	C:\Users\PC\Documents\GitHub\cex\N04_knowledge\schemas\export_format_contract.md	2	8.8	1.00	keep	Add Validation section with concrete testing commands to verify export integrity
2026-04-01 21:59:00	C:\Users\PC\Documents\GitHub\cex\N04_knowledge\schemas\export_format_contract.md	3	8.8	1.00	discard	Convert anti-patterns bullet list to structured table with specific examples and remediation guidance
2026-04-01 21:59:26	C:\Users\PC\Documents\GitHub\cex\N04_knowledge\schemas\export_format_contract.md	4	8.8	1.00	discard	Add Field Mapping subsection to Format Specs showing precise CEX-to-export field transformations for each format
2026-04-01 21:59:52	C:\Users\PC\Documents\GitHub\cex\N04_knowledge\schemas\export_format_contract.md	5	8.8	1.00	discard	Add Common Issues section with concrete troubleshooting steps to improve actionability
2026-04-01 21:59:53	C:\Users\PC\Documents\GitHub\cex\N01_intelligence\quality\quality_gate_intelligence.md	1	8.7	0.92	discard	added density_score: 0.92
2026-04-01 21:59:53	C:\Users\PC\Documents\GitHub\cex\N01_intelligence\quality\quality_gate_intelligence.md	2	8.7	0.92	discard	added density_score: 0.92
2026-04-01 21:59:54	C:\Users\PC\Documents\GitHub\cex\N01_intelligence\quality\quality_gate_intelligence.md	3	8.7	0.92	discard	added density_score: 0.92
2026-04-01 22:00:36	C:\Users\PC\Documents\GitHub\cex\N01_intelligence\quality\quality_gate_intelligence.md	1	8.7	0.94	discard	Add concrete examples section showing what passes vs fails each gate to dramatically improve actionability
2026-04-01 22:01:18	C:\Users\PC\Documents\GitHub\cex\N01_intelligence\quality\quality_gate_intelligence.md	2	8.7	0.95	discard	Expand OUTCOMES section with detailed workflow procedures and escalation paths to improve actionability
2026-04-01 22:01:58	C:\Users\PC\Documents\GitHub\cex\N01_intelligence\quality\quality_gate_intelligence.md	3	8.7	0.93	discard	Add Process Integration section to clarify trigger conditions and workflow integration for improved actionability
2026-04-01 22:02:38	C:\Users\PC\Documents\GitHub\cex\N01_intelligence\quality\quality_gate_intelligence.md	4	8.7	0.92	discard	Add missing `when_to_use` frontmatter field to improve front matter completeness score
2026-04-01 22:03:27	C:\Users\PC\Documents\GitHub\cex\N01_intelligence\quality\quality_gate_intelligence.md	5	8.7	0.95	discard	Add Common Failure Patterns section to improve actionability by identifying typical failure modes for each gate
2026-04-01 22:03:28	C:\Users\PC\Documents\GitHub\cex\N01_intelligence\schemas\research_brief_contract.md	1	8.7	1.00	discard	polished formatting (whitespace cleanup)
2026-04-01 22:03:28	C:\Users\PC\Documents\GitHub\cex\N01_intelligence\schemas\research_brief_contract.md	2	8.7	1.00	discard	polished formatting (whitespace cleanup)
2026-04-01 22:03:28	C:\Users\PC\Documents\GitHub\cex\N01_intelligence\schemas\research_brief_contract.md	3	8.7	1.00	discard	polished formatting (whitespace cleanup)
2026-04-01 22:03:45	C:\Users\PC\Documents\GitHub\cex\N01_intelligence\schemas\research_brief_contract.md	1	8.8	1.00	keep	Add Usage Guidelines section with when-to-use scenarios and anti-patterns to improve actionability
2026-04-01 22:04:08	C:\Users\PC\Documents\GitHub\cex\N01_intelligence\schemas\research_brief_contract.md	2	8.8	1.00	discard	Add Validation Rules section with concrete field validation criteria to improve practical actionability
2026-04-01 22:04:31	C:\Users\PC\Documents\GitHub\cex\N01_intelligence\schemas\research_brief_contract.md	3	8.8	1.00	discard	Make output_format field more actionable by specifying the actual enum values instead of just "enum"
2026-04-01 22:05:02	C:\Users\PC\Documents\GitHub\cex\N01_intelligence\schemas\research_brief_contract.md	4	8.8	1.00	discard	Enhance Required Fields descriptions with more specific guidance and examples to improve actionability
2026-04-01 22:05:27	C:\Users\PC\Documents\GitHub\cex\N01_intelligence\schemas\research_brief_contract.md	5	8.8	1.00	discard	Enhance Optional Fields descriptions with specific examples to improve actionability
2026-04-01 22:05:28	C:\Users\PC\Documents\GitHub\cex\N01_intelligence\schemas\competitive_analysis_contract.md	1	8.7	1.00	discard	polished formatting (whitespace cleanup)
2026-04-01 22:05:28	C:\Users\PC\Documents\GitHub\cex\N01_intelligence\schemas\competitive_analysis_contract.md	2	8.7	1.00	discard	polished formatting (whitespace cleanup)
2026-04-01 22:05:29	C:\Users\PC\Documents\GitHub\cex\N01_intelligence\schemas\competitive_analysis_contract.md	3	8.7	1.00	discard	polished formatting (whitespace cleanup)
2026-04-01 22:05:48	C:\Users\PC\Documents\GitHub\cex\N01_intelligence\schemas\competitive_analysis_contract.md	1	8.8	1.00	keep	Add Usage Guidelines section with when-to-use scenarios and anti-patterns to improve actionability
2026-04-01 22:06:09	C:\Users\PC\Documents\GitHub\cex\N01_intelligence\schemas\competitive_analysis_contract.md	2	8.8	1.00	discard	Add concrete example section showing what a completed competitive analysis entry looks like
2026-04-01 22:06:30	C:\Users\PC\Documents\GitHub\cex\N01_intelligence\schemas\competitive_analysis_contract.md	3	8.8	1.00	discard	Add descriptions to optional dimensions table to match required dimensions format and improve actionability
2026-04-01 22:06:57	C:\Users\PC\Documents\GitHub\cex\N01_intelligence\schemas\competitive_analysis_contract.md	4	8.8	1.00	discard	Add validation rules section to specify data quality requirements and make the contract more actionable
2026-04-01 22:07:20	C:\Users\PC\Documents\GitHub\cex\N01_intelligence\schemas\competitive_analysis_contract.md	5	8.8	1.00	discard	Enhance Grid Structure section with concrete template format to improve actionability
2026-04-01 22:07:21	C:\Users\PC\Documents\GitHub\cex\N04_knowledge\output\output_gap_report.md	1	8.7	1.00	discard	polished formatting (whitespace cleanup)
2026-04-01 22:07:21	C:\Users\PC\Documents\GitHub\cex\N04_knowledge\output\output_gap_report.md	2	8.7	1.00	discard	polished formatting (whitespace cleanup)
2026-04-01 22:07:21	C:\Users\PC\Documents\GitHub\cex\N04_knowledge\output\output_gap_report.md	3	8.7	1.00	discard	polished formatting (whitespace cleanup)
2026-04-01 22:07:40	C:\Users\PC\Documents\GitHub\cex\N04_knowledge\output\output_gap_report.md	1	8.8	1.00	keep	Add Usage Guidelines section with when-to-use scenarios and anti-patterns to improve actionability
2026-04-01 22:08:02	C:\Users\PC\Documents\GitHub\cex\N04_knowledge\output\output_gap_report.md	2	8.8	1.00	discard	Add automation section with specific commands to generate gap reports automatically
2026-04-01 22:08:24	C:\Users\PC\Documents\GitHub\cex\N04_knowledge\output\output_gap_report.md	3	8.8	1.00	discard	Add methodology section with concrete impact scoring criteria to improve actionability
2026-04-01 22:08:53	C:\Users\PC\Documents\GitHub\cex\N04_knowledge\output\output_gap_report.md	4	8.8	1.00	discard	Add Gap Analysis Criteria subsection within template to provide concrete scoring guidance for impact assessment
2026-04-01 22:09:23	C:\Users\PC\Documents\GitHub\cex\N04_knowledge\output\output_gap_report.md	5	8.8	1.00	discard	Expand Recommendations section in template with structured action categories to improve actionability
2026-04-01 22:09:24	C:\Users\PC\Documents\GitHub\cex\N02_marketing\orchestration\p12_wf_weekly_fashion_content.md	1	8.7	1.00	discard	polished formatting (whitespace cleanup)
2026-04-01 22:09:25	C:\Users\PC\Documents\GitHub\cex\N02_marketing\orchestration\p12_wf_weekly_fashion_content.md	2	8.7	1.00	discard	polished formatting (whitespace cleanup)
2026-04-01 22:09:25	C:\Users\PC\Documents\GitHub\cex\N02_marketing\orchestration\p12_wf_weekly_fashion_content.md	3	8.7	1.00	discard	polished formatting (whitespace cleanup)
2026-04-01 22:09:53	C:\Users\PC\Documents\GitHub\cex\N02_marketing\orchestration\p12_wf_weekly_fashion_content.md	1	8.8	1.00	keep	Add Usage Guidelines section with when-to-use scenarios and anti-patterns to improve actionability
2026-04-01 22:10:23	C:\Users\PC\Documents\GitHub\cex\N02_marketing\orchestration\p12_wf_weekly_fashion_content.md	2	8.9	1.00	keep	Convert step details from bullet lists to compact tables for higher information density
2026-04-01 22:10:59	C:\Users\PC\Documents\GitHub\cex\N02_marketing\orchestration\p12_wf_weekly_fashion_content.md	3	8.9	1.00	discard	Add Success Metrics section with specific KPIs and benchmarks to improve workflow actionability and measurability
2026-04-01 22:11:34	C:\Users\PC\Documents\GitHub\cex\N02_marketing\orchestration\p12_wf_weekly_fashion_content.md	4	8.9	1.00	discard	Expand Dependencies section into detailed table format with specific tools, APIs, and technical requirements
2026-04-01 22:12:15	C:\Users\PC\Documents\GitHub\cex\N02_marketing\orchestration\p12_wf_weekly_fashion_content.md	5	8.9	1.00	discard	Expand Signals section with specific signal names and detailed error handling procedures for better workflow orchestration
2026-04-01 22:12:16	C:\Users\PC\Documents\GitHub\cex\N04_knowledge\orchestration\workflow_knowledge.md	1	8.7	1.00	discard	polished formatting (whitespace cleanup)
2026-04-01 22:12:16	C:\Users\PC\Documents\GitHub\cex\N04_knowledge\orchestration\workflow_knowledge.md	2	8.7	1.00	discard	polished formatting (whitespace cleanup)
2026-04-01 22:12:17	C:\Users\PC\Documents\GitHub\cex\N04_knowledge\orchestration\workflow_knowledge.md	3	8.7	1.00	discard	polished formatting (whitespace cleanup)
2026-04-01 22:12:35	C:\Users\PC\Documents\GitHub\cex\N04_knowledge\orchestration\workflow_knowledge.md	1	8.8	1.00	keep	Add Usage Guidelines section with when-to-use scenarios and anti-patterns to improve actionability
2026-04-01 22:12:57	C:\Users\PC\Documents\GitHub\cex\N04_knowledge\orchestration\workflow_knowledge.md	2	8.8	1.00	discard	Add concrete command examples to the pipeline table to make each step immediately actionable
2026-04-01 22:13:20	C:\Users\PC\Documents\GitHub\cex\N04_knowledge\orchestration\workflow_knowledge.md	3	8.8	1.00	discard	Enhance pipeline table with more specific and actionable tool commands/scripts
2026-04-01 22:13:44	C:\Users\PC\Documents\GitHub\cex\N04_knowledge\orchestration\workflow_knowledge.md	4	8.8	1.00	discard	Add success criteria column to pipeline table to make each step more actionable and measurable
2026-04-01 22:14:08	C:\Users\PC\Documents\GitHub\cex\N04_knowledge\orchestration\workflow_knowledge.md	5	8.8	1.00	discard	Enhance export formats table with specific schemas and technical details to improve density and actionability
2026-04-01 22:14:09	C:\Users\PC\Documents\GitHub\cex\N04_knowledge\knowledge\rag_source_knowledge.md	1	8.7	0.85	discard	added density_score: 0.85
2026-04-01 22:14:10	C:\Users\PC\Documents\GitHub\cex\N04_knowledge\knowledge\rag_source_knowledge.md	2	8.7	0.85	discard	added density_score: 0.85
2026-04-01 22:14:10	C:\Users\PC\Documents\GitHub\cex\N04_knowledge\knowledge\rag_source_knowledge.md	3	8.7	0.85	discard	added density_score: 0.85
2026-04-01 22:14:31	C:\Users\PC\Documents\GitHub\cex\N04_knowledge\knowledge\rag_source_knowledge.md	1	8.7	0.90	discard	Add Usage Guidelines section with when-to-use scenarios and anti-patterns to improve actionability
2026-04-01 22:14:55	C:\Users\PC\Documents\GitHub\cex\N04_knowledge\knowledge\rag_source_knowledge.md	2	8.8	0.91	keep	Convert Section 3 freshness details from prose to table format for higher information density
2026-04-01 22:15:16	C:\Users\PC\Documents\GitHub\cex\N04_knowledge\knowledge\rag_source_knowledge.md	3	8.8	0.94	discard	Convert Section 2 configuration details from prose to table format for higher information density
2026-04-01 22:15:37	C:\Users\PC\Documents\GitHub\cex\N04_knowledge\knowledge\rag_source_knowledge.md	4	8.8	0.97	discard	Convert Section 4 reliability details from prose to table format for higher information density
2026-04-01 22:16:05	C:\Users\PC\Documents\GitHub\cex\N04_knowledge\knowledge\rag_source_knowledge.md	5	8.8	0.96	discard	Convert Section 1 source description from wordy prose to structured table format for higher information density
2026-04-01 22:16:06	C:\Users\PC\Documents\GitHub\cex\N04_knowledge\prompts\system_prompt_knowledge.md	1	8.7	0.88	discard	analyzed: increase_density: remove filler words, compress prose into tables
2026-04-01 22:16:06	C:\Users\PC\Documents\GitHub\cex\N04_knowledge\prompts\system_prompt_knowledge.md	2	8.7	0.88	discard	analyzed: increase_density: remove filler words, compress prose into tables
2026-04-01 22:16:06	C:\Users\PC\Documents\GitHub\cex\N04_knowledge\prompts\system_prompt_knowledge.md	3	8.7	0.88	discard	analyzed: increase_density: remove filler words, compress prose into tables
2026-04-01 22:16:27	C:\Users\PC\Documents\GitHub\cex\N04_knowledge\prompts\system_prompt_knowledge.md	1	8.7	1.00	discard	Convert the 12 rules from verbose bullet points into a compact table format to increase density and readability
2026-04-01 22:16:53	C:\Users\PC\Documents\GitHub\cex\N04_knowledge\prompts\system_prompt_knowledge.md	2	8.7	0.88	discard	Add Usage Guidelines section with when-to-use scenarios and anti-patterns to improve actionability
2026-04-01 22:17:16	C:\Users\PC\Documents\GitHub\cex\N04_knowledge\prompts\system_prompt_knowledge.md	3	8.8	0.97	keep	Convert Knowledge Boundary section from prose list to structured table format for improved readability and density
2026-04-01 22:17:43	C:\Users\PC\Documents\GitHub\cex\N04_knowledge\prompts\system_prompt_knowledge.md	4	8.8	1.00	discard	Add concrete examples section showing good vs bad KC structure to increase actionability and specificity
2026-04-01 22:18:16	C:\Users\PC\Documents\GitHub\cex\N04_knowledge\prompts\system_prompt_knowledge.md	5	8.9	1.00	keep	Add dedicated Anti-Patterns section with specific knowledge engineering mistakes to increase actionability
2026-04-01 22:18:17	C:\Users\PC\Documents\GitHub\cex\N04_knowledge\output\output_taxonomy_map.md	1	8.7	1.00	discard	polished formatting (whitespace cleanup)
2026-04-01 22:18:18	C:\Users\PC\Documents\GitHub\cex\N04_knowledge\output\output_taxonomy_map.md	2	8.7	1.00	discard	polished formatting (whitespace cleanup)
2026-04-01 22:18:18	C:\Users\PC\Documents\GitHub\cex\N04_knowledge\output\output_taxonomy_map.md	3	8.7	1.00	discard	polished formatting (whitespace cleanup)
2026-04-01 22:18:36	C:\Users\PC\Documents\GitHub\cex\N04_knowledge\output\output_taxonomy_map.md	1	8.8	1.00	keep	Add Usage Guidelines section with when-to-use scenarios and interpretation guidance to improve actionability
2026-04-01 22:18:55	C:\Users\PC\Documents\GitHub\cex\N04_knowledge\output\output_taxonomy_map.md	2	8.8	1.00	discard	Expand Interpretation Guide with more specific coverage scenarios and recommended actions
2026-04-01 22:19:20	C:\Users\PC\Documents\GitHub\cex\N04_knowledge\output\output_taxonomy_map.md	3	8.8	1.00	discard	Replace template placeholders with concrete realistic examples to improve immediate actionability and density
2026-04-01 22:19:43	C:\Users\PC\Documents\GitHub\cex\N04_knowledge\output\output_taxonomy_map.md	4	8.8	1.00	discard	Add Anti-Patterns section with specific taxonomy mapping mistakes to improve actionability
2026-04-01 22:20:07	C:\Users\PC\Documents\GitHub\cex\N04_knowledge\output\output_taxonomy_map.md	5	8.8	1.00	discard	Add Success Metrics section with specific quantitative criteria for evaluating taxonomy coverage completeness
2026-04-01 22:20:08	C:\Users\PC\Documents\GitHub\cex\N04_knowledge\output\output_knowledge_card.md	1	8.7	1.00	discard	analyzed: reduce_prose: convert long prose sections into tables or bullet lists
2026-04-01 22:20:08	C:\Users\PC\Documents\GitHub\cex\N04_knowledge\output\output_knowledge_card.md	2	8.7	1.00	discard	analyzed: reduce_prose: convert long prose sections into tables or bullet lists
2026-04-01 22:20:09	C:\Users\PC\Documents\GitHub\cex\N04_knowledge\output\output_knowledge_card.md	3	8.7	1.00	discard	analyzed: reduce_prose: convert long prose sections into tables or bullet lists
2026-04-01 22:20:28	C:\Users\PC\Documents\GitHub\cex\N04_knowledge\output\output_knowledge_card.md	1	8.7	1.00	discard	Add Usage Guidelines section with specific when-to-create scenarios and KC type selection criteria to improve actionability
2026-04-01 22:20:49	C:\Users\PC\Documents\GitHub\cex\N04_knowledge\output\output_knowledge_card.md	2	8.8	1.00	keep	Add Template Population Guide section with structured table format for improved actionability and density
2026-04-01 22:21:14	C:\Users\PC\Documents\GitHub\cex\N04_knowledge\output\output_knowledge_card.md	3	8.8	1.00	discard	Enhance Template Population Guide table with validation criteria and quality thresholds to improve actionability
2026-04-01 22:21:42	C:\Users\PC\Documents\GitHub\cex\N04_knowledge\output\output_knowledge_card.md	4	8.8	1.00	discard	Add Quality Validation Checklist section with specific verification steps to improve actionability for KC creators
2026-04-01 22:22:08	C:\Users\PC\Documents\GitHub\cex\N04_knowledge\output\output_knowledge_card.md	5	8.8	1.00	discard	Enhance Template Population Guide with more CEX-specific examples and additional field coverage for better actionability
2026-04-01 22:22:09	C:\Users\PC\Documents\GitHub\cex\N01_intelligence\memory\rag_source_intelligence.md	1	8.7	0.93	discard	added density_score: 0.93
2026-04-01 22:22:09	C:\Users\PC\Documents\GitHub\cex\N01_intelligence\memory\rag_source_intelligence.md	2	8.7	0.93	discard	added density_score: 0.93
2026-04-01 22:22:09	C:\Users\PC\Documents\GitHub\cex\N01_intelligence\memory\rag_source_intelligence.md	3	8.7	0.93	discard	added density_score: 0.93
