timestamp	file	round	quality	density	status	description
2026-04-15 22:06:24	C:\Users\CEX\Documents\GitHub\cex\archetypes\builders\ecommerce-vertical-builder\bld_tools_ecommerce_vertical.md	1	8.9	1.00	keep	polished formatting (whitespace cleanup)
2026-04-15 22:06:25	C:\Users\CEX\Documents\GitHub\cex\archetypes\builders\edtech-vertical-builder\bld_architecture_edtech_vertical.md	1	9.0	1.00	keep	polished formatting (whitespace cleanup)
2026-04-15 22:06:25	C:\Users\CEX\Documents\GitHub\cex\archetypes\builders\edtech-vertical-builder\bld_collaboration_edtech_vertical.md	1	8.9	0.87	keep	analyzed: increase_density: remove filler words, compress prose into tables
2026-04-15 22:06:25	C:\Users\CEX\Documents\GitHub\cex\archetypes\builders\edtech-vertical-builder\bld_config_edtech_vertical.md	1	8.6	0.95	keep	polished formatting (whitespace cleanup)
2026-04-15 22:06:26	C:\Users\CEX\Documents\GitHub\cex\archetypes\builders\edtech-vertical-builder\bld_examples_edtech_vertical.md	1	8.9	0.96	keep	analyzed: reduce_prose: convert long prose sections into tables or bullet lists
2026-04-15 22:06:26	C:\Users\CEX\Documents\GitHub\cex\archetypes\builders\edtech-vertical-builder\bld_instruction_edtech_vertical.md	1	8.9	1.00	keep	analyzed: reduce_prose: convert long prose sections into tables or bullet lists
2026-04-15 22:06:26	C:\Users\CEX\Documents\GitHub\cex\archetypes\builders\edtech-vertical-builder\bld_knowledge_card_edtech_vertical.md	1	9.2	1.00	keep	analyzed: reduce_prose: convert long prose sections into tables or bullet lists
2026-04-15 22:06:27	C:\Users\CEX\Documents\GitHub\cex\archetypes\builders\edtech-vertical-builder\bld_manifest_edtech_vertical.md	1	8.8	0.81	keep	analyzed: increase_density: remove filler words, compress prose into tables
2026-04-15 22:06:27	C:\Users\CEX\Documents\GitHub\cex\archetypes\builders\edtech-vertical-builder\bld_memory_edtech_vertical.md	1	8.8	0.98	keep	polished formatting (whitespace cleanup)
2026-04-15 22:06:27	C:\Users\CEX\Documents\GitHub\cex\archetypes\builders\edtech-vertical-builder\bld_output_template_edtech_vertical.md	1	9.1	1.00	keep	analyzed: reduce_prose: convert long prose sections into tables or bullet lists
2026-04-15 22:06:27	C:\Users\CEX\Documents\GitHub\cex\archetypes\builders\edtech-vertical-builder\bld_quality_gate_edtech_vertical.md	1	9.0	1.00	keep	polished formatting (whitespace cleanup)
2026-04-15 22:06:28	C:\Users\CEX\Documents\GitHub\cex\archetypes\builders\edtech-vertical-builder\bld_schema_edtech_vertical.md	1	9.1	1.00	keep	polished formatting (whitespace cleanup)
2026-04-15 22:06:28	C:\Users\CEX\Documents\GitHub\cex\archetypes\builders\edtech-vertical-builder\bld_system_prompt_edtech_vertical.md	1	8.8	0.81	keep	analyzed: increase_density: remove filler words, compress prose into tables
2026-04-15 22:06:28	C:\Users\CEX\Documents\GitHub\cex\archetypes\builders\edtech-vertical-builder\bld_tools_edtech_vertical.md	1	8.8	1.00	keep	polished formatting (whitespace cleanup)
2026-04-15 22:06:29	C:\Users\CEX\Documents\GitHub\cex\archetypes\builders\enterprise-sla-builder\bld_architecture_enterprise_sla.md	1	9.0	1.00	keep	polished formatting (whitespace cleanup)
2026-04-15 22:06:29	C:\Users\CEX\Documents\GitHub\cex\archetypes\builders\enterprise-sla-builder\bld_collaboration_enterprise_sla.md	1	8.9	0.88	keep	analyzed: increase_density: remove filler words, compress prose into tables
2026-04-15 22:06:29	C:\Users\CEX\Documents\GitHub\cex\archetypes\builders\enterprise-sla-builder\bld_config_enterprise_sla.md	1	8.6	0.95	keep	polished formatting (whitespace cleanup)
2026-04-15 22:06:30	C:\Users\CEX\Documents\GitHub\cex\archetypes\builders\enterprise-sla-builder\bld_examples_enterprise_sla.md	1	8.9	0.94	keep	polished formatting (whitespace cleanup)
2026-04-15 22:06:30	C:\Users\CEX\Documents\GitHub\cex\archetypes\builders\enterprise-sla-builder\bld_instruction_enterprise_sla.md	1	8.9	0.89	keep	analyzed: reduce_prose: convert long prose sections into tables or bullet lists
2026-04-15 22:06:30	C:\Users\CEX\Documents\GitHub\cex\archetypes\builders\enterprise-sla-builder\bld_knowledge_card_enterprise_sla.md	1	9.2	0.96	keep	analyzed: reduce_prose: convert long prose sections into tables or bullet lists
2026-04-15 22:06:31	C:\Users\CEX\Documents\GitHub\cex\archetypes\builders\enterprise-sla-builder\bld_manifest_enterprise_sla.md	1	8.8	0.80	keep	analyzed: increase_density: remove filler words, compress prose into tables
2026-04-15 22:06:31	C:\Users\CEX\Documents\GitHub\cex\archetypes\builders\enterprise-sla-builder\bld_memory_enterprise_sla.md	1	8.7	0.99	keep	polished formatting (whitespace cleanup)
2026-04-15 22:06:31	C:\Users\CEX\Documents\GitHub\cex\archetypes\builders\enterprise-sla-builder\bld_output_template_enterprise_sla.md	1	8.7	1.00	keep	analyzed: reduce_prose: convert long prose sections into tables or bullet lists
2026-04-15 22:06:32	C:\Users\CEX\Documents\GitHub\cex\archetypes\builders\enterprise-sla-builder\bld_quality_gate_enterprise_sla.md	1	9.1	1.00	keep	polished formatting (whitespace cleanup)
2026-04-15 22:06:32	C:\Users\CEX\Documents\GitHub\cex\archetypes\builders\enterprise-sla-builder\bld_schema_enterprise_sla.md	1	9.1	1.00	keep	polished formatting (whitespace cleanup)
2026-04-15 22:06:32	C:\Users\CEX\Documents\GitHub\cex\archetypes\builders\enterprise-sla-builder\bld_system_prompt_enterprise_sla.md	1	8.8	0.83	keep	analyzed: increase_density: remove filler words, compress prose into tables
2026-04-15 22:06:33	C:\Users\CEX\Documents\GitHub\cex\archetypes\builders\enterprise-sla-builder\bld_tools_enterprise_sla.md	1	8.9	1.00	keep	polished formatting (whitespace cleanup)
2026-04-15 22:06:33	C:\Users\CEX\Documents\GitHub\cex\archetypes\builders\eval-dataset-builder\bld_memory_eval_dataset.md	1	8.9	0.96	keep	added density_score: 0.96
2026-04-15 22:06:33	C:\Users\CEX\Documents\GitHub\cex\archetypes\builders\eval-framework-builder\bld_architecture_eval_framework.md	1	9.0	1.00	keep	polished formatting (whitespace cleanup)
2026-04-15 22:06:34	C:\Users\CEX\Documents\GitHub\cex\archetypes\builders\eval-framework-builder\bld_collaboration_eval_framework.md	1	8.9	0.84	keep	analyzed: increase_density: remove filler words, compress prose into tables
2026-04-15 22:06:34	C:\Users\CEX\Documents\GitHub\cex\archetypes\builders\eval-framework-builder\bld_config_eval_framework.md	1	8.6	0.95	keep	polished formatting (whitespace cleanup)
2026-04-15 22:06:34	C:\Users\CEX\Documents\GitHub\cex\archetypes\builders\eval-framework-builder\bld_examples_eval_framework.md	1	8.9	0.83	keep	analyzed: reduce_prose: convert long prose sections into tables or bullet lists
2026-04-15 22:06:34	C:\Users\CEX\Documents\GitHub\cex\archetypes\builders\eval-framework-builder\bld_instruction_eval_framework.md	1	8.8	0.99	keep	analyzed: reduce_prose: convert long prose sections into tables or bullet lists
2026-04-15 22:06:35	C:\Users\CEX\Documents\GitHub\cex\archetypes\builders\eval-framework-builder\bld_knowledge_card_eval_framework.md	1	9.2	1.00	keep	tldr flagged for manual review
2026-04-15 22:06:35	C:\Users\CEX\Documents\GitHub\cex\archetypes\builders\eval-framework-builder\bld_manifest_eval_framework.md	1	8.8	0.82	keep	analyzed: increase_density: remove filler words, compress prose into tables
2026-04-15 22:06:36	C:\Users\CEX\Documents\GitHub\cex\archetypes\builders\eval-framework-builder\bld_memory_eval_framework.md	1	8.7	0.99	keep	polished formatting (whitespace cleanup)
2026-04-15 22:06:36	C:\Users\CEX\Documents\GitHub\cex\archetypes\builders\eval-framework-builder\bld_output_template_eval_framework.md	1	8.7	1.00	keep	analyzed: reduce_prose: convert long prose sections into tables or bullet lists
2026-04-15 22:06:36	C:\Users\CEX\Documents\GitHub\cex\archetypes\builders\eval-framework-builder\bld_quality_gate_eval_framework.md	1	9.0	1.00	keep	polished formatting (whitespace cleanup)
2026-04-15 22:06:37	C:\Users\CEX\Documents\GitHub\cex\archetypes\builders\eval-framework-builder\bld_schema_eval_framework.md	1	9.2	1.00	keep	analyzed: reduce_prose: convert long prose sections into tables or bullet lists
2026-04-15 22:06:37	C:\Users\CEX\Documents\GitHub\cex\archetypes\builders\eval-framework-builder\bld_system_prompt_eval_framework.md	1	8.8	0.83	keep	analyzed: increase_density: remove filler words, compress prose into tables
2026-04-15 22:06:37	C:\Users\CEX\Documents\GitHub\cex\archetypes\builders\eval-framework-builder\bld_tools_eval_framework.md	1	9.0	1.00	keep	polished formatting (whitespace cleanup)
2026-04-15 22:06:37	C:\Users\CEX\Documents\GitHub\cex\archetypes\builders\eval-metric-builder\bld_architecture_eval_metric.md	1	9.0	1.00	keep	polished formatting (whitespace cleanup)
2026-04-15 22:06:38	C:\Users\CEX\Documents\GitHub\cex\archetypes\builders\eval-metric-builder\bld_collaboration_eval_metric.md	1	8.9	0.89	keep	analyzed: increase_density: remove filler words, compress prose into tables
2026-04-15 22:06:38	C:\Users\CEX\Documents\GitHub\cex\archetypes\builders\eval-metric-builder\bld_config_eval_metric.md	1	8.6	1.00	keep	polished formatting (whitespace cleanup)
2026-04-15 22:06:38	C:\Users\CEX\Documents\GitHub\cex\archetypes\builders\eval-metric-builder\bld_examples_eval_metric.md	1	9.0	0.91	keep	polished formatting (whitespace cleanup)
2026-04-15 22:06:39	C:\Users\CEX\Documents\GitHub\cex\archetypes\builders\eval-metric-builder\bld_instruction_eval_metric.md	1	8.8	1.00	keep	analyzed: reduce_prose: convert long prose sections into tables or bullet lists
2026-04-15 22:06:39	C:\Users\CEX\Documents\GitHub\cex\archetypes\builders\eval-metric-builder\bld_knowledge_card_eval_metric.md	1	9.1	0.97	keep	polished formatting (whitespace cleanup)
2026-04-15 22:06:39	C:\Users\CEX\Documents\GitHub\cex\archetypes\builders\eval-metric-builder\bld_manifest_eval_metric.md	1	8.8	0.80	keep	analyzed: increase_density: remove filler words, compress prose into tables
2026-04-15 22:06:40	C:\Users\CEX\Documents\GitHub\cex\archetypes\builders\eval-metric-builder\bld_memory_eval_metric.md	1	8.7	0.99	keep	polished formatting (whitespace cleanup)
2026-04-15 22:06:40	C:\Users\CEX\Documents\GitHub\cex\archetypes\builders\eval-metric-builder\bld_output_template_eval_metric.md	1	8.7	1.00	keep	analyzed: reduce_prose: convert long prose sections into tables or bullet lists
2026-04-15 22:06:40	C:\Users\CEX\Documents\GitHub\cex\archetypes\builders\eval-metric-builder\bld_quality_gate_eval_metric.md	1	9.1	1.00	keep	polished formatting (whitespace cleanup)
2026-04-15 22:06:41	C:\Users\CEX\Documents\GitHub\cex\archetypes\builders\eval-metric-builder\bld_schema_eval_metric.md	1	9.1	1.00	keep	polished formatting (whitespace cleanup)
2026-04-15 22:06:41	C:\Users\CEX\Documents\GitHub\cex\archetypes\builders\eval-metric-builder\bld_system_prompt_eval_metric.md	1	8.8	0.80	keep	analyzed: increase_density: remove filler words, compress prose into tables
2026-04-15 22:06:41	C:\Users\CEX\Documents\GitHub\cex\archetypes\builders\eval-metric-builder\bld_tools_eval_metric.md	1	8.9	1.00	keep	polished formatting (whitespace cleanup)
2026-04-15 22:06:42	C:\Users\CEX\Documents\GitHub\cex\archetypes\builders\expansion-play-builder\bld_architecture_expansion_play.md	1	9.0	1.00	keep	polished formatting (whitespace cleanup)
2026-04-15 22:06:42	C:\Users\CEX\Documents\GitHub\cex\archetypes\builders\expansion-play-builder\bld_collaboration_expansion_play.md	1	8.9	0.87	keep	analyzed: increase_density: remove filler words, compress prose into tables
2026-04-15 22:06:42	C:\Users\CEX\Documents\GitHub\cex\archetypes\builders\expansion-play-builder\bld_config_expansion_play.md	1	8.7	1.00	keep	polished formatting (whitespace cleanup)
2026-04-15 22:06:43	C:\Users\CEX\Documents\GitHub\cex\archetypes\builders\expansion-play-builder\bld_examples_expansion_play.md	1	9.1	0.99	keep	analyzed: reduce_prose: convert long prose sections into tables or bullet lists
2026-04-15 22:06:43	C:\Users\CEX\Documents\GitHub\cex\archetypes\builders\expansion-play-builder\bld_instruction_expansion_play.md	1	8.9	0.99	keep	analyzed: reduce_prose: convert long prose sections into tables or bullet lists
2026-04-15 22:06:43	C:\Users\CEX\Documents\GitHub\cex\archetypes\builders\expansion-play-builder\bld_knowledge_card_expansion_play.md	1	9.2	0.99	keep	analyzed: reduce_prose: convert long prose sections into tables or bullet lists
2026-04-15 22:06:43	C:\Users\CEX\Documents\GitHub\cex\archetypes\builders\expansion-play-builder\bld_manifest_expansion_play.md	1	8.9	0.85	keep	analyzed: reduce_prose: convert long prose sections into tables or bullet lists
2026-04-15 22:06:44	C:\Users\CEX\Documents\GitHub\cex\archetypes\builders\expansion-play-builder\bld_memory_expansion_play.md	1	8.8	0.89	keep	analyzed: increase_density: remove filler words, compress prose into tables
2026-04-15 22:06:44	C:\Users\CEX\Documents\GitHub\cex\archetypes\builders\expansion-play-builder\bld_output_template_expansion_play.md	1	9.1	1.00	keep	analyzed: reduce_prose: convert long prose sections into tables or bullet lists
2026-04-15 22:06:44	C:\Users\CEX\Documents\GitHub\cex\archetypes\builders\expansion-play-builder\bld_quality_gate_expansion_play.md	1	9.1	1.00	keep	polished formatting (whitespace cleanup)
2026-04-15 22:06:45	C:\Users\CEX\Documents\GitHub\cex\archetypes\builders\expansion-play-builder\bld_schema_expansion_play.md	1	9.2	1.00	keep	analyzed: reduce_prose: convert long prose sections into tables or bullet lists
2026-04-15 22:06:45	C:\Users\CEX\Documents\GitHub\cex\archetypes\builders\expansion-play-builder\bld_system_prompt_expansion_play.md	1	9.0	0.83	keep	analyzed: reduce_prose: convert long prose sections into tables or bullet lists
2026-04-15 22:06:45	C:\Users\CEX\Documents\GitHub\cex\archetypes\builders\expansion-play-builder\bld_tools_expansion_play.md	1	9.0	1.00	keep	polished formatting (whitespace cleanup)
2026-04-15 22:06:46	C:\Users\CEX\Documents\GitHub\cex\archetypes\builders\experiment-config-builder\bld_architecture_experiment_config.md	1	9.1	1.00	keep	analyzed: reduce_prose: convert long prose sections into tables or bullet lists
2026-04-15 22:06:46	C:\Users\CEX\Documents\GitHub\cex\archetypes\builders\experiment-config-builder\bld_collaboration_experiment_config.md	1	9.1	0.98	keep	polished formatting (whitespace cleanup)
2026-04-15 22:06:46	C:\Users\CEX\Documents\GitHub\cex\archetypes\builders\experiment-config-builder\bld_config_experiment_config.md	1	9.1	1.00	keep	polished formatting (whitespace cleanup)
2026-04-15 22:06:47	C:\Users\CEX\Documents\GitHub\cex\archetypes\builders\experiment-config-builder\bld_examples_experiment_config.md	1	9.2	1.00	keep	analyzed: reduce_prose: convert long prose sections into tables or bullet lists
2026-04-15 22:06:47	C:\Users\CEX\Documents\GitHub\cex\archetypes\builders\experiment-config-builder\bld_instruction_experiment_config.md	1	9.0	0.79	keep	analyzed: reduce_prose: convert long prose sections into tables or bullet lists
2026-04-15 22:06:47	C:\Users\CEX\Documents\GitHub\cex\archetypes\builders\experiment-config-builder\bld_knowledge_card_experiment_config.md	1	9.2	1.00	keep	analyzed: reduce_prose: convert long prose sections into tables or bullet lists
2026-04-15 22:06:48	C:\Users\CEX\Documents\GitHub\cex\archetypes\builders\experiment-config-builder\bld_manifest_experiment_config.md	1	9.1	1.00	keep	analyzed: reduce_prose: convert long prose sections into tables or bullet lists
2026-04-15 22:06:48	C:\Users\CEX\Documents\GitHub\cex\archetypes\builders\experiment-config-builder\bld_memory_experiment_config.md	1	9.2	0.95	keep	analyzed: add_tags: minimum 3 tags required
2026-04-15 22:06:48	C:\Users\CEX\Documents\GitHub\cex\archetypes\builders\experiment-config-builder\bld_output_template_experiment_config.md	1	9.1	1.00	keep	analyzed: reduce_prose: convert long prose sections into tables or bullet lists
2026-04-15 22:06:49	C:\Users\CEX\Documents\GitHub\cex\archetypes\builders\experiment-config-builder\bld_quality_gate_experiment_config.md	1	9.1	1.00	keep	polished formatting (whitespace cleanup)
2026-04-15 22:06:49	C:\Users\CEX\Documents\GitHub\cex\archetypes\builders\experiment-config-builder\bld_schema_experiment_config.md	1	9.1	1.00	keep	analyzed: reduce_prose: convert long prose sections into tables or bullet lists
2026-04-15 22:06:49	C:\Users\CEX\Documents\GitHub\cex\archetypes\builders\experiment-config-builder\bld_system_prompt_experiment_config.md	1	9.0	0.77	keep	analyzed: increase_density: remove filler words, compress prose into tables
2026-04-15 22:06:51	C:\Users\CEX\Documents\GitHub\cex\archetypes\builders\experiment-config-builder\bld_tools_experiment_config.md	1	9.1	1.00	keep	polished formatting (whitespace cleanup)
2026-04-15 22:06:52	C:\Users\CEX\Documents\GitHub\cex\archetypes\builders\experiment-tracker-builder\bld_architecture_experiment_tracker.md	1	9.1	1.00	keep	polished formatting (whitespace cleanup)
2026-04-15 22:06:52	C:\Users\CEX\Documents\GitHub\cex\archetypes\builders\experiment-tracker-builder\bld_collaboration_experiment_tracker.md	1	8.9	0.99	keep	polished formatting (whitespace cleanup)
2026-04-15 22:06:52	C:\Users\CEX\Documents\GitHub\cex\archetypes\builders\experiment-tracker-builder\bld_config_experiment_tracker.md	1	8.6	0.95	keep	polished formatting (whitespace cleanup)
2026-04-15 22:06:53	C:\Users\CEX\Documents\GitHub\cex\archetypes\builders\experiment-tracker-builder\bld_examples_experiment_tracker.md	1	8.8	0.80	keep	analyzed: reduce_prose: convert long prose sections into tables or bullet lists
2026-04-15 22:06:53	C:\Users\CEX\Documents\GitHub\cex\archetypes\builders\experiment-tracker-builder\bld_instruction_experiment_tracker.md	1	9.0	1.00	keep	polished formatting (whitespace cleanup)
2026-04-15 22:06:53	C:\Users\CEX\Documents\GitHub\cex\archetypes\builders\experiment-tracker-builder\bld_knowledge_card_experiment_tracker.md	1	9.1	0.95	keep	polished formatting (whitespace cleanup)
2026-04-15 22:06:54	C:\Users\CEX\Documents\GitHub\cex\archetypes\builders\experiment-tracker-builder\bld_manifest_experiment_tracker.md	1	8.8	0.77	keep	analyzed: increase_density: remove filler words, compress prose into tables
2026-04-15 22:06:54	C:\Users\CEX\Documents\GitHub\cex\archetypes\builders\experiment-tracker-builder\bld_memory_experiment_tracker.md	1	8.7	0.87	keep	analyzed: increase_density: remove filler words, compress prose into tables
2026-04-15 22:06:54	C:\Users\CEX\Documents\GitHub\cex\archetypes\builders\experiment-tracker-builder\bld_output_template_experiment_tracker.md	1	8.9	1.00	keep	analyzed: reduce_prose: convert long prose sections into tables or bullet lists
2026-04-15 22:06:55	C:\Users\CEX\Documents\GitHub\cex\archetypes\builders\experiment-tracker-builder\bld_quality_gate_experiment_tracker.md	1	9.0	1.00	keep	polished formatting (whitespace cleanup)
2026-04-15 22:06:55	C:\Users\CEX\Documents\GitHub\cex\archetypes\builders\experiment-tracker-builder\bld_schema_experiment_tracker.md	1	8.9	1.00	keep	polished formatting (whitespace cleanup)
2026-04-15 22:06:55	C:\Users\CEX\Documents\GitHub\cex\archetypes\builders\experiment-tracker-builder\bld_system_prompt_experiment_tracker.md	1	8.8	0.77	keep	analyzed: increase_density: remove filler words, compress prose into tables
2026-04-15 22:06:56	C:\Users\CEX\Documents\GitHub\cex\archetypes\builders\experiment-tracker-builder\bld_tools_experiment_tracker.md	1	9.0	1.00	keep	polished formatting (whitespace cleanup)
2026-04-15 22:06:56	C:\Users\CEX\Documents\GitHub\cex\archetypes\builders\faq-entry-builder\bld_architecture_faq_entry.md	1	9.0	1.00	keep	polished formatting (whitespace cleanup)
2026-04-15 22:06:56	C:\Users\CEX\Documents\GitHub\cex\archetypes\builders\faq-entry-builder\bld_collaboration_faq_entry.md	1	8.9	0.86	keep	analyzed: increase_density: remove filler words, compress prose into tables
2026-04-15 22:06:56	C:\Users\CEX\Documents\GitHub\cex\archetypes\builders\faq-entry-builder\bld_config_faq_entry.md	1	8.6	1.00	keep	polished formatting (whitespace cleanup)
2026-04-15 22:06:57	C:\Users\CEX\Documents\GitHub\cex\archetypes\builders\faq-entry-builder\bld_examples_faq_entry.md	1	8.9	0.86	keep	analyzed: reduce_prose: convert long prose sections into tables or bullet lists
2026-04-15 22:06:57	C:\Users\CEX\Documents\GitHub\cex\archetypes\builders\faq-entry-builder\bld_instruction_faq_entry.md	1	8.9	0.98	keep	analyzed: reduce_prose: convert long prose sections into tables or bullet lists
2026-04-15 22:06:57	C:\Users\CEX\Documents\GitHub\cex\archetypes\builders\faq-entry-builder\bld_knowledge_card_faq_entry.md	1	9.2	0.99	keep	analyzed: reduce_prose: convert long prose sections into tables or bullet lists
2026-04-15 22:06:58	C:\Users\CEX\Documents\GitHub\cex\archetypes\builders\faq-entry-builder\bld_manifest_faq_entry.md	1	8.9	0.83	keep	analyzed: increase_density: remove filler words, compress prose into tables
2026-04-15 22:06:58	C:\Users\CEX\Documents\GitHub\cex\archetypes\builders\faq-entry-builder\bld_memory_faq_entry.md	1	8.7	0.92	keep	polished formatting (whitespace cleanup)
2026-04-15 22:06:58	C:\Users\CEX\Documents\GitHub\cex\archetypes\builders\faq-entry-builder\bld_output_template_faq_entry.md	1	8.8	1.00	keep	analyzed: reduce_prose: convert long prose sections into tables or bullet lists
2026-04-15 22:06:59	C:\Users\CEX\Documents\GitHub\cex\archetypes\builders\faq-entry-builder\bld_quality_gate_faq_entry.md	1	9.0	1.00	keep	polished formatting (whitespace cleanup)
2026-04-15 22:06:59	C:\Users\CEX\Documents\GitHub\cex\archetypes\builders\faq-entry-builder\bld_schema_faq_entry.md	1	9.1	1.00	keep	polished formatting (whitespace cleanup)
2026-04-15 22:06:59	C:\Users\CEX\Documents\GitHub\cex\archetypes\builders\faq-entry-builder\bld_system_prompt_faq_entry.md	1	9.0	0.80	keep	analyzed: increase_density: remove filler words, compress prose into tables
2026-04-15 22:07:00	C:\Users\CEX\Documents\GitHub\cex\archetypes\builders\faq-entry-builder\bld_tools_faq_entry.md	1	8.9	1.00	keep	polished formatting (whitespace cleanup)
