timestamp	file	round	quality	density	status	description
2026-04-01 22:52:30	C:\Users\PC\Documents\GitHub\cex\N01_intelligence\output\output_benchmark_report.md	1	8.7	1.00	discard	Add Usage Guide section with when-to-use criteria, scoring methodology, and anti-patterns to increase actionability.
2026-04-01 22:52:54	C:\Users\PC\Documents\GitHub\cex\N01_intelligence\output\output_benchmark_report.md	2	8.8	1.00	keep	Add concrete scoring methodology and example criteria to increase actionability and density
2026-04-01 22:53:24	C:\Users\PC\Documents\GitHub\cex\N01_intelligence\output\output_benchmark_report.md	3	8.8	1.00	discard	Add specific criteria for each star rating level to make scoring more objective and actionable
2026-04-01 22:53:50	C:\Users\PC\Documents\GitHub\cex\N01_intelligence\output\output_benchmark_report.md	4	8.8	1.00	discard	Enhance recommendation template with structured decision framework to increase actionability
2026-04-01 22:54:14	C:\Users\PC\Documents\GitHub\cex\N01_intelligence\output\output_benchmark_report.md	5	8.8	1.00	discard	Expand Common Criteria Examples table with more product categories and specific criteria to increase density and actionability
2026-04-01 22:54:15	C:\Users\PC\Documents\GitHub\cex\N01_intelligence\output\output_executive_summary.md	1	8.7	1.00	discard	polished formatting (whitespace cleanup)
2026-04-01 22:54:15	C:\Users\PC\Documents\GitHub\cex\N01_intelligence\output\output_executive_summary.md	2	8.7	1.00	discard	polished formatting (whitespace cleanup)
2026-04-01 22:54:15	C:\Users\PC\Documents\GitHub\cex\N01_intelligence\output\output_executive_summary.md	3	8.7	1.00	discard	polished formatting (whitespace cleanup)
2026-04-01 22:54:30	C:\Users\PC\Documents\GitHub\cex\N01_intelligence\output\output_executive_summary.md	1	8.7	1.00	discard	Add when_to_use field to frontmatter to improve front matter completeness and actionability
2026-04-01 22:54:54	C:\Users\PC\Documents\GitHub\cex\N01_intelligence\output\output_executive_summary.md	2	8.8	1.00	keep	Add Usage Guidelines section with specific dos/don'ts and timing guidance to increase actionability and density
2026-04-01 22:55:23	C:\Users\PC\Documents\GitHub\cex\N01_intelligence\output\output_executive_summary.md	3	8.9	1.00	keep	Add concrete example section showing filled template to increase actionability and demonstrate usage
2026-04-01 22:55:55	C:\Users\PC\Documents\GitHub\cex\N01_intelligence\output\output_executive_summary.md	4	8.9	1.00	discard	Add Anti-Patterns section after Usage Guidelines to increase actionability with concrete examples of common executive summary failures
2026-04-01 22:56:42	C:\Users\PC\Documents\GitHub\cex\N01_intelligence\output\output_executive_summary.md	5	8.9	1.00	discard	Add validation checklist section to provide self-assessment framework for testing executive summary quality before presentation
2026-04-01 22:56:43	C:\Users\PC\Documents\GitHub\cex\N01_intelligence\output\output_market_snapshot.md	1	8.7	1.00	discard	polished formatting (whitespace cleanup)
2026-04-01 22:56:43	C:\Users\PC\Documents\GitHub\cex\N01_intelligence\output\output_market_snapshot.md	2	8.7	1.00	discard	polished formatting (whitespace cleanup)
2026-04-01 22:56:43	C:\Users\PC\Documents\GitHub\cex\N01_intelligence\output\output_market_snapshot.md	3	8.7	1.00	discard	polished formatting (whitespace cleanup)
2026-04-01 22:56:59	C:\Users\PC\Documents\GitHub\cex\N01_intelligence\output\output_market_snapshot.md	1	8.7	1.00	discard	Add Usage Guidelines section with specific when-to-use criteria and confidence scoring methodology to increase actionability
2026-04-01 22:57:21	C:\Users\PC\Documents\GitHub\cex\N01_intelligence\output\output_market_snapshot.md	2	8.9	1.00	keep	Add concrete Example Output section showing filled template with realistic market data to increase actionability and demonstrate proper usage
2026-04-01 22:57:47	C:\Users\PC\Documents\GitHub\cex\N01_intelligence\output\output_market_snapshot.md	3	8.9	1.00	discard	Add Anti-Patterns section showing common mistakes to increase actionability and guide proper usage
2026-04-01 22:58:32	C:\Users\PC\Documents\GitHub\cex\N01_intelligence\output\output_market_snapshot.md	4	8.9	1.00	discard	Add "Key Assumptions" section to template and example to increase transparency and actionability of market sizing methodology
2026-04-01 22:59:07	C:\Users\PC\Documents\GitHub\cex\N01_intelligence\output\output_market_snapshot.md	5	8.9	1.00	discard	Add specific field guidance and confidence level definitions to template to increase precision and actionability
2026-04-01 22:59:08	C:\Users\PC\Documents\GitHub\cex\N04_knowledge\knowledge\retriever_config_knowledge.md	1	8.8	0.86	discard	analyzed: increase_density: remove filler words, compress prose into tables
2026-04-01 22:59:08	C:\Users\PC\Documents\GitHub\cex\N04_knowledge\knowledge\retriever_config_knowledge.md	2	8.8	0.86	discard	analyzed: increase_density: remove filler words, compress prose into tables
2026-04-01 22:59:08	C:\Users\PC\Documents\GitHub\cex\N04_knowledge\knowledge\retriever_config_knowledge.md	3	8.8	0.86	discard	analyzed: increase_density: remove filler words, compress prose into tables
2026-04-01 22:59:39	C:\Users\PC\Documents\GitHub\cex\N04_knowledge\knowledge\retriever_config_knowledge.md	1	8.9	0.91	keep	Condense wordy overview section into dense table format showing retriever performance characteristics and usage criteria
2026-04-01 23:00:08	C:\Users\PC\Documents\GitHub\cex\N04_knowledge\knowledge\retriever_config_knowledge.md	2	8.8	0.97	discard	Convert verbose "Advanced & Future Strategies" section into compact comparison table to increase density
2026-04-01 23:00:46	C:\Users\PC\Documents\GitHub\cex\N04_knowledge\knowledge\retriever_config_knowledge.md	3	8.9	0.94	discard	Add concrete parameter tuning guidance and anti-patterns section to increase actionability
2026-04-01 23:01:23	C:\Users\PC\Documents\GitHub\cex\N04_knowledge\knowledge\retriever_config_knowledge.md	4	8.9	0.94	discard	Condense verbose prose in Section 2 and expand Section 4 with concrete usage examples to increase actionability
2026-04-01 23:01:57	C:\Users\PC\Documents\GitHub\cex\N04_knowledge\knowledge\retriever_config_knowledge.md	5	8.9	0.95	discard	Expand Integration section with concrete usage examples and parameter override patterns to increase actionability
2026-04-01 23:01:58	C:\Users\PC\Documents\GitHub\cex\N04_knowledge\knowledge\rag_source_supabase.md	1	8.8	1.00	discard	analyzed: reduce_prose: convert long prose sections into tables or bullet lists
2026-04-01 23:01:58	C:\Users\PC\Documents\GitHub\cex\N04_knowledge\knowledge\rag_source_supabase.md	2	8.8	1.00	discard	analyzed: reduce_prose: convert long prose sections into tables or bullet lists
2026-04-01 23:01:59	C:\Users\PC\Documents\GitHub\cex\N04_knowledge\knowledge\rag_source_supabase.md	3	8.8	1.00	discard	analyzed: reduce_prose: convert long prose sections into tables or bullet lists
2026-04-01 23:02:29	C:\Users\PC\Documents\GitHub\cex\N04_knowledge\knowledge\rag_source_supabase.md	1	8.9	1.00	keep	Add "Limitations & Anti-Patterns" section to increase actionability by highlighting when NOT to use pgvector and common pitfalls
2026-04-01 23:03:02	C:\Users\PC\Documents\GitHub\cex\N04_knowledge\knowledge\rag_source_supabase.md	2	8.9	1.00	discard	Add "Setup Steps" section with concrete implementation sequence to bridge config and actual deployment
2026-04-01 23:03:39	C:\Users\PC\Documents\GitHub\cex\N04_knowledge\knowledge\rag_source_supabase.md	3	8.9	1.00	discard	Add "Performance Optimization" section with concrete tuning parameters and troubleshooting steps to increase actionability
2026-04-01 23:04:17	C:\Users\PC\Documents\GitHub\cex\N04_knowledge\knowledge\rag_source_supabase.md	4	8.9	1.00	discard	Replace text-based retrieval pipeline with executable SQL example to increase actionability
2026-04-01 23:04:57	C:\Users\PC\Documents\GitHub\cex\N04_knowledge\knowledge\rag_source_supabase.md	5	8.9	1.00	discard	Enhance Multi-Tenant RAG section with complete SQL setup example showing table creation and functions, not just RLS policy
2026-04-01 23:04:58	C:\Users\PC\Documents\GitHub\cex\N04_knowledge\architecture\agent_card_knowledge.md	1	8.8	1.00	discard	polished formatting (whitespace cleanup)
2026-04-01 23:04:58	C:\Users\PC\Documents\GitHub\cex\N04_knowledge\architecture\agent_card_knowledge.md	2	8.8	1.00	discard	polished formatting (whitespace cleanup)
2026-04-01 23:04:58	C:\Users\PC\Documents\GitHub\cex\N04_knowledge\architecture\agent_card_knowledge.md	3	8.8	1.00	discard	polished formatting (whitespace cleanup)
2026-04-01 23:05:18	C:\Users\PC\Documents\GitHub\cex\N04_knowledge\architecture\agent_card_knowledge.md	1	8.8	1.00	discard	Add "When to Use" section with specific task examples and anti-patterns to increase actionability
2026-04-01 23:05:39	C:\Users\PC\Documents\GitHub\cex\N04_knowledge\architecture\agent_card_knowledge.md	2	8.8	1.00	discard	Expand Triple-Export Architecture section with specific technical details and use cases for each export type to increase density and actionability
2026-04-01 23:05:58	C:\Users\PC\Documents\GitHub\cex\N04_knowledge\architecture\agent_card_knowledge.md	3	8.8	1.00	discard	Add "Capabilities & Limits" section with specific boundaries and scale characteristics to improve routing decisions and actionability
2026-04-01 23:06:22	C:\Users\PC\Documents\GitHub\cex\N04_knowledge\architecture\agent_card_knowledge.md	4	8.8	1.00	discard	Expand Provider section with detailed routing criteria, technical specs, and fallback scenarios to increase actionability and density
2026-04-01 23:06:47	C:\Users\PC\Documents\GitHub\cex\N04_knowledge\architecture\agent_card_knowledge.md	5	8.8	1.00	discard	Expand Routing section with specific task examples and routing criteria to improve actionability for N07 orchestrator decisions
2026-04-01 23:06:48	C:\Users\PC\Documents\GitHub\cex\N04_knowledge\agents\agent_knowledge.md	1	8.8	1.00	discard	polished formatting (whitespace cleanup)
2026-04-01 23:06:49	C:\Users\PC\Documents\GitHub\cex\N04_knowledge\agents\agent_knowledge.md	2	8.8	1.00	discard	polished formatting (whitespace cleanup)
2026-04-01 23:06:49	C:\Users\PC\Documents\GitHub\cex\N04_knowledge\agents\agent_knowledge.md	3	8.8	1.00	discard	polished formatting (whitespace cleanup)
2026-04-01 23:07:18	C:\Users\PC\Documents\GitHub\cex\N04_knowledge\agents\agent_knowledge.md	1	8.9	1.00	keep	Add concrete "Usage Patterns" section with specific scenarios and examples to increase actionability
2026-04-01 23:07:50	C:\Users\PC\Documents\GitHub\cex\N04_knowledge\agents\agent_knowledge.md	2	8.9	1.00	discard	Convert "Three Missions" section to dense table format for better scannability and information density
2026-04-01 23:08:24	C:\Users\PC\Documents\GitHub\cex\N04_knowledge\agents\agent_knowledge.md	3	8.9	1.00	discard	Replace metaphorical Identity section with concrete operational responsibilities and specific knowledge management workflows
2026-04-01 23:09:06	C:\Users\PC\Documents\GitHub\cex\N04_knowledge\agents\agent_knowledge.md	4	8.9	1.00	discard	Add concrete examples section showing actual KC format and database schema to increase actionability and specificity
2026-04-01 23:09:52	C:\Users\PC\Documents\GitHub\cex\N04_knowledge\agents\agent_knowledge.md	5	8.9	1.00	discard	Add "Operational Procedures" section with step-by-step workflows for key N04 functions to increase actionability and operational specificity
2026-04-01 23:09:53	C:\Users\PC\Documents\GitHub\cex\N02_marketing\schemas\tailwind_palette_contract.md	1	8.8	1.00	discard	analyzed: reduce_prose: convert long prose sections into tables or bullet lists
2026-04-01 23:09:54	C:\Users\PC\Documents\GitHub\cex\N02_marketing\schemas\tailwind_palette_contract.md	2	8.8	1.00	discard	analyzed: reduce_prose: convert long prose sections into tables or bullet lists
2026-04-01 23:09:54	C:\Users\PC\Documents\GitHub\cex\N02_marketing\schemas\tailwind_palette_contract.md	3	8.8	1.00	discard	analyzed: reduce_prose: convert long prose sections into tables or bullet lists
2026-04-01 23:10:31	C:\Users\PC\Documents\GitHub\cex\N02_marketing\schemas\tailwind_palette_contract.md	1	8.8	1.00	discard	Add concrete "Example Usage" section with before/after code to increase actionability
2026-04-01 23:11:13	C:\Users\PC\Documents\GitHub\cex\N02_marketing\schemas\tailwind_palette_contract.md	2	8.8	1.00	discard	Expand validation section with comprehensive automated checking methods and integration points
2026-04-01 23:11:56	C:\Users\PC\Documents\GitHub\cex\N02_marketing\schemas\tailwind_palette_contract.md	3	8.8	1.00	discard	Add "Usage Scope" section to clarify when this contract applies vs when exceptions are allowed, increasing actionability
2026-04-01 23:12:44	C:\Users\PC\Documents\GitHub\cex\N02_marketing\schemas\tailwind_palette_contract.md	4	8.9	1.00	keep	Enhance the 60-30-10 Rule section with specific implementation guidelines and measurable criteria to increase actionability
2026-04-01 23:13:30	C:\Users\PC\Documents\GitHub\cex\N02_marketing\schemas\tailwind_palette_contract.md	5	8.9	1.00	discard	Add "Implementation Workflow" section with step-by-step guidance for developers applying this contract in practice
2026-04-01 23:13:32	C:\Users\PC\Documents\GitHub\cex\N04_knowledge\orchestration\dispatch_rule_knowledge.md	1	8.9	0.88	keep	added density_score: 0.88
2026-04-01 23:13:32	C:\Users\PC\Documents\GitHub\cex\N04_knowledge\orchestration\dispatch_rule_knowledge.md	2	8.9	0.88	discard	analyzed: increase_density: remove filler words, compress prose into tables
2026-04-01 23:13:32	C:\Users\PC\Documents\GitHub\cex\N04_knowledge\orchestration\dispatch_rule_knowledge.md	3	8.9	0.88	discard	analyzed: increase_density: remove filler words, compress prose into tables
2026-04-01 23:14:10	C:\Users\PC\Documents\GitHub\cex\N04_knowledge\orchestration\dispatch_rule_knowledge.md	1	8.9	0.95	discard	Add concrete examples and anti-patterns section to increase actionability and demonstrate real routing scenarios
2026-04-01 23:14:42	C:\Users\PC\Documents\GitHub\cex\N04_knowledge\orchestration\dispatch_rule_knowledge.md	2	8.9	0.89	discard	Convert keyword lists in section 3.1 into a structured table format to improve density and readability
2026-04-01 23:15:17	C:\Users\PC\Documents\GitHub\cex\N04_knowledge\orchestration\dispatch_rule_knowledge.md	3	8.9	0.92	discard	Convert governance rationales from prose explanations to a structured table format to increase density
2026-04-01 23:16:04	C:\Users\PC\Documents\GitHub\cex\N04_knowledge\orchestration\dispatch_rule_knowledge.md	4	8.9	0.90	discard	Add a "Validation Checklist" section with actionable steps to verify routing accuracy and performance
2026-04-01 23:16:44	C:\Users\PC\Documents\GitHub\cex\N04_knowledge\orchestration\dispatch_rule_knowledge.md	5	8.9	0.92	discard	Convert section 3.2 mandatory conditions to a dense table format combining intents, domains, and examples
2026-04-01 23:16:45	C:\Users\PC\Documents\GitHub\cex\N04_knowledge\tools\supabase_data_layer_tool.md	1	8.8	1.00	discard	analyzed: reduce_prose: convert long prose sections into tables or bullet lists
2026-04-01 23:16:46	C:\Users\PC\Documents\GitHub\cex\N04_knowledge\tools\supabase_data_layer_tool.md	2	8.8	1.00	discard	analyzed: reduce_prose: convert long prose sections into tables or bullet lists
2026-04-01 23:16:46	C:\Users\PC\Documents\GitHub\cex\N04_knowledge\tools\supabase_data_layer_tool.md	3	8.8	1.00	discard	analyzed: reduce_prose: convert long prose sections into tables or bullet lists
2026-04-01 23:17:13	C:\Users\PC\Documents\GitHub\cex\N04_knowledge\tools\supabase_data_layer_tool.md	1	8.9	1.00	keep	Replace text pipeline diagram with detailed table showing specific outputs, validation steps, and file sizes for each stage
2026-04-01 23:17:44	C:\Users\PC\Documents\GitHub\cex\N04_knowledge\tools\supabase_data_layer_tool.md	2	8.9	1.00	discard	Add "Limitations & Anti-Patterns" section to increase actionability by highlighting when NOT to use this tool and common pitfalls
2026-04-01 23:18:15	C:\Users\PC\Documents\GitHub\cex\N04_knowledge\tools\supabase_data_layer_tool.md	3	8.9	1.00	discard	Expand Nucleus Integration section with specific use cases and concrete file outputs to increase actionability
2026-04-01 23:18:43	C:\Users\PC\Documents\GitHub\cex\N04_knowledge\tools\supabase_data_layer_tool.md	4	8.9	1.00	discard	Enhance Usage section with real-world workflow examples and specific flags to increase actionability
2026-04-01 23:19:12	C:\Users\PC\Documents\GitHub\cex\N04_knowledge\tools\supabase_data_layer_tool.md	5	8.9	1.00	discard	Make the Purpose section more specific by detailing the exact config-to-code transformation to increase actionability
2026-04-01 23:19:13	C:\Users\PC\Documents\GitHub\cex\N04_knowledge\quality\quality_gate_knowledge.md	1	8.8	0.90	discard	added density_score: 0.9
2026-04-01 23:19:14	C:\Users\PC\Documents\GitHub\cex\N04_knowledge\quality\quality_gate_knowledge.md	2	8.8	0.90	discard	added density_score: 0.9
2026-04-01 23:19:14	C:\Users\PC\Documents\GitHub\cex\N04_knowledge\quality\quality_gate_knowledge.md	3	8.8	0.90	discard	added density_score: 0.9
2026-04-01 23:19:49	C:\Users\PC\Documents\GitHub\cex\N04_knowledge\quality\quality_gate_knowledge.md	1	8.8	0.93	discard	Add troubleshooting section with concrete examples of common gate failures and their fixes to increase actionability
2026-04-01 23:20:28	C:\Users\PC\Documents\GitHub\cex\N04_knowledge\quality\quality_gate_knowledge.md	2	8.8	0.93	discard	Add concrete examples section showing what passes/fails key gates to increase actionability
2026-04-01 23:21:02	C:\Users\PC\Documents\GitHub\cex\N04_knowledge\quality\quality_gate_knowledge.md	3	8.8	0.96	discard	Convert the prose-heavy "Execution & Enforcement" section into a structured table format to increase content density
2026-04-01 23:21:47	C:\Users\PC\Documents\GitHub\cex\N04_knowledge\quality\quality_gate_knowledge.md	4	8.8	0.94	discard	Convert the verbose Overview section into a structured format with clearer definitions and improved density
2026-04-01 23:22:28	C:\Users\PC\Documents\GitHub\cex\N04_knowledge\quality\quality_gate_knowledge.md	5	8.8	0.93	discard	Add Implementation Guidelines section with concrete steps for using this quality gate system to increase actionability
2026-04-01 23:22:29	C:\Users\PC\Documents\GitHub\cex\N04_knowledge\schemas\taxonomy_contract.md	1	8.8	1.00	discard	analyzed: add_field_table: schemas need a field/type/description table
2026-04-01 23:22:29	C:\Users\PC\Documents\GitHub\cex\N04_knowledge\schemas\taxonomy_contract.md	2	8.8	1.00	discard	analyzed: add_field_table: schemas need a field/type/description table
2026-04-01 23:22:29	C:\Users\PC\Documents\GitHub\cex\N04_knowledge\schemas\taxonomy_contract.md	3	8.8	1.00	discard	analyzed: add_field_table: schemas need a field/type/description table
2026-04-01 23:22:48	C:\Users\PC\Documents\GitHub\cex\N04_knowledge\schemas\taxonomy_contract.md	1	8.8	1.00	discard	Add concrete Examples section showing real classification decisions to improve actionability
2026-04-01 23:23:09	C:\Users\PC\Documents\GitHub\cex\N04_knowledge\schemas\taxonomy_contract.md	2	8.8	1.00	discard	Add Anti-Patterns section to show common classification mistakes and edge cases to avoid
2026-04-01 23:23:28	C:\Users\PC\Documents\GitHub\cex\N04_knowledge\schemas\taxonomy_contract.md	3	8.7	1.00	discard	Replace simple numbered decision tree with structured decision matrix table showing specific criteria and classification outcomes
2026-04-01 23:23:52	C:\Users\PC\Documents\GitHub\cex\N04_knowledge\schemas\taxonomy_contract.md	4	8.8	1.00	discard	Add Validation Checklist section with specific verification steps to increase actionability
2026-04-01 23:24:15	C:\Users\PC\Documents\GitHub\cex\N04_knowledge\schemas\taxonomy_contract.md	5	8.8	1.00	discard	Convert Ambiguity Rules from bullet points to structured table format for clearer decision criteria
2026-04-01 23:24:16	C:\Users\PC\Documents\GitHub\cex\N04_knowledge\output\output_knowledge_graph.md	1	8.8	1.00	discard	polished formatting (whitespace cleanup)
2026-04-01 23:24:16	C:\Users\PC\Documents\GitHub\cex\N04_knowledge\output\output_knowledge_graph.md	2	8.8	1.00	discard	polished formatting (whitespace cleanup)
2026-04-01 23:24:16	C:\Users\PC\Documents\GitHub\cex\N04_knowledge\output\output_knowledge_graph.md	3	8.8	1.00	discard	polished formatting (whitespace cleanup)
2026-04-01 23:24:43	C:\Users\PC\Documents\GitHub\cex\N04_knowledge\output\output_knowledge_graph.md	1	8.9	1.00	keep	Add "Usage Patterns" section with concrete scenarios and anti-patterns to improve actionability
2026-04-01 23:25:15	C:\Users\PC\Documents\GitHub\cex\N04_knowledge\output\output_knowledge_graph.md	2	8.9	1.00	discard	Add "Tools & Data Sources" section to explain how this output is generated in the CEX system
2026-04-01 23:25:37	C:\Users\PC\Documents\GitHub\cex\N04_knowledge\output\output_knowledge_graph.md	3	8.9	1.00	discard	Add "Validation Criteria" section with specific quality checks to increase actionability
2026-04-01 23:25:59	C:\Users\PC\Documents\GitHub\cex\N04_knowledge\output\output_knowledge_graph.md	4	8.9	1.00	discard	Expand Key Relationships table with more CEX-specific relationship types to increase template actionability
2026-04-01 23:26:26	C:\Users\PC\Documents\GitHub\cex\N04_knowledge\output\output_knowledge_graph.md	5	8.9	1.00	discard	Enhance Template section with realistic CEX-specific examples and counts to increase actionability
2026-04-01 23:26:27	C:\Users\PC\Documents\GitHub\cex\N04_knowledge\orchestration\dispatch_rule_supabase.md	1	8.8	1.00	discard	analyzed: reduce_prose: convert long prose sections into tables or bullet lists
2026-04-01 23:26:27	C:\Users\PC\Documents\GitHub\cex\N04_knowledge\orchestration\dispatch_rule_supabase.md	2	8.8	1.00	discard	analyzed: reduce_prose: convert long prose sections into tables or bullet lists
