timestamp	file	round	quality	density	status	description
2026-04-15 22:05:51	C:\Users\CEX\Documents\GitHub\cex\archetypes\builders\cost-budget-builder\bld_system_prompt_cost_budget.md	1	9.0	0.78	keep	analyzed: reduce_prose: convert long prose sections into tables or bullet lists
2026-04-15 22:05:51	C:\Users\CEX\Documents\GitHub\cex\archetypes\builders\cost-budget-builder\bld_tools_cost_budget.md	1	9.1	1.00	keep	polished formatting (whitespace cleanup)
2026-04-15 22:05:52	C:\Users\CEX\Documents\GitHub\cex\archetypes\builders\course-module-builder\bld_architecture_course_module.md	1	9.0	1.00	keep	polished formatting (whitespace cleanup)
2026-04-15 22:05:52	C:\Users\CEX\Documents\GitHub\cex\archetypes\builders\course-module-builder\bld_collaboration_course_module.md	1	8.9	0.86	keep	analyzed: increase_density: remove filler words, compress prose into tables
2026-04-15 22:05:52	C:\Users\CEX\Documents\GitHub\cex\archetypes\builders\course-module-builder\bld_config_course_module.md	1	8.6	0.93	keep	polished formatting (whitespace cleanup)
2026-04-15 22:05:53	C:\Users\CEX\Documents\GitHub\cex\archetypes\builders\course-module-builder\bld_examples_course_module.md	1	8.8	1.00	keep	polished formatting (whitespace cleanup)
2026-04-15 22:05:53	C:\Users\CEX\Documents\GitHub\cex\archetypes\builders\course-module-builder\bld_instruction_course_module.md	1	8.8	0.97	keep	analyzed: reduce_prose: convert long prose sections into tables or bullet lists
2026-04-15 22:05:53	C:\Users\CEX\Documents\GitHub\cex\archetypes\builders\course-module-builder\bld_knowledge_card_course_module.md	1	9.2	0.99	keep	polished formatting (whitespace cleanup)
2026-04-15 22:05:54	C:\Users\CEX\Documents\GitHub\cex\archetypes\builders\course-module-builder\bld_manifest_course_module.md	1	8.8	0.82	keep	analyzed: increase_density: remove filler words, compress prose into tables
2026-04-15 22:05:54	C:\Users\CEX\Documents\GitHub\cex\archetypes\builders\course-module-builder\bld_memory_course_module.md	1	9.0	0.92	keep	analyzed: reduce_prose: convert long prose sections into tables or bullet lists
2026-04-15 22:05:54	C:\Users\CEX\Documents\GitHub\cex\archetypes\builders\course-module-builder\bld_output_template_course_module.md	1	8.9	1.00	keep	polished formatting (whitespace cleanup)
2026-04-15 22:05:55	C:\Users\CEX\Documents\GitHub\cex\archetypes\builders\course-module-builder\bld_quality_gate_course_module.md	1	9.1	1.00	keep	polished formatting (whitespace cleanup)
2026-04-15 22:05:55	C:\Users\CEX\Documents\GitHub\cex\archetypes\builders\course-module-builder\bld_schema_course_module.md	1	9.2	1.00	keep	analyzed: reduce_prose: convert long prose sections into tables or bullet lists
2026-04-15 22:05:55	C:\Users\CEX\Documents\GitHub\cex\archetypes\builders\course-module-builder\bld_system_prompt_course_module.md	1	9.0	0.80	keep	analyzed: increase_density: remove filler words, compress prose into tables
2026-04-15 22:05:55	C:\Users\CEX\Documents\GitHub\cex\archetypes\builders\course-module-builder\bld_tools_course_module.md	1	8.9	1.00	keep	polished formatting (whitespace cleanup)
2026-04-15 22:05:56	C:\Users\CEX\Documents\GitHub\cex\archetypes\builders\crew-template-builder\bld_architecture_crew_template.md	1	9.0	1.00	keep	polished formatting (whitespace cleanup)
2026-04-15 22:05:56	C:\Users\CEX\Documents\GitHub\cex\archetypes\builders\crew-template-builder\bld_collaboration_crew_template.md	1	8.9	0.98	keep	polished formatting (whitespace cleanup)
2026-04-15 22:05:56	C:\Users\CEX\Documents\GitHub\cex\archetypes\builders\crew-template-builder\bld_config_crew_template.md	1	8.7	0.93	keep	polished formatting (whitespace cleanup)
2026-04-15 22:05:57	C:\Users\CEX\Documents\GitHub\cex\archetypes\builders\crew-template-builder\bld_examples_crew_template.md	1	9.1	1.00	keep	analyzed: reduce_prose: convert long prose sections into tables or bullet lists
2026-04-15 22:05:57	C:\Users\CEX\Documents\GitHub\cex\archetypes\builders\crew-template-builder\bld_instruction_crew_template.md	1	8.9	0.96	keep	analyzed: reduce_prose: convert long prose sections into tables or bullet lists
2026-04-15 22:05:57	C:\Users\CEX\Documents\GitHub\cex\archetypes\builders\crew-template-builder\bld_knowledge_card_crew_template.md	1	9.2	1.00	keep	polished formatting (whitespace cleanup)
2026-04-15 22:05:58	C:\Users\CEX\Documents\GitHub\cex\archetypes\builders\crew-template-builder\bld_manifest_crew_template.md	1	8.9	0.80	keep	analyzed: increase_density: remove filler words, compress prose into tables
2026-04-15 22:05:58	C:\Users\CEX\Documents\GitHub\cex\archetypes\builders\crew-template-builder\bld_memory_crew_template.md	1	8.8	0.94	keep	polished formatting (whitespace cleanup)
2026-04-15 22:05:58	C:\Users\CEX\Documents\GitHub\cex\archetypes\builders\crew-template-builder\bld_output_template_crew_template.md	1	9.1	1.00	keep	analyzed: reduce_prose: convert long prose sections into tables or bullet lists
2026-04-15 22:05:59	C:\Users\CEX\Documents\GitHub\cex\archetypes\builders\crew-template-builder\bld_quality_gate_crew_template.md	1	9.0	1.00	keep	polished formatting (whitespace cleanup)
2026-04-15 22:05:59	C:\Users\CEX\Documents\GitHub\cex\archetypes\builders\crew-template-builder\bld_schema_crew_template.md	1	9.1	1.00	keep	analyzed: reduce_prose: convert long prose sections into tables or bullet lists
2026-04-15 22:05:59	C:\Users\CEX\Documents\GitHub\cex\archetypes\builders\crew-template-builder\bld_system_prompt_crew_template.md	1	9.0	0.80	keep	analyzed: reduce_prose: convert long prose sections into tables or bullet lists
2026-04-15 22:06:00	C:\Users\CEX\Documents\GitHub\cex\archetypes\builders\crew-template-builder\bld_tools_crew_template.md	1	8.9	1.00	keep	polished formatting (whitespace cleanup)
2026-04-15 22:06:00	C:\Users\CEX\Documents\GitHub\cex\archetypes\builders\customer-segment-builder\bld_architecture_customer_segment.md	1	9.0	1.00	keep	polished formatting (whitespace cleanup)
2026-04-15 22:06:00	C:\Users\CEX\Documents\GitHub\cex\archetypes\builders\customer-segment-builder\bld_collaboration_customer_segment.md	1	8.9	0.85	keep	analyzed: increase_density: remove filler words, compress prose into tables
2026-04-15 22:06:01	C:\Users\CEX\Documents\GitHub\cex\archetypes\builders\customer-segment-builder\bld_config_customer_segment.md	1	8.6	0.95	keep	polished formatting (whitespace cleanup)
2026-04-15 22:06:01	C:\Users\CEX\Documents\GitHub\cex\archetypes\builders\customer-segment-builder\bld_examples_customer_segment.md	1	8.8	1.00	keep	analyzed: reduce_prose: convert long prose sections into tables or bullet lists
2026-04-15 22:06:01	C:\Users\CEX\Documents\GitHub\cex\archetypes\builders\customer-segment-builder\bld_instruction_customer_segment.md	1	8.9	0.92	keep	analyzed: reduce_prose: convert long prose sections into tables or bullet lists
2026-04-15 22:06:01	C:\Users\CEX\Documents\GitHub\cex\archetypes\builders\customer-segment-builder\bld_knowledge_card_customer_segment.md	1	9.2	1.00	keep	analyzed: reduce_prose: convert long prose sections into tables or bullet lists
2026-04-15 22:06:02	C:\Users\CEX\Documents\GitHub\cex\archetypes\builders\customer-segment-builder\bld_manifest_customer_segment.md	1	8.8	0.80	keep	analyzed: increase_density: remove filler words, compress prose into tables
2026-04-15 22:06:02	C:\Users\CEX\Documents\GitHub\cex\archetypes\builders\customer-segment-builder\bld_memory_customer_segment.md	1	8.7	0.97	keep	polished formatting (whitespace cleanup)
2026-04-15 22:06:02	C:\Users\CEX\Documents\GitHub\cex\archetypes\builders\customer-segment-builder\bld_output_template_customer_segment.md	1	9.1	1.00	keep	analyzed: reduce_prose: convert long prose sections into tables or bullet lists
2026-04-15 22:06:03	C:\Users\CEX\Documents\GitHub\cex\archetypes\builders\customer-segment-builder\bld_quality_gate_customer_segment.md	1	9.0	1.00	keep	polished formatting (whitespace cleanup)
2026-04-15 22:06:03	C:\Users\CEX\Documents\GitHub\cex\archetypes\builders\customer-segment-builder\bld_schema_customer_segment.md	1	9.1	0.96	keep	analyzed: reduce_prose: convert long prose sections into tables or bullet lists
2026-04-15 22:06:03	C:\Users\CEX\Documents\GitHub\cex\archetypes\builders\customer-segment-builder\bld_system_prompt_customer_segment.md	1	9.0	0.82	keep	analyzed: increase_density: remove filler words, compress prose into tables
2026-04-15 22:06:04	C:\Users\CEX\Documents\GitHub\cex\archetypes\builders\customer-segment-builder\bld_tools_customer_segment.md	1	8.9	1.00	keep	polished formatting (whitespace cleanup)
2026-04-15 22:06:04	C:\Users\CEX\Documents\GitHub\cex\archetypes\builders\data-residency-builder\bld_architecture_data_residency.md	1	9.0	1.00	keep	polished formatting (whitespace cleanup)
2026-04-15 22:06:04	C:\Users\CEX\Documents\GitHub\cex\archetypes\builders\data-residency-builder\bld_collaboration_data_residency.md	1	8.9	0.85	keep	analyzed: increase_density: remove filler words, compress prose into tables
2026-04-15 22:06:05	C:\Users\CEX\Documents\GitHub\cex\archetypes\builders\data-residency-builder\bld_config_data_residency.md	1	8.6	0.92	keep	polished formatting (whitespace cleanup)
2026-04-15 22:06:05	C:\Users\CEX\Documents\GitHub\cex\archetypes\builders\data-residency-builder\bld_examples_data_residency.md	1	8.8	1.00	keep	analyzed: reduce_prose: convert long prose sections into tables or bullet lists
2026-04-15 22:06:05	C:\Users\CEX\Documents\GitHub\cex\archetypes\builders\data-residency-builder\bld_instruction_data_residency.md	1	8.8	1.00	keep	analyzed: reduce_prose: convert long prose sections into tables or bullet lists
2026-04-15 22:06:06	C:\Users\CEX\Documents\GitHub\cex\archetypes\builders\data-residency-builder\bld_knowledge_card_data_residency.md	1	9.2	0.97	keep	polished formatting (whitespace cleanup)
2026-04-15 22:06:06	C:\Users\CEX\Documents\GitHub\cex\archetypes\builders\data-residency-builder\bld_manifest_data_residency.md	1	8.8	0.81	keep	analyzed: increase_density: remove filler words, compress prose into tables
2026-04-15 22:06:06	C:\Users\CEX\Documents\GitHub\cex\archetypes\builders\data-residency-builder\bld_memory_data_residency.md	1	8.7	1.00	keep	polished formatting (whitespace cleanup)
2026-04-15 22:06:07	C:\Users\CEX\Documents\GitHub\cex\archetypes\builders\data-residency-builder\bld_output_template_data_residency.md	1	8.8	1.00	keep	analyzed: reduce_prose: convert long prose sections into tables or bullet lists
2026-04-15 22:06:07	C:\Users\CEX\Documents\GitHub\cex\archetypes\builders\data-residency-builder\bld_quality_gate_data_residency.md	1	9.1	1.00	keep	polished formatting (whitespace cleanup)
2026-04-15 22:06:07	C:\Users\CEX\Documents\GitHub\cex\archetypes\builders\data-residency-builder\bld_schema_data_residency.md	1	9.1	1.00	keep	polished formatting (whitespace cleanup)
2026-04-15 22:06:08	C:\Users\CEX\Documents\GitHub\cex\archetypes\builders\data-residency-builder\bld_system_prompt_data_residency.md	1	8.9	0.82	keep	analyzed: increase_density: remove filler words, compress prose into tables
2026-04-15 22:06:08	C:\Users\CEX\Documents\GitHub\cex\archetypes\builders\data-residency-builder\bld_tools_data_residency.md	1	8.7	1.00	keep	polished formatting (whitespace cleanup)
2026-04-15 22:06:08	C:\Users\CEX\Documents\GitHub\cex\archetypes\builders\dataset-card-builder\bld_architecture_dataset_card.md	1	9.1	1.00	keep	polished formatting (whitespace cleanup)
2026-04-15 22:06:09	C:\Users\CEX\Documents\GitHub\cex\archetypes\builders\dataset-card-builder\bld_collaboration_dataset_card.md	1	8.9	0.97	keep	polished formatting (whitespace cleanup)
2026-04-15 22:06:09	C:\Users\CEX\Documents\GitHub\cex\archetypes\builders\dataset-card-builder\bld_config_dataset_card.md	1	8.7	0.95	keep	polished formatting (whitespace cleanup)
2026-04-15 22:06:09	C:\Users\CEX\Documents\GitHub\cex\archetypes\builders\dataset-card-builder\bld_examples_dataset_card.md	1	8.9	0.90	keep	polished formatting (whitespace cleanup)
2026-04-15 22:06:09	C:\Users\CEX\Documents\GitHub\cex\archetypes\builders\dataset-card-builder\bld_instruction_dataset_card.md	1	9.0	0.98	keep	polished formatting (whitespace cleanup)
2026-04-15 22:06:10	C:\Users\CEX\Documents\GitHub\cex\archetypes\builders\dataset-card-builder\bld_knowledge_card_dataset_card.md	1	9.1	0.96	keep	polished formatting (whitespace cleanup)
2026-04-15 22:06:10	C:\Users\CEX\Documents\GitHub\cex\archetypes\builders\dataset-card-builder\bld_manifest_dataset_card.md	1	8.8	0.76	keep	analyzed: increase_density: remove filler words, compress prose into tables
2026-04-15 22:06:10	C:\Users\CEX\Documents\GitHub\cex\archetypes\builders\dataset-card-builder\bld_memory_dataset_card.md	1	8.7	0.94	keep	polished formatting (whitespace cleanup)
2026-04-15 22:06:11	C:\Users\CEX\Documents\GitHub\cex\archetypes\builders\dataset-card-builder\bld_output_template_dataset_card.md	1	8.7	1.00	keep	analyzed: reduce_prose: convert long prose sections into tables or bullet lists
2026-04-15 22:06:11	C:\Users\CEX\Documents\GitHub\cex\archetypes\builders\dataset-card-builder\bld_quality_gate_dataset_card.md	1	8.9	1.00	keep	polished formatting (whitespace cleanup)
2026-04-15 22:06:11	C:\Users\CEX\Documents\GitHub\cex\archetypes\builders\dataset-card-builder\bld_schema_dataset_card.md	1	9.1	1.00	keep	analyzed: reduce_prose: convert long prose sections into tables or bullet lists
2026-04-15 22:06:12	C:\Users\CEX\Documents\GitHub\cex\archetypes\builders\dataset-card-builder\bld_system_prompt_dataset_card.md	1	8.8	0.82	keep	analyzed: increase_density: remove filler words, compress prose into tables
2026-04-15 22:06:12	C:\Users\CEX\Documents\GitHub\cex\archetypes\builders\dataset-card-builder\bld_tools_dataset_card.md	1	9.0	1.00	keep	polished formatting (whitespace cleanup)
2026-04-15 22:06:12	C:\Users\CEX\Documents\GitHub\cex\archetypes\builders\discovery-questions-builder\bld_architecture_discovery_questions.md	1	9.0	1.00	keep	polished formatting (whitespace cleanup)
2026-04-15 22:06:13	C:\Users\CEX\Documents\GitHub\cex\archetypes\builders\discovery-questions-builder\bld_collaboration_discovery_questions.md	1	8.9	0.85	keep	analyzed: increase_density: remove filler words, compress prose into tables
2026-04-15 22:06:13	C:\Users\CEX\Documents\GitHub\cex\archetypes\builders\discovery-questions-builder\bld_config_discovery_questions.md	1	8.6	1.00	keep	polished formatting (whitespace cleanup)
2026-04-15 22:06:13	C:\Users\CEX\Documents\GitHub\cex\archetypes\builders\discovery-questions-builder\bld_examples_discovery_questions.md	1	8.9	0.78	keep	analyzed: reduce_prose: convert long prose sections into tables or bullet lists
2026-04-15 22:06:14	C:\Users\CEX\Documents\GitHub\cex\archetypes\builders\discovery-questions-builder\bld_instruction_discovery_questions.md	1	8.9	0.90	keep	analyzed: reduce_prose: convert long prose sections into tables or bullet lists
2026-04-15 22:06:14	C:\Users\CEX\Documents\GitHub\cex\archetypes\builders\discovery-questions-builder\bld_knowledge_card_discovery_questions.md	1	9.1	0.98	keep	polished formatting (whitespace cleanup)
2026-04-15 22:06:14	C:\Users\CEX\Documents\GitHub\cex\archetypes\builders\discovery-questions-builder\bld_manifest_discovery_questions.md	1	8.8	0.81	keep	analyzed: increase_density: remove filler words, compress prose into tables
2026-04-15 22:06:15	C:\Users\CEX\Documents\GitHub\cex\archetypes\builders\discovery-questions-builder\bld_memory_discovery_questions.md	1	8.7	0.96	keep	polished formatting (whitespace cleanup)
2026-04-15 22:06:15	C:\Users\CEX\Documents\GitHub\cex\archetypes\builders\discovery-questions-builder\bld_output_template_discovery_questions.md	1	9.1	1.00	keep	analyzed: reduce_prose: convert long prose sections into tables or bullet lists
2026-04-15 22:06:15	C:\Users\CEX\Documents\GitHub\cex\archetypes\builders\discovery-questions-builder\bld_quality_gate_discovery_questions.md	1	8.9	0.89	keep	analyzed: reduce_prose: convert long prose sections into tables or bullet lists
2026-04-15 22:06:15	C:\Users\CEX\Documents\GitHub\cex\archetypes\builders\discovery-questions-builder\bld_schema_discovery_questions.md	1	9.1	1.00	keep	polished formatting (whitespace cleanup)
2026-04-15 22:06:16	C:\Users\CEX\Documents\GitHub\cex\archetypes\builders\discovery-questions-builder\bld_system_prompt_discovery_questions.md	1	8.8	0.80	keep	analyzed: increase_density: remove filler words, compress prose into tables
2026-04-15 22:06:16	C:\Users\CEX\Documents\GitHub\cex\archetypes\builders\discovery-questions-builder\bld_tools_discovery_questions.md	1	8.9	1.00	keep	polished formatting (whitespace cleanup)
2026-04-15 22:06:16	C:\Users\CEX\Documents\GitHub\cex\archetypes\builders\dual-loop-architecture-builder\bld_architecture_dual_loop_architecture.md	1	9.1	1.00	keep	polished formatting (whitespace cleanup)
2026-04-15 22:06:17	C:\Users\CEX\Documents\GitHub\cex\archetypes\builders\dual-loop-architecture-builder\bld_collaboration_dual_loop_architecture.md	1	8.9	0.85	keep	analyzed: increase_density: remove filler words, compress prose into tables
2026-04-15 22:06:17	C:\Users\CEX\Documents\GitHub\cex\archetypes\builders\dual-loop-architecture-builder\bld_config_dual_loop_architecture.md	1	9.1	1.00	keep	analyzed: reduce_prose: convert long prose sections into tables or bullet lists
2026-04-15 22:06:17	C:\Users\CEX\Documents\GitHub\cex\archetypes\builders\dual-loop-architecture-builder\bld_examples_dual_loop_architecture.md	1	8.9	0.98	keep	analyzed: reduce_prose: convert long prose sections into tables or bullet lists
2026-04-15 22:06:18	C:\Users\CEX\Documents\GitHub\cex\archetypes\builders\dual-loop-architecture-builder\bld_instruction_dual_loop_architecture.md	1	8.9	0.97	keep	analyzed: reduce_prose: convert long prose sections into tables or bullet lists
2026-04-15 22:06:18	C:\Users\CEX\Documents\GitHub\cex\archetypes\builders\dual-loop-architecture-builder\bld_knowledge_card_dual_loop_architecture.md	1	9.2	0.98	keep	polished formatting (whitespace cleanup)
2026-04-15 22:06:18	C:\Users\CEX\Documents\GitHub\cex\archetypes\builders\dual-loop-architecture-builder\bld_manifest_dual_loop_architecture.md	1	8.9	0.82	keep	analyzed: increase_density: remove filler words, compress prose into tables
2026-04-15 22:06:19	C:\Users\CEX\Documents\GitHub\cex\archetypes\builders\dual-loop-architecture-builder\bld_memory_dual_loop_architecture.md	1	8.7	0.96	keep	polished formatting (whitespace cleanup)
2026-04-15 22:06:19	C:\Users\CEX\Documents\GitHub\cex\archetypes\builders\dual-loop-architecture-builder\bld_output_template_dual_loop_architecture.md	1	8.8	1.00	keep	analyzed: reduce_prose: convert long prose sections into tables or bullet lists
2026-04-15 22:06:19	C:\Users\CEX\Documents\GitHub\cex\archetypes\builders\dual-loop-architecture-builder\bld_quality_gate_dual_loop_architecture.md	1	9.0	1.00	keep	polished formatting (whitespace cleanup)
2026-04-15 22:06:20	C:\Users\CEX\Documents\GitHub\cex\archetypes\builders\dual-loop-architecture-builder\bld_schema_dual_loop_architecture.md	1	9.1	1.00	keep	polished formatting (whitespace cleanup)
2026-04-15 22:06:20	C:\Users\CEX\Documents\GitHub\cex\archetypes\builders\dual-loop-architecture-builder\bld_system_prompt_dual_loop_architecture.md	1	8.9	0.80	keep	analyzed: increase_density: remove filler words, compress prose into tables
2026-04-15 22:06:20	C:\Users\CEX\Documents\GitHub\cex\archetypes\builders\dual-loop-architecture-builder\bld_tools_dual_loop_architecture.md	1	9.0	1.00	keep	polished formatting (whitespace cleanup)
2026-04-15 22:06:21	C:\Users\CEX\Documents\GitHub\cex\archetypes\builders\ecommerce-vertical-builder\bld_architecture_ecommerce_vertical.md	1	9.0	1.00	keep	polished formatting (whitespace cleanup)
2026-04-15 22:06:21	C:\Users\CEX\Documents\GitHub\cex\archetypes\builders\ecommerce-vertical-builder\bld_collaboration_ecommerce_vertical.md	1	8.9	0.89	keep	analyzed: increase_density: remove filler words, compress prose into tables
2026-04-15 22:06:21	C:\Users\CEX\Documents\GitHub\cex\archetypes\builders\ecommerce-vertical-builder\bld_config_ecommerce_vertical.md	1	8.6	1.00	keep	polished formatting (whitespace cleanup)
2026-04-15 22:06:21	C:\Users\CEX\Documents\GitHub\cex\archetypes\builders\ecommerce-vertical-builder\bld_examples_ecommerce_vertical.md	1	8.9	0.98	keep	analyzed: reduce_prose: convert long prose sections into tables or bullet lists
2026-04-15 22:06:22	C:\Users\CEX\Documents\GitHub\cex\archetypes\builders\ecommerce-vertical-builder\bld_instruction_ecommerce_vertical.md	1	8.9	0.96	keep	analyzed: reduce_prose: convert long prose sections into tables or bullet lists
2026-04-15 22:06:22	C:\Users\CEX\Documents\GitHub\cex\archetypes\builders\ecommerce-vertical-builder\bld_knowledge_card_ecommerce_vertical.md	1	9.2	1.00	keep	polished formatting (whitespace cleanup)
2026-04-15 22:06:22	C:\Users\CEX\Documents\GitHub\cex\archetypes\builders\ecommerce-vertical-builder\bld_manifest_ecommerce_vertical.md	1	8.8	0.83	keep	analyzed: increase_density: remove filler words, compress prose into tables
2026-04-15 22:06:23	C:\Users\CEX\Documents\GitHub\cex\archetypes\builders\ecommerce-vertical-builder\bld_memory_ecommerce_vertical.md	1	8.8	1.00	keep	polished formatting (whitespace cleanup)
2026-04-15 22:06:23	C:\Users\CEX\Documents\GitHub\cex\archetypes\builders\ecommerce-vertical-builder\bld_output_template_ecommerce_vertical.md	1	9.1	1.00	keep	analyzed: reduce_prose: convert long prose sections into tables or bullet lists
2026-04-15 22:06:23	C:\Users\CEX\Documents\GitHub\cex\archetypes\builders\ecommerce-vertical-builder\bld_quality_gate_ecommerce_vertical.md	1	9.0	1.00	keep	polished formatting (whitespace cleanup)
2026-04-15 22:06:24	C:\Users\CEX\Documents\GitHub\cex\archetypes\builders\ecommerce-vertical-builder\bld_schema_ecommerce_vertical.md	1	9.1	1.00	keep	polished formatting (whitespace cleanup)
2026-04-15 22:06:24	C:\Users\CEX\Documents\GitHub\cex\archetypes\builders\ecommerce-vertical-builder\bld_system_prompt_ecommerce_vertical.md	1	8.9	0.85	keep	analyzed: increase_density: remove filler words, compress prose into tables
