timestamp	file	round	quality	density	status	description
2026-04-13 11:00:11	C:\Users\CEX\Documents\GitHub\cex\.cex\archive\reports\self_audit_gemini_2026_04_11.md	3	8.6	0.90	discard	tldr flagged for manual review
2026-04-13 11:00:11	C:\Users\CEX\Documents\GitHub\cex\phases.md	1	8.6	1.00	discard	analyzed: reduce_prose: convert long prose sections into tables or bullet lists
2026-04-13 11:00:11	C:\Users\CEX\Documents\GitHub\cex\phases.md	2	8.6	1.00	discard	analyzed: reduce_prose: convert long prose sections into tables or bullet lists
2026-04-13 11:00:11	C:\Users\CEX\Documents\GitHub\cex\phases.md	3	8.6	1.00	discard	analyzed: reduce_prose: convert long prose sections into tables or bullet lists
2026-04-13 11:00:11	C:\Users\CEX\Documents\GitHub\cex\N02_marketing\knowledge\kc_llm_agent_frameworks_comparison.md	1	8.7	1.00	discard	tldr flagged for manual review
2026-04-13 11:00:12	C:\Users\CEX\Documents\GitHub\cex\N02_marketing\knowledge\kc_llm_agent_frameworks_comparison.md	2	8.7	1.00	discard	tldr flagged for manual review
2026-04-13 11:00:12	C:\Users\CEX\Documents\GitHub\cex\N02_marketing\knowledge\kc_llm_agent_frameworks_comparison.md	3	8.7	1.00	discard	tldr flagged for manual review
2026-04-13 11:00:12	C:\Users\CEX\Documents\GitHub\cex\N03_engineering\knowledge\kc_aider_integration_patterns.md	1	8.7	1.00	discard	tldr flagged for manual review
2026-04-13 11:00:12	C:\Users\CEX\Documents\GitHub\cex\N03_engineering\knowledge\kc_aider_integration_patterns.md	2	8.7	1.00	discard	tldr flagged for manual review
2026-04-13 11:00:12	C:\Users\CEX\Documents\GitHub\cex\N03_engineering\knowledge\kc_aider_integration_patterns.md	3	8.7	1.00	discard	tldr flagged for manual review
2026-04-13 11:00:12	C:\Users\CEX\Documents\GitHub\cex\N04_knowledge\knowledge\p01_gl_embedding.md	1	8.7	0.84	discard	analyzed: increase_density: remove filler words, compress prose into tables
2026-04-13 11:00:12	C:\Users\CEX\Documents\GitHub\cex\N04_knowledge\knowledge\p01_gl_embedding.md	2	8.7	0.84	discard	analyzed: increase_density: remove filler words, compress prose into tables
2026-04-13 11:00:13	C:\Users\CEX\Documents\GitHub\cex\N04_knowledge\knowledge\p01_gl_embedding.md	3	8.7	0.84	discard	analyzed: increase_density: remove filler words, compress prose into tables
2026-04-13 11:00:13	C:\Users\CEX\Documents\GitHub\cex\N04_knowledge\knowledge\p01_gl_knowledge_card.md	1	8.7	0.83	discard	analyzed: increase_density: remove filler words, compress prose into tables
2026-04-13 11:00:13	C:\Users\CEX\Documents\GitHub\cex\N04_knowledge\knowledge\p01_gl_knowledge_card.md	2	8.7	0.83	discard	analyzed: increase_density: remove filler words, compress prose into tables
2026-04-13 11:00:13	C:\Users\CEX\Documents\GitHub\cex\N04_knowledge\knowledge\p01_gl_knowledge_card.md	3	8.7	0.83	discard	analyzed: increase_density: remove filler words, compress prose into tables
2026-04-13 11:00:13	C:\Users\CEX\Documents\GitHub\cex\N04_knowledge\knowledge\p01_gl_rag.md	1	8.7	0.84	discard	analyzed: increase_density: remove filler words, compress prose into tables
2026-04-13 11:00:13	C:\Users\CEX\Documents\GitHub\cex\N04_knowledge\knowledge\p01_gl_rag.md	2	8.7	0.84	discard	analyzed: increase_density: remove filler words, compress prose into tables
2026-04-13 11:00:14	C:\Users\CEX\Documents\GitHub\cex\N04_knowledge\knowledge\p01_gl_rag.md	3	8.7	0.84	discard	analyzed: increase_density: remove filler words, compress prose into tables
2026-04-13 11:00:14	C:\Users\CEX\Documents\GitHub\cex\N03_engineering\knowledge\kc_8f_pipeline_implementation.md	1	8.8	1.00	discard	tldr flagged for manual review
2026-04-13 11:00:14	C:\Users\CEX\Documents\GitHub\cex\N03_engineering\knowledge\kc_8f_pipeline_implementation.md	2	8.8	1.00	discard	tldr flagged for manual review
2026-04-13 11:00:14	C:\Users\CEX\Documents\GitHub\cex\N03_engineering\knowledge\kc_8f_pipeline_implementation.md	3	8.8	1.00	discard	tldr flagged for manual review
2026-04-13 11:00:14	C:\Users\CEX\Documents\GitHub\cex\N04_knowledge\knowledge\p01_gl_taxonomy.md	1	8.7	0.84	discard	added updated: 2026-04-13
2026-04-13 11:00:14	C:\Users\CEX\Documents\GitHub\cex\N04_knowledge\knowledge\p01_gl_taxonomy.md	2	8.7	0.84	discard	added updated: 2026-04-13
2026-04-13 11:00:15	C:\Users\CEX\Documents\GitHub\cex\N04_knowledge\knowledge\p01_gl_taxonomy.md	3	8.7	0.84	discard	added updated: 2026-04-13
2026-04-13 11:00:18	C:\Users\CEX\Documents\GitHub\cex\.cex\archive\reports\self_audit_gemini_2026_04_11.md	1	8.6	0.90	discard	tldr flagged for manual review
2026-04-13 11:00:18	C:\Users\CEX\Documents\GitHub\cex\.cex\archive\reports\self_audit_gemini_2026_04_11.md	2	8.6	0.90	discard	tldr flagged for manual review
2026-04-13 11:00:18	C:\Users\CEX\Documents\GitHub\cex\.cex\archive\reports\self_audit_gemini_2026_04_11.md	3	8.6	0.90	discard	tldr flagged for manual review
2026-04-13 11:00:19	C:\Users\CEX\Documents\GitHub\cex\phases.md	1	8.6	1.00	discard	analyzed: reduce_prose: convert long prose sections into tables or bullet lists
2026-04-13 11:00:19	C:\Users\CEX\Documents\GitHub\cex\phases.md	2	8.6	1.00	discard	analyzed: reduce_prose: convert long prose sections into tables or bullet lists
2026-04-13 11:00:19	C:\Users\CEX\Documents\GitHub\cex\phases.md	3	8.6	1.00	discard	analyzed: reduce_prose: convert long prose sections into tables or bullet lists
2026-04-13 11:00:19	C:\Users\CEX\Documents\GitHub\cex\N02_marketing\knowledge\kc_llm_agent_frameworks_comparison.md	1	8.7	1.00	discard	tldr flagged for manual review
2026-04-13 11:00:19	C:\Users\CEX\Documents\GitHub\cex\N02_marketing\knowledge\kc_llm_agent_frameworks_comparison.md	2	8.7	1.00	discard	tldr flagged for manual review
2026-04-13 11:00:19	C:\Users\CEX\Documents\GitHub\cex\N02_marketing\knowledge\kc_llm_agent_frameworks_comparison.md	3	8.7	1.00	discard	tldr flagged for manual review
2026-04-13 11:00:19	C:\Users\CEX\Documents\GitHub\cex\N03_engineering\knowledge\kc_aider_integration_patterns.md	1	8.7	1.00	discard	tldr flagged for manual review
2026-04-13 11:00:20	C:\Users\CEX\Documents\GitHub\cex\N03_engineering\knowledge\kc_aider_integration_patterns.md	2	8.7	1.00	discard	tldr flagged for manual review
2026-04-13 11:00:20	C:\Users\CEX\Documents\GitHub\cex\N03_engineering\knowledge\kc_aider_integration_patterns.md	3	8.7	1.00	discard	tldr flagged for manual review
2026-04-13 11:00:20	C:\Users\CEX\Documents\GitHub\cex\N04_knowledge\knowledge\p01_gl_embedding.md	1	8.7	0.84	discard	analyzed: increase_density: remove filler words, compress prose into tables
2026-04-13 11:00:20	C:\Users\CEX\Documents\GitHub\cex\N04_knowledge\knowledge\p01_gl_embedding.md	2	8.7	0.84	discard	analyzed: increase_density: remove filler words, compress prose into tables
2026-04-13 11:00:20	C:\Users\CEX\Documents\GitHub\cex\N04_knowledge\knowledge\p01_gl_embedding.md	3	8.7	0.84	discard	analyzed: increase_density: remove filler words, compress prose into tables
2026-04-13 11:00:20	C:\Users\CEX\Documents\GitHub\cex\N04_knowledge\knowledge\p01_gl_knowledge_card.md	1	8.7	0.83	discard	analyzed: increase_density: remove filler words, compress prose into tables
2026-04-13 11:00:21	C:\Users\CEX\Documents\GitHub\cex\N04_knowledge\knowledge\p01_gl_knowledge_card.md	2	8.7	0.83	discard	analyzed: increase_density: remove filler words, compress prose into tables
2026-04-13 11:00:21	C:\Users\CEX\Documents\GitHub\cex\N04_knowledge\knowledge\p01_gl_knowledge_card.md	3	8.7	0.83	discard	analyzed: increase_density: remove filler words, compress prose into tables
2026-04-13 11:00:21	C:\Users\CEX\Documents\GitHub\cex\N04_knowledge\knowledge\p01_gl_rag.md	1	8.7	0.84	discard	analyzed: increase_density: remove filler words, compress prose into tables
2026-04-13 11:00:21	C:\Users\CEX\Documents\GitHub\cex\N04_knowledge\knowledge\p01_gl_rag.md	2	8.7	0.84	discard	analyzed: increase_density: remove filler words, compress prose into tables
2026-04-13 11:00:21	C:\Users\CEX\Documents\GitHub\cex\N04_knowledge\knowledge\p01_gl_rag.md	3	8.7	0.84	discard	analyzed: increase_density: remove filler words, compress prose into tables
2026-04-13 11:00:21	C:\Users\CEX\Documents\GitHub\cex\N03_engineering\knowledge\kc_8f_pipeline_implementation.md	1	8.8	1.00	discard	tldr flagged for manual review
2026-04-13 11:00:22	C:\Users\CEX\Documents\GitHub\cex\N03_engineering\knowledge\kc_8f_pipeline_implementation.md	2	8.8	1.00	discard	tldr flagged for manual review
2026-04-13 11:00:22	C:\Users\CEX\Documents\GitHub\cex\N03_engineering\knowledge\kc_8f_pipeline_implementation.md	3	8.8	1.00	discard	tldr flagged for manual review
2026-04-13 11:00:22	C:\Users\CEX\Documents\GitHub\cex\N04_knowledge\knowledge\p01_gl_taxonomy.md	1	8.7	0.84	discard	added updated: 2026-04-13
2026-04-13 11:00:22	C:\Users\CEX\Documents\GitHub\cex\N04_knowledge\knowledge\p01_gl_taxonomy.md	2	8.7	0.84	discard	added updated: 2026-04-13
2026-04-13 11:00:22	C:\Users\CEX\Documents\GitHub\cex\N04_knowledge\knowledge\p01_gl_taxonomy.md	3	8.7	0.84	discard	added updated: 2026-04-13
2026-04-13 11:00:26	C:\Users\CEX\Documents\GitHub\cex\.cex\archive\reports\self_audit_gemini_2026_04_11.md	1	8.6	0.90	discard	tldr flagged for manual review
2026-04-13 11:00:26	C:\Users\CEX\Documents\GitHub\cex\.cex\archive\reports\self_audit_gemini_2026_04_11.md	2	8.6	0.90	discard	tldr flagged for manual review
2026-04-13 11:00:26	C:\Users\CEX\Documents\GitHub\cex\.cex\archive\reports\self_audit_gemini_2026_04_11.md	3	8.6	0.90	discard	tldr flagged for manual review
2026-04-13 11:00:26	C:\Users\CEX\Documents\GitHub\cex\phases.md	1	8.6	1.00	discard	analyzed: reduce_prose: convert long prose sections into tables or bullet lists
2026-04-13 11:00:26	C:\Users\CEX\Documents\GitHub\cex\phases.md	2	8.6	1.00	discard	analyzed: reduce_prose: convert long prose sections into tables or bullet lists
2026-04-13 11:00:26	C:\Users\CEX\Documents\GitHub\cex\phases.md	3	8.6	1.00	discard	analyzed: reduce_prose: convert long prose sections into tables or bullet lists
2026-04-13 11:00:27	C:\Users\CEX\Documents\GitHub\cex\N02_marketing\knowledge\kc_llm_agent_frameworks_comparison.md	1	8.7	1.00	discard	tldr flagged for manual review
2026-04-13 11:00:27	C:\Users\CEX\Documents\GitHub\cex\N02_marketing\knowledge\kc_llm_agent_frameworks_comparison.md	2	8.7	1.00	discard	tldr flagged for manual review
2026-04-13 11:00:27	C:\Users\CEX\Documents\GitHub\cex\N02_marketing\knowledge\kc_llm_agent_frameworks_comparison.md	3	8.7	1.00	discard	tldr flagged for manual review
2026-04-13 11:00:27	C:\Users\CEX\Documents\GitHub\cex\N03_engineering\knowledge\kc_aider_integration_patterns.md	1	8.7	1.00	discard	tldr flagged for manual review
2026-04-13 11:00:27	C:\Users\CEX\Documents\GitHub\cex\N03_engineering\knowledge\kc_aider_integration_patterns.md	2	8.7	1.00	discard	tldr flagged for manual review
2026-04-13 11:00:27	C:\Users\CEX\Documents\GitHub\cex\N03_engineering\knowledge\kc_aider_integration_patterns.md	3	8.7	1.00	discard	tldr flagged for manual review
2026-04-13 11:00:27	C:\Users\CEX\Documents\GitHub\cex\N04_knowledge\knowledge\p01_gl_embedding.md	1	8.7	0.84	discard	analyzed: increase_density: remove filler words, compress prose into tables
2026-04-13 11:00:28	C:\Users\CEX\Documents\GitHub\cex\N04_knowledge\knowledge\p01_gl_embedding.md	2	8.7	0.84	discard	analyzed: increase_density: remove filler words, compress prose into tables
2026-04-13 11:00:28	C:\Users\CEX\Documents\GitHub\cex\N04_knowledge\knowledge\p01_gl_embedding.md	3	8.7	0.84	discard	analyzed: increase_density: remove filler words, compress prose into tables
2026-04-13 11:00:28	C:\Users\CEX\Documents\GitHub\cex\N04_knowledge\knowledge\p01_gl_knowledge_card.md	1	8.7	0.83	discard	analyzed: increase_density: remove filler words, compress prose into tables
2026-04-13 11:00:28	C:\Users\CEX\Documents\GitHub\cex\N04_knowledge\knowledge\p01_gl_knowledge_card.md	2	8.7	0.83	discard	analyzed: increase_density: remove filler words, compress prose into tables
2026-04-13 11:00:28	C:\Users\CEX\Documents\GitHub\cex\N04_knowledge\knowledge\p01_gl_knowledge_card.md	3	8.7	0.83	discard	analyzed: increase_density: remove filler words, compress prose into tables
2026-04-13 11:00:28	C:\Users\CEX\Documents\GitHub\cex\N04_knowledge\knowledge\p01_gl_rag.md	1	8.7	0.84	discard	analyzed: increase_density: remove filler words, compress prose into tables
2026-04-13 11:00:28	C:\Users\CEX\Documents\GitHub\cex\N04_knowledge\knowledge\p01_gl_rag.md	2	8.7	0.84	discard	analyzed: increase_density: remove filler words, compress prose into tables
2026-04-13 11:00:29	C:\Users\CEX\Documents\GitHub\cex\N04_knowledge\knowledge\p01_gl_rag.md	3	8.7	0.84	discard	analyzed: increase_density: remove filler words, compress prose into tables
2026-04-13 11:00:29	C:\Users\CEX\Documents\GitHub\cex\N03_engineering\knowledge\kc_8f_pipeline_implementation.md	1	8.8	1.00	discard	tldr flagged for manual review
2026-04-13 11:00:29	C:\Users\CEX\Documents\GitHub\cex\N03_engineering\knowledge\kc_8f_pipeline_implementation.md	2	8.8	1.00	discard	tldr flagged for manual review
2026-04-13 11:00:29	C:\Users\CEX\Documents\GitHub\cex\N03_engineering\knowledge\kc_8f_pipeline_implementation.md	3	8.8	1.00	discard	tldr flagged for manual review
2026-04-13 11:00:29	C:\Users\CEX\Documents\GitHub\cex\N04_knowledge\knowledge\p01_gl_taxonomy.md	1	8.7	0.84	discard	added updated: 2026-04-13
2026-04-13 11:00:29	C:\Users\CEX\Documents\GitHub\cex\N04_knowledge\knowledge\p01_gl_taxonomy.md	2	8.7	0.84	discard	added updated: 2026-04-13
2026-04-13 11:00:29	C:\Users\CEX\Documents\GitHub\cex\N04_knowledge\knowledge\p01_gl_taxonomy.md	3	8.7	0.84	discard	added updated: 2026-04-13
2026-04-13 11:00:33	C:\Users\CEX\Documents\GitHub\cex\.cex\archive\reports\self_audit_gemini_2026_04_11.md	1	8.6	0.90	discard	tldr flagged for manual review
2026-04-13 11:00:33	C:\Users\CEX\Documents\GitHub\cex\.cex\archive\reports\self_audit_gemini_2026_04_11.md	2	8.6	0.90	discard	tldr flagged for manual review
2026-04-13 11:00:33	C:\Users\CEX\Documents\GitHub\cex\.cex\archive\reports\self_audit_gemini_2026_04_11.md	3	8.6	0.90	discard	tldr flagged for manual review
2026-04-13 11:00:34	C:\Users\CEX\Documents\GitHub\cex\phases.md	1	8.6	1.00	discard	analyzed: reduce_prose: convert long prose sections into tables or bullet lists
2026-04-13 11:00:34	C:\Users\CEX\Documents\GitHub\cex\phases.md	2	8.6	1.00	discard	analyzed: reduce_prose: convert long prose sections into tables or bullet lists
2026-04-13 11:00:34	C:\Users\CEX\Documents\GitHub\cex\phases.md	3	8.6	1.00	discard	analyzed: reduce_prose: convert long prose sections into tables or bullet lists
2026-04-13 11:00:34	C:\Users\CEX\Documents\GitHub\cex\N02_marketing\knowledge\kc_llm_agent_frameworks_comparison.md	1	8.7	1.00	discard	tldr flagged for manual review
2026-04-13 11:00:34	C:\Users\CEX\Documents\GitHub\cex\N02_marketing\knowledge\kc_llm_agent_frameworks_comparison.md	2	8.7	1.00	discard	tldr flagged for manual review
2026-04-13 11:00:34	C:\Users\CEX\Documents\GitHub\cex\N02_marketing\knowledge\kc_llm_agent_frameworks_comparison.md	3	8.7	1.00	discard	tldr flagged for manual review
2026-04-13 11:00:34	C:\Users\CEX\Documents\GitHub\cex\N03_engineering\knowledge\kc_aider_integration_patterns.md	1	8.7	1.00	discard	tldr flagged for manual review
2026-04-13 11:00:35	C:\Users\CEX\Documents\GitHub\cex\N03_engineering\knowledge\kc_aider_integration_patterns.md	2	8.7	1.00	discard	tldr flagged for manual review
2026-04-13 11:00:35	C:\Users\CEX\Documents\GitHub\cex\N03_engineering\knowledge\kc_aider_integration_patterns.md	3	8.7	1.00	discard	tldr flagged for manual review
2026-04-13 11:00:35	C:\Users\CEX\Documents\GitHub\cex\N04_knowledge\knowledge\p01_gl_embedding.md	1	8.7	0.84	discard	analyzed: increase_density: remove filler words, compress prose into tables
2026-04-13 11:00:35	C:\Users\CEX\Documents\GitHub\cex\N04_knowledge\knowledge\p01_gl_embedding.md	2	8.7	0.84	discard	analyzed: increase_density: remove filler words, compress prose into tables
2026-04-13 11:00:35	C:\Users\CEX\Documents\GitHub\cex\N04_knowledge\knowledge\p01_gl_embedding.md	3	8.7	0.84	discard	analyzed: increase_density: remove filler words, compress prose into tables
2026-04-13 11:00:35	C:\Users\CEX\Documents\GitHub\cex\N04_knowledge\knowledge\p01_gl_knowledge_card.md	1	8.7	0.83	discard	analyzed: increase_density: remove filler words, compress prose into tables
2026-04-13 11:00:35	C:\Users\CEX\Documents\GitHub\cex\N04_knowledge\knowledge\p01_gl_knowledge_card.md	2	8.7	0.83	discard	analyzed: increase_density: remove filler words, compress prose into tables
2026-04-13 11:00:36	C:\Users\CEX\Documents\GitHub\cex\N04_knowledge\knowledge\p01_gl_knowledge_card.md	3	8.7	0.83	discard	analyzed: increase_density: remove filler words, compress prose into tables
2026-04-13 11:00:36	C:\Users\CEX\Documents\GitHub\cex\N04_knowledge\knowledge\p01_gl_rag.md	1	8.7	0.84	discard	analyzed: increase_density: remove filler words, compress prose into tables
2026-04-13 11:00:36	C:\Users\CEX\Documents\GitHub\cex\N04_knowledge\knowledge\p01_gl_rag.md	2	8.7	0.84	discard	analyzed: increase_density: remove filler words, compress prose into tables
2026-04-13 11:00:36	C:\Users\CEX\Documents\GitHub\cex\N04_knowledge\knowledge\p01_gl_rag.md	3	8.7	0.84	discard	analyzed: increase_density: remove filler words, compress prose into tables
2026-04-13 11:00:36	C:\Users\CEX\Documents\GitHub\cex\N03_engineering\knowledge\kc_8f_pipeline_implementation.md	1	8.8	1.00	discard	tldr flagged for manual review
2026-04-13 11:00:36	C:\Users\CEX\Documents\GitHub\cex\N03_engineering\knowledge\kc_8f_pipeline_implementation.md	2	8.8	1.00	discard	tldr flagged for manual review
2026-04-13 11:00:37	C:\Users\CEX\Documents\GitHub\cex\N03_engineering\knowledge\kc_8f_pipeline_implementation.md	3	8.8	1.00	discard	tldr flagged for manual review
2026-04-13 11:00:37	C:\Users\CEX\Documents\GitHub\cex\N04_knowledge\knowledge\p01_gl_taxonomy.md	1	8.7	0.84	discard	analyzed: increase_density: remove filler words, compress prose into tables
2026-04-13 11:00:37	C:\Users\CEX\Documents\GitHub\cex\N04_knowledge\knowledge\p01_gl_taxonomy.md	2	8.7	0.84	discard	analyzed: increase_density: remove filler words, compress prose into tables
2026-04-13 11:00:37	C:\Users\CEX\Documents\GitHub\cex\N04_knowledge\knowledge\p01_gl_taxonomy.md	3	8.7	0.84	discard	analyzed: increase_density: remove filler words, compress prose into tables
2026-04-15 22:00:22	N01_intelligence\compiled\LEVERAGE_MAP_V2_n01_cycle2_verification.md	1	9.0	1.00	keep	added density_score: 1.0
2026-04-15 22:00:22	N01_intelligence\LEVERAGE_MAP_V2_VERIFY_CYCLE.md	1	9.1	1.00	keep	added density_score: 1.0
2026-04-15 22:00:23	N01_intelligence\reports\LEVERAGE_MAP_V2_n01_tool_verification.md	1	9.0	0.89	keep	added density_score: 0.89
2026-04-15 22:00:23	N01_intelligence\reports\selfheal_w2_diagnosis.md	1	9.1	1.00	keep	added density_score: 1.0
2026-04-15 22:00:23	N02_marketing\reports\LEVERAGE_MAP_V2_n02.md	1	9.0	1.00	keep	added density_score: 1.0
2026-04-15 22:00:24	N02_marketing\reports\LEVERAGE_MAP_V2_n02_codex.md	1	9.0	0.95	keep	added density_score: 0.95
2026-04-15 22:00:24	N02_marketing\reports\LEVERAGE_MAP_V2_n02_iteration2.md	1	9.0	1.00	keep	added density_score: 1.0
2026-04-15 22:00:24	N02_marketing\reports\LEVERAGE_MAP_V2_n02_self_audit.md	1	9.0	0.94	keep	added density_score: 0.94
2026-04-15 22:03:35	C:\Users\CEX\Documents\GitHub\cex\.cex\runtime\comparisons\claude_vs_free_decision_matrix.md	1	9.1	1.00	keep	added density_score: 1.0
2026-04-15 22:03:35	C:\Users\CEX\Documents\GitHub\cex\.cex\runtime\comparisons\kc_litellm_free_first_CLAUDE.md	1	9.1	0.98	keep	added updated: 2026-04-15
2026-04-15 22:03:36	C:\Users\CEX\Documents\GitHub\cex\.cex\runtime\out\gemma_grid_n01.md	1	8.7	0.73	keep	added density_score: 0.73
2026-04-15 22:03:36	C:\Users\CEX\Documents\GitHub\cex\.cex\runtime\out\gemma_grid_n04.md	1	8.6	0.73	keep	added density_score: 0.73
2026-04-15 22:03:36	C:\Users\CEX\Documents\GitHub\cex\.cex\runtime\out\gemma_grid_n05.md	1	8.3	0.86	keep	added density_score: 0.86
2026-04-15 22:03:36	C:\Users\CEX\Documents\GitHub\cex\.cex\runtime\out\gemma_grid_n05.md	2	8.3	0.86	discard	added updated: 2026-04-15
2026-04-15 22:03:36	C:\Users\CEX\Documents\GitHub\cex\.cex\runtime\out\gemma_grid_n06.md	1	8.4	1.00	keep	added density_score: 1.0
2026-04-15 22:03:36	C:\Users\CEX\Documents\GitHub\cex\.cex\runtime\out\gemma_grid_n06.md	2	8.4	1.00	discard	added updated: 2026-04-15
2026-04-15 22:03:37	C:\Users\CEX\Documents\GitHub\cex\.cex\runtime\out\kc_litellm_free_first.md	1	9.1	0.98	keep	added updated: 2026-04-15
2026-04-15 22:03:37	C:\Users\CEX\Documents\GitHub\cex\.cex\runtime\plans\plan_wave3_v2.md	1	9.1	1.00	keep	added density_score: 1.0
2026-04-15 22:03:37	C:\Users\CEX\Documents\GitHub\cex\.cex\runtime\tests\test_taxonomy_pipeline.md	1	9.1	1.00	keep	added density_score: 1.0
2026-04-15 22:03:37	C:\Users\CEX\Documents\GitHub\cex\.claude\commands\batch.md	1	9.1	1.00	keep	polished formatting (whitespace cleanup)
2026-04-15 22:03:38	C:\Users\CEX\Documents\GitHub\cex\.claude\commands\loop.md	1	9.1	1.00	keep	polished formatting (whitespace cleanup)
2026-04-15 22:03:38	C:\Users\CEX\Documents\GitHub\cex\.claude\commands\schedule.md	1	9.1	1.00	keep	analyzed: reduce_prose: convert long prose sections into tables or bullet lists
2026-04-15 22:03:38	C:\Users\CEX\Documents\GitHub\cex\.claude\commands\simplify.md	1	8.9	1.00	keep	polished formatting (whitespace cleanup)
2026-04-15 22:03:38	C:\Users\CEX\Documents\GitHub\cex\.claude\rules\auto-accept-handoff.md	1	9.1	0.95	keep	analyzed: reduce_prose: convert long prose sections into tables or bullet lists
2026-04-15 22:03:39	C:\Users\CEX\Documents\GitHub\cex\.claude\skills\verify.md	1	8.6	1.00	keep	added density_score: 1.0
2026-04-15 22:03:39	C:\Users\CEX\Documents\GitHub\cex\archetypes\builders\bld_norms.md	1	9.2	1.00	keep	analyzed: reduce_prose: convert long prose sections into tables or bullet lists
2026-04-15 22:03:39	C:\Users\CEX\Documents\GitHub\cex\archetypes\builders\ab-test-config-builder\bld_architecture_ab_test_config.md	1	9.0	1.00	keep	polished formatting (whitespace cleanup)
