timestamp	file	round	quality	density	status	description
2026-04-15 22:03:40	C:\Users\CEX\Documents\GitHub\cex\archetypes\builders\ab-test-config-builder\bld_collaboration_ab_test_config.md	1	8.9	0.86	keep	analyzed: increase_density: remove filler words, compress prose into tables
2026-04-15 22:03:40	C:\Users\CEX\Documents\GitHub\cex\archetypes\builders\ab-test-config-builder\bld_config_ab_test_config.md	1	8.6	0.95	keep	polished formatting (whitespace cleanup)
2026-04-15 22:03:40	C:\Users\CEX\Documents\GitHub\cex\archetypes\builders\ab-test-config-builder\bld_examples_ab_test_config.md	1	8.8	1.00	keep	analyzed: reduce_prose: convert long prose sections into tables or bullet lists
2026-04-15 22:03:41	C:\Users\CEX\Documents\GitHub\cex\archetypes\builders\ab-test-config-builder\bld_instruction_ab_test_config.md	1	8.9	1.00	keep	analyzed: reduce_prose: convert long prose sections into tables or bullet lists
2026-04-15 22:03:41	C:\Users\CEX\Documents\GitHub\cex\archetypes\builders\ab-test-config-builder\bld_knowledge_card_ab_test_config.md	1	9.2	0.96	keep	analyzed: reduce_prose: convert long prose sections into tables or bullet lists
2026-04-15 22:03:41	C:\Users\CEX\Documents\GitHub\cex\archetypes\builders\ab-test-config-builder\bld_manifest_ab_test_config.md	1	8.8	0.82	keep	analyzed: increase_density: remove filler words, compress prose into tables
2026-04-15 22:03:41	C:\Users\CEX\Documents\GitHub\cex\archetypes\builders\ab-test-config-builder\bld_memory_ab_test_config.md	1	9.0	0.89	keep	analyzed: reduce_prose: convert long prose sections into tables or bullet lists
2026-04-15 22:03:42	C:\Users\CEX\Documents\GitHub\cex\archetypes\builders\ab-test-config-builder\bld_output_template_ab_test_config.md	1	8.8	1.00	keep	analyzed: reduce_prose: convert long prose sections into tables or bullet lists
2026-04-15 22:03:42	C:\Users\CEX\Documents\GitHub\cex\archetypes\builders\ab-test-config-builder\bld_quality_gate_ab_test_config.md	1	9.1	1.00	keep	polished formatting (whitespace cleanup)
2026-04-15 22:03:42	C:\Users\CEX\Documents\GitHub\cex\archetypes\builders\ab-test-config-builder\bld_schema_ab_test_config.md	1	9.2	1.00	keep	analyzed: reduce_prose: convert long prose sections into tables or bullet lists
2026-04-15 22:03:43	C:\Users\CEX\Documents\GitHub\cex\archetypes\builders\ab-test-config-builder\bld_system_prompt_ab_test_config.md	1	9.0	0.81	keep	analyzed: increase_density: remove filler words, compress prose into tables
2026-04-15 22:03:43	C:\Users\CEX\Documents\GitHub\cex\archetypes\builders\ab-test-config-builder\bld_tools_ab_test_config.md	1	8.9	1.00	keep	polished formatting (whitespace cleanup)
2026-04-15 22:03:43	C:\Users\CEX\Documents\GitHub\cex\archetypes\builders\action-paradigm-builder\bld_architecture_action_paradigm.md	1	9.0	1.00	keep	polished formatting (whitespace cleanup)
2026-04-15 22:03:44	C:\Users\CEX\Documents\GitHub\cex\archetypes\builders\action-paradigm-builder\bld_collaboration_action_paradigm.md	1	8.9	1.00	keep	polished formatting (whitespace cleanup)
2026-04-15 22:03:44	C:\Users\CEX\Documents\GitHub\cex\archetypes\builders\action-paradigm-builder\bld_config_action_paradigm.md	1	8.8	1.00	keep	polished formatting (whitespace cleanup)
2026-04-15 22:03:44	C:\Users\CEX\Documents\GitHub\cex\archetypes\builders\action-paradigm-builder\bld_examples_action_paradigm.md	1	9.2	1.00	keep	polished formatting (whitespace cleanup)
2026-04-15 22:03:45	C:\Users\CEX\Documents\GitHub\cex\archetypes\builders\action-paradigm-builder\bld_instruction_action_paradigm.md	1	9.0	1.00	keep	analyzed: reduce_prose: convert long prose sections into tables or bullet lists
2026-04-15 22:03:45	C:\Users\CEX\Documents\GitHub\cex\archetypes\builders\action-paradigm-builder\bld_knowledge_card_action_paradigm.md	1	9.2	1.00	keep	polished formatting (whitespace cleanup)
2026-04-15 22:03:45	C:\Users\CEX\Documents\GitHub\cex\archetypes\builders\action-paradigm-builder\bld_manifest_action_paradigm.md	1	9.1	1.00	keep	polished formatting (whitespace cleanup)
2026-04-15 22:03:46	C:\Users\CEX\Documents\GitHub\cex\archetypes\builders\action-paradigm-builder\bld_memory_action_paradigm.md	1	9.1	1.00	keep	polished formatting (whitespace cleanup)
2026-04-15 22:03:46	C:\Users\CEX\Documents\GitHub\cex\archetypes\builders\action-paradigm-builder\bld_output_template_action_paradigm.md	1	9.1	1.00	keep	analyzed: reduce_prose: convert long prose sections into tables or bullet lists
2026-04-15 22:03:46	C:\Users\CEX\Documents\GitHub\cex\archetypes\builders\action-paradigm-builder\bld_quality_gate_action_paradigm.md	1	9.1	1.00	keep	polished formatting (whitespace cleanup)
2026-04-15 22:03:47	C:\Users\CEX\Documents\GitHub\cex\archetypes\builders\action-paradigm-builder\bld_schema_action_paradigm.md	1	9.2	1.00	keep	analyzed: reduce_prose: convert long prose sections into tables or bullet lists
2026-04-15 22:03:47	C:\Users\CEX\Documents\GitHub\cex\archetypes\builders\action-paradigm-builder\bld_system_prompt_action_paradigm.md	1	9.1	0.98	keep	analyzed: reduce_prose: convert long prose sections into tables or bullet lists
2026-04-15 22:03:47	C:\Users\CEX\Documents\GitHub\cex\archetypes\builders\action-paradigm-builder\bld_tools_action_paradigm.md	1	9.1	1.00	keep	polished formatting (whitespace cleanup)
2026-04-15 22:03:47	C:\Users\CEX\Documents\GitHub\cex\archetypes\builders\agent-computer-interface-builder\bld_architecture_agent_computer_interface.md	1	9.1	1.00	keep	analyzed: reduce_prose: convert long prose sections into tables or bullet lists
2026-04-15 22:03:48	C:\Users\CEX\Documents\GitHub\cex\archetypes\builders\agent-computer-interface-builder\bld_collaboration_agent_computer_interface.md	1	8.9	0.97	keep	polished formatting (whitespace cleanup)
2026-04-15 22:03:48	C:\Users\CEX\Documents\GitHub\cex\archetypes\builders\agent-computer-interface-builder\bld_config_agent_computer_interface.md	1	8.6	1.00	keep	polished formatting (whitespace cleanup)
2026-04-15 22:03:48	C:\Users\CEX\Documents\GitHub\cex\archetypes\builders\agent-computer-interface-builder\bld_examples_agent_computer_interface.md	1	9.1	1.00	keep	analyzed: reduce_prose: convert long prose sections into tables or bullet lists
2026-04-15 22:03:49	C:\Users\CEX\Documents\GitHub\cex\archetypes\builders\agent-computer-interface-builder\bld_instruction_agent_computer_interface.md	1	8.9	1.00	keep	analyzed: reduce_prose: convert long prose sections into tables or bullet lists
2026-04-15 22:03:49	C:\Users\CEX\Documents\GitHub\cex\archetypes\builders\agent-computer-interface-builder\bld_knowledge_card_agent_computer_interface.md	1	9.1	1.00	keep	polished formatting (whitespace cleanup)
2026-04-15 22:03:49	C:\Users\CEX\Documents\GitHub\cex\archetypes\builders\agent-computer-interface-builder\bld_manifest_agent_computer_interface.md	1	8.8	0.76	keep	analyzed: increase_density: remove filler words, compress prose into tables
2026-04-15 22:03:50	C:\Users\CEX\Documents\GitHub\cex\archetypes\builders\agent-computer-interface-builder\bld_memory_agent_computer_interface.md	1	8.7	0.97	keep	polished formatting (whitespace cleanup)
2026-04-15 22:03:50	C:\Users\CEX\Documents\GitHub\cex\archetypes\builders\agent-computer-interface-builder\bld_output_template_agent_computer_interface.md	1	9.1	1.00	keep	analyzed: reduce_prose: convert long prose sections into tables or bullet lists
2026-04-15 22:03:50	C:\Users\CEX\Documents\GitHub\cex\archetypes\builders\agent-computer-interface-builder\bld_quality_gate_agent_computer_interface.md	1	9.1	1.00	keep	polished formatting (whitespace cleanup)
2026-04-15 22:03:51	C:\Users\CEX\Documents\GitHub\cex\archetypes\builders\agent-computer-interface-builder\bld_schema_agent_computer_interface.md	1	9.0	1.00	keep	polished formatting (whitespace cleanup)
2026-04-15 22:03:51	C:\Users\CEX\Documents\GitHub\cex\archetypes\builders\agent-computer-interface-builder\bld_system_prompt_agent_computer_interface.md	1	8.8	0.77	keep	analyzed: increase_density: remove filler words, compress prose into tables
2026-04-15 22:03:51	C:\Users\CEX\Documents\GitHub\cex\archetypes\builders\agent-computer-interface-builder\bld_tools_agent_computer_interface.md	1	9.0	1.00	keep	polished formatting (whitespace cleanup)
2026-04-15 22:03:52	C:\Users\CEX\Documents\GitHub\cex\archetypes\builders\agent-grounding-record-builder\bld_architecture_agent_grounding_record.md	1	9.1	1.00	keep	polished formatting (whitespace cleanup)
2026-04-15 22:03:52	C:\Users\CEX\Documents\GitHub\cex\archetypes\builders\agent-grounding-record-builder\bld_collaboration_agent_grounding_record.md	1	9.1	1.00	keep	polished formatting (whitespace cleanup)
2026-04-15 22:03:52	C:\Users\CEX\Documents\GitHub\cex\archetypes\builders\agent-grounding-record-builder\bld_config_agent_grounding_record.md	1	9.1	1.00	keep	analyzed: reduce_prose: convert long prose sections into tables or bullet lists
2026-04-15 22:03:53	C:\Users\CEX\Documents\GitHub\cex\archetypes\builders\agent-grounding-record-builder\bld_examples_agent_grounding_record.md	1	9.1	1.00	keep	analyzed: reduce_prose: convert long prose sections into tables or bullet lists
2026-04-15 22:03:53	C:\Users\CEX\Documents\GitHub\cex\archetypes\builders\agent-grounding-record-builder\bld_instruction_agent_grounding_record.md	1	9.1	0.98	keep	analyzed: reduce_prose: convert long prose sections into tables or bullet lists
2026-04-15 22:03:53	C:\Users\CEX\Documents\GitHub\cex\archetypes\builders\agent-grounding-record-builder\bld_knowledge_card_agent_grounding_record.md	1	9.2	0.96	keep	polished formatting (whitespace cleanup)
2026-04-15 22:03:53	C:\Users\CEX\Documents\GitHub\cex\archetypes\builders\agent-grounding-record-builder\bld_manifest_agent_grounding_record.md	1	9.1	1.00	keep	analyzed: reduce_prose: convert long prose sections into tables or bullet lists
2026-04-15 22:03:54	C:\Users\CEX\Documents\GitHub\cex\archetypes\builders\agent-grounding-record-builder\bld_memory_agent_grounding_record.md	1	9.1	0.88	keep	analyzed: reduce_prose: convert long prose sections into tables or bullet lists
2026-04-15 22:03:54	C:\Users\CEX\Documents\GitHub\cex\archetypes\builders\agent-grounding-record-builder\bld_output_template_agent_grounding_record.md	1	9.1	1.00	keep	analyzed: reduce_prose: convert long prose sections into tables or bullet lists
2026-04-15 22:03:54	C:\Users\CEX\Documents\GitHub\cex\archetypes\builders\agent-grounding-record-builder\bld_quality_gate_agent_grounding_record.md	1	9.1	0.99	keep	polished formatting (whitespace cleanup)
2026-04-15 22:03:55	C:\Users\CEX\Documents\GitHub\cex\archetypes\builders\agent-grounding-record-builder\bld_schema_agent_grounding_record.md	1	9.1	1.00	keep	analyzed: reduce_prose: convert long prose sections into tables or bullet lists
2026-04-15 22:03:55	C:\Users\CEX\Documents\GitHub\cex\archetypes\builders\agent-grounding-record-builder\bld_system_prompt_agent_grounding_record.md	1	9.0	0.92	keep	polished formatting (whitespace cleanup)
2026-04-15 22:03:55	C:\Users\CEX\Documents\GitHub\cex\archetypes\builders\agent-grounding-record-builder\bld_tools_agent_grounding_record.md	1	9.2	1.00	keep	analyzed: reduce_prose: convert long prose sections into tables or bullet lists
2026-04-15 22:03:56	C:\Users\CEX\Documents\GitHub\cex\archetypes\builders\agent-name-service-record-builder\bld_architecture_agent_name_service_record.md	1	9.1	1.00	keep	analyzed: reduce_prose: convert long prose sections into tables or bullet lists
2026-04-15 22:03:56	C:\Users\CEX\Documents\GitHub\cex\archetypes\builders\agent-name-service-record-builder\bld_collaboration_agent_name_service_record.md	1	9.1	1.00	keep	polished formatting (whitespace cleanup)
2026-04-15 22:03:56	C:\Users\CEX\Documents\GitHub\cex\archetypes\builders\agent-name-service-record-builder\bld_config_agent_name_service_record.md	1	9.1	1.00	keep	polished formatting (whitespace cleanup)
2026-04-15 22:03:57	C:\Users\CEX\Documents\GitHub\cex\archetypes\builders\agent-name-service-record-builder\bld_examples_agent_name_service_record.md	1	9.1	1.00	keep	analyzed: reduce_prose: convert long prose sections into tables or bullet lists
2026-04-15 22:03:57	C:\Users\CEX\Documents\GitHub\cex\archetypes\builders\agent-name-service-record-builder\bld_instruction_agent_name_service_record.md	1	9.1	1.00	keep	analyzed: reduce_prose: convert long prose sections into tables or bullet lists
2026-04-15 22:03:57	C:\Users\CEX\Documents\GitHub\cex\archetypes\builders\agent-name-service-record-builder\bld_knowledge_card_agent_name_service_record.md	1	9.1	1.00	keep	polished formatting (whitespace cleanup)
2026-04-15 22:03:58	C:\Users\CEX\Documents\GitHub\cex\archetypes\builders\agent-name-service-record-builder\bld_manifest_agent_name_service_record.md	1	9.1	1.00	keep	polished formatting (whitespace cleanup)
2026-04-15 22:03:58	C:\Users\CEX\Documents\GitHub\cex\archetypes\builders\agent-name-service-record-builder\bld_memory_agent_name_service_record.md	1	9.0	1.00	keep	polished formatting (whitespace cleanup)
2026-04-15 22:03:58	C:\Users\CEX\Documents\GitHub\cex\archetypes\builders\agent-name-service-record-builder\bld_output_template_agent_name_service_record.md	1	9.1	1.00	keep	analyzed: reduce_prose: convert long prose sections into tables or bullet lists
2026-04-15 22:03:59	C:\Users\CEX\Documents\GitHub\cex\archetypes\builders\agent-name-service-record-builder\bld_quality_gate_agent_name_service_record.md	1	9.1	1.00	keep	polished formatting (whitespace cleanup)
2026-04-15 22:03:59	C:\Users\CEX\Documents\GitHub\cex\archetypes\builders\agent-name-service-record-builder\bld_schema_agent_name_service_record.md	1	9.1	1.00	keep	analyzed: reduce_prose: convert long prose sections into tables or bullet lists
2026-04-15 22:03:59	C:\Users\CEX\Documents\GitHub\cex\archetypes\builders\agent-name-service-record-builder\bld_system_prompt_agent_name_service_record.md	1	9.1	0.97	keep	polished formatting (whitespace cleanup)
2026-04-15 22:04:00	C:\Users\CEX\Documents\GitHub\cex\archetypes\builders\agent-name-service-record-builder\bld_tools_agent_name_service_record.md	1	9.1	1.00	keep	analyzed: reduce_prose: convert long prose sections into tables or bullet lists
2026-04-15 22:04:00	C:\Users\CEX\Documents\GitHub\cex\archetypes\builders\agent-profile-builder\bld_architecture_agent_profile.md	1	8.9	0.88	keep	analyzed: increase_density: remove filler words, compress prose into tables
2026-04-15 22:04:00	C:\Users\CEX\Documents\GitHub\cex\archetypes\builders\agent-profile-builder\bld_collaboration_agent_profile.md	1	8.7	0.86	keep	analyzed: increase_density: remove filler words, compress prose into tables
2026-04-15 22:04:01	C:\Users\CEX\Documents\GitHub\cex\archetypes\builders\agent-profile-builder\bld_config_agent_profile.md	1	8.6	0.93	keep	polished formatting (whitespace cleanup)
2026-04-15 22:04:01	C:\Users\CEX\Documents\GitHub\cex\archetypes\builders\agent-profile-builder\bld_examples_agent_profile.md	1	9.0	0.98	keep	polished formatting (whitespace cleanup)
2026-04-15 22:04:01	C:\Users\CEX\Documents\GitHub\cex\archetypes\builders\agent-profile-builder\bld_instruction_agent_profile.md	1	9.0	0.92	keep	analyzed: reduce_prose: convert long prose sections into tables or bullet lists
2026-04-15 22:04:01	C:\Users\CEX\Documents\GitHub\cex\archetypes\builders\agent-profile-builder\bld_knowledge_card_agent_profile.md	1	9.2	0.97	keep	polished formatting (whitespace cleanup)
2026-04-15 22:04:02	C:\Users\CEX\Documents\GitHub\cex\archetypes\builders\agent-profile-builder\bld_manifest_agent_profile.md	1	8.8	0.83	keep	analyzed: increase_density: remove filler words, compress prose into tables
2026-04-15 22:04:02	C:\Users\CEX\Documents\GitHub\cex\archetypes\builders\agent-profile-builder\bld_memory_agent_profile.md	1	8.7	0.97	keep	polished formatting (whitespace cleanup)
2026-04-15 22:04:02	C:\Users\CEX\Documents\GitHub\cex\archetypes\builders\agent-profile-builder\bld_output_template_agent_profile.md	1	9.0	1.00	keep	analyzed: reduce_prose: convert long prose sections into tables or bullet lists
2026-04-15 22:04:03	C:\Users\CEX\Documents\GitHub\cex\archetypes\builders\agent-profile-builder\bld_quality_gate_agent_profile.md	1	9.2	1.00	keep	tldr flagged for manual review
2026-04-15 22:04:03	C:\Users\CEX\Documents\GitHub\cex\archetypes\builders\agent-profile-builder\bld_schema_agent_profile.md	1	9.1	1.00	keep	polished formatting (whitespace cleanup)
2026-04-15 22:04:03	C:\Users\CEX\Documents\GitHub\cex\archetypes\builders\agent-profile-builder\bld_system_prompt_agent_profile.md	1	8.8	0.80	keep	analyzed: increase_density: remove filler words, compress prose into tables
2026-04-15 22:04:04	C:\Users\CEX\Documents\GitHub\cex\archetypes\builders\agent-profile-builder\bld_tools_agent_profile.md	1	8.9	1.00	keep	polished formatting (whitespace cleanup)
2026-04-15 22:04:04	C:\Users\CEX\Documents\GitHub\cex\archetypes\builders\agentic-rag-builder\bld_architecture_agentic_rag.md	1	9.0	1.00	keep	polished formatting (whitespace cleanup)
2026-04-15 22:04:04	C:\Users\CEX\Documents\GitHub\cex\archetypes\builders\agentic-rag-builder\bld_collaboration_agentic_rag.md	1	8.9	0.89	keep	analyzed: increase_density: remove filler words, compress prose into tables
2026-04-15 22:04:05	C:\Users\CEX\Documents\GitHub\cex\archetypes\builders\agentic-rag-builder\bld_config_agentic_rag.md	1	8.7	0.95	keep	analyzed: reduce_prose: convert long prose sections into tables or bullet lists
2026-04-15 22:04:05	C:\Users\CEX\Documents\GitHub\cex\archetypes\builders\agentic-rag-builder\bld_examples_agentic_rag.md	1	8.9	1.00	keep	analyzed: reduce_prose: convert long prose sections into tables or bullet lists
2026-04-15 22:04:05	C:\Users\CEX\Documents\GitHub\cex\archetypes\builders\agentic-rag-builder\bld_instruction_agentic_rag.md	1	8.8	0.86	keep	analyzed: reduce_prose: convert long prose sections into tables or bullet lists
2026-04-15 22:04:06	C:\Users\CEX\Documents\GitHub\cex\archetypes\builders\agentic-rag-builder\bld_knowledge_card_agentic_rag.md	1	9.2	1.00	keep	polished formatting (whitespace cleanup)
2026-04-15 22:04:06	C:\Users\CEX\Documents\GitHub\cex\archetypes\builders\agentic-rag-builder\bld_manifest_agentic_rag.md	1	8.8	0.82	keep	analyzed: increase_density: remove filler words, compress prose into tables
2026-04-15 22:04:06	C:\Users\CEX\Documents\GitHub\cex\archetypes\builders\agentic-rag-builder\bld_memory_agentic_rag.md	1	8.7	0.95	keep	polished formatting (whitespace cleanup)
2026-04-15 22:04:07	C:\Users\CEX\Documents\GitHub\cex\archetypes\builders\agentic-rag-builder\bld_output_template_agentic_rag.md	1	9.1	1.00	keep	analyzed: reduce_prose: convert long prose sections into tables or bullet lists
2026-04-15 22:04:07	C:\Users\CEX\Documents\GitHub\cex\archetypes\builders\agentic-rag-builder\bld_quality_gate_agentic_rag.md	1	9.0	1.00	keep	polished formatting (whitespace cleanup)
2026-04-15 22:04:07	C:\Users\CEX\Documents\GitHub\cex\archetypes\builders\agentic-rag-builder\bld_schema_agentic_rag.md	1	9.1	1.00	keep	analyzed: reduce_prose: convert long prose sections into tables or bullet lists
2026-04-15 22:04:07	C:\Users\CEX\Documents\GitHub\cex\archetypes\builders\agentic-rag-builder\bld_system_prompt_agentic_rag.md	1	8.8	0.80	keep	analyzed: increase_density: remove filler words, compress prose into tables
2026-04-15 22:04:08	C:\Users\CEX\Documents\GitHub\cex\archetypes\builders\agentic-rag-builder\bld_tools_agentic_rag.md	1	8.9	1.00	keep	polished formatting (whitespace cleanup)
2026-04-15 22:04:08	C:\Users\CEX\Documents\GitHub\cex\archetypes\builders\agents-md-builder\bld_architecture_agents_md.md	1	9.0	1.00	keep	polished formatting (whitespace cleanup)
2026-04-15 22:04:08	C:\Users\CEX\Documents\GitHub\cex\archetypes\builders\agents-md-builder\bld_collaboration_agents_md.md	1	8.9	0.99	keep	polished formatting (whitespace cleanup)
2026-04-15 22:04:09	C:\Users\CEX\Documents\GitHub\cex\archetypes\builders\agents-md-builder\bld_config_agents_md.md	1	8.6	0.92	keep	polished formatting (whitespace cleanup)
2026-04-15 22:04:09	C:\Users\CEX\Documents\GitHub\cex\archetypes\builders\agents-md-builder\bld_examples_agents_md.md	1	8.9	0.98	keep	analyzed: reduce_prose: convert long prose sections into tables or bullet lists
2026-04-15 22:04:09	C:\Users\CEX\Documents\GitHub\cex\archetypes\builders\agents-md-builder\bld_instruction_agents_md.md	1	8.9	0.97	keep	analyzed: reduce_prose: convert long prose sections into tables or bullet lists
2026-04-15 22:04:10	C:\Users\CEX\Documents\GitHub\cex\archetypes\builders\agents-md-builder\bld_knowledge_card_agents_md.md	1	9.2	0.96	keep	analyzed: reduce_prose: convert long prose sections into tables or bullet lists
2026-04-15 22:04:10	C:\Users\CEX\Documents\GitHub\cex\archetypes\builders\agents-md-builder\bld_manifest_agents_md.md	1	8.9	0.83	keep	analyzed: increase_density: remove filler words, compress prose into tables
2026-04-15 22:04:10	C:\Users\CEX\Documents\GitHub\cex\archetypes\builders\agents-md-builder\bld_memory_agents_md.md	1	8.7	0.97	keep	polished formatting (whitespace cleanup)
2026-04-15 22:04:11	C:\Users\CEX\Documents\GitHub\cex\archetypes\builders\agents-md-builder\bld_output_template_agents_md.md	1	8.8	1.00	keep	analyzed: reduce_prose: convert long prose sections into tables or bullet lists
2026-04-15 22:04:11	C:\Users\CEX\Documents\GitHub\cex\archetypes\builders\agents-md-builder\bld_quality_gate_agents_md.md	1	9.1	1.00	keep	polished formatting (whitespace cleanup)
2026-04-15 22:04:11	C:\Users\CEX\Documents\GitHub\cex\archetypes\builders\agents-md-builder\bld_schema_agents_md.md	1	9.1	1.00	keep	analyzed: reduce_prose: convert long prose sections into tables or bullet lists
2026-04-15 22:04:12	C:\Users\CEX\Documents\GitHub\cex\archetypes\builders\agents-md-builder\bld_system_prompt_agents_md.md	1	8.9	0.81	keep	analyzed: increase_density: remove filler words, compress prose into tables
2026-04-15 22:04:12	C:\Users\CEX\Documents\GitHub\cex\archetypes\builders\agents-md-builder\bld_tools_agents_md.md	1	8.9	1.00	keep	polished formatting (whitespace cleanup)
