timestamp	file	round	quality	density	status	description
2026-04-13 10:34:40	C:\Users\CEX\Documents\GitHub\cex\P12_orchestration\templates\tpl_crm_mission_plan.md	1	9.2	1.00	keep	added updated: 2026-04-13
2026-04-13 10:34:41	C:\Users\CEX\Documents\GitHub\cex\P12_orchestration\templates\tpl_crm_pipeline_evidence.md	1	9.1	1.00	keep	added updated: 2026-04-13
2026-04-13 10:34:41	C:\Users\CEX\Documents\GitHub\cex\P12_orchestration\templates\tpl_research_batch_cnae.md	1	9.1	1.00	keep	added updated: 2026-04-13
2026-04-13 10:34:41	C:\Users\CEX\Documents\GitHub\cex\P12_orchestration\templates\tpl_research_batch_directories.md	1	9.0	1.00	keep	added updated: 2026-04-13
2026-04-13 10:34:42	C:\Users\CEX\Documents\GitHub\cex\P12_orchestration\templates\tpl_research_batch_maps.md	1	9.0	1.00	keep	added updated: 2026-04-13
2026-04-13 10:34:42	C:\Users\CEX\Documents\GitHub\cex\P12_orchestration\templates\tpl_research_batch_marketplaces.md	1	9.1	1.00	keep	added updated: 2026-04-13
2026-04-13 10:34:42	C:\Users\CEX\Documents\GitHub\cex\P12_orchestration\templates\tpl_research_batch_reputation.md	1	9.1	1.00	keep	added updated: 2026-04-13
2026-04-13 10:34:43	C:\Users\CEX\Documents\GitHub\cex\P12_orchestration\templates\tpl_research_batch_social.md	1	9.0	1.00	keep	added updated: 2026-04-13
2026-04-13 10:34:43	C:\Users\CEX\Documents\GitHub\cex\P12_orchestration\templates\tpl_workflow_research_pipeline.md	1	9.2	1.00	keep	added updated: 2026-04-13
2026-04-13 10:34:43	C:\Users\CEX\Documents\GitHub\cex\P12_orchestration\templates\tpl_workflow_strategic_outreach.md	1	9.1	1.00	keep	added updated: 2026-04-13
2026-04-13 10:34:44	C:\Users\CEX\Documents\GitHub\cex\_docs\ROADMAP.md	1	8.9	1.00	keep	added density_score: 1.0
2026-04-13 10:34:44	C:\Users\CEX\Documents\GitHub\cex\_docs\specs\port_plan_external_repos.md	1	9.1	1.00	keep	added density_score: 1.0
2026-04-13 10:34:44	C:\Users\CEX\Documents\GitHub\cex\_docs\specs\spec_claude_native_hardening.md	1	9.0	0.93	keep	added density_score: 0.93
2026-04-13 10:34:45	C:\Users\CEX\Documents\GitHub\cex\_docs\specs\spec_infinite_bootstrap_loop.md	1	9.0	1.00	keep	tldr flagged for manual review
2026-04-13 10:34:45	C:\Users\CEX\Documents\GitHub\cex\_docs\specs\spec_instance_extraction.md	1	9.0	1.00	keep	added density_score: 1.0
2026-04-13 10:34:45	C:\Users\CEX\Documents\GitHub\cex\_docs\specs\spec_seed_words.md	1	9.1	1.00	keep	added updated: 2026-04-13
2026-04-13 10:34:46	C:\Users\CEX\Documents\GitHub\cex\_docs\specs\spec_zero_install.md	1	9.0	1.00	keep	added density_score: 1.0
2026-04-13 10:34:46	C:\Users\CEX\Documents\GitHub\cex\_docs\specs\tpl_crm_admin_spec.md	1	9.1	1.00	keep	added updated: 2026-04-13
2026-04-13 10:34:46	C:\Users\CEX\Documents\GitHub\cex\_docs\specs\tpl_template_registry.md	1	9.1	1.00	keep	added updated: 2026-04-13
2026-04-13 10:36:07	C:\Users\CEX\Documents\GitHub\cex\n05_steps.md	1	9.1	0.93	keep	analyzed: fix_frontmatter: missing title
2026-04-13 10:36:07	C:\Users\CEX\Documents\GitHub\cex\.cex\archive\reports\self_audit_gemini_2026_04_11.md	1	8.6	0.90	discard	added updated: 2026-04-13
2026-04-13 10:36:07	C:\Users\CEX\Documents\GitHub\cex\.cex\archive\reports\self_audit_gemini_2026_04_11.md	2	8.6	0.90	discard	added updated: 2026-04-13
2026-04-13 10:36:07	C:\Users\CEX\Documents\GitHub\cex\.cex\archive\reports\self_audit_gemini_2026_04_11.md	3	8.6	0.90	discard	added updated: 2026-04-13
2026-04-13 10:36:08	C:\Users\CEX\Documents\GitHub\cex\N01_intelligence\knowledge\kc_overnight_evolve_pattern.md	1	8.9	1.00	keep	added density_score: 1.0
2026-04-13 10:36:08	C:\Users\CEX\Documents\GitHub\cex\N01_intelligence\knowledge\kc_overnight_evolve_pattern.md	2	8.9	1.00	discard	added updated: 2026-04-13
2026-04-13 10:36:08	C:\Users\CEX\Documents\GitHub\cex\N01_intelligence\knowledge\kc_overnight_evolve_pattern.md	3	8.9	1.00	discard	added updated: 2026-04-13
2026-04-13 10:36:08	C:\Users\CEX\Documents\GitHub\cex\N02_marketing\knowledge\kc_llm_agent_frameworks_comparison.md	1	8.7	1.00	keep	added density_score: 1.0
2026-04-13 10:36:09	C:\Users\CEX\Documents\GitHub\cex\N02_marketing\knowledge\kc_llm_agent_frameworks_comparison.md	2	8.7	1.00	discard	added updated: 2026-04-13
2026-04-13 10:36:09	C:\Users\CEX\Documents\GitHub\cex\N02_marketing\knowledge\kc_llm_agent_frameworks_comparison.md	3	8.7	1.00	discard	added updated: 2026-04-13
2026-04-13 10:36:09	C:\Users\CEX\Documents\GitHub\cex\N03_engineering\knowledge\kc_aider_integration_patterns.md	1	8.7	1.00	keep	added density_score: 1.0
2026-04-13 10:36:09	C:\Users\CEX\Documents\GitHub\cex\N03_engineering\knowledge\kc_aider_integration_patterns.md	2	8.7	1.00	discard	added updated: 2026-04-13
2026-04-13 10:36:09	C:\Users\CEX\Documents\GitHub\cex\N03_engineering\knowledge\kc_aider_integration_patterns.md	3	8.7	1.00	discard	added updated: 2026-04-13
2026-04-13 10:36:10	C:\Users\CEX\Documents\GitHub\cex\N03_engineering\knowledge\kc_dispatch_modes.md	1	8.9	1.00	keep	added density_score: 1.0
2026-04-13 10:36:10	C:\Users\CEX\Documents\GitHub\cex\N03_engineering\knowledge\kc_dispatch_modes.md	2	8.9	1.00	discard	added updated: 2026-04-13
2026-04-13 10:36:10	C:\Users\CEX\Documents\GitHub\cex\N03_engineering\knowledge\kc_dispatch_modes.md	3	8.9	1.00	discard	added updated: 2026-04-13
2026-04-13 10:36:10	C:\Users\CEX\Documents\GitHub\cex\phases.md	1	8.6	1.00	discard	analyzed: reduce_prose: convert long prose sections into tables or bullet lists
2026-04-13 10:36:10	C:\Users\CEX\Documents\GitHub\cex\phases.md	2	8.6	1.00	discard	analyzed: reduce_prose: convert long prose sections into tables or bullet lists
2026-04-13 10:36:10	C:\Users\CEX\Documents\GitHub\cex\phases.md	3	8.6	1.00	discard	analyzed: reduce_prose: convert long prose sections into tables or bullet lists
2026-04-13 10:36:11	C:\Users\CEX\Documents\GitHub\cex\.cex\archive\examples\p12_sc_instagram_content_weekly.md	1	8.7	1.00	discard	analyzed: fix_frontmatter: missing title
2026-04-13 10:36:11	C:\Users\CEX\Documents\GitHub\cex\.cex\archive\examples\p12_sc_instagram_content_weekly.md	2	8.7	1.00	discard	analyzed: fix_frontmatter: missing title
2026-04-13 10:36:11	C:\Users\CEX\Documents\GitHub\cex\.cex\archive\examples\p12_sc_instagram_content_weekly.md	3	8.7	1.00	discard	analyzed: fix_frontmatter: missing title
2026-04-13 10:36:11	C:\Users\CEX\Documents\GitHub\cex\N04_knowledge\knowledge\p01_gl_embedding.md	1	8.7	0.84	discard	added updated: 2026-04-13
2026-04-13 10:36:11	C:\Users\CEX\Documents\GitHub\cex\N04_knowledge\knowledge\p01_gl_embedding.md	2	8.7	0.84	discard	added updated: 2026-04-13
2026-04-13 10:36:11	C:\Users\CEX\Documents\GitHub\cex\N04_knowledge\knowledge\p01_gl_embedding.md	3	8.7	0.84	discard	added updated: 2026-04-13
2026-04-13 10:36:15	C:\Users\CEX\Documents\GitHub\cex\.cex\archive\reports\self_audit_gemini_2026_04_11.md	1	8.6	0.90	discard	added updated: 2026-04-13
2026-04-13 10:36:15	C:\Users\CEX\Documents\GitHub\cex\.cex\archive\reports\self_audit_gemini_2026_04_11.md	2	8.6	0.90	discard	added updated: 2026-04-13
2026-04-13 10:36:15	C:\Users\CEX\Documents\GitHub\cex\.cex\archive\reports\self_audit_gemini_2026_04_11.md	3	8.6	0.90	discard	added updated: 2026-04-13
2026-04-13 10:36:15	C:\Users\CEX\Documents\GitHub\cex\phases.md	1	8.6	1.00	discard	analyzed: reduce_prose: convert long prose sections into tables or bullet lists
2026-04-13 10:36:15	C:\Users\CEX\Documents\GitHub\cex\phases.md	2	8.6	1.00	discard	analyzed: reduce_prose: convert long prose sections into tables or bullet lists
2026-04-13 10:36:16	C:\Users\CEX\Documents\GitHub\cex\phases.md	3	8.6	1.00	discard	analyzed: reduce_prose: convert long prose sections into tables or bullet lists
2026-04-13 10:36:16	C:\Users\CEX\Documents\GitHub\cex\.cex\archive\examples\p12_sc_instagram_content_weekly.md	1	8.7	1.00	discard	analyzed: fix_frontmatter: missing title
2026-04-13 10:36:16	C:\Users\CEX\Documents\GitHub\cex\.cex\archive\examples\p12_sc_instagram_content_weekly.md	2	8.7	1.00	discard	analyzed: fix_frontmatter: missing title
2026-04-13 10:36:16	C:\Users\CEX\Documents\GitHub\cex\.cex\archive\examples\p12_sc_instagram_content_weekly.md	3	8.7	1.00	discard	analyzed: fix_frontmatter: missing title
2026-04-13 10:36:16	C:\Users\CEX\Documents\GitHub\cex\N02_marketing\knowledge\kc_llm_agent_frameworks_comparison.md	1	8.7	1.00	discard	added updated: 2026-04-13
2026-04-13 10:36:16	C:\Users\CEX\Documents\GitHub\cex\N02_marketing\knowledge\kc_llm_agent_frameworks_comparison.md	2	8.7	1.00	discard	added updated: 2026-04-13
2026-04-13 10:36:16	C:\Users\CEX\Documents\GitHub\cex\N02_marketing\knowledge\kc_llm_agent_frameworks_comparison.md	3	8.7	1.00	discard	added updated: 2026-04-13
2026-04-13 10:36:17	C:\Users\CEX\Documents\GitHub\cex\N03_engineering\knowledge\kc_aider_integration_patterns.md	1	8.7	1.00	discard	added updated: 2026-04-13
2026-04-13 10:36:17	C:\Users\CEX\Documents\GitHub\cex\N03_engineering\knowledge\kc_aider_integration_patterns.md	2	8.7	1.00	discard	added updated: 2026-04-13
2026-04-13 10:36:17	C:\Users\CEX\Documents\GitHub\cex\N03_engineering\knowledge\kc_aider_integration_patterns.md	3	8.7	1.00	discard	added updated: 2026-04-13
2026-04-13 10:36:17	C:\Users\CEX\Documents\GitHub\cex\N04_knowledge\knowledge\p01_gl_embedding.md	1	8.7	0.84	discard	added updated: 2026-04-13
2026-04-13 10:36:17	C:\Users\CEX\Documents\GitHub\cex\N04_knowledge\knowledge\p01_gl_embedding.md	2	8.7	0.84	discard	added updated: 2026-04-13
2026-04-13 10:36:17	C:\Users\CEX\Documents\GitHub\cex\N04_knowledge\knowledge\p01_gl_embedding.md	3	8.7	0.84	discard	added updated: 2026-04-13
2026-04-13 10:36:17	C:\Users\CEX\Documents\GitHub\cex\N04_knowledge\knowledge\p01_gl_knowledge_card.md	1	8.7	0.83	discard	added updated: 2026-04-13
2026-04-13 10:36:18	C:\Users\CEX\Documents\GitHub\cex\N04_knowledge\knowledge\p01_gl_knowledge_card.md	2	8.7	0.83	discard	added updated: 2026-04-13
2026-04-13 10:36:18	C:\Users\CEX\Documents\GitHub\cex\N04_knowledge\knowledge\p01_gl_knowledge_card.md	3	8.7	0.83	discard	added updated: 2026-04-13
2026-04-13 10:36:18	C:\Users\CEX\Documents\GitHub\cex\N04_knowledge\knowledge\p01_gl_rag.md	1	8.7	0.84	discard	added updated: 2026-04-13
2026-04-13 10:36:18	C:\Users\CEX\Documents\GitHub\cex\N04_knowledge\knowledge\p01_gl_rag.md	2	8.7	0.84	discard	added updated: 2026-04-13
2026-04-13 10:36:18	C:\Users\CEX\Documents\GitHub\cex\N04_knowledge\knowledge\p01_gl_rag.md	3	8.7	0.84	discard	added updated: 2026-04-13
2026-04-13 10:36:19	C:\Users\CEX\Documents\GitHub\cex\n05_core.md	1	9.1	1.00	keep	analyzed: reduce_prose: convert long prose sections into tables or bullet lists
2026-04-13 10:36:22	C:\Users\CEX\Documents\GitHub\cex\.cex\archive\reports\self_audit_gemini_2026_04_11.md	1	8.6	0.90	discard	added updated: 2026-04-13
2026-04-13 10:36:22	C:\Users\CEX\Documents\GitHub\cex\.cex\archive\reports\self_audit_gemini_2026_04_11.md	2	8.6	0.90	discard	added updated: 2026-04-13
2026-04-13 10:36:22	C:\Users\CEX\Documents\GitHub\cex\.cex\archive\reports\self_audit_gemini_2026_04_11.md	3	8.6	0.90	discard	added updated: 2026-04-13
2026-04-13 10:36:23	C:\Users\CEX\Documents\GitHub\cex\phases.md	1	8.6	1.00	discard	analyzed: reduce_prose: convert long prose sections into tables or bullet lists
2026-04-13 10:36:23	C:\Users\CEX\Documents\GitHub\cex\phases.md	2	8.6	1.00	discard	analyzed: reduce_prose: convert long prose sections into tables or bullet lists
2026-04-13 10:36:23	C:\Users\CEX\Documents\GitHub\cex\phases.md	3	8.6	1.00	discard	analyzed: reduce_prose: convert long prose sections into tables or bullet lists
2026-04-13 10:36:23	C:\Users\CEX\Documents\GitHub\cex\.cex\archive\examples\p12_sc_instagram_content_weekly.md	1	8.7	1.00	discard	analyzed: fix_frontmatter: missing title
2026-04-13 10:36:23	C:\Users\CEX\Documents\GitHub\cex\.cex\archive\examples\p12_sc_instagram_content_weekly.md	2	8.7	1.00	discard	analyzed: fix_frontmatter: missing title
2026-04-13 10:36:23	C:\Users\CEX\Documents\GitHub\cex\.cex\archive\examples\p12_sc_instagram_content_weekly.md	3	8.7	1.00	discard	analyzed: fix_frontmatter: missing title
2026-04-13 10:36:24	C:\Users\CEX\Documents\GitHub\cex\N02_marketing\knowledge\kc_llm_agent_frameworks_comparison.md	1	8.7	1.00	discard	added updated: 2026-04-13
2026-04-13 10:36:24	C:\Users\CEX\Documents\GitHub\cex\N02_marketing\knowledge\kc_llm_agent_frameworks_comparison.md	2	8.7	1.00	discard	added updated: 2026-04-13
2026-04-13 10:36:24	C:\Users\CEX\Documents\GitHub\cex\N02_marketing\knowledge\kc_llm_agent_frameworks_comparison.md	3	8.7	1.00	discard	added updated: 2026-04-13
2026-04-13 10:36:24	C:\Users\CEX\Documents\GitHub\cex\N03_engineering\knowledge\kc_aider_integration_patterns.md	1	8.7	1.00	discard	added updated: 2026-04-13
2026-04-13 10:36:24	C:\Users\CEX\Documents\GitHub\cex\N03_engineering\knowledge\kc_aider_integration_patterns.md	2	8.7	1.00	discard	added updated: 2026-04-13
2026-04-13 10:36:24	C:\Users\CEX\Documents\GitHub\cex\N03_engineering\knowledge\kc_aider_integration_patterns.md	3	8.7	1.00	discard	added updated: 2026-04-13
2026-04-13 10:36:24	C:\Users\CEX\Documents\GitHub\cex\N04_knowledge\knowledge\p01_gl_embedding.md	1	8.7	0.84	discard	added updated: 2026-04-13
2026-04-13 10:36:24	C:\Users\CEX\Documents\GitHub\cex\N04_knowledge\knowledge\p01_gl_embedding.md	2	8.7	0.84	discard	added updated: 2026-04-13
2026-04-13 10:36:25	C:\Users\CEX\Documents\GitHub\cex\N04_knowledge\knowledge\p01_gl_embedding.md	3	8.7	0.84	discard	added updated: 2026-04-13
2026-04-13 10:36:25	C:\Users\CEX\Documents\GitHub\cex\N04_knowledge\knowledge\p01_gl_knowledge_card.md	1	8.7	0.83	discard	added updated: 2026-04-13
2026-04-13 10:36:25	C:\Users\CEX\Documents\GitHub\cex\N04_knowledge\knowledge\p01_gl_knowledge_card.md	2	8.7	0.83	discard	added updated: 2026-04-13
2026-04-13 10:36:25	C:\Users\CEX\Documents\GitHub\cex\N04_knowledge\knowledge\p01_gl_knowledge_card.md	3	8.7	0.83	discard	added updated: 2026-04-13
2026-04-13 10:36:25	C:\Users\CEX\Documents\GitHub\cex\N04_knowledge\knowledge\p01_gl_rag.md	1	8.7	0.84	discard	added updated: 2026-04-13
2026-04-13 10:36:25	C:\Users\CEX\Documents\GitHub\cex\N04_knowledge\knowledge\p01_gl_rag.md	2	8.7	0.84	discard	added updated: 2026-04-13
2026-04-13 10:36:25	C:\Users\CEX\Documents\GitHub\cex\N04_knowledge\knowledge\p01_gl_rag.md	3	8.7	0.84	discard	added updated: 2026-04-13
2026-04-13 10:36:26	C:\Users\CEX\Documents\GitHub\cex\N05_operations\knowledge\kc_pre_commit_hooks_for_ai.md	1	8.6	1.00	discard	added density_score: 1.0
2026-04-13 10:36:26	C:\Users\CEX\Documents\GitHub\cex\N05_operations\knowledge\kc_pre_commit_hooks_for_ai.md	2	8.6	1.00	discard	added density_score: 1.0
2026-04-13 10:36:26	C:\Users\CEX\Documents\GitHub\cex\N05_operations\knowledge\kc_pre_commit_hooks_for_ai.md	3	8.6	1.00	discard	added density_score: 1.0
2026-04-13 10:36:29	C:\Users\CEX\Documents\GitHub\cex\.cex\archive\reports\self_audit_gemini_2026_04_11.md	1	8.6	0.90	discard	added updated: 2026-04-13
2026-04-13 10:36:29	C:\Users\CEX\Documents\GitHub\cex\.cex\archive\reports\self_audit_gemini_2026_04_11.md	2	8.6	0.90	discard	added updated: 2026-04-13
2026-04-13 10:36:30	C:\Users\CEX\Documents\GitHub\cex\.cex\archive\reports\self_audit_gemini_2026_04_11.md	3	8.6	0.90	discard	added updated: 2026-04-13
2026-04-13 10:36:30	C:\Users\CEX\Documents\GitHub\cex\phases.md	1	8.6	1.00	discard	analyzed: reduce_prose: convert long prose sections into tables or bullet lists
2026-04-13 10:36:30	C:\Users\CEX\Documents\GitHub\cex\phases.md	2	8.6	1.00	discard	analyzed: reduce_prose: convert long prose sections into tables or bullet lists
2026-04-13 10:36:30	C:\Users\CEX\Documents\GitHub\cex\phases.md	3	8.6	1.00	discard	analyzed: reduce_prose: convert long prose sections into tables or bullet lists
2026-04-13 10:36:30	C:\Users\CEX\Documents\GitHub\cex\.cex\archive\examples\p12_sc_instagram_content_weekly.md	1	8.7	1.00	discard	analyzed: fix_frontmatter: missing title
2026-04-13 10:36:30	C:\Users\CEX\Documents\GitHub\cex\.cex\archive\examples\p12_sc_instagram_content_weekly.md	2	8.7	1.00	discard	analyzed: fix_frontmatter: missing title
2026-04-13 10:36:30	C:\Users\CEX\Documents\GitHub\cex\.cex\archive\examples\p12_sc_instagram_content_weekly.md	3	8.7	1.00	discard	analyzed: fix_frontmatter: missing title
2026-04-13 10:36:31	C:\Users\CEX\Documents\GitHub\cex\N02_marketing\knowledge\kc_llm_agent_frameworks_comparison.md	1	8.7	1.00	discard	added updated: 2026-04-13
2026-04-13 10:36:31	C:\Users\CEX\Documents\GitHub\cex\N02_marketing\knowledge\kc_llm_agent_frameworks_comparison.md	2	8.7	1.00	discard	added updated: 2026-04-13
2026-04-13 10:36:31	C:\Users\CEX\Documents\GitHub\cex\N02_marketing\knowledge\kc_llm_agent_frameworks_comparison.md	3	8.7	1.00	discard	added updated: 2026-04-13
2026-04-13 10:36:31	C:\Users\CEX\Documents\GitHub\cex\N03_engineering\knowledge\kc_aider_integration_patterns.md	1	8.7	1.00	discard	added updated: 2026-04-13
2026-04-13 10:36:31	C:\Users\CEX\Documents\GitHub\cex\N03_engineering\knowledge\kc_aider_integration_patterns.md	2	8.7	1.00	discard	added updated: 2026-04-13
2026-04-13 10:36:31	C:\Users\CEX\Documents\GitHub\cex\N03_engineering\knowledge\kc_aider_integration_patterns.md	3	8.7	1.00	discard	added updated: 2026-04-13
2026-04-13 10:36:31	C:\Users\CEX\Documents\GitHub\cex\N04_knowledge\knowledge\p01_gl_embedding.md	1	8.7	0.84	discard	added updated: 2026-04-13
2026-04-13 10:36:32	C:\Users\CEX\Documents\GitHub\cex\N04_knowledge\knowledge\p01_gl_embedding.md	2	8.7	0.84	discard	added updated: 2026-04-13
2026-04-13 10:36:32	C:\Users\CEX\Documents\GitHub\cex\N04_knowledge\knowledge\p01_gl_embedding.md	3	8.7	0.84	discard	added updated: 2026-04-13
2026-04-13 10:36:32	C:\Users\CEX\Documents\GitHub\cex\N04_knowledge\knowledge\p01_gl_knowledge_card.md	1	8.7	0.83	discard	added updated: 2026-04-13
2026-04-13 10:36:32	C:\Users\CEX\Documents\GitHub\cex\N04_knowledge\knowledge\p01_gl_knowledge_card.md	2	8.7	0.83	discard	added updated: 2026-04-13
2026-04-13 10:36:32	C:\Users\CEX\Documents\GitHub\cex\N04_knowledge\knowledge\p01_gl_knowledge_card.md	3	8.7	0.83	discard	added updated: 2026-04-13
2026-04-13 10:36:32	C:\Users\CEX\Documents\GitHub\cex\N04_knowledge\knowledge\p01_gl_rag.md	1	8.7	0.84	discard	added updated: 2026-04-13
2026-04-13 10:36:32	C:\Users\CEX\Documents\GitHub\cex\N04_knowledge\knowledge\p01_gl_rag.md	2	8.7	0.84	discard	added updated: 2026-04-13
2026-04-13 10:36:33	C:\Users\CEX\Documents\GitHub\cex\N04_knowledge\knowledge\p01_gl_rag.md	3	8.7	0.84	discard	added updated: 2026-04-13
2026-04-13 10:36:33	C:\Users\CEX\Documents\GitHub\cex\N05_operations\knowledge\kc_pre_commit_hooks_for_ai.md	1	8.6	1.00	discard	added density_score: 1.0
2026-04-13 10:36:33	C:\Users\CEX\Documents\GitHub\cex\N05_operations\knowledge\kc_pre_commit_hooks_for_ai.md	2	8.6	1.00	discard	added density_score: 1.0
2026-04-13 10:36:33	C:\Users\CEX\Documents\GitHub\cex\N05_operations\knowledge\kc_pre_commit_hooks_for_ai.md	3	8.6	1.00	discard	added density_score: 1.0
2026-04-13 10:36:36	C:\Users\CEX\Documents\GitHub\cex\.cex\archive\reports\self_audit_gemini_2026_04_11.md	1	8.6	0.90	discard	added updated: 2026-04-13
2026-04-13 10:36:36	C:\Users\CEX\Documents\GitHub\cex\.cex\archive\reports\self_audit_gemini_2026_04_11.md	2	8.6	0.90	discard	added updated: 2026-04-13
2026-04-13 10:36:37	C:\Users\CEX\Documents\GitHub\cex\.cex\archive\reports\self_audit_gemini_2026_04_11.md	3	8.6	0.90	discard	added updated: 2026-04-13
2026-04-13 10:36:37	C:\Users\CEX\Documents\GitHub\cex\phases.md	1	8.6	1.00	discard	analyzed: reduce_prose: convert long prose sections into tables or bullet lists
2026-04-13 10:36:37	C:\Users\CEX\Documents\GitHub\cex\phases.md	2	8.6	1.00	discard	analyzed: reduce_prose: convert long prose sections into tables or bullet lists
2026-04-13 10:36:37	C:\Users\CEX\Documents\GitHub\cex\phases.md	3	8.6	1.00	discard	analyzed: reduce_prose: convert long prose sections into tables or bullet lists
2026-04-13 10:36:37	C:\Users\CEX\Documents\GitHub\cex\.cex\archive\examples\p12_sc_instagram_content_weekly.md	1	8.7	1.00	discard	analyzed: fix_frontmatter: missing title
2026-04-13 10:36:37	C:\Users\CEX\Documents\GitHub\cex\.cex\archive\examples\p12_sc_instagram_content_weekly.md	2	8.7	1.00	discard	analyzed: fix_frontmatter: missing title
2026-04-13 10:36:37	C:\Users\CEX\Documents\GitHub\cex\.cex\archive\examples\p12_sc_instagram_content_weekly.md	3	8.7	1.00	discard	analyzed: fix_frontmatter: missing title
2026-04-13 10:36:38	C:\Users\CEX\Documents\GitHub\cex\N02_marketing\knowledge\kc_llm_agent_frameworks_comparison.md	1	8.7	1.00	discard	added updated: 2026-04-13
2026-04-13 10:36:38	C:\Users\CEX\Documents\GitHub\cex\N02_marketing\knowledge\kc_llm_agent_frameworks_comparison.md	2	8.7	1.00	discard	added updated: 2026-04-13
2026-04-13 10:36:38	C:\Users\CEX\Documents\GitHub\cex\N02_marketing\knowledge\kc_llm_agent_frameworks_comparison.md	3	8.7	1.00	discard	added updated: 2026-04-13
2026-04-13 10:36:38	C:\Users\CEX\Documents\GitHub\cex\N03_engineering\knowledge\kc_aider_integration_patterns.md	1	8.7	1.00	discard	added updated: 2026-04-13
2026-04-13 10:36:38	C:\Users\CEX\Documents\GitHub\cex\N03_engineering\knowledge\kc_aider_integration_patterns.md	2	8.7	1.00	discard	added updated: 2026-04-13
2026-04-13 10:36:38	C:\Users\CEX\Documents\GitHub\cex\N03_engineering\knowledge\kc_aider_integration_patterns.md	3	8.7	1.00	discard	added updated: 2026-04-13
2026-04-13 10:36:38	C:\Users\CEX\Documents\GitHub\cex\N04_knowledge\knowledge\p01_gl_embedding.md	1	8.7	0.84	discard	added updated: 2026-04-13
2026-04-13 10:36:39	C:\Users\CEX\Documents\GitHub\cex\N04_knowledge\knowledge\p01_gl_embedding.md	2	8.7	0.84	discard	added updated: 2026-04-13
2026-04-13 10:36:39	C:\Users\CEX\Documents\GitHub\cex\N04_knowledge\knowledge\p01_gl_embedding.md	3	8.7	0.84	discard	added updated: 2026-04-13
2026-04-13 10:36:39	C:\Users\CEX\Documents\GitHub\cex\N04_knowledge\knowledge\p01_gl_knowledge_card.md	1	8.7	0.83	discard	added updated: 2026-04-13
2026-04-13 10:36:39	C:\Users\CEX\Documents\GitHub\cex\N04_knowledge\knowledge\p01_gl_knowledge_card.md	2	8.7	0.83	discard	added updated: 2026-04-13
