timestamp	file	round	quality	density	status	description
2026-04-01 22:22:30	C:\Users\PC\Documents\GitHub\cex\N01_intelligence\memory\rag_source_intelligence.md	1	8.8	0.98	keep	Convert prose-heavy "Ingestion & Retrieval Strategy" section to structured table format for higher information density
2026-04-01 22:22:56	C:\Users\PC\Documents\GitHub\cex\N01_intelligence\memory\rag_source_intelligence.md	2	8.9	1.00	keep	Add Configuration Parameters section with specific technical implementation details to increase actionability
2026-04-01 22:23:28	C:\Users\PC\Documents\GitHub\cex\N01_intelligence\memory\rag_source_intelligence.md	3	8.9	1.00	discard	Add Quality Gates section with specific validation criteria to increase actionability for monitoring RAG source health
2026-04-01 22:24:04	C:\Users\PC\Documents\GitHub\cex\N01_intelligence\memory\rag_source_intelligence.md	4	8.9	1.00	discard	Add Usage Guidelines section with when-to-use scenarios and anti-patterns to increase actionability
2026-04-01 22:24:37	C:\Users\PC\Documents\GitHub\cex\N01_intelligence\memory\rag_source_intelligence.md	5	8.9	1.00	discard	Convert sparse "Future Sources" section to structured table format with implementation details and priority rankings
2026-04-01 22:24:38	C:\Users\PC\Documents\GitHub\cex\N04_knowledge\schemas\freshness_contract.md	1	8.7	1.00	discard	analyzed: add_field_table: schemas need a field/type/description table
2026-04-01 22:24:39	C:\Users\PC\Documents\GitHub\cex\N04_knowledge\schemas\freshness_contract.md	2	8.7	1.00	discard	analyzed: add_field_table: schemas need a field/type/description table
2026-04-01 22:24:39	C:\Users\PC\Documents\GitHub\cex\N04_knowledge\schemas\freshness_contract.md	3	8.7	1.00	discard	analyzed: add_field_table: schemas need a field/type/description table
2026-04-01 22:24:55	C:\Users\PC\Documents\GitHub\cex\N04_knowledge\schemas\freshness_contract.md	1	8.8	1.00	keep	Add Implementation Guide section with specific monitoring steps and edge case handling to increase actionability.
2026-04-01 22:25:14	C:\Users\PC\Documents\GitHub\cex\N04_knowledge\schemas\freshness_contract.md	2	8.8	1.00	discard	Add when_to_use field to frontmatter to improve completeness scoring
2026-04-01 22:25:35	C:\Users\PC\Documents\GitHub\cex\N04_knowledge\schemas\freshness_contract.md	3	8.8	1.00	discard	Add concrete monitoring tools and commands to Implementation Guide for better actionability
2026-04-01 22:25:59	C:\Users\PC\Documents\GitHub\cex\N04_knowledge\schemas\freshness_contract.md	4	8.8	1.00	discard	Add Usage Examples section with specific scenarios to increase actionability and practical application guidance
2026-04-01 22:26:24	C:\Users\PC\Documents\GitHub\cex\N04_knowledge\schemas\freshness_contract.md	5	8.8	1.00	discard	Expand the brief Freshness Score Formula section into a comprehensive Calculation & Scoring section with usage guidance and interpretation rules to increase actionability.
2026-04-01 22:26:24	C:\Users\PC\Documents\GitHub\cex\N04_knowledge\schemas\embedding_contract.md	1	8.7	1.00	discard	analyzed: add_field_table: schemas need a field/type/description table
2026-04-01 22:26:25	C:\Users\PC\Documents\GitHub\cex\N04_knowledge\schemas\embedding_contract.md	2	8.7	1.00	discard	analyzed: add_field_table: schemas need a field/type/description table
2026-04-01 22:26:25	C:\Users\PC\Documents\GitHub\cex\N04_knowledge\schemas\embedding_contract.md	3	8.7	1.00	discard	analyzed: add_field_table: schemas need a field/type/description table
2026-04-01 22:26:42	C:\Users\PC\Documents\GitHub\cex\N04_knowledge\schemas\embedding_contract.md	1	8.8	1.00	keep	Add Selection Criteria section with specific guidance for choosing embedding configurations based on use case requirements
2026-04-01 22:27:05	C:\Users\PC\Documents\GitHub\cex\N04_knowledge\schemas\embedding_contract.md	2	8.8	1.00	discard	Add Anti-patterns section to improve actionability by showing what NOT to do with embedding configurations
2026-04-01 22:27:31	C:\Users\PC\Documents\GitHub\cex\N04_knowledge\schemas\embedding_contract.md	3	8.8	1.00	discard	Add Index Configuration section with table showing index types and distance metrics for different use cases
2026-04-01 22:28:02	C:\Users\PC\Documents\GitHub\cex\N04_knowledge\schemas\embedding_contract.md	4	8.8	1.00	discard	Add Performance Optimization section with actionable table showing specific optimizations for different bottlenecks and constraints
2026-04-01 22:28:26	C:\Users\PC\Documents\GitHub\cex\N04_knowledge\schemas\embedding_contract.md	5	8.8	1.00	discard	Add Quality Validation section with specific metrics and thresholds to validate embedding configuration performance
2026-04-01 22:28:27	C:\Users\PC\Documents\GitHub\cex\N01_intelligence\schemas\citation_format_contract.md	1	8.7	1.00	discard	polished formatting (whitespace cleanup)
2026-04-01 22:28:28	C:\Users\PC\Documents\GitHub\cex\N01_intelligence\schemas\citation_format_contract.md	2	8.7	1.00	discard	polished formatting (whitespace cleanup)
2026-04-01 22:28:28	C:\Users\PC\Documents\GitHub\cex\N01_intelligence\schemas\citation_format_contract.md	3	8.7	1.00	discard	polished formatting (whitespace cleanup)
2026-04-01 22:28:47	C:\Users\PC\Documents\GitHub\cex\N01_intelligence\schemas\citation_format_contract.md	1	8.8	1.00	keep	Add Usage Guidelines section with when-to-use criteria and reliability scoring details to increase actionability
2026-04-01 22:29:11	C:\Users\PC\Documents\GitHub\cex\N01_intelligence\schemas\citation_format_contract.md	2	8.8	1.00	discard	Add Validation Rules section with specific checks to ensure citation quality and completeness
2026-04-01 22:29:33	C:\Users\PC\Documents\GitHub\cex\N01_intelligence\schemas\citation_format_contract.md	3	8.8	1.00	discard	Add Anti-Patterns section with specific citation mistakes to avoid, increasing actionability
2026-04-01 22:29:59	C:\Users\PC\Documents\GitHub\cex\N01_intelligence\schemas\citation_format_contract.md	4	8.8	1.00	discard	Convert the Format section into a step-by-step template with placeholders for easier citation construction
2026-04-01 22:30:23	C:\Users\PC\Documents\GitHub\cex\N01_intelligence\schemas\citation_format_contract.md	5	8.8	1.00	discard	Add specific URL examples to each reliability level to make source evaluation more concrete and actionable
2026-04-01 22:30:23	C:\Users\PC\Documents\GitHub\cex\N01_intelligence\feedback\quality_gate_intelligence.md	1	8.7	1.00	discard	polished formatting (whitespace cleanup)
2026-04-01 22:30:24	C:\Users\PC\Documents\GitHub\cex\N01_intelligence\feedback\quality_gate_intelligence.md	2	8.7	1.00	discard	polished formatting (whitespace cleanup)
2026-04-01 22:30:24	C:\Users\PC\Documents\GitHub\cex\N01_intelligence\feedback\quality_gate_intelligence.md	3	8.7	1.00	discard	polished formatting (whitespace cleanup)
2026-04-01 22:30:44	C:\Users\PC\Documents\GitHub\cex\N01_intelligence\feedback\quality_gate_intelligence.md	1	8.8	1.00	keep	Add Application Guide section with specific usage scenarios and validation steps to increase actionability
2026-04-01 22:31:12	C:\Users\PC\Documents\GitHub\cex\N01_intelligence\feedback\quality_gate_intelligence.md	2	8.8	1.00	discard	Expand Anti-patterns section with more specific examples and detailed explanations to increase actionability
2026-04-01 22:31:49	C:\Users\PC\Documents\GitHub\cex\N01_intelligence\feedback\quality_gate_intelligence.md	3	8.8	1.00	discard	Add Validation Examples section with concrete research outputs showing how claims pass/fail each gate to increase actionability
2026-04-01 22:32:18	C:\Users\PC\Documents\GitHub\cex\N01_intelligence\feedback\quality_gate_intelligence.md	4	8.8	1.00	discard	Add Quality Checklist section with specific validation steps to make the gate more actionable
2026-04-01 22:32:47	C:\Users\PC\Documents\GitHub\cex\N01_intelligence\feedback\quality_gate_intelligence.md	5	8.8	1.00	discard	Convert Anti-patterns from bullets to table format to increase density and structure
2026-04-01 22:32:48	C:\Users\PC\Documents\GitHub\cex\N01_intelligence\architecture\agent_card_intelligence.md	1	8.7	1.00	discard	polished formatting (whitespace cleanup)
2026-04-01 22:32:48	C:\Users\PC\Documents\GitHub\cex\N01_intelligence\architecture\agent_card_intelligence.md	2	8.7	1.00	discard	polished formatting (whitespace cleanup)
2026-04-01 22:32:48	C:\Users\PC\Documents\GitHub\cex\N01_intelligence\architecture\agent_card_intelligence.md	3	8.7	1.00	discard	polished formatting (whitespace cleanup)
2026-04-01 22:33:08	C:\Users\PC\Documents\GitHub\cex\N01_intelligence\architecture\agent_card_intelligence.md	1	8.8	1.00	keep	Add Anti-Patterns section to improve actionability and routing precision
2026-04-01 22:33:34	C:\Users\PC\Documents\GitHub\cex\N01_intelligence\architecture\agent_card_intelligence.md	2	8.8	1.00	discard	Enhance Provider section with specific trigger conditions and decision criteria for better actionability
2026-04-01 22:34:00	C:\Users\PC\Documents\GitHub\cex\N01_intelligence\architecture\agent_card_intelligence.md	3	8.8	1.00	discard	Enhance Capabilities Map with specific input formats and real examples to increase actionability
2026-04-01 22:34:30	C:\Users\PC\Documents\GitHub\cex\N01_intelligence\architecture\agent_card_intelligence.md	4	8.8	1.00	discard	Expand Inter-Nucleus Handoffs section with comprehensive handoff protocols and signal formats for better coordination
2026-04-01 22:35:03	C:\Users\PC\Documents\GitHub\cex\N01_intelligence\architecture\agent_card_intelligence.md	5	8.8	1.00	discard	Enhance Routing section with negative keywords and specific decision criteria for more precise routing
2026-04-01 22:35:04	C:\Users\PC\Documents\GitHub\cex\N04_knowledge\schemas\kc_structure_contract.md	1	8.7	1.00	discard	polished formatting (whitespace cleanup)
2026-04-01 22:35:05	C:\Users\PC\Documents\GitHub\cex\N04_knowledge\schemas\kc_structure_contract.md	2	8.7	1.00	discard	polished formatting (whitespace cleanup)
2026-04-01 22:35:05	C:\Users\PC\Documents\GitHub\cex\N04_knowledge\schemas\kc_structure_contract.md	3	8.7	1.00	discard	polished formatting (whitespace cleanup)
2026-04-01 22:35:25	C:\Users\PC\Documents\GitHub\cex\N04_knowledge\schemas\kc_structure_contract.md	1	8.8	1.00	keep	Add Anti-Patterns section with specific examples of common KC structure mistakes to increase actionability
2026-04-01 22:35:51	C:\Users\PC\Documents\GitHub\cex\N04_knowledge\schemas\kc_structure_contract.md	2	8.8	1.00	discard	Add validation checklist section with specific verification steps to increase actionability
2026-04-01 22:36:13	C:\Users\PC\Documents\GitHub\cex\N04_knowledge\schemas\kc_structure_contract.md	3	8.8	1.00	discard	Add Purpose column to frontmatter table explaining why each field is required
2026-04-01 22:36:35	C:\Users\PC\Documents\GitHub\cex\N04_knowledge\schemas\kc_structure_contract.md	4	8.8	1.00	discard	Add missing CEX Integration section with specific system connections to match declared section order
2026-04-01 22:36:59	C:\Users\PC\Documents\GitHub\cex\N04_knowledge\schemas\kc_structure_contract.md	5	8.8	1.00	discard	Convert Section Order list to detailed table with requirements and constraints for each section
2026-04-01 22:37:00	C:\Users\PC\Documents\GitHub\cex\N01_intelligence\knowledge\embedding_config_intelligence.md	1	8.7	0.93	discard	added density_score: 0.93
2026-04-01 22:37:00	C:\Users\PC\Documents\GitHub\cex\N01_intelligence\knowledge\embedding_config_intelligence.md	2	8.7	0.93	discard	added density_score: 0.93
2026-04-01 22:37:01	C:\Users\PC\Documents\GitHub\cex\N01_intelligence\knowledge\embedding_config_intelligence.md	3	8.7	0.93	discard	added density_score: 0.93
2026-04-01 22:37:37	C:\Users\PC\Documents\GitHub\cex\N01_intelligence\knowledge\embedding_config_intelligence.md	1	8.8	0.95	keep	Add Selection Criteria section with specific guidance for when to use this embedding configuration versus alternatives
2026-04-01 22:38:16	C:\Users\PC\Documents\GitHub\cex\N01_intelligence\knowledge\embedding_config_intelligence.md	2	8.9	0.97	keep	Convert embedding model specification from bullet list to structured table for improved density and scannability
2026-04-01 22:38:58	C:\Users\PC\Documents\GitHub\cex\N01_intelligence\knowledge\embedding_config_intelligence.md	3	8.9	1.00	discard	Convert Vector Database Configuration section from sparse bullet points to detailed comparison table for improved density and actionability
2026-04-01 22:39:41	C:\Users\PC\Documents\GitHub\cex\N01_intelligence\knowledge\embedding_config_intelligence.md	4	8.9	0.99	discard	Convert Level 3 metadata enrichment bullet list to structured table for improved density and scannability
2026-04-01 22:40:22	C:\Users\PC\Documents\GitHub\cex\N01_intelligence\knowledge\embedding_config_intelligence.md	5	8.9	0.97	discard	Expand Vector Database Configuration section with specific index parameters, memory requirements, and performance benchmarks to increase actionability and technical density.
2026-04-01 22:40:23	C:\Users\PC\Documents\GitHub\cex\N01_intelligence\orchestration\workflow_intelligence.md	1	8.7	1.00	discard	polished formatting (whitespace cleanup)
2026-04-01 22:40:23	C:\Users\PC\Documents\GitHub\cex\N01_intelligence\orchestration\workflow_intelligence.md	2	8.7	1.00	discard	polished formatting (whitespace cleanup)
2026-04-01 22:40:24	C:\Users\PC\Documents\GitHub\cex\N01_intelligence\orchestration\workflow_intelligence.md	3	8.7	1.00	discard	polished formatting (whitespace cleanup)
2026-04-01 22:40:46	C:\Users\PC\Documents\GitHub\cex\N01_intelligence\orchestration\workflow_intelligence.md	1	8.8	1.00	keep	Add Anti-Patterns section with specific research workflow mistakes to increase actionability and routing precision
2026-04-01 22:41:16	C:\Users\PC\Documents\GitHub\cex\N01_intelligence\orchestration\workflow_intelligence.md	2	8.9	1.00	keep	Expand Decision Points section with more specific scenarios and actionable guidance for each workflow step
2026-04-01 22:41:48	C:\Users\PC\Documents\GitHub\cex\N01_intelligence\orchestration\workflow_intelligence.md	3	8.9	1.00	discard	Add Success Metrics section with measurable criteria for each pipeline step to increase actionability
2026-04-01 22:42:16	C:\Users\PC\Documents\GitHub\cex\N01_intelligence\orchestration\workflow_intelligence.md	4	8.9	1.00	discard	Add specific command examples to pipeline table to increase actionability and make workflow more executable
2026-04-01 22:42:58	C:\Users\PC\Documents\GitHub\cex\N01_intelligence\orchestration\workflow_intelligence.md	5	8.9	1.00	discard	Add Workflow Scope section to clarify when this research pipeline should be used versus alternatives
2026-04-01 22:42:59	C:\Users\PC\Documents\GitHub\cex\N01_intelligence\output\output_trend_report.md	1	8.7	1.00	discard	polished formatting (whitespace cleanup)
2026-04-01 22:42:59	C:\Users\PC\Documents\GitHub\cex\N01_intelligence\output\output_trend_report.md	2	8.7	1.00	discard	polished formatting (whitespace cleanup)
2026-04-01 22:42:59	C:\Users\PC\Documents\GitHub\cex\N01_intelligence\output\output_trend_report.md	3	8.7	1.00	discard	polished formatting (whitespace cleanup)
2026-04-01 22:43:20	C:\Users\PC\Documents\GitHub\cex\N01_intelligence\output\output_trend_report.md	1	8.7	1.00	discard	Add "When to Use" section to increase actionability and provide clearer guidance on appropriate contexts for trend reports
2026-04-01 22:43:38	C:\Users\PC\Documents\GitHub\cex\N01_intelligence\output\output_trend_report.md	2	8.7	1.00	discard	Add Anti-Patterns section with specific examples of common trend analysis mistakes to increase actionability
2026-04-01 22:43:59	C:\Users\PC\Documents\GitHub\cex\N01_intelligence\output\output_trend_report.md	3	8.7	1.00	discard	Enhance the Trend Matrix section with specific scoring criteria and evaluation guidance to increase actionability
2026-04-01 22:44:20	C:\Users\PC\Documents\GitHub\cex\N01_intelligence\output\output_trend_report.md	4	8.8	1.00	keep	Enhance template with more specific field guidance and prescriptive scoring criteria within existing structure
2026-04-01 22:44:52	C:\Users\PC\Documents\GitHub\cex\N01_intelligence\output\output_trend_report.md	5	8.8	1.00	discard	Make template placeholders more prescriptive with specific formatting examples and evidence thresholds
2026-04-01 22:44:53	C:\Users\PC\Documents\GitHub\cex\N01_intelligence\prompts\system_prompt_intelligence.md	1	8.7	0.89	discard	analyzed: reduce_prose: convert long prose sections into tables or bullet lists
2026-04-01 22:44:53	C:\Users\PC\Documents\GitHub\cex\N01_intelligence\prompts\system_prompt_intelligence.md	2	8.7	0.89	discard	analyzed: reduce_prose: convert long prose sections into tables or bullet lists
2026-04-01 22:44:53	C:\Users\PC\Documents\GitHub\cex\N01_intelligence\prompts\system_prompt_intelligence.md	3	8.7	0.89	discard	analyzed: reduce_prose: convert long prose sections into tables or bullet lists
2026-04-01 22:45:16	C:\Users\PC\Documents\GitHub\cex\N01_intelligence\prompts\system_prompt_intelligence.md	1	8.8	1.00	keep	Convert the 12 rules from prose format to a structured table for higher density and scannability
2026-04-01 22:45:44	C:\Users\PC\Documents\GitHub\cex\N01_intelligence\prompts\system_prompt_intelligence.md	2	8.8	1.00	discard	Add Anti-Patterns section with specific research mistakes to avoid for higher actionability
2026-04-01 22:46:13	C:\Users\PC\Documents\GitHub\cex\N01_intelligence\prompts\system_prompt_intelligence.md	3	8.8	1.00	discard	Add a Research Workflow section showing step-by-step process for executing the 12 rules in practice
2026-04-01 22:46:34	C:\Users\PC\Documents\GitHub\cex\N01_intelligence\prompts\system_prompt_intelligence.md	4	8.8	1.00	discard	Expand Provider Strategy section with specific usage patterns and decision criteria for maximum research effectiveness
2026-04-01 22:47:11	C:\Users\PC\Documents\GitHub\cex\N01_intelligence\prompts\system_prompt_intelligence.md	5	8.8	1.00	discard	Add specific concrete examples to the Core Rules table Action column to increase actionability and clarity
2026-04-01 22:47:12	C:\Users\PC\Documents\GitHub\cex\N01_intelligence\orchestration\dispatch_rule_intelligence.md	1	8.7	0.89	discard	added density_score: 0.89
2026-04-01 22:47:12	C:\Users\PC\Documents\GitHub\cex\N01_intelligence\orchestration\dispatch_rule_intelligence.md	2	8.7	0.89	discard	added density_score: 0.89
2026-04-01 22:47:13	C:\Users\PC\Documents\GitHub\cex\N01_intelligence\orchestration\dispatch_rule_intelligence.md	3	8.7	0.89	discard	added density_score: 0.89
2026-04-01 22:47:39	C:\Users\PC\Documents\GitHub\cex\N01_intelligence\orchestration\dispatch_rule_intelligence.md	1	8.9	0.95	keep	Convert exclusion criteria from bullet points to comprehensive table with specific examples for higher actionability
2026-04-01 22:48:11	C:\Users\PC\Documents\GitHub\cex\N01_intelligence\orchestration\dispatch_rule_intelligence.md	2	8.9	0.99	discard	Convert Section 4 keyword list to structured table with context and confidence weights for more actionable routing guidance
2026-04-01 22:48:44	C:\Users\PC\Documents\GitHub\cex\N01_intelligence\orchestration\dispatch_rule_intelligence.md	3	8.9	0.94	discard	Expand trigger phrases section with more comprehensive examples to increase actionability and routing precision.
2026-04-01 22:49:13	C:\Users\PC\Documents\GitHub\cex\N01_intelligence\orchestration\dispatch_rule_intelligence.md	4	8.8	0.97	discard	Convert Section 2 routing strategy from prose list to structured table showing evaluation hierarchy with weights and decision logic for clearer actionability
2026-04-01 22:49:50	C:\Users\PC\Documents\GitHub\cex\N01_intelligence\orchestration\dispatch_rule_intelligence.md	5	8.9	0.98	discard	Expand Section 6 fallback logic with specific confidence scoring examples and detailed fallback criteria for improved routing actionability
2026-04-01 22:49:51	C:\Users\PC\Documents\GitHub\cex\N01_intelligence\output\output_swot_analysis.md	1	8.7	1.00	discard	polished formatting (whitespace cleanup)
2026-04-01 22:49:52	C:\Users\PC\Documents\GitHub\cex\N01_intelligence\output\output_swot_analysis.md	2	8.7	1.00	discard	polished formatting (whitespace cleanup)
2026-04-01 22:49:52	C:\Users\PC\Documents\GitHub\cex\N01_intelligence\output\output_swot_analysis.md	3	8.7	1.00	discard	polished formatting (whitespace cleanup)
2026-04-01 22:50:10	C:\Users\PC\Documents\GitHub\cex\N01_intelligence\output\output_swot_analysis.md	1	8.7	1.00	discard	Add when_to_use frontmatter field and Usage Guidelines section for better actionability
2026-04-01 22:50:40	C:\Users\PC\Documents\GitHub\cex\N01_intelligence\output\output_swot_analysis.md	2	8.8	1.00	keep	Add concrete Example Analysis section to demonstrate template usage and improve actionability
2026-04-01 22:51:05	C:\Users\PC\Documents\GitHub\cex\N01_intelligence\output\output_swot_analysis.md	3	8.8	1.00	discard	Add Anti-Patterns section with specific mistakes to avoid when creating SWOT analyses for better actionability
2026-04-01 22:51:38	C:\Users\PC\Documents\GitHub\cex\N01_intelligence\output\output_swot_analysis.md	4	8.8	1.00	discard	Enhance Strategic Implications template with specific guidance on what each strategy type should accomplish for better actionability
2026-04-01 22:52:05	C:\Users\PC\Documents\GitHub\cex\N01_intelligence\output\output_swot_analysis.md	5	8.8	1.00	discard	Enhance template with specific criteria and quality guidelines for each SWOT quadrant to improve actionability
2026-04-01 22:52:06	C:\Users\PC\Documents\GitHub\cex\N01_intelligence\output\output_benchmark_report.md	1	8.7	1.00	discard	polished formatting (whitespace cleanup)
2026-04-01 22:52:06	C:\Users\PC\Documents\GitHub\cex\N01_intelligence\output\output_benchmark_report.md	2	8.7	1.00	discard	polished formatting (whitespace cleanup)
2026-04-01 22:52:06	C:\Users\PC\Documents\GitHub\cex\N01_intelligence\output\output_benchmark_report.md	3	8.7	1.00	discard	polished formatting (whitespace cleanup)
