timestamp	file	round	quality	density	status	description
2026-04-01 23:26:27	C:\Users\PC\Documents\GitHub\cex\N04_knowledge\orchestration\dispatch_rule_supabase.md	3	8.8	1.00	discard	analyzed: reduce_prose: convert long prose sections into tables or bullet lists
2026-04-01 23:26:55	C:\Users\PC\Documents\GitHub\cex\N04_knowledge\orchestration\dispatch_rule_supabase.md	1	8.9	1.00	keep	Add "Anti-patterns" section with specific examples of when NOT to route to N04 to increase actionability
2026-04-01 23:27:28	C:\Users\PC\Documents\GitHub\cex\N04_knowledge\orchestration\dispatch_rule_supabase.md	2	8.9	1.00	discard	Add "Decision Matrix" section with systematic routing criteria to increase actionability and systematic decision-making
2026-04-01 23:28:02	C:\Users\PC\Documents\GitHub\cex\N04_knowledge\orchestration\dispatch_rule_supabase.md	3	8.9	1.00	discard	Expand Examples section with more specific routing scenarios including edge cases and decision rationale to increase actionability
2026-04-01 23:28:32	C:\Users\PC\Documents\GitHub\cex\N04_knowledge\orchestration\dispatch_rule_supabase.md	4	8.9	1.00	discard	Enhance trigger keywords table with "Context" column to provide more specific guidance on when each keyword indicates N04 routing
2026-04-01 23:29:01	C:\Users\PC\Documents\GitHub\cex\N04_knowledge\orchestration\dispatch_rule_supabase.md	5	8.9	1.00	discard	Convert "N04 Always Owns" section from bullet list to dense table with examples and reasoning
2026-04-01 23:29:02	C:\Users\PC\Documents\GitHub\cex\N04_knowledge\orchestration\workflow_supabase_setup.md	1	8.8	1.00	discard	polished formatting (whitespace cleanup)
2026-04-01 23:29:02	C:\Users\PC\Documents\GitHub\cex\N04_knowledge\orchestration\workflow_supabase_setup.md	2	8.8	1.00	discard	polished formatting (whitespace cleanup)
2026-04-01 23:29:02	C:\Users\PC\Documents\GitHub\cex\N04_knowledge\orchestration\workflow_supabase_setup.md	3	8.8	1.00	discard	polished formatting (whitespace cleanup)
2026-04-01 23:29:35	C:\Users\PC\Documents\GitHub\cex\N04_knowledge\orchestration\workflow_supabase_setup.md	1	8.9	1.00	keep	Add "Anti-patterns" section to improve actionability by showing when NOT to use this workflow
2026-04-01 23:30:15	C:\Users\PC\Documents\GitHub\cex\N04_knowledge\orchestration\workflow_supabase_setup.md	2	8.9	1.00	discard	Add validation commands to Dependencies section to make pre-flight checks more actionable
2026-04-01 23:30:54	C:\Users\PC\Documents\GitHub\cex\N04_knowledge\orchestration\workflow_supabase_setup.md	3	8.9	1.00	discard	Add "Command Sequence" section with exact commands for each step to increase actionability
2026-04-01 23:31:30	C:\Users\PC\Documents\GitHub\cex\N04_knowledge\orchestration\workflow_supabase_setup.md	4	8.9	1.00	discard	Add specific verification examples to Step 7 to make the testing process more actionable
2026-04-01 23:32:10	C:\Users\PC\Documents\GitHub\cex\N04_knowledge\orchestration\workflow_supabase_setup.md	5	8.9	1.00	discard	Add specific SQL patterns to Step 2 to increase technical actionability
2026-04-01 23:32:11	C:\Users\PC\Documents\GitHub\cex\N04_knowledge\output\output_kc_audit_report.md	1	8.8	1.00	discard	polished formatting (whitespace cleanup)
2026-04-01 23:32:11	C:\Users\PC\Documents\GitHub\cex\N04_knowledge\output\output_kc_audit_report.md	2	8.8	1.00	discard	polished formatting (whitespace cleanup)
2026-04-01 23:32:11	C:\Users\PC\Documents\GitHub\cex\N04_knowledge\output\output_kc_audit_report.md	3	8.8	1.00	discard	polished formatting (whitespace cleanup)
2026-04-01 23:32:30	C:\Users\PC\Documents\GitHub\cex\N04_knowledge\output\output_kc_audit_report.md	1	8.8	1.00	discard	Add "Usage Guidance" section with interpretation rules and action matrix to improve actionability
2026-04-01 23:32:55	C:\Users\PC\Documents\GitHub\cex\N04_knowledge\output\output_kc_audit_report.md	2	8.9	1.00	keep	Add threshold definitions and interpretation context inline with metrics to improve actionability
2026-04-01 23:33:23	C:\Users\PC\Documents\GitHub\cex\N04_knowledge\output\output_kc_audit_report.md	3	8.9	1.00	discard	Add "Recommended Actions" column to summary table for immediate actionability
2026-04-01 23:33:54	C:\Users\PC\Documents\GitHub\cex\N04_knowledge\output\output_kc_audit_report.md	4	8.9	1.00	discard	Add conditional action guidelines based on health status to improve actionability of the Action Items section
2026-04-01 23:34:29	C:\Users\PC\Documents\GitHub\cex\N04_knowledge\output\output_kc_audit_report.md	5	8.9	1.00	discard	Add "Health Interpretation" section with metric combination guidelines to improve decision-making when multiple indicators conflict
2026-04-01 23:34:30	C:\Users\PC\Documents\GitHub\cex\N02_marketing\output\landing_page_template.md	1	8.8	0.99	discard	analyzed: reduce_prose: convert long prose sections into tables or bullet lists
2026-04-01 23:34:31	C:\Users\PC\Documents\GitHub\cex\N02_marketing\output\landing_page_template.md	2	8.8	0.99	discard	analyzed: reduce_prose: convert long prose sections into tables or bullet lists
2026-04-01 23:34:31	C:\Users\PC\Documents\GitHub\cex\N02_marketing\output\landing_page_template.md	3	8.8	0.99	discard	analyzed: reduce_prose: convert long prose sections into tables or bullet lists
2026-04-01 23:36:26	C:\Users\PC\Documents\GitHub\cex\N01_intelligence\knowledge\rag_source_intelligence.md	1	8.8	0.94	discard	added density_score: 0.94
2026-04-01 23:36:27	C:\Users\PC\Documents\GitHub\cex\N01_intelligence\knowledge\rag_source_intelligence.md	2	8.8	0.94	discard	added density_score: 0.94
2026-04-01 23:36:27	C:\Users\PC\Documents\GitHub\cex\N01_intelligence\knowledge\rag_source_intelligence.md	3	8.8	0.94	discard	added density_score: 0.94
2026-04-01 23:36:53	C:\Users\PC\Documents\GitHub\cex\N01_intelligence\knowledge\rag_source_intelligence.md	1	8.8	0.94	discard	Add "Anti-patterns" section to improve actionability by showing when NOT to use each tier
2026-04-01 23:37:26	C:\Users\PC\Documents\GitHub\cex\N01_intelligence\knowledge\rag_source_intelligence.md	2	8.8	0.98	discard	Convert the FRESHNESS & RETENTION POLICY section into a structured table format to improve density and actionability
2026-04-01 23:38:23	C:\Users\PC\Documents\GitHub\cex\N01_intelligence\knowledge\rag_source_intelligence.md	3	8.8	1.00	discard	Convert SOURCE TIERS section to a comprehensive table format to improve density and actionability
2026-04-01 23:38:55	C:\Users\PC\Documents\GitHub\cex\N01_intelligence\knowledge\rag_source_intelligence.md	4	8.8	0.94	discard	Add "USAGE GUIDANCE" section mapping specific research question types to tier prioritization for improved actionability
2026-04-01 23:39:32	C:\Users\PC\Documents\GitHub\cex\N01_intelligence\knowledge\rag_source_intelligence.md	5	8.9	0.97	keep	Add "SOURCE VALIDATION" section with specific quality thresholds and validation criteria to improve actionability
2026-04-01 23:39:33	C:\Users\PC\Documents\GitHub\cex\N01_intelligence\output\output_competitive_grid.md	1	8.8	1.00	discard	polished formatting (whitespace cleanup)
2026-04-01 23:39:33	C:\Users\PC\Documents\GitHub\cex\N01_intelligence\output\output_competitive_grid.md	2	8.8	1.00	discard	polished formatting (whitespace cleanup)
2026-04-01 23:39:34	C:\Users\PC\Documents\GitHub\cex\N01_intelligence\output\output_competitive_grid.md	3	8.8	1.00	discard	polished formatting (whitespace cleanup)
2026-04-01 23:39:52	C:\Users\PC\Documents\GitHub\cex\N01_intelligence\output\output_competitive_grid.md	1	8.8	1.00	discard	Add "When to Use" section to improve actionability by clarifying appropriate scenarios for this competitive grid format
2026-04-01 23:40:13	C:\Users\PC\Documents\GitHub\cex\N01_intelligence\output\output_competitive_grid.md	2	8.8	1.00	discard	Add "Field Guide" section with specific guidance on how to populate each grid dimension effectively
2026-04-01 23:40:37	C:\Users\PC\Documents\GitHub\cex\N01_intelligence\output\output_competitive_grid.md	3	8.8	1.00	discard	Add "Anti-patterns" section to improve actionability by showing what NOT to do when creating competitive grids
2026-04-01 23:40:52	C:\Users\PC\Documents\GitHub\cex\N01_intelligence\output\output_competitive_grid.md	4	8.8	1.00	discard	Add `when_to_use` field to frontmatter to improve completeness and actionability
2026-04-01 23:41:13	C:\Users\PC\Documents\GitHub\cex\N01_intelligence\output\output_competitive_grid.md	5	8.8	1.00	discard	Add "Research Methodology" section with specific intelligence gathering steps to improve actionability
2026-04-01 23:41:14	C:\Users\PC\Documents\GitHub\cex\N02_marketing\output\output_email_template.md	1	8.8	1.00	discard	added density_score: 1.0
2026-04-01 23:41:14	C:\Users\PC\Documents\GitHub\cex\N02_marketing\output\output_email_template.md	2	8.8	1.00	discard	added density_score: 1.0
2026-04-01 23:41:14	C:\Users\PC\Documents\GitHub\cex\N02_marketing\output\output_email_template.md	3	8.8	1.00	discard	added density_score: 1.0
2026-04-01 23:42:18	C:\Users\PC\Documents\GitHub\cex\N02_marketing\output\output_email_template.md	1	8.9	1.00	keep	Add tldr field to frontmatter for improved completeness and quick user reference
2026-04-01 23:43:06	C:\Users\PC\Documents\GitHub\cex\N02_marketing\output\output_email_template.md	2	8.9	1.00	discard	Add "Anti-patterns" section to improve actionability by showing common email template mistakes to avoid
2026-04-01 23:44:44	C:\Users\PC\Documents\GitHub\cex\N02_marketing\output\output_email_template.md	3	8.9	1.00	discard	Add when_to_use field to frontmatter to improve completeness and user guidance
2026-04-01 23:45:26	C:\Users\PC\Documents\GitHub\cex\N02_marketing\output\output_email_template.md	4	8.9	1.00	discard	Add "Common Issues & Solutions" table to improve actionability with specific troubleshooting guidance for email development problems
2026-04-01 23:45:27	C:\Users\PC\Documents\GitHub\cex\N02_marketing\knowledge\kc_accessibility_a11y.md	1	8.8	1.00	discard	analyzed: add_tags: minimum 3 tags required
2026-04-01 23:45:27	C:\Users\PC\Documents\GitHub\cex\N02_marketing\knowledge\kc_accessibility_a11y.md	2	8.8	1.00	discard	analyzed: add_tags: minimum 3 tags required
2026-04-01 23:45:28	C:\Users\PC\Documents\GitHub\cex\N02_marketing\knowledge\kc_accessibility_a11y.md	3	8.8	1.00	discard	analyzed: add_tags: minimum 3 tags required
2026-04-01 23:46:09	C:\Users\PC\Documents\GitHub\cex\N02_marketing\knowledge\kc_accessibility_a11y.md	1	8.8	0.99	discard	Add Anti-patterns section to improve actionability by showing common accessibility mistakes to avoid
2026-04-01 23:46:42	C:\Users\PC\Documents\GitHub\cex\N02_marketing\knowledge\kc_accessibility_a11y.md	2	8.9	1.00	keep	Convert wordy Key Concepts section into structured table format for better density and scannability
2026-04-01 23:47:20	C:\Users\PC\Documents\GitHub\cex\N02_marketing\knowledge\kc_accessibility_a11y.md	3	8.9	1.00	discard	Condense Golden Rules section into actionable checklist format for better density and scannability
2026-04-01 23:48:04	C:\Users\PC\Documents\GitHub\cex\N02_marketing\knowledge\kc_accessibility_a11y.md	4	8.9	1.00	discard	Add Testing Checklist section for improved actionability and practical verification steps
2026-04-01 23:48:47	C:\Users\PC\Documents\GitHub\cex\N02_marketing\knowledge\kc_accessibility_a11y.md	5	8.9	1.00	discard	Enhance Quick Reference YAML section with more comprehensive ARIA roles and specific implementation values for better actionability
2026-04-01 23:48:48	C:\Users\PC\Documents\GitHub\cex\N01_intelligence\knowledge\knowledge_card_intelligence.md	1	8.8	0.93	discard	added density_score: 0.93
2026-04-01 23:48:48	C:\Users\PC\Documents\GitHub\cex\N01_intelligence\knowledge\knowledge_card_intelligence.md	2	8.8	0.93	discard	added density_score: 0.93
2026-04-01 23:48:48	C:\Users\PC\Documents\GitHub\cex\N01_intelligence\knowledge\knowledge_card_intelligence.md	3	8.8	0.93	discard	added density_score: 0.93
2026-04-01 23:49:27	C:\Users\PC\Documents\GitHub\cex\N01_intelligence\knowledge\knowledge_card_intelligence.md	1	8.8	0.93	discard	Add "Research Anti-Patterns" section to improve actionability with concrete examples of what NOT to do
2026-04-01 23:49:58	C:\Users\PC\Documents\GitHub\cex\N01_intelligence\knowledge\knowledge_card_intelligence.md	2	8.8	0.98	discard	Convert "Analytical & Synthesis Frameworks" section from bullet descriptions to structured table format for better density and scannability
2026-04-01 23:50:29	C:\Users\PC\Documents\GitHub\cex\N01_intelligence\knowledge\knowledge_card_intelligence.md	3	8.9	0.94	keep	Convert "Hierarchy of Evidence" section from bullet points to structured table format for better density and scannability
2026-04-01 23:51:06	C:\Users\PC\Documents\GitHub\cex\N01_intelligence\knowledge\knowledge_card_intelligence.md	4	8.9	1.00	discard	Convert Core Research Methodologies section to structured table format for better density and actionability
2026-04-01 23:51:44	C:\Users\PC\Documents\GitHub\cex\N01_intelligence\knowledge\knowledge_card_intelligence.md	5	8.9	0.96	discard	Add "Research Workflow" section with concrete step-by-step process to improve actionability and provide practical implementation guidance
2026-04-01 23:51:45	C:\Users\PC\Documents\GitHub\cex\N01_intelligence\agents\agent_intelligence.md	1	8.8	1.00	discard	polished formatting (whitespace cleanup)
2026-04-01 23:51:45	C:\Users\PC\Documents\GitHub\cex\N01_intelligence\agents\agent_intelligence.md	2	8.8	1.00	discard	polished formatting (whitespace cleanup)
2026-04-01 23:51:45	C:\Users\PC\Documents\GitHub\cex\N01_intelligence\agents\agent_intelligence.md	3	8.8	1.00	discard	polished formatting (whitespace cleanup)
2026-04-01 23:52:11	C:\Users\PC\Documents\GitHub\cex\N01_intelligence\agents\agent_intelligence.md	1	8.8	1.00	discard	Convert Identity section from prose to structured table format for better density and scannability
2026-04-01 23:52:41	C:\Users\PC\Documents\GitHub\cex\N01_intelligence\agents\agent_intelligence.md	2	8.8	1.00	discard	Add "Anti-Patterns" section to improve actionability with specific scenarios when NOT to use N01
2026-04-01 23:53:10	C:\Users\PC\Documents\GitHub\cex\N01_intelligence\agents\agent_intelligence.md	3	8.8	1.00	discard	Convert Routing section from keyword list to structured routing table with specific "Route TO N01" and "Route AWAY" scenarios for better actionability
2026-04-01 23:53:41	C:\Users\PC\Documents\GitHub\cex\N01_intelligence\agents\agent_intelligence.md	4	8.8	1.00	discard	Expand Provider Strategy section with specific use cases and switching examples for better actionability
2026-04-01 23:54:16	C:\Users\PC\Documents\GitHub\cex\N01_intelligence\agents\agent_intelligence.md	5	8.8	1.00	discard	Replace brief "Metaphor" section with expanded "Approach & Mindset" section containing specific operational principles and verification methods for better actionability.
2026-04-01 23:54:17	C:\Users\PC\Documents\GitHub\cex\N02_marketing\output\component_template.md	1	8.8	0.97	discard	analyzed: reduce_prose: convert long prose sections into tables or bullet lists
2026-04-01 23:54:17	C:\Users\PC\Documents\GitHub\cex\N02_marketing\output\component_template.md	2	8.8	0.97	discard	analyzed: reduce_prose: convert long prose sections into tables or bullet lists
2026-04-01 23:54:17	C:\Users\PC\Documents\GitHub\cex\N02_marketing\output\component_template.md	3	8.8	0.97	discard	analyzed: reduce_prose: convert long prose sections into tables or bullet lists
2026-04-01 23:56:02	C:\Users\PC\Documents\GitHub\cex\N02_marketing\output\component_template.md	1	8.8	0.97	discard	Add `when_to_use` field to frontmatter for better actionability and completeness
2026-04-01 23:57:11	C:\Users\PC\Documents\GitHub\cex\N02_marketing\output\component_template.md	2	8.9	1.00	keep	Add anti-patterns section to improve actionability and provide clear guidance on what NOT to do
2026-04-01 23:58:18	C:\Users\PC\Documents\GitHub\cex\N02_marketing\output\component_template.md	3	8.9	1.00	discard	Convert Universal A11y Requirements from code examples to structured table format for better density and scannability
2026-04-01 23:59:34	C:\Users\PC\Documents\GitHub\cex\N02_marketing\output\component_template.md	4	8.9	1.00	discard	Convert Component Integration section into comprehensive validation workflow table for better actionability and density
2026-04-01 23:59:35	C:\Users\PC\Documents\GitHub\cex\N02_marketing\knowledge\kc_html_component_library.md	1	8.8	1.00	discard	analyzed: reduce_prose: convert long prose sections into tables or bullet lists
2026-04-01 23:59:36	C:\Users\PC\Documents\GitHub\cex\N02_marketing\knowledge\kc_html_component_library.md	2	8.8	1.00	discard	analyzed: reduce_prose: convert long prose sections into tables or bullet lists
2026-04-01 23:59:36	C:\Users\PC\Documents\GitHub\cex\N02_marketing\knowledge\kc_html_component_library.md	3	8.8	1.00	discard	analyzed: reduce_prose: convert long prose sections into tables or bullet lists
2026-04-02 00:00:16	C:\Users\PC\Documents\GitHub\cex\N02_marketing\knowledge\kc_html_component_library.md	1	8.9	1.00	keep	Add anti-patterns section to improve actionability with specific "don't do this" guidance
2026-04-02 00:00:59	C:\Users\PC\Documents\GitHub\cex\N02_marketing\knowledge\kc_html_component_library.md	2	8.9	1.00	discard	Add structured "When to Use" section to improve actionability with clear decision criteria
2026-04-02 00:01:45	C:\Users\PC\Documents\GitHub\cex\N02_marketing\knowledge\kc_html_component_library.md	3	8.9	1.00	discard	Convert Radix package list from prose descriptions to structured table format showing package, purpose, and common use cases for better density and actionability
2026-04-02 00:02:36	C:\Users\PC\Documents\GitHub\cex\N02_marketing\knowledge\kc_html_component_library.md	4	8.9	1.00	discard	Expand the Data-State Styling Pattern section with more comprehensive styling examples and responsive patterns to improve actionability
2026-04-02 00:03:19	C:\Users\PC\Documents\GitHub\cex\N02_marketing\knowledge\kc_html_component_library.md	5	8.9	1.00	discard	Convert Philosophy section to structured comparison table showing when to use shadcn/ui vs Radix UI directly for better actionability
2026-04-02 00:03:20	C:\Users\PC\Documents\GitHub\cex\N02_marketing\architecture\agent_card_marketing.md	1	9.0	1.00	keep	added density_score: 1.0
2026-04-02 00:03:21	C:\Users\PC\Documents\GitHub\cex\N02_marketing\feedback\quality_gate_marketing.md	1	8.9	1.00	discard	analyzed: reduce_prose: convert long prose sections into tables or bullet lists
2026-04-02 00:03:22	C:\Users\PC\Documents\GitHub\cex\N02_marketing\feedback\quality_gate_marketing.md	2	8.9	1.00	discard	analyzed: reduce_prose: convert long prose sections into tables or bullet lists
2026-04-02 00:03:22	C:\Users\PC\Documents\GitHub\cex\N02_marketing\feedback\quality_gate_marketing.md	3	8.9	1.00	discard	analyzed: reduce_prose: convert long prose sections into tables or bullet lists
2026-04-02 00:04:41	C:\Users\PC\Documents\GitHub\cex\N02_marketing\feedback\quality_gate_marketing.md	1	8.9	1.00	discard	Convert the "Audit Trail" section from prose to structured table format with specific log fields and usage patterns for better density and actionability
2026-04-02 00:05:57	C:\Users\PC\Documents\GitHub\cex\N02_marketing\feedback\quality_gate_marketing.md	2	8.9	1.00	discard	Replace verbose Python validation scripts with concise validation checklists to improve density while maintaining actionability
2026-04-02 00:07:23	C:\Users\PC\Documents\GitHub\cex\N02_marketing\feedback\quality_gate_marketing.md	3	8.9	1.00	discard	Convert the "Purpose" section from prose to structured table format showing mode applicability for better density and clarity
2026-04-02 00:08:55	C:\Users\PC\Documents\GitHub\cex\N02_marketing\feedback\quality_gate_marketing.md	4	8.9	1.00	discard	Expand Bypass Policy section with structured process, consequences, and anti-patterns to improve actionability
2026-04-02 00:10:24	C:\Users\PC\Documents\GitHub\cex\N02_marketing\feedback\quality_gate_marketing.md	5	8.9	1.00	discard	Convert "Scoring Formula" section from repetitive prose blocks to structured comparison table for better density and scannability
2026-04-02 00:10:25	C:\Users\PC\Documents\GitHub\cex\N02_marketing\knowledge\knowledge_card_social_publishing.md	1	8.9	1.00	discard	polished formatting (whitespace cleanup)
2026-04-02 00:10:26	C:\Users\PC\Documents\GitHub\cex\N02_marketing\knowledge\knowledge_card_social_publishing.md	2	8.9	1.00	discard	polished formatting (whitespace cleanup)
2026-04-02 00:10:26	C:\Users\PC\Documents\GitHub\cex\N02_marketing\knowledge\knowledge_card_social_publishing.md	3	8.9	1.00	discard	polished formatting (whitespace cleanup)
2026-04-02 00:11:04	C:\Users\PC\Documents\GitHub\cex\N02_marketing\knowledge\knowledge_card_social_publishing.md	1	8.9	1.00	discard	Add "When to Use" section after Executive Summary to improve actionability and clarity on when this knowledge applies
2026-04-02 00:11:45	C:\Users\PC\Documents\GitHub\cex\N02_marketing\knowledge\knowledge_card_social_publishing.md	2	8.9	1.00	discard	Replace theoretical Caption Generation content with concrete example showing actual caption generation process and output
2026-04-02 00:12:26	C:\Users\PC\Documents\GitHub\cex\N02_marketing\knowledge\knowledge_card_social_publishing.md	3	8.9	1.00	discard	Add implementation guidance to Posting Time Science section with timezone handling and automation specifics
2026-04-02 00:13:14	C:\Users\PC\Documents\GitHub\cex\N02_marketing\knowledge\knowledge_card_social_publishing.md	4	9.0	1.00	keep	Enhance the "Rotation & Cooldown" section with detailed implementation strategies and platform-specific rotation patterns to improve actionability
2026-04-02 00:13:15	C:\Users\PC\Documents\GitHub\cex\N01_intelligence\knowledge\knowledge_card_source_catalog.md	1	8.9	1.00	discard	polished formatting (whitespace cleanup)
2026-04-02 00:13:15	C:\Users\PC\Documents\GitHub\cex\N01_intelligence\knowledge\knowledge_card_source_catalog.md	2	8.9	1.00	discard	polished formatting (whitespace cleanup)
