timestamp	file	round	quality	density	status	description
2026-04-02 00:13:16	C:\Users\PC\Documents\GitHub\cex\N01_intelligence\knowledge\knowledge_card_source_catalog.md	3	8.9	1.00	discard	polished formatting (whitespace cleanup)
2026-04-02 00:13:54	C:\Users\PC\Documents\GitHub\cex\N01_intelligence\knowledge\knowledge_card_source_catalog.md	1	8.9	1.00	discard	Add anti-patterns section to improve actionability with specific "don't do this" guidance for research source selection and usage.
2026-04-02 00:14:32	C:\Users\PC\Documents\GitHub\cex\N01_intelligence\knowledge\knowledge_card_source_catalog.md	2	8.9	1.00	discard	Add "Setup Priority" section with specific implementation order and configuration examples to improve actionability
2026-04-02 00:15:13	C:\Users\PC\Documents\GitHub\cex\N01_intelligence\knowledge\knowledge_card_source_catalog.md	3	8.9	1.00	discard	Add "Research Goal → Source Mapping" table to show which source combinations to use for common research scenarios, improving actionability.
2026-04-02 00:15:49	C:\Users\PC\Documents\GitHub\cex\N01_intelligence\knowledge\knowledge_card_source_catalog.md	4	8.9	1.00	discard	Enhance cost summary table with value/ROI column to improve actionability and decision-making context.
2026-04-02 00:16:35	C:\Users\PC\Documents\GitHub\cex\N01_intelligence\knowledge\knowledge_card_source_catalog.md	5	8.9	1.00	discard	Enhance the Fallback Chains section with specific implementation details and timeout recommendations to improve actionability.
2026-04-02 00:16:36	C:\Users\PC\Documents\GitHub\cex\N01_intelligence\orchestration\dispatch_rule_research_pipeline.md	1	8.9	1.00	discard	analyzed: reduce_prose: convert long prose sections into tables or bullet lists
2026-04-02 00:16:36	C:\Users\PC\Documents\GitHub\cex\N01_intelligence\orchestration\dispatch_rule_research_pipeline.md	2	8.9	1.00	discard	analyzed: reduce_prose: convert long prose sections into tables or bullet lists
2026-04-02 00:16:36	C:\Users\PC\Documents\GitHub\cex\N01_intelligence\orchestration\dispatch_rule_research_pipeline.md	3	8.9	1.00	discard	analyzed: reduce_prose: convert long prose sections into tables or bullet lists
2026-04-02 00:17:00	C:\Users\PC\Documents\GitHub\cex\N01_intelligence\orchestration\dispatch_rule_research_pipeline.md	1	8.9	1.00	discard	Add anti-patterns section to improve actionability with specific examples of what NOT to route to N01
2026-04-02 00:17:29	C:\Users\PC\Documents\GitHub\cex\N01_intelligence\orchestration\dispatch_rule_research_pipeline.md	2	8.9	1.00	discard	Enhance validation section with more detailed, actionable criteria and troubleshooting steps
2026-04-02 00:17:54	C:\Users\PC\Documents\GitHub\cex\N01_intelligence\orchestration\dispatch_rule_research_pipeline.md	3	8.9	1.00	discard	Convert trigger keywords from YAML lists to dense confidence-scored table format
2026-04-02 00:18:24	C:\Users\PC\Documents\GitHub\cex\N01_intelligence\orchestration\dispatch_rule_research_pipeline.md	4	8.9	1.00	discard	Enhance routing rules with more granular scenarios and precise confidence scoring for better dispatch accuracy
2026-04-02 00:18:58	C:\Users\PC\Documents\GitHub\cex\N01_intelligence\orchestration\dispatch_rule_research_pipeline.md	5	8.9	1.00	discard	Enhance Cross-Nucleus Handoffs section with specific data schemas and execution triggers for better actionability
2026-04-02 00:18:59	C:\Users\PC\Documents\GitHub\cex\N02_marketing\schemas\html_output_schema.md	1	8.9	1.00	discard	analyzed: reduce_prose: convert long prose sections into tables or bullet lists
2026-04-02 00:18:59	C:\Users\PC\Documents\GitHub\cex\N02_marketing\schemas\html_output_schema.md	2	8.9	1.00	discard	analyzed: reduce_prose: convert long prose sections into tables or bullet lists
2026-04-02 00:18:59	C:\Users\PC\Documents\GitHub\cex\N02_marketing\schemas\html_output_schema.md	3	8.9	1.00	discard	analyzed: reduce_prose: convert long prose sections into tables or bullet lists
2026-04-02 00:20:01	C:\Users\PC\Documents\GitHub\cex\N01_intelligence\knowledge\knowledge_card_research_methods.md	1	8.9	1.00	discard	analyzed: reduce_prose: convert long prose sections into tables or bullet lists
2026-04-02 00:20:01	C:\Users\PC\Documents\GitHub\cex\N01_intelligence\knowledge\knowledge_card_research_methods.md	2	8.9	1.00	discard	analyzed: reduce_prose: convert long prose sections into tables or bullet lists
2026-04-02 00:20:01	C:\Users\PC\Documents\GitHub\cex\N01_intelligence\knowledge\knowledge_card_research_methods.md	3	8.9	1.00	discard	analyzed: reduce_prose: convert long prose sections into tables or bullet lists
2026-04-02 00:20:38	C:\Users\PC\Documents\GitHub\cex\N01_intelligence\knowledge\knowledge_card_research_methods.md	1	8.9	1.00	discard	Add anti-patterns section to improve actionability by showing what NOT to do when implementing these research methods
2026-04-02 00:21:18	C:\Users\PC\Documents\GitHub\cex\N01_intelligence\knowledge\knowledge_card_research_methods.md	2	8.9	1.00	discard	Add "Implementation Sequence" section with step-by-step guidance for implementing these methods in practice
2026-04-02 00:21:57	C:\Users\PC\Documents\GitHub\cex\N01_intelligence\knowledge\knowledge_card_research_methods.md	3	8.9	1.00	discard	Add concrete CRITIC verification example with actual error types and corrections to improve actionability
2026-04-02 00:22:35	C:\Users\PC\Documents\GitHub\cex\N01_intelligence\knowledge\knowledge_card_research_methods.md	4	8.9	1.00	discard	Enhance "How They Combine" section with detailed workflow orchestration showing specific decision points and handoffs between the three methods
2026-04-02 00:23:11	C:\Users\PC\Documents\GitHub\cex\N01_intelligence\knowledge\knowledge_card_research_methods.md	5	8.9	1.00	discard	Enhance the STORM example table with more specific, actionable query examples that provide better implementation guidance
2026-04-02 00:23:12	C:\Users\PC\Documents\GitHub\cex\N01_intelligence\tools\research_pipeline_intelligence.md	1	8.9	1.00	discard	analyzed: reduce_prose: convert long prose sections into tables or bullet lists
2026-04-02 00:23:12	C:\Users\PC\Documents\GitHub\cex\N01_intelligence\tools\research_pipeline_intelligence.md	2	8.9	1.00	discard	analyzed: reduce_prose: convert long prose sections into tables or bullet lists
2026-04-02 00:23:12	C:\Users\PC\Documents\GitHub\cex\N01_intelligence\tools\research_pipeline_intelligence.md	3	8.9	1.00	discard	analyzed: reduce_prose: convert long prose sections into tables or bullet lists
2026-04-02 00:23:42	C:\Users\PC\Documents\GitHub\cex\N01_intelligence\tools\research_pipeline_intelligence.md	1	8.9	1.00	discard	Add anti-patterns section to improve actionability with specific "don't do this" guidance
2026-04-02 00:24:14	C:\Users\PC\Documents\GitHub\cex\N01_intelligence\tools\research_pipeline_intelligence.md	2	8.9	1.00	discard	Expand Config Reference section with concrete YAML structure and parameters to improve actionability
2026-04-02 00:24:50	C:\Users\PC\Documents\GitHub\cex\N01_intelligence\tools\research_pipeline_intelligence.md	3	8.9	1.00	discard	Convert Usage section to more concrete, actionable examples with real business scenarios
2026-04-02 00:25:26	C:\Users\PC\Documents\GitHub\cex\N01_intelligence\tools\research_pipeline_intelligence.md	4	8.9	1.00	discard	Convert Quality Gates bullet list to a dense table format showing gate criteria and validation purpose
2026-04-02 00:25:59	C:\Users\PC\Documents\GitHub\cex\N01_intelligence\tools\research_pipeline_intelligence.md	5	8.9	1.00	discard	Add Model Routing section with specific technical parameters for each pipeline stage to improve actionability
2026-04-02 00:26:00	C:\Users\PC\Documents\GitHub\cex\N02_marketing\agents\agent_marketing.md	1	8.9	1.00	discard	analyzed: reduce_prose: convert long prose sections into tables or bullet lists
2026-04-02 00:26:00	C:\Users\PC\Documents\GitHub\cex\N02_marketing\agents\agent_marketing.md	2	8.9	1.00	discard	analyzed: reduce_prose: convert long prose sections into tables or bullet lists
2026-04-02 00:26:00	C:\Users\PC\Documents\GitHub\cex\N02_marketing\agents\agent_marketing.md	3	8.9	1.00	discard	analyzed: reduce_prose: convert long prose sections into tables or bullet lists
2026-04-02 00:27:28	C:\Users\PC\Documents\GitHub\cex\N01_intelligence\prompts\prompt_template_intelligence.md	1	8.9	0.94	discard	added density_score: 0.94
2026-04-02 00:27:28	C:\Users\PC\Documents\GitHub\cex\N01_intelligence\prompts\prompt_template_intelligence.md	2	8.9	0.94	discard	added density_score: 0.94
2026-04-02 00:27:28	C:\Users\PC\Documents\GitHub\cex\N01_intelligence\prompts\prompt_template_intelligence.md	3	8.9	0.94	discard	added density_score: 0.94
2026-04-02 00:28:04	C:\Users\PC\Documents\GitHub\cex\N01_intelligence\prompts\prompt_template_intelligence.md	1	8.9	0.96	discard	Add anti-patterns section to improve actionability by showing what NOT to do when using these templates
2026-04-02 00:28:40	C:\Users\PC\Documents\GitHub\cex\N01_intelligence\prompts\prompt_template_intelligence.md	2	8.9	0.97	discard	Replace wordy PURPOSE section with concise workflow selection table to improve density and actionability
2026-04-02 00:29:15	C:\Users\PC\Documents\GitHub\cex\N01_intelligence\prompts\prompt_template_intelligence.md	3	8.9	0.96	discard	Add Quick Reference section with decision tree to help users rapidly select the correct template based on their research needs
2026-04-02 00:29:48	C:\Users\PC\Documents\GitHub\cex\N01_intelligence\prompts\prompt_template_intelligence.md	4	8.9	1.00	discard	Improve template clarity by standardizing YAML format and making variable descriptions more precise and actionable
2026-04-02 00:30:23	C:\Users\PC\Documents\GitHub\cex\N01_intelligence\prompts\prompt_template_intelligence.md	5	8.9	0.96	discard	Condense wordy PURPOSE section into a concise, actionable statement to improve density
2026-04-02 00:30:24	C:\Users\PC\Documents\GitHub\cex\N01_intelligence\quality\p07_scoring_rubric_create_a_scoring_rubric_for_intelligence.md	1	8.9	1.00	discard	polished formatting (whitespace cleanup)
2026-04-02 00:30:25	C:\Users\PC\Documents\GitHub\cex\N01_intelligence\quality\p07_scoring_rubric_create_a_scoring_rubric_for_intelligence.md	2	8.9	1.00	discard	polished formatting (whitespace cleanup)
2026-04-02 00:30:25	C:\Users\PC\Documents\GitHub\cex\N01_intelligence\quality\p07_scoring_rubric_create_a_scoring_rubric_for_intelligence.md	3	8.9	1.00	discard	polished formatting (whitespace cleanup)
2026-04-02 00:31:01	C:\Users\PC\Documents\GitHub\cex\N01_intelligence\quality\p07_scoring_rubric_create_a_scoring_rubric_for_intelligence.md	1	8.9	1.00	discard	Add Anti-patterns section to improve actionability by showing common scoring mistakes to avoid
2026-04-02 00:31:37	C:\Users\PC\Documents\GitHub\cex\N01_intelligence\quality\p07_scoring_rubric_create_a_scoring_rubric_for_intelligence.md	2	8.9	1.00	discard	Add boundary case examples to calibration section to improve evaluator guidance for edge cases
2026-04-02 00:32:15	C:\Users\PC\Documents\GitHub\cex\N01_intelligence\quality\p07_scoring_rubric_create_a_scoring_rubric_for_intelligence.md	3	8.9	1.00	discard	Add explicit score breakdowns to calibration examples showing how dimensions combine to reach final scores
2026-04-02 00:32:57	C:\Users\PC\Documents\GitHub\cex\N01_intelligence\quality\p07_scoring_rubric_create_a_scoring_rubric_for_intelligence.md	4	8.9	1.00	discard	Add "Evaluation Process" section with step-by-step guidance for evaluators to improve actionability
2026-04-02 00:33:36	C:\Users\PC\Documents\GitHub\cex\N01_intelligence\quality\p07_scoring_rubric_create_a_scoring_rubric_for_intelligence.md	5	8.9	1.00	discard	Expand References section with specific actionable tools and checklists that evaluators can directly use when scoring
2026-04-02 00:33:37	C:\Users\PC\Documents\GitHub\cex\N02_marketing\orchestration\dispatch_rule_marketing.md	1	8.9	1.00	discard	added density_score: 1.0
2026-04-02 00:33:37	C:\Users\PC\Documents\GitHub\cex\N02_marketing\orchestration\dispatch_rule_marketing.md	2	8.9	1.00	discard	added density_score: 1.0
2026-04-02 00:33:37	C:\Users\PC\Documents\GitHub\cex\N02_marketing\orchestration\dispatch_rule_marketing.md	3	8.9	1.00	discard	added density_score: 1.0
2026-04-02 00:34:36	C:\Users\PC\Documents\GitHub\cex\N02_marketing\orchestration\dispatch_rule_marketing.md	1	8.9	1.00	discard	Convert routing logic pseudo-code to a decision table for better scannability and actionability
2026-04-02 00:35:36	C:\Users\PC\Documents\GitHub\cex\N02_marketing\orchestration\dispatch_rule_marketing.md	2	8.9	1.00	discard	Add anti-patterns section with specific examples of common routing mistakes to improve actionability
2026-04-02 00:36:42	C:\Users\PC\Documents\GitHub\cex\N02_marketing\orchestration\dispatch_rule_marketing.md	3	8.9	1.00	discard	Replace placeholder text in Handoff Template with concrete examples for each mode to improve actionability
2026-04-02 00:37:44	C:\Users\PC\Documents\GitHub\cex\N02_marketing\orchestration\dispatch_rule_marketing.md	4	8.9	1.00	discard	Convert Python code in Mode Detection Logic to structured decision flowchart for better scannability and actionability
2026-04-02 00:38:49	C:\Users\PC\Documents\GitHub\cex\N02_marketing\orchestration\dispatch_rule_marketing.md	5	8.9	1.00	discard	Add compound keyword phrases and technical patterns to Trigger Conditions tables for more precise routing detection
2026-04-02 00:38:50	C:\Users\PC\Documents\GitHub\cex\N02_marketing\output\output_visual_report.md	1	8.9	1.00	discard	analyzed: reduce_prose: convert long prose sections into tables or bullet lists
2026-04-02 00:38:51	C:\Users\PC\Documents\GitHub\cex\N02_marketing\output\output_visual_report.md	2	8.9	1.00	discard	analyzed: reduce_prose: convert long prose sections into tables or bullet lists
2026-04-02 00:38:51	C:\Users\PC\Documents\GitHub\cex\N02_marketing\output\output_visual_report.md	3	8.9	1.00	discard	analyzed: reduce_prose: convert long prose sections into tables or bullet lists
2026-04-02 00:39:47	C:\Users\PC\Documents\GitHub\cex\N02_marketing\output\output_visual_report.md	1	8.9	1.00	discard	Add anti-patterns section to improve actionability with specific "don't do this" guidance
2026-04-02 00:40:44	C:\Users\PC\Documents\GitHub\cex\N02_marketing\output\output_visual_report.md	2	8.9	1.00	discard	Add validation checklist section to improve actionability with specific criteria for validating visual report outputs
2026-04-02 00:41:44	C:\Users\PC\Documents\GitHub\cex\N02_marketing\output\output_visual_report.md	3	8.9	1.00	discard	Add "When to Use" section to improve actionability by clarifying appropriate use cases vs other output formats
2026-04-02 00:42:48	C:\Users\PC\Documents\GitHub\cex\N02_marketing\output\output_visual_report.md	4	8.9	1.00	discard	Enhance Template Variables section with concrete example values to improve actionability and reduce guesswork for implementers.
2026-04-02 00:43:44	C:\Users\PC\Documents\GitHub\cex\N02_marketing\output\output_visual_report.md	5	8.9	1.00	discard	Convert Structure section from code block list to detailed table format for higher density and actionability
2026-04-02 00:43:45	C:\Users\PC\Documents\GitHub\cex\N02_marketing\prompts\action_prompt_marketing.md	1	8.9	1.00	discard	analyzed: reduce_prose: convert long prose sections into tables or bullet lists
2026-04-02 00:43:45	C:\Users\PC\Documents\GitHub\cex\N02_marketing\prompts\action_prompt_marketing.md	2	8.9	1.00	discard	analyzed: reduce_prose: convert long prose sections into tables or bullet lists
2026-04-02 00:43:46	C:\Users\PC\Documents\GitHub\cex\N02_marketing\prompts\action_prompt_marketing.md	3	8.9	1.00	discard	analyzed: reduce_prose: convert long prose sections into tables or bullet lists
2026-04-02 00:45:26	C:\Users\PC\Documents\GitHub\cex\N04_knowledge\knowledge\embedding_config_knowledge.md	1	8.9	0.91	discard	added density_score: 0.91
2026-04-02 00:45:26	C:\Users\PC\Documents\GitHub\cex\N04_knowledge\knowledge\embedding_config_knowledge.md	2	8.9	0.91	discard	added density_score: 0.91
2026-04-02 00:45:27	C:\Users\PC\Documents\GitHub\cex\N04_knowledge\knowledge\embedding_config_knowledge.md	3	8.9	0.91	discard	added density_score: 0.91
2026-04-02 00:45:58	C:\Users\PC\Documents\GitHub\cex\N04_knowledge\knowledge\embedding_config_knowledge.md	1	8.9	0.93	discard	Add anti-patterns section to improve actionability by providing specific guidance on what NOT to do when configuring embedding models
2026-04-02 00:46:28	C:\Users\PC\Documents\GitHub\cex\N04_knowledge\knowledge\embedding_config_knowledge.md	2	8.8	0.95	discard	Convert routing logic from numbered list to structured table format for better density and scannability
2026-04-02 00:47:00	C:\Users\PC\Documents\GitHub\cex\N04_knowledge\knowledge\embedding_config_knowledge.md	3	8.9	0.93	discard	Add concrete configuration examples section with actual YAML snippets to improve actionability
2026-04-02 00:47:35	C:\Users\PC\Documents\GitHub\cex\N04_knowledge\knowledge\embedding_config_knowledge.md	4	8.9	0.94	discard	Add performance benchmarks section with concrete metrics to improve actionability for model selection decisions
2026-04-02 00:48:07	C:\Users\PC\Documents\GitHub\cex\N04_knowledge\knowledge\embedding_config_knowledge.md	5	8.9	0.95	discard	Replace verbose Overview section with a dense decision matrix table showing when to use each embedding model
2026-04-02 00:48:08	C:\Users\PC\Documents\GitHub\cex\N04_knowledge\knowledge\chunk_strategy_knowledge.md	1	8.9	0.89	discard	added density_score: 0.89
2026-04-02 00:48:08	C:\Users\PC\Documents\GitHub\cex\N04_knowledge\knowledge\chunk_strategy_knowledge.md	2	8.9	0.89	discard	added density_score: 0.89
2026-04-02 00:48:08	C:\Users\PC\Documents\GitHub\cex\N04_knowledge\knowledge\chunk_strategy_knowledge.md	3	8.9	0.89	discard	added density_score: 0.89
2026-04-02 00:48:36	C:\Users\PC\Documents\GitHub\cex\N04_knowledge\knowledge\chunk_strategy_knowledge.md	1	8.9	0.94	discard	Convert separator hierarchies from numbered lists to a dense comparison table format
2026-04-02 00:49:06	C:\Users\PC\Documents\GitHub\cex\N04_knowledge\knowledge\chunk_strategy_knowledge.md	2	8.9	0.91	discard	Convert section 5 "Advanced Strategies" from wordy prose descriptions to a dense comparison table format
2026-04-02 00:49:42	C:\Users\PC\Documents\GitHub\cex\N04_knowledge\knowledge\chunk_strategy_knowledge.md	3	8.9	0.96	discard	Add "Usage Guidelines & Anti-patterns" section to improve actionability with specific guidance on when to use each content type and common mistakes to avoid
2026-04-02 00:50:17	C:\Users\PC\Documents\GitHub\cex\N04_knowledge\knowledge\chunk_strategy_knowledge.md	4	8.9	0.89	discard	Add concrete step-by-step example to section 2 showing hierarchical recursive chunking in action to improve actionability
2026-04-02 00:51:02	C:\Users\PC\Documents\GitHub\cex\N04_knowledge\knowledge\chunk_strategy_knowledge.md	5	8.9	0.94	discard	Expand the Global Parameters table with additional chunking configuration parameters to improve density and actionability
2026-04-02 00:51:03	C:\Users\PC\Documents\GitHub\cex\N02_marketing\schemas\design_token_contract.md	1	8.9	1.00	discard	analyzed: reduce_prose: convert long prose sections into tables or bullet lists
2026-04-02 00:51:03	C:\Users\PC\Documents\GitHub\cex\N02_marketing\schemas\design_token_contract.md	2	8.9	1.00	discard	analyzed: reduce_prose: convert long prose sections into tables or bullet lists
2026-04-02 00:51:04	C:\Users\PC\Documents\GitHub\cex\N02_marketing\schemas\design_token_contract.md	3	8.9	1.00	discard	analyzed: reduce_prose: convert long prose sections into tables or bullet lists
2026-04-02 00:52:25	C:\Users\PC\Documents\GitHub\cex\N02_marketing\schemas\design_token_contract.md	1	8.9	1.00	discard	Add "When NOT to Use This Contract" section to improve actionability and provide clearer boundaries
2026-04-02 00:53:44	C:\Users\PC\Documents\GitHub\cex\N02_marketing\schemas\design_token_contract.md	2	8.9	1.00	discard	Convert the "Common Violations" section from verbose code examples into a dense comparison table for better scannability and actionability
2026-04-02 00:55:47	C:\Users\PC\Documents\GitHub\cex\N02_marketing\schemas\responsive_breakpoints.md	1	8.9	1.00	discard	analyzed: reduce_prose: convert long prose sections into tables or bullet lists
2026-04-02 00:55:48	C:\Users\PC\Documents\GitHub\cex\N02_marketing\schemas\responsive_breakpoints.md	2	8.9	1.00	discard	analyzed: reduce_prose: convert long prose sections into tables or bullet lists
2026-04-02 00:55:48	C:\Users\PC\Documents\GitHub\cex\N02_marketing\schemas\responsive_breakpoints.md	3	8.9	1.00	discard	analyzed: reduce_prose: convert long prose sections into tables or bullet lists
2026-04-02 00:56:19	C:\Users\PC\Documents\GitHub\cex\N02_marketing\schemas\responsive_breakpoints.md	1	8.9	1.00	discard	Add actionable testing instructions and tools to the validation section for better implementability.
2026-04-02 00:56:51	C:\Users\PC\Documents\GitHub\cex\N02_marketing\schemas\responsive_breakpoints.md	2	8.9	1.00	discard	Add anti-patterns section to improve actionability with specific "don't do this" guidance
2026-04-02 00:57:29	C:\Users\PC\Documents\GitHub\cex\N02_marketing\schemas\responsive_breakpoints.md	3	8.9	1.00	discard	Convert Schema Purpose section to dense rule table and add implementation context to breakpoint definitions
2026-04-02 00:58:03	C:\Users\PC\Documents\GitHub\cex\N02_marketing\schemas\responsive_breakpoints.md	4	8.9	1.00	discard	Add concrete HTML code examples to the Responsive Images section to improve actionability
2026-04-02 00:58:38	C:\Users\PC\Documents\GitHub\cex\N02_marketing\schemas\responsive_breakpoints.md	5	8.9	1.00	discard	Add usage context to spacing scale section for improved actionability without anti-patterns
2026-04-02 00:58:39	C:\Users\PC\Documents\GitHub\cex\N02_marketing\schemas\a11y_checklist.md	1	8.9	1.00	discard	analyzed: reduce_prose: convert long prose sections into tables or bullet lists
