timestamp	file	round	quality	density	status	description
2026-04-02 10:12:41	C:\Users\PC\Documents\GitHub\cex\P01_knowledge\examples\p01_knowledge_card_create_knowledge_card_about_source_credibility_scoring_frame.md	1	8.9	1.00	keep	Fix section heading from "Comparativo" to "Comparison" for English consistency
2026-04-02 10:13:15	C:\Users\PC\Documents\GitHub\cex\P01_knowledge\examples\p01_knowledge_card_create_knowledge_card_about_source_credibility_scoring_frame.md	2	9.0	1.00	keep	Add precise calculation formulas table to replace descriptive text in Key Concepts section for higher density and actionability
2026-04-02 10:14:18	C:\Users\PC\Documents\GitHub\cex\P01_knowledge\examples\p06_input_schema_create_schema_contract_for_benchmark_comparison_data_model.md	1	8.9	1.00	keep	analyzed: fix_frontmatter: missing title
2026-04-02 10:16:07	C:\Users\PC\Documents\GitHub\cex\P01_knowledge\examples\p04_research_pipeline_create_output_template_for_weekly_market_intelligence_brief.md	1	8.8	1.00	keep	analyzed: reduce_prose: convert long prose sections into tables or bullet lists
2026-04-02 10:17:03	C:\Users\PC\Documents\GitHub\cex\P01_knowledge\examples\p01_knowledge_card_create_knowledge_card_about_conversion_copywriting_framework.md	1	8.9	1.00	keep	polished formatting (whitespace cleanup)
2026-04-02 10:18:01	C:\Users\PC\Documents\GitHub\cex\P01_knowledge\examples\p01_knowledge_card_create_knowledge_card_about_brand_voice_consistency_across_c.md	1	8.9	1.00	keep	polished formatting (whitespace cleanup)
2026-04-02 10:18:56	C:\Users\PC\Documents\GitHub\cex\P01_knowledge\examples\p01_knowledge_card_create_knowledge_card_about_a_b_testing_for_content_optimiza.md	1	9.0	1.00	keep	analyzed: reduce_prose: convert long prose sections into tables or bullet lists
2026-04-02 10:19:52	C:\Users\PC\Documents\GitHub\cex\P01_knowledge\examples\p01_knowledge_card_create_knowledge_card_about_seo_content_strategy_for_e_comme.md	1	0.0	0.00	crash	compile fail after: tldr flagged for manual review
2026-04-02 10:19:52	C:\Users\PC\Documents\GitHub\cex\P01_knowledge\examples\p01_knowledge_card_create_knowledge_card_about_seo_content_strategy_for_e_comme.md	2	0.0	0.00	crash	compile fail after: tldr flagged for manual review
2026-04-02 10:19:52	C:\Users\PC\Documents\GitHub\cex\P01_knowledge\examples\p01_knowledge_card_create_knowledge_card_about_seo_content_strategy_for_e_comme.md	3	0.0	0.00	crash	compile fail after: tldr flagged for manual review
2026-04-02 10:20:25	C:\Users\PC\Documents\GitHub\cex\P01_knowledge\examples\p01_knowledge_card_create_knowledge_card_about_seo_content_strategy_for_e_comme.md	1	8.9	1.00	keep	Fix quality field from 0.0 to null (builders must never self-score)
2026-04-02 10:21:00	C:\Users\PC\Documents\GitHub\cex\P01_knowledge\examples\p01_knowledge_card_create_knowledge_card_about_seo_content_strategy_for_e_comme.md	2	8.9	1.00	discard	Convert Key Concepts section from bullet points to table format for higher density
2026-04-02 10:21:25	C:\Users\PC\Documents\GitHub\cex\P01_knowledge\examples\p01_knowledge_card_create_knowledge_card_about_seo_content_strategy_for_e_comme.md	3	8.9	1.00	discard	Add specific anti-patterns section to boost actionability with concrete examples of what NOT to do
2026-04-02 10:22:00	C:\Users\PC\Documents\GitHub\cex\P01_knowledge\examples\p01_knowledge_card_create_knowledge_card_about_seo_content_strategy_for_e_comme.md	4	8.9	1.00	discard	Convert Golden Rules from bullet points to structured table with metrics and rationale for higher density
2026-04-02 10:22:38	C:\Users\PC\Documents\GitHub\cex\P01_knowledge\examples\p01_knowledge_card_create_knowledge_card_about_seo_content_strategy_for_e_comme.md	5	8.9	1.00	discard	Enhance Strategy Phases section with specific metrics, timeframes, and tools for higher actionability
2026-04-02 10:24:22	C:\Users\PC\Documents\GitHub\cex\P01_knowledge\examples\p04_social_publisher_create_output_template_for_social_media_content_calendar.md	1	8.9	1.00	keep	analyzed: reduce_prose: convert long prose sections into tables or bullet lists
2026-04-02 10:25:27	C:\Users\PC\Documents\GitHub\cex\P01_knowledge\examples\p06_input_schema_create_schema_contract_for_campaign_performance_metrics.md	1	8.9	1.00	keep	analyzed: fix_frontmatter: missing title
2026-04-02 10:26:22	C:\Users\PC\Documents\GitHub\cex\P01_knowledge\examples\p01_knowledge_card_create_knowledge_card_about_prompt_engineering_best_practice.md	1	0.0	0.00	crash	compile fail after: tldr flagged for manual review
2026-04-02 10:26:22	C:\Users\PC\Documents\GitHub\cex\P01_knowledge\examples\p01_knowledge_card_create_knowledge_card_about_prompt_engineering_best_practice.md	2	8.9	1.00	keep	polished formatting (whitespace cleanup)
2026-04-02 10:27:19	C:\Users\PC\Documents\GitHub\cex\P01_knowledge\examples\p01_knowledge_card_create_knowledge_card_about_multi_agent_orchestration_patter.md	1	8.9	1.00	keep	analyzed: reduce_prose: convert long prose sections into tables or bullet lists
2026-04-02 10:28:22	C:\Users\PC\Documents\GitHub\cex\P01_knowledge\examples\p01_knowledge_card_create_knowledge_card_about_artifact_quality_evaluation_meth.md	1	0.0	0.00	crash	compile fail after: tldr flagged for manual review
2026-04-02 10:28:22	C:\Users\PC\Documents\GitHub\cex\P01_knowledge\examples\p01_knowledge_card_create_knowledge_card_about_artifact_quality_evaluation_meth.md	2	0.0	0.00	crash	compile fail after: tldr flagged for manual review
2026-04-02 10:28:22	C:\Users\PC\Documents\GitHub\cex\P01_knowledge\examples\p01_knowledge_card_create_knowledge_card_about_artifact_quality_evaluation_meth.md	3	0.0	0.00	crash	compile fail after: tldr flagged for manual review
2026-04-02 10:28:55	C:\Users\PC\Documents\GitHub\cex\P01_knowledge\examples\p01_knowledge_card_create_knowledge_card_about_artifact_quality_evaluation_meth.md	1	0.0	0.00	crash	compile fail: Convert Strategy Phases from prose to actionable table format to improve density and clarity
2026-04-02 10:29:29	C:\Users\PC\Documents\GitHub\cex\P01_knowledge\examples\p01_knowledge_card_create_knowledge_card_about_artifact_quality_evaluation_meth.md	2	9.0	1.00	keep	Convert Key Concepts from bullet list to structured table for better density and scannability
2026-04-02 10:30:31	C:\Users\PC\Documents\GitHub\cex\P01_knowledge\examples\p01_knowledge_card_create_knowledge_card_about_llm_output_parsing_and_validatio.md	1	9.0	1.00	keep	analyzed: reduce_prose: convert long prose sections into tables or bullet lists
2026-04-02 10:31:22	C:\Users\PC\Documents\GitHub\cex\P01_knowledge\examples\p06_input_schema_create_schema_contract_for_builder_specification_format.md	1	8.9	1.00	keep	analyzed: reduce_prose: convert long prose sections into tables or bullet lists
2026-04-02 10:32:26	C:\Users\PC\Documents\GitHub\cex\P01_knowledge\examples\p05_formatter_create_output_template_for_artifact_creation_report.md	1	8.9	1.00	keep	analyzed: reduce_prose: convert long prose sections into tables or bullet lists
2026-04-02 10:33:33	C:\Users\PC\Documents\GitHub\cex\P01_knowledge\examples\p01_knowledge_card_create_knowledge_card_about_rag_chunking_strategies_comparis.md	1	0.0	0.00	crash	compile fail after: tldr flagged for manual review
2026-04-02 10:33:33	C:\Users\PC\Documents\GitHub\cex\P01_knowledge\examples\p01_knowledge_card_create_knowledge_card_about_rag_chunking_strategies_comparis.md	2	0.0	0.00	crash	compile fail after: tldr flagged for manual review
2026-04-02 10:33:33	C:\Users\PC\Documents\GitHub\cex\P01_knowledge\examples\p01_knowledge_card_create_knowledge_card_about_rag_chunking_strategies_comparis.md	3	0.0	0.00	crash	compile fail after: tldr flagged for manual review
2026-04-02 10:34:17	C:\Users\PC\Documents\GitHub\cex\P01_knowledge\examples\p01_knowledge_card_create_knowledge_card_about_rag_chunking_strategies_comparis.md	1	0.0	0.00	crash	compile fail: Add dedicated Anti-Patterns section to improve actionability and highlight common chunking mistakes
2026-04-02 10:35:03	C:\Users\PC\Documents\GitHub\cex\P01_knowledge\examples\p01_knowledge_card_create_knowledge_card_about_rag_chunking_strategies_comparis.md	2	0.0	0.00	crash	compile fail: Convert Strategy Phases from numbered list to structured table format for higher density and clearer action steps
2026-04-02 10:35:06	C:\Users\PC\AppData\Local\Temp\pytest-of-PC\pytest-2370\test_already_at_target0\scored.md	0	9.2	1.00	skip	already at target
2026-04-02 10:35:06	C:\Users\PC\AppData\Local\Temp\pytest-of-PC\pytest-2370\test_returns_dict0\test_artifact.md	1	8.7	0.97	keep	polished formatting (whitespace cleanup)
2026-04-02 10:35:51	C:\Users\PC\Documents\GitHub\cex\P01_knowledge\examples\p01_knowledge_card_create_knowledge_card_about_rag_chunking_strategies_comparis.md	3	0.0	0.00	crash	compile fail: Enhance Quick Reference section with decision tree format to improve immediate actionability for strategy selection
2026-04-02 10:35:58	C:\Users\PC\AppData\Local\Temp\pytest-of-PC\pytest-2371\test_already_at_target0\scored.md	0	9.2	1.00	skip	already at target
2026-04-02 10:35:58	C:\Users\PC\AppData\Local\Temp\pytest-of-PC\pytest-2371\test_returns_dict0\test_artifact.md	1	8.7	0.97	keep	polished formatting (whitespace cleanup)
2026-04-02 10:35:59	C:\Users\PC\AppData\Local\Temp\pytest-of-PC\pytest-2371\test_skips_already_at_target0\test_artifact.md	0	9.5	0.97	skip	already at target
2026-04-02 10:36:30	C:\Users\PC\AppData\Local\Temp\pytest-of-PC\pytest-2372\test_already_at_target0\scored.md	0	9.2	1.00	skip	already at target
2026-04-02 10:36:31	C:\Users\PC\AppData\Local\Temp\pytest-of-PC\pytest-2372\test_returns_dict0\test_artifact.md	1	8.7	0.97	keep	polished formatting (whitespace cleanup)
2026-04-02 10:36:31	C:\Users\PC\AppData\Local\Temp\pytest-of-PC\pytest-2372\test_skips_already_at_target0\test_artifact.md	0	9.5	0.97	skip	already at target
2026-04-02 10:36:43	C:\Users\PC\Documents\GitHub\cex\P01_knowledge\examples\p01_knowledge_card_create_knowledge_card_about_rag_chunking_strategies_comparis.md	4	0.0	0.00	crash	compile fail: Convert Key Concepts from bullet definitions to structured comparison table for higher information density
2026-04-02 10:37:01	C:\Users\PC\AppData\Local\Temp\pytest-of-PC\pytest-2372\test_keep_on_improvement0\test_artifact.md	1	8.3	0.95	discard	added examples
2026-04-02 10:37:42	C:\Users\PC\Documents\GitHub\cex\P01_knowledge\examples\p01_knowledge_card_create_knowledge_card_about_rag_chunking_strategies_comparis.md	5	0.0	0.00	crash	compile fail: Expand Implementation Patterns section with complete code examples for all chunking strategies to improve actionability and completeness
2026-04-02 10:38:16	C:\Users\PC\AppData\Local\Temp\pytest-of-PC\pytest-2374\test_keep_on_improvement0\test_artifact.md	1	8.4	0.95	discard	added examples
2026-04-02 10:38:32	C:\Users\PC\AppData\Local\Temp\pytest-of-PC\pytest-2375\test_keep_on_improvement0\test_artifact.md	1	8.5	0.95	keep	added examples
2026-04-02 10:38:36	C:\Users\PC\AppData\Local\Temp\pytest-of-PC\pytest-2376\test_already_at_target0\scored.md	0	9.2	1.00	skip	already at target
2026-04-02 10:38:37	C:\Users\PC\AppData\Local\Temp\pytest-of-PC\pytest-2376\test_returns_dict0\test_artifact.md	1	8.7	0.97	keep	polished formatting (whitespace cleanup)
2026-04-02 10:38:37	C:\Users\PC\AppData\Local\Temp\pytest-of-PC\pytest-2376\test_skips_already_at_target0\test_artifact.md	0	9.5	0.97	skip	already at target
2026-04-02 10:38:37	C:\Users\PC\AppData\Local\Temp\pytest-of-PC\pytest-2376\test_keep_on_improvement0\test_artifact.md	1	8.5	0.95	keep	added examples
2026-04-02 10:38:48	C:\Users\PC\Documents\GitHub\cex\P01_knowledge\examples\p01_knowledge_card_create_knowledge_card_about_vector_embedding_model_selection.md	1	9.1	1.00	keep	polished formatting (whitespace cleanup)
2026-04-02 10:39:09	C:\Users\PC\AppData\Local\Temp\pytest-of-PC\pytest-2376\test_discard_on_no_improvement0\test_artifact.md	1	8.3	0.95	discard	tried something
2026-04-02 10:39:33	C:\Users\PC\AppData\Local\Temp\pytest-of-PC\pytest-2377\test_already_at_target0\scored.md	0	9.2	1.00	skip	already at target
2026-04-02 10:39:34	C:\Users\PC\AppData\Local\Temp\pytest-of-PC\pytest-2377\test_returns_dict0\test_artifact.md	1	8.7	0.97	keep	polished formatting (whitespace cleanup)
2026-04-02 10:39:34	C:\Users\PC\AppData\Local\Temp\pytest-of-PC\pytest-2377\test_skips_already_at_target0\test_artifact.md	0	9.5	0.97	skip	already at target
2026-04-02 10:39:34	C:\Users\PC\AppData\Local\Temp\pytest-of-PC\pytest-2377\test_keep_on_improvement0\test_artifact.md	1	8.5	0.95	keep	added examples
2026-04-02 10:39:34	C:\Users\PC\AppData\Local\Temp\pytest-of-PC\pytest-2377\test_discard_on_no_improvement0\test_artifact.md	1	6.5	0.95	discard	tried something
2026-04-02 10:39:34	C:\Users\PC\AppData\Local\Temp\pytest-of-PC\pytest-2377\test_budget_stops_loop0\test_artifact.md	1	5.0	0.95	discard	small change
2026-04-02 10:39:49	C:\Users\PC\Documents\GitHub\cex\P01_knowledge\examples\p01_knowledge_card_create_knowledge_card_about_knowledge_graph_construction_fro.md	1	9.1	1.00	keep	analyzed: reduce_prose: convert long prose sections into tables or bullet lists
2026-04-02 10:42:01	C:\Users\PC\Documents\GitHub\cex\P01_knowledge\examples\p02_agent_create_agent_for_creation_nucleus.md	1	9.1	1.00	keep	analyzed: reduce_prose: convert long prose sections into tables or bullet lists
2026-04-02 10:42:56	C:\Users\PC\Documents\GitHub\cex\P01_knowledge\examples\p03_system_prompt_create_system_prompt_for_creation_nucleus.md	1	9.0	0.95	keep	analyzed: reduce_prose: convert long prose sections into tables or bullet lists
2026-04-02 10:44:05	C:\Users\PC\Documents\GitHub\cex\P01_knowledge\examples\p01_knowledge_card_create_knowledge_card_about_creation_best_practices.md	1	9.2	1.00	keep	analyzed: reduce_prose: convert long prose sections into tables or bullet lists
2026-04-02 10:45:02	C:\Users\PC\Documents\GitHub\cex\P01_knowledge\examples\p02_agent_create_agent_card_for_creation_nucleus.md	1	9.1	1.00	keep	analyzed: reduce_prose: convert long prose sections into tables or bullet lists
2026-04-02 10:45:53	C:\Users\PC\Documents\GitHub\cex\P01_knowledge\examples\p12_workflow_create_workflow_for_creation_pipeline.md	1	8.9	0.99	keep	polished formatting (whitespace cleanup)
2026-04-02 10:46:53	C:\Users\PC\Documents\GitHub\cex\P01_knowledge\examples\p11_quality_gate_create_quality_gate_for_creation_artifacts.md	1	9.1	1.00	keep	polished formatting (whitespace cleanup)
2026-04-02 10:47:51	C:\Users\PC\Documents\GitHub\cex\P01_knowledge\examples\p07_scoring_rubric_create_scoring_rubric_for_creation_evaluation.md	1	0.0	0.00	crash	compile fail after: analyzed: increase_density: remove filler words, compress prose into tables
2026-04-02 10:47:51	C:\Users\PC\Documents\GitHub\cex\P01_knowledge\examples\p07_scoring_rubric_create_scoring_rubric_for_creation_evaluation.md	2	9.1	1.00	keep	polished formatting (whitespace cleanup)
2026-04-02 10:48:37	C:\Users\PC\Documents\GitHub\cex\P01_knowledge\examples\p12_dispatch_rule_create_dispatch_rule_for_creation_routing.md	1	8.7	0.79	keep	added density_score: 0.79
2026-04-02 10:49:48	C:\Users\PC\Documents\GitHub\cex\P01_knowledge\examples\p06_input_schema_create_schema_contract_for_creation_data_model.md	1	9.1	1.00	keep	analyzed: reduce_prose: convert long prose sections into tables or bullet lists
2026-04-02 10:50:48	C:\Users\PC\Documents\GitHub\cex\P01_knowledge\examples\p05_formatter_create_output_template_for_creation_reports.md	1	9.1	1.00	keep	analyzed: reduce_prose: convert long prose sections into tables or bullet lists
2026-04-02 10:51:25	C:\Users\PC\Documents\GitHub\cex\P01_knowledge\examples\p05_formatter_create_output_template_for_creation_reports.md	1	9.1	1.00	keep	analyzed: reduce_prose: convert long prose sections into tables or bullet lists
2026-04-02 10:52:38	C:\Users\PC\Documents\GitHub\cex\P01_knowledge\examples\p03_prompt_template_create_prompt_template_for_creation_tasks.md	1	9.2	1.00	keep	analyzed: reduce_prose: convert long prose sections into tables or bullet lists
2026-04-02 10:54:13	C:\Users\PC\Documents\GitHub\cex\P01_knowledge\examples\p01_bld_sp_manifest_software_project_create_agent_for_engineering_nucleus.md	1	8.8	1.00	keep	added density_score: 1.0
2026-04-02 10:55:06	C:\Users\PC\Documents\GitHub\cex\P01_knowledge\examples\p03_system_prompt_create_system_prompt_for_engineering_nucleus.md	1	9.0	0.96	keep	analyzed: reduce_prose: convert long prose sections into tables or bullet lists
2026-04-02 10:55:56	C:\Users\PC\Documents\GitHub\cex\P01_knowledge\examples\p01_knowledge_card_create_knowledge_card_about_engineering_best_practices.md	1	9.1	1.00	keep	polished formatting (whitespace cleanup)
2026-04-02 10:56:47	C:\Users\PC\Documents\GitHub\cex\P01_knowledge\examples\p01_bld_sp_manifest_software_project_create_agent_card_for_engineering_nucleus.md	1	8.8	1.00	keep	added density_score: 1.0
2026-04-02 10:57:33	C:\Users\PC\Documents\GitHub\cex\P01_knowledge\examples\p12_workflow_create_workflow_for_engineering_pipeline.md	1	8.9	1.00	keep	polished formatting (whitespace cleanup)
2026-04-02 10:58:27	C:\Users\PC\Documents\GitHub\cex\P01_knowledge\examples\p11_quality_gate_create_quality_gate_for_engineering_artifacts.md	1	9.1	1.00	keep	polished formatting (whitespace cleanup)
2026-04-02 10:59:27	C:\Users\PC\Documents\GitHub\cex\P01_knowledge\examples\p07_scoring_rubric_create_scoring_rubric_for_engineering_evaluation.md	1	9.1	1.00	keep	polished formatting (whitespace cleanup)
2026-04-02 11:00:17	C:\Users\PC\Documents\GitHub\cex\P01_knowledge\examples\p12_dispatch_rule_create_dispatch_rule_for_engineering_routing.md	1	8.7	0.79	keep	added density_score: 0.79
2026-04-02 11:01:08	C:\Users\PC\Documents\GitHub\cex\P01_knowledge\examples\p06_input_schema_create_schema_contract_for_engineering_data_model.md	1	9.1	1.00	keep	analyzed: reduce_prose: convert long prose sections into tables or bullet lists
2026-04-02 11:02:18	C:\Users\PC\Documents\GitHub\cex\P01_knowledge\examples\p05_formatter_create_output_template_for_engineering_reports.md	1	9.1	1.00	keep	analyzed: reduce_prose: convert long prose sections into tables or bullet lists
2026-04-02 11:03:31	C:\Users\PC\Documents\GitHub\cex\P01_knowledge\examples\p03_prompt_template_create_prompt_template_for_engineering_tasks.md	1	9.2	1.00	keep	analyzed: reduce_prose: convert long prose sections into tables or bullet lists
2026-04-02 11:05:05	C:\Users\PC\Documents\GitHub\cex\P01_knowledge\examples\p02_agent_create_agent_for_brand_nucleus.md	1	9.1	1.00	keep	analyzed: reduce_prose: convert long prose sections into tables or bullet lists
2026-04-02 11:06:07	C:\Users\PC\Documents\GitHub\cex\P01_knowledge\examples\p03_system_prompt_create_system_prompt_for_brand_nucleus.md	1	9.0	0.93	keep	analyzed: reduce_prose: convert long prose sections into tables or bullet lists
2026-04-02 11:07:08	C:\Users\PC\Documents\GitHub\cex\P01_knowledge\examples\p01_knowledge_card_create_knowledge_card_about_brand_best_practices.md	1	0.0	0.00	crash	compile fail after: tldr flagged for manual review
2026-04-02 11:07:09	C:\Users\PC\Documents\GitHub\cex\P01_knowledge\examples\p01_knowledge_card_create_knowledge_card_about_brand_best_practices.md	2	9.1	1.00	keep	polished formatting (whitespace cleanup)
2026-04-02 11:08:16	C:\Users\PC\Documents\GitHub\cex\P01_knowledge\examples\p08_agent_card_create_agent_card_for_brand_nucleus.md	1	9.0	1.00	keep	added density_score: 1.0
2026-04-02 11:09:17	C:\Users\PC\Documents\GitHub\cex\P01_knowledge\examples\p12_workflow_create_workflow_for_brand_pipeline.md	1	8.9	1.00	keep	polished formatting (whitespace cleanup)
2026-04-02 11:10:12	C:\Users\PC\Documents\GitHub\cex\P01_knowledge\examples\p11_quality_gate_create_quality_gate_for_brand_artifacts.md	1	8.9	1.00	keep	polished formatting (whitespace cleanup)
2026-04-02 11:11:18	C:\Users\PC\Documents\GitHub\cex\P01_knowledge\examples\p07_scoring_rubric_create_scoring_rubric_for_brand_evaluation.md	1	9.1	1.00	keep	polished formatting (whitespace cleanup)
2026-04-02 11:12:04	C:\Users\PC\Documents\GitHub\cex\P01_knowledge\examples\p12_dispatch_rule_create_dispatch_rule_for_brand_routing.md	1	8.7	0.82	keep	added density_score: 0.82
2026-04-02 11:13:02	C:\Users\PC\Documents\GitHub\cex\P01_knowledge\examples\p06_input_schema_create_schema_contract_for_brand_data_model.md	1	9.1	1.00	keep	analyzed: reduce_prose: convert long prose sections into tables or bullet lists
2026-04-02 11:14:22	C:\Users\PC\Documents\GitHub\cex\P01_knowledge\examples\p05_formatter_create_output_template_for_brand_reports.md	1	9.1	1.00	keep	analyzed: reduce_prose: convert long prose sections into tables or bullet lists
2026-04-02 11:15:50	C:\Users\PC\Documents\GitHub\cex\P01_knowledge\examples\p03_prompt_template_create_prompt_template_for_brand_tasks.md	1	9.2	1.00	keep	analyzed: reduce_prose: convert long prose sections into tables or bullet lists
2026-04-02 11:17:31	C:\Users\PC\Documents\GitHub\cex\P01_knowledge\examples\p12_workflow_create_agent_for_orchestration_nucleus.md	1	8.9	1.00	keep	polished formatting (whitespace cleanup)
2026-04-02 12:38:39	C:\Users\PC\AppData\Local\Temp\pytest-of-PC\pytest-2378\test_already_at_target0\scored.md	0	9.2	1.00	skip	already at target
2026-04-02 12:38:40	C:\Users\PC\AppData\Local\Temp\pytest-of-PC\pytest-2378\test_returns_dict0\test_artifact.md	1	8.7	0.97	keep	polished formatting (whitespace cleanup)
2026-04-02 12:38:40	C:\Users\PC\AppData\Local\Temp\pytest-of-PC\pytest-2378\test_skips_already_at_target0\test_artifact.md	0	9.5	0.97	skip	already at target
2026-04-02 12:38:40	C:\Users\PC\AppData\Local\Temp\pytest-of-PC\pytest-2378\test_keep_on_improvement0\test_artifact.md	1	8.5	0.95	keep	added examples
2026-04-02 12:38:40	C:\Users\PC\AppData\Local\Temp\pytest-of-PC\pytest-2378\test_discard_on_no_improvement0\test_artifact.md	1	6.5	0.95	discard	tried something
2026-04-02 12:38:40	C:\Users\PC\AppData\Local\Temp\pytest-of-PC\pytest-2378\test_budget_stops_loop0\test_artifact.md	1	5.0	0.95	discard	small change
