timestamp	file	round	quality	density	status	description
2026-04-15 22:04:46	C:\Users\CEX\Documents\GitHub\cex\archetypes\builders\c2pa-manifest-builder\bld_examples_c2pa_manifest.md	1	8.9	1.00	keep	analyzed: reduce_prose: convert long prose sections into tables or bullet lists
2026-04-15 22:04:46	C:\Users\CEX\Documents\GitHub\cex\archetypes\builders\c2pa-manifest-builder\bld_instruction_c2pa_manifest.md	1	8.9	1.00	keep	analyzed: reduce_prose: convert long prose sections into tables or bullet lists
2026-04-15 22:04:47	C:\Users\CEX\Documents\GitHub\cex\archetypes\builders\c2pa-manifest-builder\bld_knowledge_card_c2pa_manifest.md	1	9.2	1.00	keep	polished formatting (whitespace cleanup)
2026-04-15 22:04:47	C:\Users\CEX\Documents\GitHub\cex\archetypes\builders\c2pa-manifest-builder\bld_manifest_c2pa_manifest.md	1	8.9	0.84	keep	analyzed: reduce_prose: convert long prose sections into tables or bullet lists
2026-04-15 22:04:47	C:\Users\CEX\Documents\GitHub\cex\archetypes\builders\c2pa-manifest-builder\bld_memory_c2pa_manifest.md	1	8.7	0.97	keep	polished formatting (whitespace cleanup)
2026-04-15 22:04:48	C:\Users\CEX\Documents\GitHub\cex\archetypes\builders\c2pa-manifest-builder\bld_output_template_c2pa_manifest.md	1	8.9	1.00	keep	analyzed: reduce_prose: convert long prose sections into tables or bullet lists
2026-04-15 22:04:48	C:\Users\CEX\Documents\GitHub\cex\archetypes\builders\c2pa-manifest-builder\bld_quality_gate_c2pa_manifest.md	1	9.0	1.00	keep	polished formatting (whitespace cleanup)
2026-04-15 22:04:48	C:\Users\CEX\Documents\GitHub\cex\archetypes\builders\c2pa-manifest-builder\bld_schema_c2pa_manifest.md	1	9.1	1.00	keep	analyzed: reduce_prose: convert long prose sections into tables or bullet lists
2026-04-15 22:04:49	C:\Users\CEX\Documents\GitHub\cex\archetypes\builders\c2pa-manifest-builder\bld_system_prompt_c2pa_manifest.md	1	9.0	0.82	keep	analyzed: increase_density: remove filler words, compress prose into tables
2026-04-15 22:04:49	C:\Users\CEX\Documents\GitHub\cex\archetypes\builders\c2pa-manifest-builder\bld_tools_c2pa_manifest.md	1	8.9	1.00	keep	polished formatting (whitespace cleanup)
2026-04-15 22:04:49	C:\Users\CEX\Documents\GitHub\cex\archetypes\builders\capability-registry-builder\bld_architecture_capability_registry.md	1	9.1	1.00	keep	analyzed: reduce_prose: convert long prose sections into tables or bullet lists
2026-04-15 22:04:50	C:\Users\CEX\Documents\GitHub\cex\archetypes\builders\capability-registry-builder\bld_collaboration_capability_registry.md	1	9.0	0.95	keep	polished formatting (whitespace cleanup)
2026-04-15 22:04:50	C:\Users\CEX\Documents\GitHub\cex\archetypes\builders\capability-registry-builder\bld_config_capability_registry.md	1	8.9	1.00	keep	polished formatting (whitespace cleanup)
2026-04-15 22:04:50	C:\Users\CEX\Documents\GitHub\cex\archetypes\builders\capability-registry-builder\bld_examples_capability_registry.md	1	9.1	1.00	keep	analyzed: reduce_prose: convert long prose sections into tables or bullet lists
2026-04-15 22:04:50	C:\Users\CEX\Documents\GitHub\cex\archetypes\builders\capability-registry-builder\bld_instruction_capability_registry.md	1	8.9	0.97	keep	analyzed: reduce_prose: convert long prose sections into tables or bullet lists
2026-04-15 22:04:51	C:\Users\CEX\Documents\GitHub\cex\archetypes\builders\capability-registry-builder\bld_knowledge_card_capability_registry.md	1	9.2	0.96	keep	analyzed: reduce_prose: convert long prose sections into tables or bullet lists
2026-04-15 22:04:51	C:\Users\CEX\Documents\GitHub\cex\archetypes\builders\capability-registry-builder\bld_manifest_capability_registry.md	1	8.9	0.81	keep	analyzed: reduce_prose: convert long prose sections into tables or bullet lists
2026-04-15 22:04:51	C:\Users\CEX\Documents\GitHub\cex\archetypes\builders\capability-registry-builder\bld_memory_capability_registry.md	1	8.8	0.92	keep	polished formatting (whitespace cleanup)
2026-04-15 22:04:52	C:\Users\CEX\Documents\GitHub\cex\archetypes\builders\capability-registry-builder\bld_output_template_capability_registry.md	1	9.1	1.00	keep	analyzed: reduce_prose: convert long prose sections into tables or bullet lists
2026-04-15 22:04:52	C:\Users\CEX\Documents\GitHub\cex\archetypes\builders\capability-registry-builder\bld_quality_gate_capability_registry.md	1	9.1	1.00	keep	polished formatting (whitespace cleanup)
2026-04-15 22:04:52	C:\Users\CEX\Documents\GitHub\cex\archetypes\builders\capability-registry-builder\bld_schema_capability_registry.md	1	9.1	1.00	keep	polished formatting (whitespace cleanup)
2026-04-15 22:04:53	C:\Users\CEX\Documents\GitHub\cex\archetypes\builders\capability-registry-builder\bld_system_prompt_capability_registry.md	1	9.0	0.79	keep	analyzed: reduce_prose: convert long prose sections into tables or bullet lists
2026-04-15 22:04:53	C:\Users\CEX\Documents\GitHub\cex\archetypes\builders\capability-registry-builder\bld_tools_capability_registry.md	1	9.0	1.00	keep	polished formatting (whitespace cleanup)
2026-04-15 22:04:53	C:\Users\CEX\Documents\GitHub\cex\archetypes\builders\case-study-builder\bld_architecture_case_study.md	1	9.0	1.00	keep	polished formatting (whitespace cleanup)
2026-04-15 22:04:54	C:\Users\CEX\Documents\GitHub\cex\archetypes\builders\case-study-builder\bld_collaboration_case_study.md	1	8.9	0.86	keep	analyzed: increase_density: remove filler words, compress prose into tables
2026-04-15 22:04:54	C:\Users\CEX\Documents\GitHub\cex\archetypes\builders\case-study-builder\bld_config_case_study.md	1	8.6	1.00	keep	polished formatting (whitespace cleanup)
2026-04-15 22:04:54	C:\Users\CEX\Documents\GitHub\cex\archetypes\builders\case-study-builder\bld_examples_case_study.md	1	8.8	0.79	keep	analyzed: increase_density: remove filler words, compress prose into tables
2026-04-15 22:04:55	C:\Users\CEX\Documents\GitHub\cex\archetypes\builders\case-study-builder\bld_instruction_case_study.md	1	8.9	1.00	keep	analyzed: reduce_prose: convert long prose sections into tables or bullet lists
2026-04-15 22:04:55	C:\Users\CEX\Documents\GitHub\cex\archetypes\builders\case-study-builder\bld_knowledge_card_case_study.md	1	9.2	0.97	keep	analyzed: reduce_prose: convert long prose sections into tables or bullet lists
2026-04-15 22:04:55	C:\Users\CEX\Documents\GitHub\cex\archetypes\builders\case-study-builder\bld_manifest_case_study.md	1	8.8	0.80	keep	analyzed: increase_density: remove filler words, compress prose into tables
2026-04-15 22:04:56	C:\Users\CEX\Documents\GitHub\cex\archetypes\builders\case-study-builder\bld_memory_case_study.md	1	8.7	0.90	keep	polished formatting (whitespace cleanup)
2026-04-15 22:04:56	C:\Users\CEX\Documents\GitHub\cex\archetypes\builders\case-study-builder\bld_output_template_case_study.md	1	9.1	1.00	keep	analyzed: reduce_prose: convert long prose sections into tables or bullet lists
2026-04-15 22:04:56	C:\Users\CEX\Documents\GitHub\cex\archetypes\builders\case-study-builder\bld_quality_gate_case_study.md	1	9.0	1.00	keep	polished formatting (whitespace cleanup)
2026-04-15 22:04:56	C:\Users\CEX\Documents\GitHub\cex\archetypes\builders\case-study-builder\bld_schema_case_study.md	1	9.1	1.00	keep	analyzed: reduce_prose: convert long prose sections into tables or bullet lists
2026-04-15 22:04:57	C:\Users\CEX\Documents\GitHub\cex\archetypes\builders\case-study-builder\bld_system_prompt_case_study.md	1	8.8	0.79	keep	analyzed: increase_density: remove filler words, compress prose into tables
2026-04-15 22:04:57	C:\Users\CEX\Documents\GitHub\cex\archetypes\builders\case-study-builder\bld_tools_case_study.md	1	8.9	1.00	keep	polished formatting (whitespace cleanup)
2026-04-15 22:04:57	C:\Users\CEX\Documents\GitHub\cex\archetypes\builders\changelog-builder\bld_architecture_changelog.md	1	9.0	1.00	keep	polished formatting (whitespace cleanup)
2026-04-15 22:04:58	C:\Users\CEX\Documents\GitHub\cex\archetypes\builders\changelog-builder\bld_collaboration_changelog.md	1	8.9	0.86	keep	analyzed: increase_density: remove filler words, compress prose into tables
2026-04-15 22:04:58	C:\Users\CEX\Documents\GitHub\cex\archetypes\builders\changelog-builder\bld_config_changelog.md	1	8.6	1.00	keep	polished formatting (whitespace cleanup)
2026-04-15 22:04:58	C:\Users\CEX\Documents\GitHub\cex\archetypes\builders\changelog-builder\bld_examples_changelog.md	1	8.9	1.00	keep	analyzed: reduce_prose: convert long prose sections into tables or bullet lists
2026-04-15 22:04:59	C:\Users\CEX\Documents\GitHub\cex\archetypes\builders\changelog-builder\bld_instruction_changelog.md	1	8.9	0.95	keep	analyzed: reduce_prose: convert long prose sections into tables or bullet lists
2026-04-15 22:04:59	C:\Users\CEX\Documents\GitHub\cex\archetypes\builders\changelog-builder\bld_knowledge_card_changelog.md	1	9.2	0.98	keep	analyzed: reduce_prose: convert long prose sections into tables or bullet lists
2026-04-15 22:04:59	C:\Users\CEX\Documents\GitHub\cex\archetypes\builders\changelog-builder\bld_manifest_changelog.md	1	8.8	0.80	keep	analyzed: increase_density: remove filler words, compress prose into tables
2026-04-15 22:05:00	C:\Users\CEX\Documents\GitHub\cex\archetypes\builders\changelog-builder\bld_memory_changelog.md	1	8.7	0.95	keep	polished formatting (whitespace cleanup)
2026-04-15 22:05:00	C:\Users\CEX\Documents\GitHub\cex\archetypes\builders\changelog-builder\bld_output_template_changelog.md	1	9.0	1.00	keep	analyzed: reduce_prose: convert long prose sections into tables or bullet lists
2026-04-15 22:05:00	C:\Users\CEX\Documents\GitHub\cex\archetypes\builders\changelog-builder\bld_quality_gate_changelog.md	1	9.0	1.00	keep	polished formatting (whitespace cleanup)
2026-04-15 22:05:01	C:\Users\CEX\Documents\GitHub\cex\archetypes\builders\changelog-builder\bld_schema_changelog.md	1	9.1	1.00	keep	analyzed: reduce_prose: convert long prose sections into tables or bullet lists
2026-04-15 22:05:01	C:\Users\CEX\Documents\GitHub\cex\archetypes\builders\changelog-builder\bld_system_prompt_changelog.md	1	8.8	0.80	keep	analyzed: increase_density: remove filler words, compress prose into tables
2026-04-15 22:05:01	C:\Users\CEX\Documents\GitHub\cex\archetypes\builders\changelog-builder\bld_tools_changelog.md	1	8.9	1.00	keep	polished formatting (whitespace cleanup)
2026-04-15 22:05:02	C:\Users\CEX\Documents\GitHub\cex\archetypes\builders\churn-prevention-playbook-builder\bld_architecture_churn_prevention_playbook.md	1	9.0	1.00	keep	polished formatting (whitespace cleanup)
2026-04-15 22:05:02	C:\Users\CEX\Documents\GitHub\cex\archetypes\builders\churn-prevention-playbook-builder\bld_collaboration_churn_prevention_playbook.md	1	8.9	1.00	keep	polished formatting (whitespace cleanup)
2026-04-15 22:05:02	C:\Users\CEX\Documents\GitHub\cex\archetypes\builders\churn-prevention-playbook-builder\bld_config_churn_prevention_playbook.md	1	8.6	0.88	keep	analyzed: increase_density: remove filler words, compress prose into tables
2026-04-15 22:05:03	C:\Users\CEX\Documents\GitHub\cex\archetypes\builders\churn-prevention-playbook-builder\bld_examples_churn_prevention_playbook.md	1	8.9	1.00	keep	analyzed: reduce_prose: convert long prose sections into tables or bullet lists
2026-04-15 22:05:03	C:\Users\CEX\Documents\GitHub\cex\archetypes\builders\churn-prevention-playbook-builder\bld_instruction_churn_prevention_playbook.md	1	8.9	1.00	keep	analyzed: reduce_prose: convert long prose sections into tables or bullet lists
2026-04-15 22:05:03	C:\Users\CEX\Documents\GitHub\cex\archetypes\builders\churn-prevention-playbook-builder\bld_knowledge_card_churn_prevention_playbook.md	1	9.1	1.00	keep	polished formatting (whitespace cleanup)
2026-04-15 22:05:03	C:\Users\CEX\Documents\GitHub\cex\archetypes\builders\churn-prevention-playbook-builder\bld_manifest_churn_prevention_playbook.md	1	8.8	0.86	keep	analyzed: reduce_prose: convert long prose sections into tables or bullet lists
2026-04-15 22:05:04	C:\Users\CEX\Documents\GitHub\cex\archetypes\builders\churn-prevention-playbook-builder\bld_memory_churn_prevention_playbook.md	1	8.7	0.99	keep	polished formatting (whitespace cleanup)
2026-04-15 22:05:04	C:\Users\CEX\Documents\GitHub\cex\archetypes\builders\churn-prevention-playbook-builder\bld_output_template_churn_prevention_playbook.md	1	9.2	1.00	keep	analyzed: reduce_prose: convert long prose sections into tables or bullet lists
2026-04-15 22:05:04	C:\Users\CEX\Documents\GitHub\cex\archetypes\builders\churn-prevention-playbook-builder\bld_quality_gate_churn_prevention_playbook.md	1	9.1	1.00	keep	polished formatting (whitespace cleanup)
2026-04-15 22:05:05	C:\Users\CEX\Documents\GitHub\cex\archetypes\builders\churn-prevention-playbook-builder\bld_schema_churn_prevention_playbook.md	1	9.1	0.99	keep	analyzed: reduce_prose: convert long prose sections into tables or bullet lists
2026-04-15 22:05:05	C:\Users\CEX\Documents\GitHub\cex\archetypes\builders\churn-prevention-playbook-builder\bld_system_prompt_churn_prevention_playbook.md	1	8.9	0.81	keep	analyzed: increase_density: remove filler words, compress prose into tables
2026-04-15 22:05:05	C:\Users\CEX\Documents\GitHub\cex\archetypes\builders\churn-prevention-playbook-builder\bld_tools_churn_prevention_playbook.md	1	8.9	1.00	keep	polished formatting (whitespace cleanup)
2026-04-15 22:05:06	C:\Users\CEX\Documents\GitHub\cex\archetypes\builders\citation-builder\bld_memory_citation.md	1	8.8	0.97	keep	added density_score: 0.97
2026-04-15 22:05:06	C:\Users\CEX\Documents\GitHub\cex\archetypes\builders\code-of-conduct-builder\bld_architecture_code_of_conduct.md	1	9.0	1.00	keep	polished formatting (whitespace cleanup)
2026-04-15 22:05:06	C:\Users\CEX\Documents\GitHub\cex\archetypes\builders\code-of-conduct-builder\bld_collaboration_code_of_conduct.md	1	8.9	0.99	keep	polished formatting (whitespace cleanup)
2026-04-15 22:05:07	C:\Users\CEX\Documents\GitHub\cex\archetypes\builders\code-of-conduct-builder\bld_config_code_of_conduct.md	1	8.6	0.88	keep	analyzed: increase_density: remove filler words, compress prose into tables
2026-04-15 22:05:07	C:\Users\CEX\Documents\GitHub\cex\archetypes\builders\code-of-conduct-builder\bld_examples_code_of_conduct.md	1	9.0	0.96	keep	analyzed: reduce_prose: convert long prose sections into tables or bullet lists
2026-04-15 22:05:07	C:\Users\CEX\Documents\GitHub\cex\archetypes\builders\code-of-conduct-builder\bld_instruction_code_of_conduct.md	1	8.9	1.00	keep	analyzed: reduce_prose: convert long prose sections into tables or bullet lists
2026-04-15 22:05:08	C:\Users\CEX\Documents\GitHub\cex\archetypes\builders\code-of-conduct-builder\bld_knowledge_card_code_of_conduct.md	1	9.2	0.99	keep	analyzed: reduce_prose: convert long prose sections into tables or bullet lists
2026-04-15 22:05:08	C:\Users\CEX\Documents\GitHub\cex\archetypes\builders\code-of-conduct-builder\bld_manifest_code_of_conduct.md	1	8.8	0.82	keep	analyzed: increase_density: remove filler words, compress prose into tables
2026-04-15 22:05:08	C:\Users\CEX\Documents\GitHub\cex\archetypes\builders\code-of-conduct-builder\bld_memory_code_of_conduct.md	1	8.6	0.96	keep	polished formatting (whitespace cleanup)
2026-04-15 22:05:09	C:\Users\CEX\Documents\GitHub\cex\archetypes\builders\code-of-conduct-builder\bld_output_template_code_of_conduct.md	1	9.1	0.85	keep	analyzed: reduce_prose: convert long prose sections into tables or bullet lists
2026-04-15 22:05:09	C:\Users\CEX\Documents\GitHub\cex\archetypes\builders\code-of-conduct-builder\bld_quality_gate_code_of_conduct.md	1	9.0	1.00	keep	polished formatting (whitespace cleanup)
2026-04-15 22:05:09	C:\Users\CEX\Documents\GitHub\cex\archetypes\builders\code-of-conduct-builder\bld_schema_code_of_conduct.md	1	9.1	1.00	keep	analyzed: reduce_prose: convert long prose sections into tables or bullet lists
2026-04-15 22:05:10	C:\Users\CEX\Documents\GitHub\cex\archetypes\builders\code-of-conduct-builder\bld_system_prompt_code_of_conduct.md	1	9.0	0.80	keep	analyzed: increase_density: remove filler words, compress prose into tables
2026-04-15 22:05:10	C:\Users\CEX\Documents\GitHub\cex\archetypes\builders\code-of-conduct-builder\bld_tools_code_of_conduct.md	1	8.9	1.00	keep	polished formatting (whitespace cleanup)
2026-04-15 22:05:10	C:\Users\CEX\Documents\GitHub\cex\archetypes\builders\cohort-analysis-builder\bld_architecture_cohort_analysis.md	1	9.0	1.00	keep	polished formatting (whitespace cleanup)
2026-04-15 22:05:10	C:\Users\CEX\Documents\GitHub\cex\archetypes\builders\cohort-analysis-builder\bld_collaboration_cohort_analysis.md	1	8.9	0.86	keep	analyzed: increase_density: remove filler words, compress prose into tables
2026-04-15 22:05:11	C:\Users\CEX\Documents\GitHub\cex\archetypes\builders\cohort-analysis-builder\bld_config_cohort_analysis.md	1	8.6	0.95	keep	polished formatting (whitespace cleanup)
2026-04-15 22:05:11	C:\Users\CEX\Documents\GitHub\cex\archetypes\builders\cohort-analysis-builder\bld_examples_cohort_analysis.md	1	8.9	1.00	keep	analyzed: reduce_prose: convert long prose sections into tables or bullet lists
2026-04-15 22:05:11	C:\Users\CEX\Documents\GitHub\cex\archetypes\builders\cohort-analysis-builder\bld_instruction_cohort_analysis.md	1	8.9	0.99	keep	analyzed: reduce_prose: convert long prose sections into tables or bullet lists
2026-04-15 22:05:12	C:\Users\CEX\Documents\GitHub\cex\archetypes\builders\cohort-analysis-builder\bld_knowledge_card_cohort_analysis.md	1	9.2	1.00	keep	analyzed: reduce_prose: convert long prose sections into tables or bullet lists
2026-04-15 22:05:12	C:\Users\CEX\Documents\GitHub\cex\archetypes\builders\cohort-analysis-builder\bld_manifest_cohort_analysis.md	1	8.8	0.79	keep	analyzed: increase_density: remove filler words, compress prose into tables
2026-04-15 22:05:12	C:\Users\CEX\Documents\GitHub\cex\archetypes\builders\cohort-analysis-builder\bld_memory_cohort_analysis.md	1	8.7	0.98	keep	polished formatting (whitespace cleanup)
2026-04-15 22:05:13	C:\Users\CEX\Documents\GitHub\cex\archetypes\builders\cohort-analysis-builder\bld_output_template_cohort_analysis.md	1	8.7	1.00	keep	analyzed: reduce_prose: convert long prose sections into tables or bullet lists
2026-04-15 22:05:13	C:\Users\CEX\Documents\GitHub\cex\archetypes\builders\cohort-analysis-builder\bld_quality_gate_cohort_analysis.md	1	9.0	1.00	keep	polished formatting (whitespace cleanup)
2026-04-15 22:05:13	C:\Users\CEX\Documents\GitHub\cex\archetypes\builders\cohort-analysis-builder\bld_schema_cohort_analysis.md	1	9.1	0.98	keep	analyzed: reduce_prose: convert long prose sections into tables or bullet lists
2026-04-15 22:05:14	C:\Users\CEX\Documents\GitHub\cex\archetypes\builders\cohort-analysis-builder\bld_system_prompt_cohort_analysis.md	1	8.8	0.83	keep	analyzed: increase_density: remove filler words, compress prose into tables
2026-04-15 22:05:14	C:\Users\CEX\Documents\GitHub\cex\archetypes\builders\cohort-analysis-builder\bld_tools_cohort_analysis.md	1	8.9	1.00	keep	polished formatting (whitespace cleanup)
2026-04-15 22:05:14	C:\Users\CEX\Documents\GitHub\cex\archetypes\builders\collaboration-pattern-builder\bld_architecture_collaboration_pattern.md	1	9.0	1.00	keep	polished formatting (whitespace cleanup)
2026-04-15 22:05:15	C:\Users\CEX\Documents\GitHub\cex\archetypes\builders\collaboration-pattern-builder\bld_collaboration_collaboration_pattern.md	1	8.9	1.00	keep	polished formatting (whitespace cleanup)
2026-04-15 22:05:15	C:\Users\CEX\Documents\GitHub\cex\archetypes\builders\collaboration-pattern-builder\bld_config_collaboration_pattern.md	1	8.8	1.00	keep	polished formatting (whitespace cleanup)
2026-04-15 22:05:15	C:\Users\CEX\Documents\GitHub\cex\archetypes\builders\collaboration-pattern-builder\bld_examples_collaboration_pattern.md	1	9.1	0.99	keep	polished formatting (whitespace cleanup)
2026-04-15 22:05:16	C:\Users\CEX\Documents\GitHub\cex\archetypes\builders\collaboration-pattern-builder\bld_instruction_collaboration_pattern.md	1	9.0	1.00	keep	analyzed: reduce_prose: convert long prose sections into tables or bullet lists
2026-04-15 22:05:16	C:\Users\CEX\Documents\GitHub\cex\archetypes\builders\collaboration-pattern-builder\bld_knowledge_card_collaboration_pattern.md	1	9.2	1.00	keep	analyzed: reduce_prose: convert long prose sections into tables or bullet lists
2026-04-15 22:05:16	C:\Users\CEX\Documents\GitHub\cex\archetypes\builders\collaboration-pattern-builder\bld_manifest_collaboration_pattern.md	1	9.1	1.00	keep	polished formatting (whitespace cleanup)
2026-04-15 22:05:16	C:\Users\CEX\Documents\GitHub\cex\archetypes\builders\collaboration-pattern-builder\bld_memory_collaboration_pattern.md	1	9.2	0.92	keep	analyzed: reduce_prose: convert long prose sections into tables or bullet lists
2026-04-15 22:05:17	C:\Users\CEX\Documents\GitHub\cex\archetypes\builders\collaboration-pattern-builder\bld_output_template_collaboration_pattern.md	1	8.7	1.00	keep	analyzed: reduce_prose: convert long prose sections into tables or bullet lists
2026-04-15 22:05:17	C:\Users\CEX\Documents\GitHub\cex\archetypes\builders\collaboration-pattern-builder\bld_quality_gate_collaboration_pattern.md	1	9.1	1.00	keep	polished formatting (whitespace cleanup)
2026-04-15 22:05:17	C:\Users\CEX\Documents\GitHub\cex\archetypes\builders\collaboration-pattern-builder\bld_schema_collaboration_pattern.md	1	9.2	1.00	keep	polished formatting (whitespace cleanup)
2026-04-15 22:05:18	C:\Users\CEX\Documents\GitHub\cex\archetypes\builders\collaboration-pattern-builder\bld_system_prompt_collaboration_pattern.md	1	9.1	0.99	keep	analyzed: reduce_prose: convert long prose sections into tables or bullet lists
2026-04-15 22:05:18	C:\Users\CEX\Documents\GitHub\cex\archetypes\builders\collaboration-pattern-builder\bld_tools_collaboration_pattern.md	1	9.1	1.00	keep	polished formatting (whitespace cleanup)
2026-04-15 22:05:18	C:\Users\CEX\Documents\GitHub\cex\archetypes\builders\competitive-matrix-builder\bld_architecture_competitive_matrix.md	1	9.0	1.00	keep	polished formatting (whitespace cleanup)
