timestamp	file	round	quality	density	status	description
2026-04-07 08:41:27	C:\Users\PC\Documents\GitHub\cex\P01_knowledge\library\integration\kc_elevenlabs_tts.md	1	9.1	1.00	keep	analyzed: reduce_prose: convert long prose sections into tables or bullet lists
2026-04-07 08:41:28	C:\Users\PC\Documents\GitHub\cex\P01_knowledge\library\integration\kc_ffmpeg_patterns.md	1	9.0	1.00	keep	analyzed: reduce_prose: convert long prose sections into tables or bullet lists
2026-04-07 08:41:28	C:\Users\PC\Documents\GitHub\cex\P01_knowledge\library\integration\kc_marp_cli.md	1	9.1	1.00	keep	analyzed: reduce_prose: convert long prose sections into tables or bullet lists
2026-04-07 08:41:29	C:\Users\PC\Documents\GitHub\cex\P01_knowledge\library\integration\kc_notebooklm_integration.md	1	9.2	1.00	keep	analyzed: reduce_prose: convert long prose sections into tables or bullet lists
2026-04-07 08:41:30	C:\Users\PC\Documents\GitHub\cex\P01_knowledge\library\integration\kc_pandoc_pipeline.md	1	9.1	1.00	keep	analyzed: reduce_prose: convert long prose sections into tables or bullet lists
2026-04-07 08:41:31	C:\Users\PC\Documents\GitHub\cex\P01_knowledge\library\integration\kc_runway_api.md	1	9.1	1.00	keep	analyzed: reduce_prose: convert long prose sections into tables or bullet lists
2026-04-07 08:41:32	C:\Users\PC\Documents\GitHub\cex\P01_knowledge\library\integration\kc_typst_patterns.md	1	9.0	1.00	keep	analyzed: reduce_prose: convert long prose sections into tables or bullet lists
2026-04-07 08:41:32	C:\Users\PC\Documents\GitHub\cex\P01_knowledge\library\integration\kc_youtube_api.md	1	9.0	1.00	keep	analyzed: reduce_prose: convert long prose sections into tables or bullet lists
2026-04-07 08:41:33	C:\Users\PC\Documents\GitHub\cex\P01_knowledge\library\kind\kc_landing_page.md	1	8.8	1.00	keep	added density_score: 1.0
2026-04-07 08:41:34	C:\Users\PC\Documents\GitHub\cex\P01_knowledge\library\kind\kc_landing_page.md	2	8.8	1.00	discard	tldr flagged for manual review
2026-04-07 08:41:34	C:\Users\PC\Documents\GitHub\cex\P01_knowledge\library\kind\kc_landing_page.md	3	8.8	1.00	discard	tldr flagged for manual review
2026-04-07 08:41:35	C:\Users\PC\Documents\GitHub\cex\P01_knowledge\library\kind\kc_tagline.md	1	8.9	1.00	keep	added density_score: 1.0
2026-04-07 08:41:35	C:\Users\PC\Documents\GitHub\cex\P01_knowledge\library\kind\kc_tagline.md	2	8.9	1.00	discard	tldr flagged for manual review
2026-04-07 08:41:35	C:\Users\PC\Documents\GitHub\cex\P01_knowledge\library\kind\kc_tagline.md	3	8.9	1.00	discard	tldr flagged for manual review
2026-04-07 08:41:36	C:\Users\PC\Documents\GitHub\cex\P01_knowledge\library\specs\openclaude_patterns\PATTERNS_INDEX.md	1	9.0	1.00	keep	added density_score: 1.0
2026-04-07 08:41:37	C:\Users\PC\Documents\GitHub\cex\P02_model\examples\ex_model_provider_anthropic_claude.md	1	9.1	1.00	keep	analyzed: reduce_prose: convert long prose sections into tables or bullet lists
2026-04-07 08:41:38	C:\Users\PC\Documents\GitHub\cex\P03_prompt\examples\ex_reasoning_trace_8f_pipeline.md	1	9.1	1.00	keep	polished formatting (whitespace cleanup)
2026-04-07 08:41:39	C:\Users\PC\Documents\GitHub\cex\P03_prompts\actions\content_factory\p03_ap_cf_generate_campaign.md	1	9.1	1.00	keep	analyzed: reduce_prose: convert long prose sections into tables or bullet lists
2026-04-07 08:41:40	C:\Users\PC\Documents\GitHub\cex\P03_prompts\actions\content_factory\p03_ap_cf_generate_course.md	1	9.1	1.00	keep	analyzed: reduce_prose: convert long prose sections into tables or bullet lists
2026-04-07 08:41:40	C:\Users\PC\Documents\GitHub\cex\P03_prompts\actions\content_factory\p03_ap_cf_generate_ebook.md	1	9.1	1.00	keep	polished formatting (whitespace cleanup)
2026-04-07 08:41:41	C:\Users\PC\Documents\GitHub\cex\P03_prompts\actions\content_factory\p03_ap_cf_generate_podcast.md	1	9.1	1.00	keep	polished formatting (whitespace cleanup)
2026-04-07 08:41:42	C:\Users\PC\Documents\GitHub\cex\P03_prompts\actions\content_factory\p03_ap_cf_generate_presentation.md	1	9.1	1.00	keep	analyzed: reduce_prose: convert long prose sections into tables or bullet lists
2026-04-07 08:41:43	C:\Users\PC\Documents\GitHub\cex\P03_prompts\actions\content_factory\p03_ap_cf_generate_video.md	1	9.1	1.00	keep	analyzed: reduce_prose: convert long prose sections into tables or bullet lists
2026-04-07 08:41:43	C:\Users\PC\Documents\GitHub\cex\P03_prompts\actions\content_factory\p03_ap_cf_publish.md	1	9.1	0.98	keep	analyzed: reduce_prose: convert long prose sections into tables or bullet lists
2026-04-07 08:41:44	C:\Users\PC\Documents\GitHub\cex\P03_prompts\constraints\content_factory\p03_constraint_cf_brief.md	1	9.1	1.00	keep	added density_score: 1.0
2026-04-07 08:41:45	C:\Users\PC\Documents\GitHub\cex\P03_prompts\constraints\content_factory\p03_constraint_cf_course.md	1	9.1	1.00	keep	added density_score: 1.0
2026-04-07 08:41:46	C:\Users\PC\Documents\GitHub\cex\P03_prompts\constraints\content_factory\p03_constraint_cf_ebook.md	1	9.1	1.00	keep	added density_score: 1.0
2026-04-07 08:41:47	C:\Users\PC\Documents\GitHub\cex\P03_prompts\constraints\content_factory\p03_constraint_cf_podcast.md	1	9.1	1.00	keep	added density_score: 1.0
2026-04-07 08:41:47	C:\Users\PC\Documents\GitHub\cex\P03_prompts\constraints\content_factory\p03_constraint_cf_presentation.md	1	9.1	1.00	keep	added density_score: 1.0
2026-04-07 08:41:48	C:\Users\PC\Documents\GitHub\cex\P03_prompts\constraints\content_factory\p03_constraint_cf_video.md	1	9.1	1.00	keep	added density_score: 1.0
2026-04-07 08:41:49	C:\Users\PC\Documents\GitHub\cex\P03_prompts\templates\content_factory\p03_pt_cf_course_outline.md	1	9.1	1.00	keep	analyzed: reduce_prose: convert long prose sections into tables or bullet lists
2026-04-07 08:41:50	C:\Users\PC\Documents\GitHub\cex\P03_prompts\templates\content_factory\p03_pt_cf_ebook_chapter.md	1	9.1	0.99	keep	analyzed: reduce_prose: convert long prose sections into tables or bullet lists
2026-04-07 08:41:51	C:\Users\PC\Documents\GitHub\cex\P03_prompts\templates\content_factory\p03_pt_cf_lesson_script.md	1	9.1	0.98	keep	analyzed: reduce_prose: convert long prose sections into tables or bullet lists
2026-04-07 08:41:51	C:\Users\PC\Documents\GitHub\cex\P03_prompts\templates\content_factory\p03_pt_cf_quiz.md	1	9.1	1.00	keep	analyzed: reduce_prose: convert long prose sections into tables or bullet lists
2026-04-07 08:41:52	C:\Users\PC\Documents\GitHub\cex\P03_prompts\templates\content_factory\p03_pt_cf_slide_deck.md	1	9.1	1.00	keep	analyzed: reduce_prose: convert long prose sections into tables or bullet lists
2026-04-07 08:41:53	C:\Users\PC\Documents\GitHub\cex\P03_prompts\templates\content_factory\p03_pt_cf_social_post.md	1	9.1	1.00	keep	analyzed: reduce_prose: convert long prose sections into tables or bullet lists
2026-04-07 08:41:54	C:\Users\PC\Documents\GitHub\cex\P03_prompts\templates\content_factory\p03_pt_cf_video_script.md	1	9.1	0.99	keep	analyzed: reduce_prose: convert long prose sections into tables or bullet lists
2026-04-07 08:41:54	C:\Users\PC\Documents\GitHub\cex\P04_tools\examples\ex_toolkit_browser_tools.md	1	9.1	1.00	keep	analyzed: reduce_prose: convert long prose sections into tables or bullet lists
2026-04-07 08:41:55	C:\Users\PC\Documents\GitHub\cex\P04_tools\functions\content_factory\p04_fn_cf_canva_create.md	1	9.0	0.91	keep	added density_score: 0.91
2026-04-07 08:41:56	C:\Users\PC\Documents\GitHub\cex\P04_tools\functions\content_factory\p04_fn_cf_canva_export.md	1	9.0	0.91	keep	added density_score: 0.91
2026-04-07 08:41:57	C:\Users\PC\Documents\GitHub\cex\P04_tools\functions\content_factory\p04_fn_cf_ebook_compile.md	1	9.0	0.99	keep	added density_score: 0.99
2026-04-07 08:41:57	C:\Users\PC\Documents\GitHub\cex\P04_tools\functions\content_factory\p04_fn_cf_elevenlabs_tts.md	1	9.0	0.94	keep	added density_score: 0.94
2026-04-07 08:41:58	C:\Users\PC\Documents\GitHub\cex\P04_tools\functions\content_factory\p04_fn_cf_pdf_generate.md	1	9.0	0.98	keep	added density_score: 0.98
2026-04-07 08:41:59	C:\Users\PC\Documents\GitHub\cex\P04_tools\functions\content_factory\p04_fn_cf_slides_generate.md	1	9.0	0.99	keep	added density_score: 0.99
2026-04-07 08:42:00	C:\Users\PC\Documents\GitHub\cex\P04_tools\functions\content_factory\p04_fn_cf_video_assemble.md	1	9.0	0.92	keep	added density_score: 0.92
2026-04-07 08:42:01	C:\Users\PC\Documents\GitHub\cex\P07_evals\examples\ex_trace_config_opentelemetry.md	1	9.1	1.00	keep	analyzed: reduce_prose: convert long prose sections into tables or bullet lists
2026-04-07 08:42:02	C:\Users\PC\Documents\GitHub\cex\P10_memory\examples\ex_compression_config_token_reduction_50pct.md	1	9.1	1.00	keep	analyzed: reduce_prose: convert long prose sections into tables or bullet lists
2026-04-07 08:42:02	C:\Users\PC\Documents\GitHub\cex\P10_memory\examples\ex_session_backend_redis_config.md	1	9.1	1.00	keep	polished formatting (whitespace cleanup)
2026-04-07 08:42:03	C:\Users\PC\Documents\GitHub\cex\P12_orchestration\dags\content_factory\dag_cf_course.md	1	9.0	1.00	keep	added density_score: 1.0
2026-04-07 08:42:04	C:\Users\PC\Documents\GitHub\cex\P12_orchestration\dags\content_factory\dag_cf_ebook.md	1	9.0	1.00	keep	added density_score: 1.0
2026-04-07 08:42:05	C:\Users\PC\Documents\GitHub\cex\P12_orchestration\dags\content_factory\dag_cf_master.md	1	9.0	1.00	keep	added density_score: 1.0
2026-04-07 08:42:06	C:\Users\PC\Documents\GitHub\cex\P12_orchestration\dags\content_factory\dag_cf_presentation.md	1	9.0	1.00	keep	added density_score: 1.0
2026-04-07 08:42:06	C:\Users\PC\Documents\GitHub\cex\P12_orchestration\dags\content_factory\dag_cf_social.md	1	9.0	1.00	keep	added density_score: 1.0
2026-04-07 08:42:07	C:\Users\PC\Documents\GitHub\cex\P12_orchestration\dags\content_factory\dag_cf_video.md	1	9.0	1.00	keep	added density_score: 1.0
2026-04-07 08:42:08	C:\Users\PC\Documents\GitHub\cex\P12_orchestration\examples\ex_workflow_primitive_map_reduce.md	1	9.1	1.00	keep	analyzed: reduce_prose: convert long prose sections into tables or bullet lists
2026-04-07 08:42:09	C:\Users\PC\Documents\GitHub\cex\P12_orchestration\workflows\content_factory\p12_wf_cf_email_launch.md	1	9.0	1.00	keep	polished formatting (whitespace cleanup)
2026-04-07 08:42:09	C:\Users\PC\Documents\GitHub\cex\P12_orchestration\workflows\content_factory\p12_wf_cf_promote.md	1	8.9	1.00	keep	polished formatting (whitespace cleanup)
2026-04-07 08:42:10	C:\Users\PC\Documents\GitHub\cex\P12_orchestration\workflows\content_factory\p12_wf_cf_promote.md	2	8.9	1.00	discard	polished formatting (whitespace cleanup)
2026-04-07 08:42:10	C:\Users\PC\Documents\GitHub\cex\P12_orchestration\workflows\content_factory\p12_wf_cf_promote.md	3	8.9	1.00	discard	polished formatting (whitespace cleanup)
2026-04-07 08:42:11	C:\Users\PC\Documents\GitHub\cex\P12_orchestration\workflows\content_factory\p12_wf_cf_publish_hotmart.md	1	9.0	1.00	keep	polished formatting (whitespace cleanup)
2026-04-07 08:42:12	C:\Users\PC\Documents\GitHub\cex\P12_orchestration\workflows\content_factory\p12_wf_cf_publish_social.md	1	8.9	1.00	keep	polished formatting (whitespace cleanup)
2026-04-07 08:42:12	C:\Users\PC\Documents\GitHub\cex\P12_orchestration\workflows\content_factory\p12_wf_cf_publish_social.md	2	8.9	1.00	discard	polished formatting (whitespace cleanup)
2026-04-07 08:42:12	C:\Users\PC\Documents\GitHub\cex\P12_orchestration\workflows\content_factory\p12_wf_cf_publish_social.md	3	8.9	1.00	discard	polished formatting (whitespace cleanup)
2026-04-07 08:42:13	C:\Users\PC\Documents\GitHub\cex\P12_orchestration\workflows\content_factory\p12_wf_cf_publish_youtube.md	1	9.0	1.00	keep	polished formatting (whitespace cleanup)
2026-04-07 08:42:14	C:\Users\PC\Documents\GitHub\cex\_docs\AGNO_vs_CEX_ANALYSIS.md	1	9.1	1.00	keep	added density_score: 1.0
2026-04-07 08:42:15	C:\Users\PC\Documents\GitHub\cex\_docs\ASSIMILATION_PLAN.md	1	9.0	1.00	keep	added density_score: 1.0
2026-04-07 08:42:16	C:\Users\PC\Documents\GitHub\cex\_docs\CROSS_REPO_ANALYSIS.md	1	9.1	1.00	keep	polished formatting (whitespace cleanup)
2026-04-07 08:42:17	C:\Users\PC\Documents\GitHub\cex\_docs\specs\spec_autoresearch_assimilation.md	1	8.8	1.00	keep	added density_score: 1.0
2026-04-07 08:42:17	C:\Users\PC\Documents\GitHub\cex\_docs\specs\spec_autoresearch_assimilation.md	2	8.8	1.00	discard	tldr flagged for manual review
2026-04-07 08:42:18	C:\Users\PC\Documents\GitHub\cex\_docs\specs\spec_autoresearch_assimilation.md	3	8.8	1.00	discard	tldr flagged for manual review
2026-04-07 08:42:18	C:\Users\PC\Documents\GitHub\cex\_docs\tests\e2e_gold\docs_marketing.md	1	9.1	0.98	keep	tldr flagged for manual review
2026-04-07 08:42:19	C:\Users\PC\Documents\GitHub\cex\_docs\tests\e2e_gold\instagram_marketing.md	1	8.8	1.00	keep	added density_score: 1.0
2026-04-07 08:42:20	C:\Users\PC\Documents\GitHub\cex\_docs\tests\e2e_gold\instagram_marketing.md	2	8.8	1.00	discard	tldr flagged for manual review
2026-04-07 08:42:20	C:\Users\PC\Documents\GitHub\cex\_docs\tests\e2e_gold\instagram_marketing.md	3	8.8	1.00	discard	tldr flagged for manual review
2026-04-07 08:42:21	C:\Users\PC\Documents\GitHub\cex\_docs\tests\e2e_gold\petshop_marketing.md	1	9.0	1.00	keep	added density_score: 1.0
2026-04-07 08:42:22	C:\Users\PC\Documents\GitHub\cex\_docs\tests\e2e_gold\quality_rubric.md	1	9.0	0.97	keep	added density_score: 0.97
2026-04-07 08:42:22	C:\Users\PC\Documents\GitHub\cex\_docs\tests\e2e_output\instagram_content.md	1	9.1	1.00	keep	added density_score: 1.0
2026-04-07 08:42:23	C:\Users\PC\Documents\GitHub\cex\_docs\tests\e2e_output\petshop_landing.md	1	9.0	0.99	keep	added density_score: 0.99
2026-04-07 08:42:24	C:\Users\PC\Documents\GitHub\cex\_docs\tests\e2e_output\project_docs.md	1	9.0	1.00	keep	added density_score: 1.0
2026-04-07 08:42:25	C:\Users\PC\Documents\GitHub\cex\_instances\_template\N04_knowledge\supabase_config.md	1	9.0	1.00	keep	analyzed: reduce_prose: convert long prose sections into tables or bullet lists
2026-04-07 08:42:26	C:\Users\PC\Documents\GitHub\cex\_instances\_template\N06_commercial\content_monetization_config.md	1	9.0	1.00	keep	added density_score: 1.0
2026-04-07 08:42:26	C:\Users\PC\Documents\GitHub\cex\_instances\_template\N06_commercial\launch_checklist.md	1	8.9	1.00	keep	added density_score: 1.0
2026-04-07 08:42:27	C:\Users\PC\Documents\GitHub\cex\_instances\_template\N06_commercial\launch_checklist.md	2	8.9	1.00	discard	analyzed: fix_frontmatter: missing title
2026-04-07 08:42:27	C:\Users\PC\Documents\GitHub\cex\_instances\_template\N06_commercial\launch_checklist.md	3	8.9	1.00	discard	analyzed: fix_frontmatter: missing title
2026-04-07 08:42:28	C:\Users\PC\Documents\GitHub\cex\_instances\_template\N06_commercial\pricing_model.md	1	9.0	1.00	keep	added density_score: 1.0
2026-04-07 08:42:29	C:\Users\PC\Documents\GitHub\cex\_tools\proof\rebuilt\agent-builder\bld_quality_gate_agent.md	1	9.0	1.00	keep	polished formatting (whitespace cleanup)
2026-04-07 08:42:29	C:\Users\PC\Documents\GitHub\cex\_tools\proof\rebuilt\agent-builder\bld_system_prompt_agent.md	1	9.0	0.87	keep	analyzed: reduce_prose: convert long prose sections into tables or bullet lists
2026-04-07 08:42:30	C:\Users\PC\Documents\GitHub\cex\_tools\proof\rebuilt\director-builder\bld_instruction_director.md	1	9.0	0.93	keep	analyzed: reduce_prose: convert long prose sections into tables or bullet lists
2026-04-07 08:42:31	C:\Users\PC\Documents\GitHub\cex\_tools\proof\rebuilt\director-builder\bld_quality_gate_director.md	1	9.0	0.96	keep	analyzed: add_tags: minimum 3 tags required
2026-04-07 08:42:32	C:\Users\PC\Documents\GitHub\cex\_tools\proof\rebuilt\director-builder\bld_system_prompt_director.md	1	9.0	0.87	keep	analyzed: reduce_prose: convert long prose sections into tables or bullet lists
2026-04-07 08:42:32	C:\Users\PC\Documents\GitHub\cex\_tools\proof\rebuilt\env-config-builder\bld_quality_gate_env_config.md	1	9.0	1.00	keep	polished formatting (whitespace cleanup)
2026-04-07 08:42:33	C:\Users\PC\Documents\GitHub\cex\_tools\proof\rebuilt\env-config-builder\bld_system_prompt_env_config.md	1	9.0	0.78	keep	analyzed: increase_density: remove filler words, compress prose into tables
2026-04-07 08:42:34	C:\Users\PC\Documents\GitHub\cex\_tools\proof\rebuilt\knowledge-card-builder\bld_quality_gate_knowledge_card.md	1	9.0	0.99	keep	polished formatting (whitespace cleanup)
2026-04-07 08:42:35	C:\Users\PC\Documents\GitHub\cex\_tools\proof\rebuilt\knowledge-card-builder\bld_system_prompt_knowledge_card.md	1	9.0	0.79	keep	analyzed: reduce_prose: convert long prose sections into tables or bullet lists
2026-04-07 08:42:36	C:\Users\PC\Documents\GitHub\cex\_tools\proof\rebuilt\quality-gate-builder\bld_instruction_quality_gate.md	1	9.1	0.93	keep	analyzed: reduce_prose: convert long prose sections into tables or bullet lists
2026-04-07 08:42:36	C:\Users\PC\Documents\GitHub\cex\_tools\proof\rebuilt\quality-gate-builder\bld_quality_gate_quality_gate.md	1	9.0	0.98	keep	analyzed: add_tags: minimum 3 tags required
2026-04-07 08:42:37	C:\Users\PC\Documents\GitHub\cex\_tools\proof\rebuilt\quality-gate-builder\bld_system_prompt_quality_gate.md	1	9.0	0.86	keep	analyzed: reduce_prose: convert long prose sections into tables or bullet lists
2026-04-07 08:42:38	C:\Users\PC\Documents\GitHub\cex\_tools\proof\rebuilt\signal-builder\bld_instruction_signal.md	1	9.0	0.92	keep	analyzed: reduce_prose: convert long prose sections into tables or bullet lists
2026-04-07 08:42:38	C:\Users\PC\Documents\GitHub\cex\_tools\proof\rebuilt\signal-builder\bld_quality_gate_signal.md	1	9.0	0.96	keep	analyzed: add_tags: minimum 3 tags required
2026-04-07 08:42:39	C:\Users\PC\Documents\GitHub\cex\_tools\proof\rebuilt\signal-builder\bld_system_prompt_signal.md	1	9.0	0.85	keep	analyzed: reduce_prose: convert long prose sections into tables or bullet lists
2026-04-07 12:06:40	C:\Users\PC\Documents\GitHub\cex\.cex\runtime\plans\mission_self_bootstrap.md	1	8.8	1.00	keep	added density_score: 1.0
2026-04-07 12:06:41	C:\Users\PC\Documents\GitHub\cex\N01_intelligence\deck_n01.md	1	9.0	1.00	keep	added density_score: 1.0
2026-04-07 12:06:42	C:\Users\PC\Documents\GitHub\cex\N01_intelligence\output\grid_test_20260407.md	1	8.9	1.00	keep	added density_score: 1.0
2026-04-07 12:06:43	C:\Users\PC\Documents\GitHub\cex\N02_marketing\deck_n02.md	1	9.1	1.00	keep	added density_score: 1.0
2026-04-07 12:06:43	C:\Users\PC\Documents\GitHub\cex\N02_marketing\output\output_grid_test.md	1	8.8	1.00	keep	added density_score: 1.0
2026-04-07 12:06:44	C:\Users\PC\Documents\GitHub\cex\N03_engineering\deck_n03.md	1	9.0	1.00	keep	added density_score: 1.0
2026-04-07 12:06:45	C:\Users\PC\Documents\GitHub\cex\N04_knowledge\deck_n04.md	1	9.1	1.00	keep	added density_score: 1.0
2026-04-07 12:06:45	C:\Users\PC\Documents\GitHub\cex\N04_knowledge\output\grid_test_20260407.md	1	8.9	1.00	keep	added density_score: 1.0
2026-04-07 12:06:46	C:\Users\PC\Documents\GitHub\cex\N05_operations\deck_n05.md	1	9.0	1.00	keep	added density_score: 1.0
2026-04-07 12:06:47	C:\Users\PC\Documents\GitHub\cex\N05_operations\output\grid_test_20260407.md	1	8.8	1.00	keep	added density_score: 1.0
2026-04-07 12:06:48	C:\Users\PC\Documents\GitHub\cex\N06_commercial\deck_n06.md	1	9.1	1.00	keep	added density_score: 1.0
2026-04-07 12:06:48	C:\Users\PC\Documents\GitHub\cex\N07_admin\deck_n07.md	1	9.0	1.00	keep	added density_score: 1.0
2026-04-07 12:06:49	C:\Users\PC\Documents\GitHub\cex\P01_knowledge\examples\p01_knowledge_card_create_knowledge_card_about_rag_chunking_strategies_comparis.md	1	9.1	1.00	keep	analyzed: reduce_prose: convert long prose sections into tables or bullet lists
2026-04-07 12:06:50	C:\Users\PC\Documents\GitHub\cex\P01_knowledge\library\domain\patterns\kc_prompt_evolution.md	1	9.1	1.00	keep	polished formatting (whitespace cleanup)
2026-04-07 12:06:50	C:\Users\PC\Documents\GitHub\cex\P01_knowledge\library\domain\patterns\kc_query_decomposition.md	1	9.1	1.00	keep	analyzed: reduce_prose: convert long prose sections into tables or bullet lists
2026-04-07 12:06:51	C:\Users\PC\Documents\GitHub\cex\_docs\specs\spec_context_assembly.md	1	9.0	1.00	keep	added density_score: 1.0
2026-04-07 12:06:52	C:\Users\PC\Documents\GitHub\cex\_docs\specs\spec_metaphor_dictionary.md	1	9.0	1.00	keep	added density_score: 1.0
2026-04-07 12:06:52	C:\Users\PC\Documents\GitHub\cex\_docs\specs\spec_n07_bootstrap_context.md	1	8.9	1.00	keep	added density_score: 1.0
2026-04-07 12:14:27	C:\Users\PC\AppData\Local\Temp\pytest-of-PC\pytest-2396\test_already_at_target0\scored.md	0	9.2	1.00	skip	already at target
2026-04-07 12:14:28	C:\Users\PC\AppData\Local\Temp\pytest-of-PC\pytest-2396\test_returns_dict0\test_artifact.md	1	8.7	0.97	keep	polished formatting (whitespace cleanup)
2026-04-07 12:14:28	C:\Users\PC\AppData\Local\Temp\pytest-of-PC\pytest-2396\test_skips_already_at_target0\test_artifact.md	0	9.5	0.97	skip	already at target
2026-04-07 12:14:28	C:\Users\PC\AppData\Local\Temp\pytest-of-PC\pytest-2396\test_keep_on_improvement0\test_artifact.md	1	8.5	0.95	keep	added examples
2026-04-07 12:14:28	C:\Users\PC\AppData\Local\Temp\pytest-of-PC\pytest-2396\test_discard_on_no_improvement0\test_artifact.md	1	6.5	0.95	discard	tried something
2026-04-07 12:14:28	C:\Users\PC\AppData\Local\Temp\pytest-of-PC\pytest-2396\test_budget_stops_loop0\test_artifact.md	1	5.0	0.95	discard	small change
2026-04-07 12:24:31	C:\Users\PC\AppData\Local\Temp\pytest-of-PC\pytest-2397\test_already_at_target0\scored.md	0	9.2	1.00	skip	already at target
2026-04-07 12:24:32	C:\Users\PC\AppData\Local\Temp\pytest-of-PC\pytest-2397\test_returns_dict0\test_artifact.md	1	8.7	0.97	keep	polished formatting (whitespace cleanup)
2026-04-07 12:24:32	C:\Users\PC\AppData\Local\Temp\pytest-of-PC\pytest-2397\test_skips_already_at_target0\test_artifact.md	0	9.5	0.97	skip	already at target
2026-04-07 12:24:32	C:\Users\PC\AppData\Local\Temp\pytest-of-PC\pytest-2397\test_keep_on_improvement0\test_artifact.md	1	8.5	0.95	keep	added examples
2026-04-07 12:24:32	C:\Users\PC\AppData\Local\Temp\pytest-of-PC\pytest-2397\test_discard_on_no_improvement0\test_artifact.md	1	6.5	0.95	discard	tried something
