timestamp	file	round	quality	density	status	description
2026-04-02 12:44:52	C:\Users\PC\AppData\Local\Temp\pytest-of-PC\pytest-2379\test_already_at_target0\scored.md	0	9.2	1.00	skip	already at target
2026-04-02 12:44:53	C:\Users\PC\AppData\Local\Temp\pytest-of-PC\pytest-2379\test_returns_dict0\test_artifact.md	1	8.7	0.97	keep	polished formatting (whitespace cleanup)
2026-04-02 12:44:53	C:\Users\PC\AppData\Local\Temp\pytest-of-PC\pytest-2379\test_skips_already_at_target0\test_artifact.md	0	9.5	0.97	skip	already at target
2026-04-02 12:44:53	C:\Users\PC\AppData\Local\Temp\pytest-of-PC\pytest-2379\test_keep_on_improvement0\test_artifact.md	1	8.5	0.95	keep	added examples
2026-04-02 12:44:53	C:\Users\PC\AppData\Local\Temp\pytest-of-PC\pytest-2379\test_discard_on_no_improvement0\test_artifact.md	1	6.5	0.95	discard	tried something
2026-04-02 12:44:53	C:\Users\PC\AppData\Local\Temp\pytest-of-PC\pytest-2379\test_budget_stops_loop0\test_artifact.md	1	5.0	0.95	discard	small change
2026-04-02 12:48:20	C:\Users\PC\AppData\Local\Temp\pytest-of-PC\pytest-2382\test_already_at_target0\scored.md	0	9.2	1.00	skip	already at target
2026-04-02 12:48:20	C:\Users\PC\AppData\Local\Temp\pytest-of-PC\pytest-2382\test_returns_dict0\test_artifact.md	1	8.7	0.97	keep	polished formatting (whitespace cleanup)
2026-04-02 12:48:20	C:\Users\PC\AppData\Local\Temp\pytest-of-PC\pytest-2382\test_skips_already_at_target0\test_artifact.md	0	9.5	0.97	skip	already at target
2026-04-02 12:48:20	C:\Users\PC\AppData\Local\Temp\pytest-of-PC\pytest-2382\test_keep_on_improvement0\test_artifact.md	1	8.5	0.95	keep	added examples
2026-04-02 12:48:20	C:\Users\PC\AppData\Local\Temp\pytest-of-PC\pytest-2382\test_discard_on_no_improvement0\test_artifact.md	1	6.5	0.95	discard	tried something
2026-04-02 12:48:20	C:\Users\PC\AppData\Local\Temp\pytest-of-PC\pytest-2382\test_budget_stops_loop0\test_artifact.md	1	5.0	0.95	discard	small change
2026-04-02 13:02:07	C:\Users\PC\Documents\GitHub\cex\P01_knowledge\examples\p12_dispatch_rule_create_dispatch_rule_for_test.md	1	8.7	0.79	keep	added density_score: 0.79
2026-04-02 13:03:25	C:\Users\PC\AppData\Local\Temp\pytest-of-PC\pytest-2388\test_already_at_target0\scored.md	0	9.2	1.00	skip	already at target
2026-04-02 13:03:25	C:\Users\PC\AppData\Local\Temp\pytest-of-PC\pytest-2389\test_already_at_target0\scored.md	0	9.2	1.00	skip	already at target
2026-04-02 13:03:26	C:\Users\PC\AppData\Local\Temp\pytest-of-PC\pytest-2388\test_returns_dict0\test_artifact.md	1	8.7	0.97	keep	polished formatting (whitespace cleanup)
2026-04-02 13:03:26	C:\Users\PC\AppData\Local\Temp\pytest-of-PC\pytest-2388\test_skips_already_at_target0\test_artifact.md	0	9.5	0.97	skip	already at target
2026-04-02 13:03:26	C:\Users\PC\AppData\Local\Temp\pytest-of-PC\pytest-2388\test_keep_on_improvement0\test_artifact.md	1	8.5	0.95	keep	added examples
2026-04-02 13:03:26	C:\Users\PC\AppData\Local\Temp\pytest-of-PC\pytest-2388\test_discard_on_no_improvement0\test_artifact.md	1	6.5	0.95	discard	tried something
2026-04-02 13:03:26	C:\Users\PC\AppData\Local\Temp\pytest-of-PC\pytest-2388\test_budget_stops_loop0\test_artifact.md	1	5.0	0.95	discard	small change
2026-04-02 13:03:26	C:\Users\PC\AppData\Local\Temp\pytest-of-PC\pytest-2389\test_returns_dict0\test_artifact.md	1	8.7	0.97	keep	polished formatting (whitespace cleanup)
2026-04-02 13:03:26	C:\Users\PC\AppData\Local\Temp\pytest-of-PC\pytest-2389\test_skips_already_at_target0\test_artifact.md	0	9.5	0.97	skip	already at target
2026-04-02 13:03:26	C:\Users\PC\AppData\Local\Temp\pytest-of-PC\pytest-2389\test_keep_on_improvement0\test_artifact.md	1	8.5	0.95	keep	added examples
2026-04-02 13:03:26	C:\Users\PC\AppData\Local\Temp\pytest-of-PC\pytest-2389\test_discard_on_no_improvement0\test_artifact.md	1	6.5	0.95	discard	tried something
2026-04-02 13:03:26	C:\Users\PC\AppData\Local\Temp\pytest-of-PC\pytest-2389\test_budget_stops_loop0\test_artifact.md	1	5.0	0.95	discard	small change
2026-04-02 13:07:31	C:\Users\PC\Documents\GitHub\cex\P01_knowledge\examples\p02_agent_create_agent_for_creation_nucleus.md	1	9.1	1.00	keep	analyzed: reduce_prose: convert long prose sections into tables or bullet lists
2026-04-02 13:08:55	C:\Users\PC\Documents\GitHub\cex\P01_knowledge\examples\p03_system_prompt_create_system_prompt_for_creation_nucleus.md	1	9.0	0.89	keep	analyzed: increase_density: remove filler words, compress prose into tables
2026-04-02 13:10:54	C:\Users\PC\Documents\GitHub\cex\P01_knowledge\examples\p01_knowledge_card_create_knowledge_card_about_creation_best_practices.md	1	9.1	1.00	keep	analyzed: reduce_prose: convert long prose sections into tables or bullet lists
2026-04-02 13:12:34	C:\Users\PC\Documents\GitHub\cex\P01_knowledge\examples\p02_agent_create_agent_card_for_creation_nucleus.md	1	9.2	1.00	keep	analyzed: reduce_prose: convert long prose sections into tables or bullet lists
2026-04-02 13:13:52	C:\Users\PC\Documents\GitHub\cex\P01_knowledge\examples\p12_workflow_create_workflow_for_creation_pipeline.md	1	9.0	1.00	keep	polished formatting (whitespace cleanup)
2026-04-02 13:14:47	C:\Users\PC\Documents\GitHub\cex\P01_knowledge\examples\p11_quality_gate_create_quality_gate_for_creation_artifacts.md	1	9.1	0.99	keep	polished formatting (whitespace cleanup)
2026-04-02 13:15:53	C:\Users\PC\Documents\GitHub\cex\P01_knowledge\examples\p07_scoring_rubric_create_scoring_rubric_for_creation_evaluation.md	1	9.1	1.00	keep	polished formatting (whitespace cleanup)
2026-04-02 13:17:04	C:\Users\PC\Documents\GitHub\cex\P01_knowledge\examples\p12_dispatch_rule_create_dispatch_rule_for_creation_routing.md	1	8.8	0.78	keep	added density_score: 0.78
2026-04-02 13:18:34	C:\Users\PC\Documents\GitHub\cex\P01_knowledge\examples\p06_input_schema_create_schema_contract_for_creation_data_model.md	1	0.0	0.00	crash	compile fail after: tldr flagged for manual review
2026-04-02 13:18:35	C:\Users\PC\Documents\GitHub\cex\P01_knowledge\examples\p06_input_schema_create_schema_contract_for_creation_data_model.md	2	9.1	1.00	keep	analyzed: reduce_prose: convert long prose sections into tables or bullet lists
2026-04-02 13:19:44	C:\Users\PC\Documents\GitHub\cex\P01_knowledge\examples\p05_formatter_create_output_template_for_creation_reports.md	1	9.1	1.00	keep	analyzed: reduce_prose: convert long prose sections into tables or bullet lists
2026-04-02 13:20:58	C:\Users\PC\Documents\GitHub\cex\P01_knowledge\examples\p03_prompt_template_create_prompt_template_for_creation_tasks.md	1	9.2	0.94	keep	analyzed: reduce_prose: convert long prose sections into tables or bullet lists
2026-04-02 13:23:35	C:\Users\PC\Documents\GitHub\cex\P01_knowledge\examples\p01_bld_sp_manifest_software_project_create_agent_for_engineering_nucleus.md	1	9.1	1.00	keep	analyzed: reduce_prose: convert long prose sections into tables or bullet lists
2026-04-02 13:25:12	C:\Users\PC\Documents\GitHub\cex\P01_knowledge\examples\p03_system_prompt_create_system_prompt_for_engineering_nucleus.md	1	9.0	0.90	keep	polished formatting (whitespace cleanup)
2026-04-02 13:26:20	C:\Users\PC\Documents\GitHub\cex\P01_knowledge\examples\p01_knowledge_card_create_knowledge_card_about_engineering_best_practices.md	1	0.0	0.00	crash	compile fail after: tldr flagged for manual review
2026-04-02 13:26:21	C:\Users\PC\Documents\GitHub\cex\P01_knowledge\examples\p01_knowledge_card_create_knowledge_card_about_engineering_best_practices.md	2	9.1	1.00	keep	polished formatting (whitespace cleanup)
2026-04-02 13:27:21	C:\Users\PC\Documents\GitHub\cex\P01_knowledge\examples\p01_bld_sp_manifest_software_project_create_agent_card_for_engineering_nucleus.md	1	9.0	1.00	keep	added density_score: 1.0
2026-04-02 13:28:36	C:\Users\PC\Documents\GitHub\cex\P01_knowledge\examples\p12_workflow_create_workflow_for_engineering_pipeline.md	1	9.0	0.99	keep	polished formatting (whitespace cleanup)
2026-04-02 13:29:48	C:\Users\PC\Documents\GitHub\cex\P01_knowledge\examples\p11_quality_gate_create_quality_gate_for_engineering_artifacts.md	1	9.0	1.00	keep	polished formatting (whitespace cleanup)
2026-04-02 13:31:15	C:\Users\PC\Documents\GitHub\cex\P01_knowledge\examples\p07_scoring_rubric_create_scoring_rubric_for_engineering_evaluation.md	1	0.0	0.00	crash	compile fail after: tldr flagged for manual review
2026-04-02 13:31:15	C:\Users\PC\Documents\GitHub\cex\P01_knowledge\examples\p07_scoring_rubric_create_scoring_rubric_for_engineering_evaluation.md	2	9.1	1.00	keep	polished formatting (whitespace cleanup)
2026-04-02 13:32:21	C:\Users\PC\Documents\GitHub\cex\P01_knowledge\examples\p12_dispatch_rule_create_dispatch_rule_for_engineering_routing.md	1	0.0	0.00	crash	compile fail after: added density_score: 0.86
2026-04-02 13:32:21	C:\Users\PC\Documents\GitHub\cex\P01_knowledge\examples\p12_dispatch_rule_create_dispatch_rule_for_engineering_routing.md	2	8.7	0.79	keep	analyzed: fix_frontmatter: missing title
2026-04-02 13:33:47	C:\Users\PC\Documents\GitHub\cex\P01_knowledge\examples\p06_input_schema_create_schema_contract_for_engineering_data_model.md	1	9.1	1.00	keep	analyzed: reduce_prose: convert long prose sections into tables or bullet lists
2026-04-02 13:35:32	C:\Users\PC\Documents\GitHub\cex\P01_knowledge\examples\p05_formatter_create_output_template_for_engineering_reports.md	1	0.0	0.00	crash	compile fail after: tldr flagged for manual review
2026-04-02 13:35:33	C:\Users\PC\Documents\GitHub\cex\P01_knowledge\examples\p05_formatter_create_output_template_for_engineering_reports.md	2	9.1	1.00	keep	analyzed: reduce_prose: convert long prose sections into tables or bullet lists
2026-04-02 13:37:34	C:\Users\PC\Documents\GitHub\cex\P01_knowledge\examples\p03_prompt_template_create_prompt_template_for_engineering_tasks.md	1	9.1	0.99	keep	analyzed: reduce_prose: convert long prose sections into tables or bullet lists
2026-04-02 13:39:43	C:\Users\PC\Documents\GitHub\cex\P01_knowledge\examples\p02_agent_create_agent_for_brand_nucleus.md	1	9.1	1.00	keep	analyzed: reduce_prose: convert long prose sections into tables or bullet lists
2026-04-02 13:40:50	C:\Users\PC\Documents\GitHub\cex\P01_knowledge\examples\p03_system_prompt_create_system_prompt_for_brand_nucleus.md	1	9.0	0.93	keep	polished formatting (whitespace cleanup)
2026-04-02 13:42:15	C:\Users\PC\Documents\GitHub\cex\P01_knowledge\examples\p01_knowledge_card_create_knowledge_card_about_brand_best_practices.md	1	9.2	1.00	keep	analyzed: reduce_prose: convert long prose sections into tables or bullet lists
2026-04-02 13:43:36	C:\Users\PC\Documents\GitHub\cex\P01_knowledge\examples\p08_agent_card_create_agent_card_for_brand_nucleus.md	1	9.1	1.00	keep	added density_score: 1.0
2026-04-02 13:45:06	C:\Users\PC\Documents\GitHub\cex\P01_knowledge\examples\p12_workflow_create_workflow_for_brand_pipeline.md	1	9.0	1.00	keep	polished formatting (whitespace cleanup)
2026-04-02 13:46:10	C:\Users\PC\Documents\GitHub\cex\P01_knowledge\examples\p11_quality_gate_create_quality_gate_for_brand_artifacts.md	1	9.1	1.00	keep	polished formatting (whitespace cleanup)
2026-04-02 13:47:34	C:\Users\PC\Documents\GitHub\cex\P01_knowledge\examples\p07_scoring_rubric_create_scoring_rubric_for_brand_evaluation.md	1	9.1	0.96	keep	polished formatting (whitespace cleanup)
2026-04-02 13:48:45	C:\Users\PC\Documents\GitHub\cex\P01_knowledge\examples\p12_dispatch_rule_create_dispatch_rule_for_brand_routing.md	1	8.8	0.79	keep	added density_score: 0.79
2026-04-02 13:50:38	C:\Users\PC\Documents\GitHub\cex\P01_knowledge\examples\p06_input_schema_create_schema_contract_for_brand_data_model.md	1	9.1	1.00	keep	analyzed: reduce_prose: convert long prose sections into tables or bullet lists
2026-04-02 13:52:36	C:\Users\PC\Documents\GitHub\cex\P01_knowledge\examples\p05_formatter_create_output_template_for_brand_reports.md	1	9.1	1.00	keep	analyzed: reduce_prose: convert long prose sections into tables or bullet lists
2026-04-02 13:54:09	C:\Users\PC\Documents\GitHub\cex\P01_knowledge\examples\p03_prompt_template_create_prompt_template_for_brand_tasks.md	1	9.2	0.99	keep	analyzed: reduce_prose: convert long prose sections into tables or bullet lists
2026-04-02 13:55:59	C:\Users\PC\Documents\GitHub\cex\P01_knowledge\examples\p12_workflow_create_agent_for_orchestration_nucleus.md	1	8.9	1.00	keep	polished formatting (whitespace cleanup)
2026-04-02 13:57:08	C:\Users\PC\Documents\GitHub\cex\P01_knowledge\examples\p03_system_prompt_create_system_prompt_for_orchestration_nucleus.md	1	9.0	0.91	keep	polished formatting (whitespace cleanup)
2026-04-02 13:59:01	C:\Users\PC\Documents\GitHub\cex\P01_knowledge\examples\p01_knowledge_card_create_knowledge_card_about_orchestration_best_practices.md	1	9.2	1.00	keep	analyzed: reduce_prose: convert long prose sections into tables or bullet lists
2026-04-02 14:00:23	C:\Users\PC\Documents\GitHub\cex\P01_knowledge\examples\p08_agent_card_create_agent_card_for_orchestration_nucleus.md	1	0.0	0.00	crash	compile fail after: added density_score: 1.0
2026-04-02 14:00:24	C:\Users\PC\Documents\GitHub\cex\P01_knowledge\examples\p08_agent_card_create_agent_card_for_orchestration_nucleus.md	2	9.0	1.00	keep	analyzed: reduce_prose: convert long prose sections into tables or bullet lists
2026-04-02 14:01:46	C:\Users\PC\Documents\GitHub\cex\P01_knowledge\examples\p12_workflow_create_workflow_for_orchestration_pipeline.md	1	9.0	0.97	keep	polished formatting (whitespace cleanup)
2026-04-02 14:03:18	C:\Users\PC\Documents\GitHub\cex\P01_knowledge\examples\p11_quality_gate_create_quality_gate_for_orchestration_artifacts.md	1	9.1	0.99	keep	polished formatting (whitespace cleanup)
2026-04-02 14:05:11	C:\Users\PC\Documents\GitHub\cex\P01_knowledge\examples\p07_scoring_rubric_create_scoring_rubric_for_orchestration_evaluation.md	1	9.1	1.00	keep	polished formatting (whitespace cleanup)
2026-04-02 14:06:06	C:\Users\PC\Documents\GitHub\cex\P01_knowledge\examples\p12_dispatch_rule_create_dispatch_rule_for_orchestration_routing.md	1	8.8	0.81	keep	added density_score: 0.81
2026-04-02 14:07:18	C:\Users\PC\Documents\GitHub\cex\P01_knowledge\examples\p06_input_schema_create_schema_contract_for_orchestration_data_model.md	1	9.1	1.00	keep	analyzed: reduce_prose: convert long prose sections into tables or bullet lists
2026-04-02 14:08:26	C:\Users\PC\Documents\GitHub\cex\P01_knowledge\examples\p05_formatter_create_output_template_for_orchestration_reports.md	1	9.1	1.00	keep	analyzed: reduce_prose: convert long prose sections into tables or bullet lists
2026-04-02 14:13:01	C:\Users\PC\Documents\GitHub\cex\P01_knowledge\examples\p04_research_pipeline_create_agent_for_intelligence_nucleus.md	1	9.1	1.00	keep	added density_score: 1.0
2026-04-02 14:14:20	C:\Users\PC\Documents\GitHub\cex\P01_knowledge\examples\p03_system_prompt_create_system_prompt_for_intelligence_nucleus.md	1	9.0	0.86	keep	analyzed: increase_density: remove filler words, compress prose into tables
2026-04-02 14:15:34	C:\Users\PC\Documents\GitHub\cex\P01_knowledge\examples\p01_knowledge_card_create_knowledge_card_about_intelligence_best_practices.md	1	0.0	0.00	crash	compile fail after: tldr flagged for manual review
2026-04-02 14:15:35	C:\Users\PC\Documents\GitHub\cex\P01_knowledge\examples\p01_knowledge_card_create_knowledge_card_about_intelligence_best_practices.md	2	9.1	1.00	keep	analyzed: reduce_prose: convert long prose sections into tables or bullet lists
2026-04-02 14:17:02	C:\Users\PC\Documents\GitHub\cex\P01_knowledge\examples\p08_agent_card_create_agent_card_for_intelligence_nucleus.md	1	0.0	0.00	crash	compile fail after: added density_score: 1.0
2026-04-02 14:17:02	C:\Users\PC\Documents\GitHub\cex\P01_knowledge\examples\p08_agent_card_create_agent_card_for_intelligence_nucleus.md	2	9.0	1.00	keep	analyzed: reduce_prose: convert long prose sections into tables or bullet lists
2026-04-02 14:17:58	C:\Users\PC\Documents\GitHub\cex\P01_knowledge\examples\p12_workflow_create_workflow_for_intelligence_pipeline.md	1	9.0	0.99	keep	polished formatting (whitespace cleanup)
2026-04-02 14:19:50	C:\Users\PC\Documents\GitHub\cex\P01_knowledge\examples\p11_quality_gate_create_quality_gate_for_intelligence_artifacts.md	1	9.1	1.00	keep	polished formatting (whitespace cleanup)
2026-04-02 14:20:57	C:\Users\PC\Documents\GitHub\cex\P01_knowledge\examples\p07_scoring_rubric_create_scoring_rubric_for_intelligence_evaluation.md	1	9.1	1.00	keep	polished formatting (whitespace cleanup)
2026-04-02 14:22:26	C:\Users\PC\Documents\GitHub\cex\P01_knowledge\examples\p12_dispatch_rule_create_dispatch_rule_for_intelligence_routing.md	1	0.0	0.00	crash	compile fail after: added density_score: 0.84
2026-04-02 14:22:27	C:\Users\PC\Documents\GitHub\cex\P01_knowledge\examples\p12_dispatch_rule_create_dispatch_rule_for_intelligence_routing.md	2	9.0	0.99	keep	analyzed: fix_frontmatter: missing title
2026-04-02 14:23:32	C:\Users\PC\Documents\GitHub\cex\P01_knowledge\examples\p06_input_schema_create_schema_contract_for_intelligence_data_model.md	1	9.1	1.00	keep	analyzed: reduce_prose: convert long prose sections into tables or bullet lists
2026-04-02 14:24:46	C:\Users\PC\Documents\GitHub\cex\P01_knowledge\examples\p05_formatter_create_output_template_for_intelligence_reports.md	1	9.2	1.00	keep	analyzed: reduce_prose: convert long prose sections into tables or bullet lists
2026-04-02 14:26:19	C:\Users\PC\Documents\GitHub\cex\P01_knowledge\examples\p03_prompt_template_create_prompt_template_for_intelligence_tasks.md	1	0.0	0.00	crash	compile fail after: tldr flagged for manual review
2026-04-02 14:26:19	C:\Users\PC\Documents\GitHub\cex\P01_knowledge\examples\p03_prompt_template_create_prompt_template_for_intelligence_tasks.md	2	9.2	1.00	keep	analyzed: reduce_prose: convert long prose sections into tables or bullet lists
2026-04-02 14:28:38	C:\Users\PC\Documents\GitHub\cex\P01_knowledge\examples\p04_research_pipeline_create_agent_for_marketing_nucleus.md	1	9.2	1.00	keep	added density_score: 1.0
2026-04-02 14:30:00	C:\Users\PC\Documents\GitHub\cex\P01_knowledge\examples\p03_system_prompt_create_system_prompt_for_marketing_nucleus.md	1	9.0	0.91	keep	polished formatting (whitespace cleanup)
2026-04-02 14:31:09	C:\Users\PC\Documents\GitHub\cex\P01_knowledge\examples\p01_knowledge_card_create_knowledge_card_about_marketing_best_practices.md	1	0.0	0.00	crash	compile fail after: tldr flagged for manual review
2026-04-02 14:31:09	C:\Users\PC\Documents\GitHub\cex\P01_knowledge\examples\p01_knowledge_card_create_knowledge_card_about_marketing_best_practices.md	2	0.0	0.00	crash	compile fail after: tldr flagged for manual review
2026-04-02 14:31:09	C:\Users\PC\Documents\GitHub\cex\P01_knowledge\examples\p01_knowledge_card_create_knowledge_card_about_marketing_best_practices.md	3	0.0	0.00	crash	compile fail after: tldr flagged for manual review
2026-04-02 14:32:50	C:\Users\PC\Documents\GitHub\cex\P01_knowledge\examples\p01_knowledge_card_create_knowledge_card_about_marketing_best_practices.md	1	8.9	1.00	keep	Expand the truncated Launch phase description with specific budget allocation, testing setup, and tracking requirements to improve COMPLETENESS dimension.
2026-04-02 14:34:15	C:\Users\PC\Documents\GitHub\cex\P01_knowledge\examples\p01_knowledge_card_create_knowledge_card_about_marketing_best_practices.md	2	9.0	1.00	keep	Expand the Flow section with detailed steps, decision points, and specific metrics to improve COMPLETENESS dimension.
2026-04-02 14:35:33	C:\Users\PC\Documents\GitHub\cex\P01_knowledge\examples\p08_agent_card_create_agent_card_for_marketing_nucleus.md	1	0.0	0.00	crash	compile fail after: added density_score: 1.0
2026-04-02 14:35:34	C:\Users\PC\Documents\GitHub\cex\P01_knowledge\examples\p08_agent_card_create_agent_card_for_marketing_nucleus.md	2	0.0	0.00	crash	compile fail after: added density_score: 1.0
2026-04-02 14:35:34	C:\Users\PC\Documents\GitHub\cex\P01_knowledge\examples\p08_agent_card_create_agent_card_for_marketing_nucleus.md	3	0.0	0.00	crash	compile fail after: added density_score: 1.0
2026-04-02 14:36:53	C:\Users\PC\Documents\GitHub\cex\P01_knowledge\examples\p08_agent_card_create_agent_card_for_marketing_nucleus.md	1	0.0	0.00	crash	compile fail: Add WHY explanations to constraints table and expand clarity→desire→action formula with marketing psychology insights to improve INSIGHT_DEPTH dimension.
2026-04-02 14:37:54	C:\Users\PC\Documents\GitHub\cex\P01_knowledge\examples\p08_agent_card_create_agent_card_for_marketing_nucleus.md	2	0.0	0.00	crash	compile fail: Add anti-patterns section with specific marketing psychology failures to improve INSIGHT_DEPTH dimension through actionable negative examples.
2026-04-02 14:39:04	C:\Users\PC\Documents\GitHub\cex\P01_knowledge\examples\p08_agent_card_create_agent_card_for_marketing_nucleus.md	3	0.0	0.00	crash	compile fail: Add specific neuroscience research about cognitive processing speeds and decision-making patterns to enhance the marketing psychology insights in the output formula section.
2026-04-02 14:40:22	C:\Users\PC\Documents\GitHub\cex\P01_knowledge\examples\p08_agent_card_create_agent_card_for_marketing_nucleus.md	4	0.0	0.00	crash	compile fail: Add specific psychological triggers section with concrete examples to deepen marketing psychology insights for INSIGHT_DEPTH dimension
2026-04-02 14:41:48	C:\Users\PC\Documents\GitHub\cex\P01_knowledge\examples\p08_agent_card_create_agent_card_for_marketing_nucleus.md	5	0.0	0.00	crash	compile fail: Expand Dependencies section with specific failure modes and architectural insights to improve INSIGHT_DEPTH through concrete operational knowledge.
2026-04-02 14:42:55	C:\Users\PC\Documents\GitHub\cex\P01_knowledge\examples\p12_workflow_create_workflow_for_marketing_pipeline.md	1	9.0	1.00	keep	polished formatting (whitespace cleanup)
2026-04-02 14:44:01	C:\Users\PC\Documents\GitHub\cex\P01_knowledge\examples\p11_quality_gate_create_quality_gate_for_marketing_artifacts.md	1	9.1	0.99	keep	polished formatting (whitespace cleanup)
