timestamp	file	round	quality	density	status	description
2026-04-02 00:58:39	C:\Users\PC\Documents\GitHub\cex\N02_marketing\schemas\a11y_checklist.md	2	8.9	1.00	discard	analyzed: reduce_prose: convert long prose sections into tables or bullet lists
2026-04-02 00:58:39	C:\Users\PC\Documents\GitHub\cex\N02_marketing\schemas\a11y_checklist.md	3	8.9	1.00	discard	analyzed: reduce_prose: convert long prose sections into tables or bullet lists
2026-04-02 00:59:19	C:\Users\PC\Documents\GitHub\cex\N02_marketing\schemas\a11y_checklist.md	1	8.9	1.00	discard	Add a concise "Common Failures" section with specific anti-patterns to improve actionability
2026-04-02 00:59:52	C:\Users\PC\Documents\GitHub\cex\N02_marketing\schemas\a11y_checklist.md	2	8.9	1.00	discard	Add Priority column to each WCAG section table to improve actionability by helping users focus on highest-impact accessibility fixes first
2026-04-02 01:00:28	C:\Users\PC\Documents\GitHub\cex\N02_marketing\schemas\a11y_checklist.md	3	8.9	1.00	discard	Make threshold values more specific and actionable with concrete implementation details
2026-04-02 01:01:07	C:\Users\PC\Documents\GitHub\cex\N02_marketing\schemas\a11y_checklist.md	4	8.9	1.00	discard	Expand Schema Purpose section with specific workflow integration steps to improve actionability for N02 HTML artifact validation
2026-04-02 01:01:43	C:\Users\PC\Documents\GitHub\cex\N02_marketing\schemas\a11y_checklist.md	5	8.9	1.00	discard	Add a "Quick Test Protocol" section with step-by-step validation workflow to improve actionability
2026-04-02 01:01:44	C:\Users\PC\Documents\GitHub\cex\N02_marketing\tools\social_publisher_marketing.md	1	8.9	1.00	discard	analyzed: reduce_prose: convert long prose sections into tables or bullet lists
2026-04-02 01:01:44	C:\Users\PC\Documents\GitHub\cex\N02_marketing\tools\social_publisher_marketing.md	2	8.9	1.00	discard	analyzed: reduce_prose: convert long prose sections into tables or bullet lists
2026-04-02 01:01:45	C:\Users\PC\Documents\GitHub\cex\N02_marketing\tools\social_publisher_marketing.md	3	8.9	1.00	discard	analyzed: reduce_prose: convert long prose sections into tables or bullet lists
2026-04-02 01:02:10	C:\Users\PC\Documents\GitHub\cex\N02_marketing\tools\social_publisher_marketing.md	1	8.9	1.00	discard	Add missing `when_to_use` frontmatter field to improve completeness and actionability guidance
2026-04-02 01:02:44	C:\Users\PC\Documents\GitHub\cex\N02_marketing\tools\social_publisher_marketing.md	2	8.9	1.00	discard	Add anti-patterns section with specific "don't do this" guidance to improve actionability and help users avoid common mistakes
2026-04-02 01:03:17	C:\Users\PC\Documents\GitHub\cex\N02_marketing\tools\social_publisher_marketing.md	3	8.9	1.00	discard	Replace wordy Config Reference section with concrete YAML example to improve actionability and density
2026-04-02 01:03:47	C:\Users\PC\Documents\GitHub\cex\N02_marketing\tools\social_publisher_marketing.md	4	8.9	1.00	discard	Convert verbose ASCII pipeline diagram to dense step-by-step table format for better actionability and information density
2026-04-02 01:04:19	C:\Users\PC\Documents\GitHub\cex\N02_marketing\tools\social_publisher_marketing.md	5	8.9	1.00	discard	Replace generic Config Reference section with concrete config structure example to improve actionability and density
2026-04-02 01:04:20	C:\Users\PC\Documents\GitHub\cex\N02_marketing\output\output_dashboard_ui.md	1	8.9	1.00	discard	analyzed: reduce_prose: convert long prose sections into tables or bullet lists
2026-04-02 01:04:20	C:\Users\PC\Documents\GitHub\cex\N02_marketing\output\output_dashboard_ui.md	2	8.9	1.00	discard	analyzed: reduce_prose: convert long prose sections into tables or bullet lists
2026-04-02 01:04:20	C:\Users\PC\Documents\GitHub\cex\N02_marketing\output\output_dashboard_ui.md	3	8.9	1.00	discard	analyzed: reduce_prose: convert long prose sections into tables or bullet lists
2026-04-02 01:05:30	C:\Users\PC\Documents\GitHub\cex\N02_marketing\output\output_dashboard_ui.md	1	8.9	1.00	discard	Add anti-patterns section to improve actionability with specific "don't do this" guidance for dashboard design
2026-04-02 01:06:44	C:\Users\PC\Documents\GitHub\cex\N02_marketing\output\output_dashboard_ui.md	2	8.9	1.00	discard	Convert the brief "Variants" section into an actionable "Implementation Variants" table with specific use cases and modification instructions
2026-04-02 01:07:52	C:\Users\PC\Documents\GitHub\cex\N02_marketing\output\output_dashboard_ui.md	3	8.9	1.00	discard	Enhance the "Purpose" section with specific use-case guidance and measurable benefits to improve actionability
2026-04-02 01:09:06	C:\Users\PC\Documents\GitHub\cex\N02_marketing\output\output_dashboard_ui.md	4	8.9	1.00	discard	Add a "Customization Guide" section with actionable modification instructions in table format to improve usability
2026-04-02 01:10:34	C:\Users\PC\Documents\GitHub\cex\N02_marketing\output\output_dashboard_ui.md	5	8.9	1.00	discard	Enhance the "Responsive Behavior" section with detailed mobile UX patterns and implementation specifics to improve actionability
2026-04-02 01:10:34	C:\Users\PC\Documents\GitHub\cex\N02_marketing\output\output_social_card.md	1	8.9	1.00	discard	analyzed: reduce_prose: convert long prose sections into tables or bullet lists
2026-04-02 01:10:35	C:\Users\PC\Documents\GitHub\cex\N02_marketing\output\output_social_card.md	2	8.9	1.00	discard	analyzed: reduce_prose: convert long prose sections into tables or bullet lists
2026-04-02 01:10:35	C:\Users\PC\Documents\GitHub\cex\N02_marketing\output\output_social_card.md	3	8.9	1.00	discard	analyzed: reduce_prose: convert long prose sections into tables or bullet lists
2026-04-02 01:11:18	C:\Users\PC\Documents\GitHub\cex\N02_marketing\output\output_social_card.md	1	8.9	1.00	discard	Add anti-patterns section to improve actionability with specific "don't do this" guidance
2026-04-02 01:11:56	C:\Users\PC\Documents\GitHub\cex\N02_marketing\output\output_social_card.md	2	8.9	1.00	discard	Add "Usage Guidelines" section with platform-specific customization recommendations to improve actionability
2026-04-02 01:12:34	C:\Users\PC\Documents\GitHub\cex\N02_marketing\output\output_social_card.md	3	8.9	1.00	discard	Complete the Instagram template with full HTML structure instead of just CSS styles
2026-04-02 01:13:18	C:\Users\PC\Documents\GitHub\cex\N02_marketing\output\output_social_card.md	4	8.9	1.00	discard	Replace comment-heavy "Rendering to Image" section with actual executable commands and specific file examples
2026-04-02 01:13:57	C:\Users\PC\Documents\GitHub\cex\N02_marketing\output\output_social_card.md	5	8.9	1.00	discard	Add "Validation Checklist" section with specific verification steps to improve actionability
2026-04-02 01:13:58	C:\Users\PC\Documents\GitHub\cex\N02_marketing\orchestration\dispatch_rule_social_publisher.md	1	8.9	1.00	discard	analyzed: reduce_prose: convert long prose sections into tables or bullet lists
2026-04-02 01:13:58	C:\Users\PC\Documents\GitHub\cex\N02_marketing\orchestration\dispatch_rule_social_publisher.md	2	8.9	1.00	discard	analyzed: reduce_prose: convert long prose sections into tables or bullet lists
2026-04-02 01:13:58	C:\Users\PC\Documents\GitHub\cex\N02_marketing\orchestration\dispatch_rule_social_publisher.md	3	8.9	1.00	discard	analyzed: reduce_prose: convert long prose sections into tables or bullet lists
2026-04-02 01:14:23	C:\Users\PC\Documents\GitHub\cex\N02_marketing\orchestration\dispatch_rule_social_publisher.md	1	8.9	1.00	discard	Add anti-patterns section with specific routing edge cases to improve actionability and decision-making guidance
2026-04-02 01:14:55	C:\Users\PC\Documents\GitHub\cex\N02_marketing\orchestration\dispatch_rule_social_publisher.md	2	8.9	1.00	discard	Add concrete examples section to improve actionability with specific routing scenarios
2026-04-02 01:15:21	C:\Users\PC\Documents\GitHub\cex\N02_marketing\orchestration\dispatch_rule_social_publisher.md	3	8.8	1.00	discard	Expand validation section with comprehensive pre-dispatch checks and error handling to improve actionability
2026-04-02 01:15:48	C:\Users\PC\Documents\GitHub\cex\N02_marketing\orchestration\dispatch_rule_social_publisher.md	4	8.9	1.00	discard	Add "Exclusions" section with specific scenarios when NOT to route here to improve orchestrator decision-making
2026-04-02 01:16:14	C:\Users\PC\Documents\GitHub\cex\N02_marketing\orchestration\dispatch_rule_social_publisher.md	5	8.9	1.00	discard	Enhance routing rules table with more precise confidence thresholds and clearer routing decision criteria
2026-04-02 01:16:15	C:\Users\PC\Documents\GitHub\cex\N02_marketing\orchestration\workflow_marketing.md	1	8.9	1.00	discard	analyzed: reduce_prose: convert long prose sections into tables or bullet lists
2026-04-02 01:16:15	C:\Users\PC\Documents\GitHub\cex\N02_marketing\orchestration\workflow_marketing.md	2	8.9	1.00	discard	analyzed: reduce_prose: convert long prose sections into tables or bullet lists
2026-04-02 01:16:16	C:\Users\PC\Documents\GitHub\cex\N02_marketing\orchestration\workflow_marketing.md	3	8.9	1.00	discard	analyzed: reduce_prose: convert long prose sections into tables or bullet lists
2026-04-02 01:17:31	C:\Users\PC\Documents\GitHub\cex\N04_knowledge\knowledge\knowledge_card_knowledge.md	1	8.9	0.84	discard	analyzed: increase_density: remove filler words, compress prose into tables
2026-04-02 01:17:31	C:\Users\PC\Documents\GitHub\cex\N04_knowledge\knowledge\knowledge_card_knowledge.md	2	8.9	0.84	discard	analyzed: increase_density: remove filler words, compress prose into tables
2026-04-02 01:17:31	C:\Users\PC\Documents\GitHub\cex\N04_knowledge\knowledge\knowledge_card_knowledge.md	3	8.9	0.84	discard	analyzed: increase_density: remove filler words, compress prose into tables
2026-04-02 01:18:18	C:\Users\PC\Documents\GitHub\cex\N04_knowledge\knowledge\knowledge_card_knowledge.md	1	9.0	0.90	keep	Add anti-patterns section to improve actionability by showing what NOT to do in knowledge management
2026-04-02 01:18:19	C:\Users\PC\Documents\GitHub\cex\N04_knowledge\knowledge\embedding_config_supabase.md	1	8.9	1.00	discard	analyzed: reduce_prose: convert long prose sections into tables or bullet lists
2026-04-02 01:18:19	C:\Users\PC\Documents\GitHub\cex\N04_knowledge\knowledge\embedding_config_supabase.md	2	8.9	1.00	discard	analyzed: reduce_prose: convert long prose sections into tables or bullet lists
2026-04-02 01:18:20	C:\Users\PC\Documents\GitHub\cex\N04_knowledge\knowledge\embedding_config_supabase.md	3	8.9	1.00	discard	analyzed: reduce_prose: convert long prose sections into tables or bullet lists
2026-04-02 01:18:53	C:\Users\PC\Documents\GitHub\cex\N04_knowledge\knowledge\embedding_config_supabase.md	1	8.9	1.00	discard	Add anti-patterns section to improve actionability with specific warnings about common pgvector configuration mistakes
2026-04-02 01:19:28	C:\Users\PC\Documents\GitHub\cex\N04_knowledge\knowledge\embedding_config_supabase.md	2	8.9	1.00	discard	Add practical scenarios section with specific configuration recommendations for common use cases to improve actionability
2026-04-02 01:20:06	C:\Users\PC\Documents\GitHub\cex\N04_knowledge\knowledge\embedding_config_supabase.md	3	8.9	1.00	discard	Break down the monolithic Setup SQL section into focused subsections for better structure and actionability
2026-04-02 01:20:43	C:\Users\PC\Documents\GitHub\cex\N04_knowledge\knowledge\embedding_config_supabase.md	4	8.9	1.00	discard	Add performance benchmarks section to provide actionable query time expectations for different configurations
2026-04-02 01:21:34	C:\Users\PC\Documents\GitHub\cex\N04_knowledge\knowledge\embedding_config_supabase.md	5	8.9	1.00	discard	Add Quick Start section with condensed step-by-step setup flow to improve immediate actionability
2026-04-02 01:21:35	C:\Users\PC\Documents\GitHub\cex\N02_marketing\output\output_style_guide.md	1	8.9	0.96	discard	analyzed: reduce_prose: convert long prose sections into tables or bullet lists
2026-04-02 01:21:35	C:\Users\PC\Documents\GitHub\cex\N02_marketing\output\output_style_guide.md	2	8.9	0.96	discard	analyzed: reduce_prose: convert long prose sections into tables or bullet lists
2026-04-02 01:21:35	C:\Users\PC\Documents\GitHub\cex\N02_marketing\output\output_style_guide.md	3	8.9	0.96	discard	analyzed: reduce_prose: convert long prose sections into tables or bullet lists
2026-04-02 01:22:45	C:\Users\PC\Documents\GitHub\cex\N02_marketing\output\output_style_guide.md	1	8.9	1.00	discard	Add anti-patterns section to improve actionability by showing what NOT to do when implementing design systems
2026-04-02 01:23:53	C:\Users\PC\Documents\GitHub\cex\N02_marketing\output\output_style_guide.md	2	8.9	1.00	discard	Expand the Usage section with detailed customization patterns and implementation steps to improve actionability.
2026-04-02 01:24:52	C:\Users\PC\Documents\GitHub\cex\N02_marketing\output\output_style_guide.md	3	8.9	1.00	discard	Convert Template Structure outline to structured table format for improved density and actionability
2026-04-02 01:25:53	C:\Users\PC\Documents\GitHub\cex\N02_marketing\output\output_style_guide.md	4	8.9	0.96	discard	Enhance Template Structure section with specific CSS custom properties and implementation details for each section to improve technical actionability
2026-04-02 01:27:01	C:\Users\PC\Documents\GitHub\cex\N02_marketing\output\output_style_guide.md	5	8.9	0.96	discard	Add when_to_use frontmatter field to improve front matter completeness score
2026-04-02 01:27:02	C:\Users\PC\Documents\GitHub\cex\N04_knowledge\knowledge\knowledge_card_supabase_data_layer.md	1	8.9	1.00	discard	polished formatting (whitespace cleanup)
2026-04-02 01:27:02	C:\Users\PC\Documents\GitHub\cex\N04_knowledge\knowledge\knowledge_card_supabase_data_layer.md	2	8.9	1.00	discard	polished formatting (whitespace cleanup)
2026-04-02 01:27:02	C:\Users\PC\Documents\GitHub\cex\N04_knowledge\knowledge\knowledge_card_supabase_data_layer.md	3	8.9	1.00	discard	polished formatting (whitespace cleanup)
2026-04-02 01:27:31	C:\Users\PC\Documents\GitHub\cex\N04_knowledge\knowledge\knowledge_card_supabase_data_layer.md	1	8.9	1.00	discard	Add anti-patterns section to improve actionability by showing specific failure scenarios to avoid
2026-04-02 01:28:04	C:\Users\PC\Documents\GitHub\cex\N04_knowledge\knowledge\knowledge_card_supabase_data_layer.md	2	8.9	1.00	discard	Convert Decision Flow from text diagram to structured table format for better density and actionability
2026-04-02 01:28:33	C:\Users\PC\Documents\GitHub\cex\N04_knowledge\knowledge\knowledge_card_supabase_data_layer.md	3	8.9	1.00	discard	Convert N04's Role section from prose to actionable checklist format for better density and clarity
2026-04-02 01:29:05	C:\Users\PC\Documents\GitHub\cex\N04_knowledge\knowledge\knowledge_card_supabase_data_layer.md	4	8.9	1.00	discard	Add Configuration Example section with concrete YAML sample to improve actionability
2026-04-02 01:29:40	C:\Users\PC\Documents\GitHub\cex\N04_knowledge\knowledge\knowledge_card_supabase_data_layer.md	5	8.9	1.00	discard	Enhance pgvector section with specific technical implementation details and function signatures for better actionability
2026-04-02 09:58:55	C:\Users\PC\Documents\GitHub\cex\P01_knowledge\examples\p01_knowledge_card_create_knowledge_card_about_prompt_engineering_best_practice.md	1	8.9	1.00	keep	polished formatting (whitespace cleanup)
2026-04-02 09:59:05	C:\Users\PC\Documents\GitHub\cex\P01_knowledge\examples\p01_knowledge_card_create_knowledge_card_about_python_testing_strategies_for_ai.md	1	0.0	0.00	crash	compile fail after: tldr flagged for manual review
2026-04-02 09:59:05	C:\Users\PC\Documents\GitHub\cex\P01_knowledge\examples\p01_knowledge_card_create_knowledge_card_about_python_testing_strategies_for_ai.md	2	0.0	0.00	crash	compile fail after: tldr flagged for manual review
2026-04-02 09:59:06	C:\Users\PC\Documents\GitHub\cex\P01_knowledge\examples\p01_knowledge_card_create_knowledge_card_about_python_testing_strategies_for_ai.md	3	0.0	0.00	crash	compile fail after: tldr flagged for manual review
2026-04-02 09:59:39	C:\Users\PC\Documents\GitHub\cex\P01_knowledge\examples\p01_knowledge_card_create_knowledge_card_about_python_testing_strategies_for_ai.md	1	9.0	1.00	keep	Convert Key Concepts bullet points to a dense table format for better information density
2026-04-02 10:00:40	C:\Users\PC\Documents\GitHub\cex\P01_knowledge\examples\p01_knowledge_card_create_knowledge_card_about_docker_containerization_for_ai_s.md	1	8.9	1.00	keep	analyzed: reduce_prose: convert long prose sections into tables or bullet lists
2026-04-02 10:01:27	C:\Users\PC\Documents\GitHub\cex\P01_knowledge\examples\p09_rate_limit_config_create_knowledge_card_about_api_rate_limiting_and_retry_patt.md	1	8.6	1.00	keep	added density_score: 1.0
2026-04-02 10:03:08	C:\Users\PC\Documents\GitHub\cex\P01_knowledge\examples\p09_rate_limit_config_create_knowledge_card_about_api_rate_limiting_and_retry_patt.md	1	8.7	0.98	keep	added density_score: 0.98
2026-04-02 10:04:21	C:\Users\PC\Documents\GitHub\cex\P01_knowledge\examples\p01_knowledge_card_create_knowledge_card_about_competitive_intelligence_osint_t.md	1	9.0	1.00	keep	polished formatting (whitespace cleanup)
2026-04-02 10:05:23	C:\Users\PC\Documents\GitHub\cex\P01_knowledge\examples\p01_knowledge_card_create_knowledge_card_about_market_research_data_triangulati.md	1	0.0	0.00	crash	compile fail after: tldr flagged for manual review
2026-04-02 10:05:23	C:\Users\PC\Documents\GitHub\cex\P01_knowledge\examples\p01_knowledge_card_create_knowledge_card_about_market_research_data_triangulati.md	2	0.0	0.00	crash	compile fail after: tldr flagged for manual review
2026-04-02 10:05:23	C:\Users\PC\Documents\GitHub\cex\P01_knowledge\examples\p01_knowledge_card_create_knowledge_card_about_market_research_data_triangulati.md	3	0.0	0.00	crash	compile fail after: tldr flagged for manual review
2026-04-02 10:05:53	C:\Users\PC\Documents\GitHub\cex\P01_knowledge\examples\p01_knowledge_card_create_knowledge_card_about_market_research_data_triangulati.md	1	0.0	0.00	crash	compile fail: Add "Common Pitfalls" section to increase actionability by showing what NOT to do
2026-04-02 10:06:36	C:\Users\PC\Documents\GitHub\cex\P01_knowledge\examples\p01_knowledge_card_create_knowledge_card_about_market_research_data_triangulati.md	2	0.0	0.00	crash	compile fail: Convert Quick Reference YAML block to a structured table format for better readability and parsing
2026-04-02 10:07:15	C:\Users\PC\Documents\GitHub\cex\P01_knowledge\examples\p01_knowledge_card_create_knowledge_card_about_market_research_data_triangulati.md	3	0.0	0.00	crash	compile fail: Convert Key Concepts bullet list to dense table format to increase information density
2026-04-02 10:07:47	C:\Users\PC\Documents\GitHub\cex\P01_knowledge\examples\p01_knowledge_card_create_knowledge_card_about_market_research_data_triangulati.md	4	0.0	0.00	crash	compile fail: Convert Strategy Phases numbered list to dense table format to increase information density
2026-04-02 10:08:21	C:\Users\PC\Documents\GitHub\cex\P01_knowledge\examples\p01_knowledge_card_create_knowledge_card_about_market_research_data_triangulati.md	5	0.0	0.00	crash	compile fail: Convert Golden Rules bullet list to dense table format to increase information density
2026-04-02 10:09:16	C:\Users\PC\Documents\GitHub\cex\P01_knowledge\examples\p01_knowledge_card_create_knowledge_card_about_trend_detection_with_time_series.md	1	0.0	0.00	crash	compile fail after: tldr flagged for manual review
2026-04-02 10:09:16	C:\Users\PC\Documents\GitHub\cex\P01_knowledge\examples\p01_knowledge_card_create_knowledge_card_about_trend_detection_with_time_series.md	2	0.0	0.00	crash	compile fail after: tldr flagged for manual review
2026-04-02 10:09:16	C:\Users\PC\Documents\GitHub\cex\P01_knowledge\examples\p01_knowledge_card_create_knowledge_card_about_trend_detection_with_time_series.md	3	0.0	0.00	crash	compile fail after: tldr flagged for manual review
2026-04-02 10:09:48	C:\Users\PC\Documents\GitHub\cex\P01_knowledge\examples\p01_knowledge_card_create_knowledge_card_about_trend_detection_with_time_series.md	1	8.9	1.00	keep	Fix section heading from "Comparativo" to "Comparison" for English consistency
2026-04-02 10:10:10	C:\Users\PC\Documents\GitHub\cex\P01_knowledge\examples\p01_knowledge_card_create_knowledge_card_about_trend_detection_with_time_series.md	2	8.9	1.00	discard	Replace abstract flow diagram with actionable step-by-step implementation code snippets
2026-04-02 10:10:47	C:\Users\PC\Documents\GitHub\cex\P01_knowledge\examples\p01_knowledge_card_create_knowledge_card_about_trend_detection_with_time_series.md	3	8.9	1.00	discard	Add Anti-Patterns section with specific failure modes to increase actionability and practical guidance
2026-04-02 10:11:23	C:\Users\PC\Documents\GitHub\cex\P01_knowledge\examples\p01_knowledge_card_create_knowledge_card_about_trend_detection_with_time_series.md	4	9.0	1.00	keep	Replace sparse Quick Reference YAML with dense parameter table containing specific thresholds and configuration values
2026-04-02 10:12:20	C:\Users\PC\Documents\GitHub\cex\P01_knowledge\examples\p01_knowledge_card_create_knowledge_card_about_source_credibility_scoring_frame.md	1	0.0	0.00	crash	compile fail after: tldr flagged for manual review
2026-04-02 10:12:20	C:\Users\PC\Documents\GitHub\cex\P01_knowledge\examples\p01_knowledge_card_create_knowledge_card_about_source_credibility_scoring_frame.md	2	0.0	0.00	crash	compile fail after: tldr flagged for manual review
2026-04-02 10:12:20	C:\Users\PC\Documents\GitHub\cex\P01_knowledge\examples\p01_knowledge_card_create_knowledge_card_about_source_credibility_scoring_frame.md	3	0.0	0.00	crash	compile fail after: tldr flagged for manual review
