timestamp	file	round	quality	density	status	description
2026-04-13 10:57:14	C:\Users\CEX\Documents\GitHub\cex\N03_engineering\knowledge\kc_aider_integration_patterns.md	2	8.7	1.00	discard	tldr flagged for manual review
2026-04-13 10:57:15	C:\Users\CEX\Documents\GitHub\cex\N03_engineering\knowledge\kc_aider_integration_patterns.md	3	8.7	1.00	discard	tldr flagged for manual review
2026-04-13 10:57:15	C:\Users\CEX\Documents\GitHub\cex\N04_knowledge\knowledge\p01_gl_embedding.md	1	8.7	0.84	discard	analyzed: increase_density: remove filler words, compress prose into tables
2026-04-13 10:57:15	C:\Users\CEX\Documents\GitHub\cex\N04_knowledge\knowledge\p01_gl_embedding.md	2	8.7	0.84	discard	analyzed: increase_density: remove filler words, compress prose into tables
2026-04-13 10:57:15	C:\Users\CEX\Documents\GitHub\cex\N04_knowledge\knowledge\p01_gl_embedding.md	3	8.7	0.84	discard	analyzed: increase_density: remove filler words, compress prose into tables
2026-04-13 10:57:15	C:\Users\CEX\Documents\GitHub\cex\N04_knowledge\knowledge\p01_gl_knowledge_card.md	1	8.7	0.83	discard	analyzed: increase_density: remove filler words, compress prose into tables
2026-04-13 10:57:15	C:\Users\CEX\Documents\GitHub\cex\N04_knowledge\knowledge\p01_gl_knowledge_card.md	2	8.7	0.83	discard	analyzed: increase_density: remove filler words, compress prose into tables
2026-04-13 10:57:15	C:\Users\CEX\Documents\GitHub\cex\N04_knowledge\knowledge\p01_gl_knowledge_card.md	3	8.7	0.83	discard	analyzed: increase_density: remove filler words, compress prose into tables
2026-04-13 10:57:16	C:\Users\CEX\Documents\GitHub\cex\N04_knowledge\knowledge\p01_gl_rag.md	1	8.7	0.84	discard	analyzed: increase_density: remove filler words, compress prose into tables
2026-04-13 10:57:16	C:\Users\CEX\Documents\GitHub\cex\N04_knowledge\knowledge\p01_gl_rag.md	2	8.7	0.84	discard	analyzed: increase_density: remove filler words, compress prose into tables
2026-04-13 10:57:16	C:\Users\CEX\Documents\GitHub\cex\N04_knowledge\knowledge\p01_gl_rag.md	3	8.7	0.84	discard	analyzed: increase_density: remove filler words, compress prose into tables
2026-04-13 10:57:16	C:\Users\CEX\Documents\GitHub\cex\N03_engineering\knowledge\kc_8f_pipeline_implementation.md	1	8.8	1.00	discard	added updated: 2026-04-13
2026-04-13 10:57:16	C:\Users\CEX\Documents\GitHub\cex\N03_engineering\knowledge\kc_8f_pipeline_implementation.md	2	8.8	1.00	discard	added updated: 2026-04-13
2026-04-13 10:57:16	C:\Users\CEX\Documents\GitHub\cex\N03_engineering\knowledge\kc_8f_pipeline_implementation.md	3	8.8	1.00	discard	added updated: 2026-04-13
2026-04-13 10:57:20	C:\Users\CEX\Documents\GitHub\cex\.cex\archive\reports\self_audit_gemini_2026_04_11.md	1	8.6	0.90	discard	tldr flagged for manual review
2026-04-13 10:57:20	C:\Users\CEX\Documents\GitHub\cex\.cex\archive\reports\self_audit_gemini_2026_04_11.md	2	8.6	0.90	discard	tldr flagged for manual review
2026-04-13 10:57:20	C:\Users\CEX\Documents\GitHub\cex\.cex\archive\reports\self_audit_gemini_2026_04_11.md	3	8.6	0.90	discard	tldr flagged for manual review
2026-04-13 10:57:20	C:\Users\CEX\Documents\GitHub\cex\N05_operations\knowledge\kc_pre_commit_hooks_for_ai.md	1	8.6	1.00	discard	tldr flagged for manual review
2026-04-13 10:57:20	C:\Users\CEX\Documents\GitHub\cex\N05_operations\knowledge\kc_pre_commit_hooks_for_ai.md	2	8.6	1.00	discard	tldr flagged for manual review
2026-04-13 10:57:21	C:\Users\CEX\Documents\GitHub\cex\N05_operations\knowledge\kc_pre_commit_hooks_for_ai.md	3	8.6	1.00	discard	tldr flagged for manual review
2026-04-13 10:57:21	C:\Users\CEX\Documents\GitHub\cex\phases.md	1	8.6	1.00	discard	analyzed: reduce_prose: convert long prose sections into tables or bullet lists
2026-04-13 10:57:21	C:\Users\CEX\Documents\GitHub\cex\phases.md	2	8.6	1.00	discard	analyzed: reduce_prose: convert long prose sections into tables or bullet lists
2026-04-13 10:57:21	C:\Users\CEX\Documents\GitHub\cex\phases.md	3	8.6	1.00	discard	analyzed: reduce_prose: convert long prose sections into tables or bullet lists
2026-04-13 10:57:21	C:\Users\CEX\Documents\GitHub\cex\N02_marketing\knowledge\kc_llm_agent_frameworks_comparison.md	1	8.7	1.00	discard	tldr flagged for manual review
2026-04-13 10:57:21	C:\Users\CEX\Documents\GitHub\cex\N02_marketing\knowledge\kc_llm_agent_frameworks_comparison.md	2	8.7	1.00	discard	tldr flagged for manual review
2026-04-13 10:57:21	C:\Users\CEX\Documents\GitHub\cex\N02_marketing\knowledge\kc_llm_agent_frameworks_comparison.md	3	8.7	1.00	discard	tldr flagged for manual review
2026-04-13 10:57:22	C:\Users\CEX\Documents\GitHub\cex\N03_engineering\knowledge\kc_aider_integration_patterns.md	1	8.7	1.00	discard	tldr flagged for manual review
2026-04-13 10:57:22	C:\Users\CEX\Documents\GitHub\cex\N03_engineering\knowledge\kc_aider_integration_patterns.md	2	8.7	1.00	discard	tldr flagged for manual review
2026-04-13 10:57:22	C:\Users\CEX\Documents\GitHub\cex\N03_engineering\knowledge\kc_aider_integration_patterns.md	3	8.7	1.00	discard	tldr flagged for manual review
2026-04-13 10:57:22	C:\Users\CEX\Documents\GitHub\cex\N04_knowledge\knowledge\p01_gl_embedding.md	1	8.7	0.84	discard	analyzed: increase_density: remove filler words, compress prose into tables
2026-04-13 10:57:22	C:\Users\CEX\Documents\GitHub\cex\N04_knowledge\knowledge\p01_gl_embedding.md	2	8.7	0.84	discard	analyzed: increase_density: remove filler words, compress prose into tables
2026-04-13 10:57:22	C:\Users\CEX\Documents\GitHub\cex\N04_knowledge\knowledge\p01_gl_embedding.md	3	8.7	0.84	discard	analyzed: increase_density: remove filler words, compress prose into tables
2026-04-13 10:57:23	C:\Users\CEX\Documents\GitHub\cex\N04_knowledge\knowledge\p01_gl_knowledge_card.md	1	8.7	0.83	discard	analyzed: increase_density: remove filler words, compress prose into tables
2026-04-13 10:57:23	C:\Users\CEX\Documents\GitHub\cex\N04_knowledge\knowledge\p01_gl_knowledge_card.md	2	8.7	0.83	discard	analyzed: increase_density: remove filler words, compress prose into tables
2026-04-13 10:57:23	C:\Users\CEX\Documents\GitHub\cex\N04_knowledge\knowledge\p01_gl_knowledge_card.md	3	8.7	0.83	discard	analyzed: increase_density: remove filler words, compress prose into tables
2026-04-13 10:57:23	C:\Users\CEX\Documents\GitHub\cex\N04_knowledge\knowledge\p01_gl_rag.md	1	8.7	0.84	discard	analyzed: increase_density: remove filler words, compress prose into tables
2026-04-13 10:57:23	C:\Users\CEX\Documents\GitHub\cex\N04_knowledge\knowledge\p01_gl_rag.md	2	8.7	0.84	discard	analyzed: increase_density: remove filler words, compress prose into tables
2026-04-13 10:57:23	C:\Users\CEX\Documents\GitHub\cex\N04_knowledge\knowledge\p01_gl_rag.md	3	8.7	0.84	discard	analyzed: increase_density: remove filler words, compress prose into tables
2026-04-13 10:57:23	C:\Users\CEX\Documents\GitHub\cex\N03_engineering\knowledge\kc_8f_pipeline_implementation.md	1	8.8	1.00	discard	added updated: 2026-04-13
2026-04-13 10:57:24	C:\Users\CEX\Documents\GitHub\cex\N03_engineering\knowledge\kc_8f_pipeline_implementation.md	2	8.8	1.00	discard	added updated: 2026-04-13
2026-04-13 10:57:24	C:\Users\CEX\Documents\GitHub\cex\N03_engineering\knowledge\kc_8f_pipeline_implementation.md	3	8.8	1.00	discard	added updated: 2026-04-13
2026-04-13 10:57:27	C:\Users\CEX\Documents\GitHub\cex\.cex\archive\reports\self_audit_gemini_2026_04_11.md	1	8.6	0.90	discard	tldr flagged for manual review
2026-04-13 10:57:27	C:\Users\CEX\Documents\GitHub\cex\.cex\archive\reports\self_audit_gemini_2026_04_11.md	2	8.6	0.90	discard	tldr flagged for manual review
2026-04-13 10:57:27	C:\Users\CEX\Documents\GitHub\cex\.cex\archive\reports\self_audit_gemini_2026_04_11.md	3	8.6	0.90	discard	tldr flagged for manual review
2026-04-13 10:57:28	C:\Users\CEX\Documents\GitHub\cex\N05_operations\knowledge\kc_pre_commit_hooks_for_ai.md	1	8.6	1.00	discard	tldr flagged for manual review
2026-04-13 10:57:28	C:\Users\CEX\Documents\GitHub\cex\N05_operations\knowledge\kc_pre_commit_hooks_for_ai.md	2	8.6	1.00	discard	tldr flagged for manual review
2026-04-13 10:57:28	C:\Users\CEX\Documents\GitHub\cex\N05_operations\knowledge\kc_pre_commit_hooks_for_ai.md	3	8.6	1.00	discard	tldr flagged for manual review
2026-04-13 10:57:28	C:\Users\CEX\Documents\GitHub\cex\phases.md	1	8.6	1.00	discard	analyzed: reduce_prose: convert long prose sections into tables or bullet lists
2026-04-13 10:57:28	C:\Users\CEX\Documents\GitHub\cex\phases.md	2	8.6	1.00	discard	analyzed: reduce_prose: convert long prose sections into tables or bullet lists
2026-04-13 10:57:28	C:\Users\CEX\Documents\GitHub\cex\phases.md	3	8.6	1.00	discard	analyzed: reduce_prose: convert long prose sections into tables or bullet lists
2026-04-13 10:57:29	C:\Users\CEX\Documents\GitHub\cex\N02_marketing\knowledge\kc_llm_agent_frameworks_comparison.md	1	8.7	1.00	discard	tldr flagged for manual review
2026-04-13 10:57:29	C:\Users\CEX\Documents\GitHub\cex\N02_marketing\knowledge\kc_llm_agent_frameworks_comparison.md	2	8.7	1.00	discard	tldr flagged for manual review
2026-04-13 10:57:29	C:\Users\CEX\Documents\GitHub\cex\N02_marketing\knowledge\kc_llm_agent_frameworks_comparison.md	3	8.7	1.00	discard	tldr flagged for manual review
2026-04-13 10:57:29	C:\Users\CEX\Documents\GitHub\cex\N03_engineering\knowledge\kc_aider_integration_patterns.md	1	8.7	1.00	discard	tldr flagged for manual review
2026-04-13 10:57:29	C:\Users\CEX\Documents\GitHub\cex\N03_engineering\knowledge\kc_aider_integration_patterns.md	2	8.7	1.00	discard	tldr flagged for manual review
2026-04-13 10:57:29	C:\Users\CEX\Documents\GitHub\cex\N03_engineering\knowledge\kc_aider_integration_patterns.md	3	8.7	1.00	discard	tldr flagged for manual review
2026-04-13 10:57:29	C:\Users\CEX\Documents\GitHub\cex\N04_knowledge\knowledge\p01_gl_embedding.md	1	8.7	0.84	discard	analyzed: increase_density: remove filler words, compress prose into tables
2026-04-13 10:57:30	C:\Users\CEX\Documents\GitHub\cex\N04_knowledge\knowledge\p01_gl_embedding.md	2	8.7	0.84	discard	analyzed: increase_density: remove filler words, compress prose into tables
2026-04-13 10:57:30	C:\Users\CEX\Documents\GitHub\cex\N04_knowledge\knowledge\p01_gl_embedding.md	3	8.7	0.84	discard	analyzed: increase_density: remove filler words, compress prose into tables
2026-04-13 10:57:30	C:\Users\CEX\Documents\GitHub\cex\N04_knowledge\knowledge\p01_gl_knowledge_card.md	1	8.7	0.83	discard	analyzed: increase_density: remove filler words, compress prose into tables
2026-04-13 10:57:30	C:\Users\CEX\Documents\GitHub\cex\N04_knowledge\knowledge\p01_gl_knowledge_card.md	2	8.7	0.83	discard	analyzed: increase_density: remove filler words, compress prose into tables
2026-04-13 10:57:30	C:\Users\CEX\Documents\GitHub\cex\N04_knowledge\knowledge\p01_gl_knowledge_card.md	3	8.7	0.83	discard	analyzed: increase_density: remove filler words, compress prose into tables
2026-04-13 10:57:30	C:\Users\CEX\Documents\GitHub\cex\N04_knowledge\knowledge\p01_gl_rag.md	1	8.7	0.84	discard	analyzed: increase_density: remove filler words, compress prose into tables
2026-04-13 10:57:31	C:\Users\CEX\Documents\GitHub\cex\N04_knowledge\knowledge\p01_gl_rag.md	2	8.7	0.84	discard	analyzed: increase_density: remove filler words, compress prose into tables
2026-04-13 10:57:31	C:\Users\CEX\Documents\GitHub\cex\N04_knowledge\knowledge\p01_gl_rag.md	3	8.7	0.84	discard	analyzed: increase_density: remove filler words, compress prose into tables
2026-04-13 10:57:31	C:\Users\CEX\Documents\GitHub\cex\N03_engineering\knowledge\kc_8f_pipeline_implementation.md	1	8.8	1.00	discard	added updated: 2026-04-13
2026-04-13 10:57:31	C:\Users\CEX\Documents\GitHub\cex\N03_engineering\knowledge\kc_8f_pipeline_implementation.md	2	8.8	1.00	discard	added updated: 2026-04-13
2026-04-13 10:57:31	C:\Users\CEX\Documents\GitHub\cex\N03_engineering\knowledge\kc_8f_pipeline_implementation.md	3	8.8	1.00	discard	added updated: 2026-04-13
2026-04-13 10:57:35	C:\Users\CEX\Documents\GitHub\cex\.cex\archive\reports\self_audit_gemini_2026_04_11.md	1	8.6	0.90	discard	tldr flagged for manual review
2026-04-13 10:57:35	C:\Users\CEX\Documents\GitHub\cex\.cex\archive\reports\self_audit_gemini_2026_04_11.md	2	8.6	0.90	discard	tldr flagged for manual review
2026-04-13 10:57:35	C:\Users\CEX\Documents\GitHub\cex\.cex\archive\reports\self_audit_gemini_2026_04_11.md	3	8.6	0.90	discard	tldr flagged for manual review
2026-04-13 10:57:35	C:\Users\CEX\Documents\GitHub\cex\N05_operations\knowledge\kc_pre_commit_hooks_for_ai.md	1	8.6	1.00	discard	tldr flagged for manual review
2026-04-13 10:57:35	C:\Users\CEX\Documents\GitHub\cex\N05_operations\knowledge\kc_pre_commit_hooks_for_ai.md	2	8.6	1.00	discard	tldr flagged for manual review
2026-04-13 10:57:35	C:\Users\CEX\Documents\GitHub\cex\N05_operations\knowledge\kc_pre_commit_hooks_for_ai.md	3	8.6	1.00	discard	tldr flagged for manual review
2026-04-13 10:57:36	C:\Users\CEX\Documents\GitHub\cex\phases.md	1	8.6	1.00	discard	analyzed: reduce_prose: convert long prose sections into tables or bullet lists
2026-04-13 10:57:36	C:\Users\CEX\Documents\GitHub\cex\phases.md	2	8.6	1.00	discard	analyzed: reduce_prose: convert long prose sections into tables or bullet lists
2026-04-13 10:57:36	C:\Users\CEX\Documents\GitHub\cex\phases.md	3	8.6	1.00	discard	analyzed: reduce_prose: convert long prose sections into tables or bullet lists
2026-04-13 10:57:36	C:\Users\CEX\Documents\GitHub\cex\N02_marketing\knowledge\kc_llm_agent_frameworks_comparison.md	1	8.7	1.00	discard	tldr flagged for manual review
2026-04-13 10:57:36	C:\Users\CEX\Documents\GitHub\cex\N02_marketing\knowledge\kc_llm_agent_frameworks_comparison.md	2	8.7	1.00	discard	tldr flagged for manual review
2026-04-13 10:57:36	C:\Users\CEX\Documents\GitHub\cex\N02_marketing\knowledge\kc_llm_agent_frameworks_comparison.md	3	8.7	1.00	discard	tldr flagged for manual review
2026-04-13 10:57:36	C:\Users\CEX\Documents\GitHub\cex\N03_engineering\knowledge\kc_aider_integration_patterns.md	1	8.7	1.00	discard	tldr flagged for manual review
2026-04-13 10:57:37	C:\Users\CEX\Documents\GitHub\cex\N03_engineering\knowledge\kc_aider_integration_patterns.md	2	8.7	1.00	discard	tldr flagged for manual review
2026-04-13 10:57:37	C:\Users\CEX\Documents\GitHub\cex\N03_engineering\knowledge\kc_aider_integration_patterns.md	3	8.7	1.00	discard	tldr flagged for manual review
2026-04-13 10:57:37	C:\Users\CEX\Documents\GitHub\cex\N04_knowledge\knowledge\p01_gl_embedding.md	1	8.7	0.84	discard	analyzed: increase_density: remove filler words, compress prose into tables
2026-04-13 10:57:37	C:\Users\CEX\Documents\GitHub\cex\N04_knowledge\knowledge\p01_gl_embedding.md	2	8.7	0.84	discard	analyzed: increase_density: remove filler words, compress prose into tables
2026-04-13 10:57:37	C:\Users\CEX\Documents\GitHub\cex\N04_knowledge\knowledge\p01_gl_embedding.md	3	8.7	0.84	discard	analyzed: increase_density: remove filler words, compress prose into tables
2026-04-13 10:57:37	C:\Users\CEX\Documents\GitHub\cex\N04_knowledge\knowledge\p01_gl_knowledge_card.md	1	8.7	0.83	discard	analyzed: increase_density: remove filler words, compress prose into tables
2026-04-13 10:57:37	C:\Users\CEX\Documents\GitHub\cex\N04_knowledge\knowledge\p01_gl_knowledge_card.md	2	8.7	0.83	discard	analyzed: increase_density: remove filler words, compress prose into tables
2026-04-13 10:57:38	C:\Users\CEX\Documents\GitHub\cex\N04_knowledge\knowledge\p01_gl_knowledge_card.md	3	8.7	0.83	discard	analyzed: increase_density: remove filler words, compress prose into tables
2026-04-13 10:57:38	C:\Users\CEX\Documents\GitHub\cex\N04_knowledge\knowledge\p01_gl_rag.md	1	8.7	0.84	discard	analyzed: increase_density: remove filler words, compress prose into tables
2026-04-13 10:57:38	C:\Users\CEX\Documents\GitHub\cex\N04_knowledge\knowledge\p01_gl_rag.md	2	8.7	0.84	discard	analyzed: increase_density: remove filler words, compress prose into tables
2026-04-13 10:57:38	C:\Users\CEX\Documents\GitHub\cex\N04_knowledge\knowledge\p01_gl_rag.md	3	8.7	0.84	discard	analyzed: increase_density: remove filler words, compress prose into tables
2026-04-13 10:57:38	C:\Users\CEX\Documents\GitHub\cex\N03_engineering\knowledge\kc_8f_pipeline_implementation.md	1	8.8	1.00	discard	added updated: 2026-04-13
2026-04-13 10:57:38	C:\Users\CEX\Documents\GitHub\cex\N03_engineering\knowledge\kc_8f_pipeline_implementation.md	2	8.8	1.00	discard	added updated: 2026-04-13
2026-04-13 10:57:39	C:\Users\CEX\Documents\GitHub\cex\N03_engineering\knowledge\kc_8f_pipeline_implementation.md	3	8.8	1.00	discard	added updated: 2026-04-13
2026-04-13 10:57:42	C:\Users\CEX\Documents\GitHub\cex\.cex\archive\reports\self_audit_gemini_2026_04_11.md	1	8.6	0.90	discard	tldr flagged for manual review
2026-04-13 10:57:42	C:\Users\CEX\Documents\GitHub\cex\.cex\archive\reports\self_audit_gemini_2026_04_11.md	2	8.6	0.90	discard	tldr flagged for manual review
2026-04-13 10:57:42	C:\Users\CEX\Documents\GitHub\cex\.cex\archive\reports\self_audit_gemini_2026_04_11.md	3	8.6	0.90	discard	tldr flagged for manual review
2026-04-13 10:57:42	C:\Users\CEX\Documents\GitHub\cex\N05_operations\knowledge\kc_pre_commit_hooks_for_ai.md	1	8.6	1.00	discard	tldr flagged for manual review
2026-04-13 10:57:43	C:\Users\CEX\Documents\GitHub\cex\N05_operations\knowledge\kc_pre_commit_hooks_for_ai.md	2	8.6	1.00	discard	tldr flagged for manual review
2026-04-13 10:57:43	C:\Users\CEX\Documents\GitHub\cex\N05_operations\knowledge\kc_pre_commit_hooks_for_ai.md	3	8.6	1.00	discard	tldr flagged for manual review
2026-04-13 10:57:43	C:\Users\CEX\Documents\GitHub\cex\phases.md	1	8.6	1.00	discard	analyzed: reduce_prose: convert long prose sections into tables or bullet lists
2026-04-13 10:57:43	C:\Users\CEX\Documents\GitHub\cex\phases.md	2	8.6	1.00	discard	analyzed: reduce_prose: convert long prose sections into tables or bullet lists
2026-04-13 10:57:43	C:\Users\CEX\Documents\GitHub\cex\phases.md	3	8.6	1.00	discard	analyzed: reduce_prose: convert long prose sections into tables or bullet lists
2026-04-13 10:57:43	C:\Users\CEX\Documents\GitHub\cex\N02_marketing\knowledge\kc_llm_agent_frameworks_comparison.md	1	8.7	1.00	discard	tldr flagged for manual review
2026-04-13 10:57:44	C:\Users\CEX\Documents\GitHub\cex\N02_marketing\knowledge\kc_llm_agent_frameworks_comparison.md	2	8.7	1.00	discard	tldr flagged for manual review
2026-04-13 10:57:44	C:\Users\CEX\Documents\GitHub\cex\N02_marketing\knowledge\kc_llm_agent_frameworks_comparison.md	3	8.7	1.00	discard	tldr flagged for manual review
2026-04-13 10:57:44	C:\Users\CEX\Documents\GitHub\cex\N03_engineering\knowledge\kc_aider_integration_patterns.md	1	8.7	1.00	discard	tldr flagged for manual review
2026-04-13 10:57:44	C:\Users\CEX\Documents\GitHub\cex\N03_engineering\knowledge\kc_aider_integration_patterns.md	2	8.7	1.00	discard	tldr flagged for manual review
2026-04-13 10:57:44	C:\Users\CEX\Documents\GitHub\cex\N03_engineering\knowledge\kc_aider_integration_patterns.md	3	8.7	1.00	discard	tldr flagged for manual review
2026-04-13 10:57:44	C:\Users\CEX\Documents\GitHub\cex\N04_knowledge\knowledge\p01_gl_embedding.md	1	8.7	0.84	discard	analyzed: increase_density: remove filler words, compress prose into tables
2026-04-13 10:57:45	C:\Users\CEX\Documents\GitHub\cex\N04_knowledge\knowledge\p01_gl_embedding.md	2	8.7	0.84	discard	analyzed: increase_density: remove filler words, compress prose into tables
2026-04-13 10:57:45	C:\Users\CEX\Documents\GitHub\cex\N04_knowledge\knowledge\p01_gl_embedding.md	3	8.7	0.84	discard	analyzed: increase_density: remove filler words, compress prose into tables
2026-04-13 10:57:45	C:\Users\CEX\Documents\GitHub\cex\N04_knowledge\knowledge\p01_gl_knowledge_card.md	1	8.7	0.83	discard	analyzed: increase_density: remove filler words, compress prose into tables
2026-04-13 10:57:45	C:\Users\CEX\Documents\GitHub\cex\N04_knowledge\knowledge\p01_gl_knowledge_card.md	2	8.7	0.83	discard	analyzed: increase_density: remove filler words, compress prose into tables
2026-04-13 10:57:45	C:\Users\CEX\Documents\GitHub\cex\N04_knowledge\knowledge\p01_gl_knowledge_card.md	3	8.7	0.83	discard	analyzed: increase_density: remove filler words, compress prose into tables
2026-04-13 10:57:45	C:\Users\CEX\Documents\GitHub\cex\N04_knowledge\knowledge\p01_gl_rag.md	1	8.7	0.84	discard	analyzed: increase_density: remove filler words, compress prose into tables
2026-04-13 10:57:45	C:\Users\CEX\Documents\GitHub\cex\N04_knowledge\knowledge\p01_gl_rag.md	2	8.7	0.84	discard	analyzed: increase_density: remove filler words, compress prose into tables
2026-04-13 10:57:46	C:\Users\CEX\Documents\GitHub\cex\N04_knowledge\knowledge\p01_gl_rag.md	3	8.7	0.84	discard	analyzed: increase_density: remove filler words, compress prose into tables
2026-04-13 10:57:46	C:\Users\CEX\Documents\GitHub\cex\N03_engineering\knowledge\kc_8f_pipeline_implementation.md	1	8.8	1.00	discard	added updated: 2026-04-13
2026-04-13 10:57:46	C:\Users\CEX\Documents\GitHub\cex\N03_engineering\knowledge\kc_8f_pipeline_implementation.md	2	8.8	1.00	discard	added updated: 2026-04-13
2026-04-13 10:57:46	C:\Users\CEX\Documents\GitHub\cex\N03_engineering\knowledge\kc_8f_pipeline_implementation.md	3	8.8	1.00	discard	added updated: 2026-04-13
2026-04-13 10:57:50	C:\Users\CEX\Documents\GitHub\cex\.cex\archive\reports\self_audit_gemini_2026_04_11.md	1	8.6	0.90	discard	tldr flagged for manual review
2026-04-13 10:57:50	C:\Users\CEX\Documents\GitHub\cex\.cex\archive\reports\self_audit_gemini_2026_04_11.md	2	8.6	0.90	discard	tldr flagged for manual review
2026-04-13 10:57:50	C:\Users\CEX\Documents\GitHub\cex\.cex\archive\reports\self_audit_gemini_2026_04_11.md	3	8.6	0.90	discard	tldr flagged for manual review
2026-04-13 10:57:50	C:\Users\CEX\Documents\GitHub\cex\N05_operations\knowledge\kc_pre_commit_hooks_for_ai.md	1	8.6	1.00	discard	tldr flagged for manual review
2026-04-13 10:57:50	C:\Users\CEX\Documents\GitHub\cex\N05_operations\knowledge\kc_pre_commit_hooks_for_ai.md	2	8.6	1.00	discard	tldr flagged for manual review
