timestamp	file	round	quality	density	status	description
2026-04-02 14:45:49	C:\Users\PC\Documents\GitHub\cex\P01_knowledge\examples\p07_scoring_rubric_create_scoring_rubric_for_marketing_evaluation.md	1	9.2	1.00	keep	polished formatting (whitespace cleanup)
2026-04-02 14:46:49	C:\Users\PC\Documents\GitHub\cex\P01_knowledge\examples\p12_dispatch_rule_create_dispatch_rule_for_marketing_routing.md	1	0.0	0.00	crash	compile fail after: added density_score: 0.84
2026-04-02 14:46:50	C:\Users\PC\Documents\GitHub\cex\P01_knowledge\examples\p12_dispatch_rule_create_dispatch_rule_for_marketing_routing.md	2	0.0	0.00	crash	compile fail after: added density_score: 0.84
2026-04-02 14:46:50	C:\Users\PC\Documents\GitHub\cex\P01_knowledge\examples\p12_dispatch_rule_create_dispatch_rule_for_marketing_routing.md	3	0.0	0.00	crash	compile fail after: added density_score: 0.84
2026-04-02 14:47:28	C:\Users\PC\Documents\GitHub\cex\P01_knowledge\examples\p12_dispatch_rule_create_dispatch_rule_for_marketing_routing.md	1	0.0	0.00	crash	compile fail: Add technical decision rationale section explaining why confidence_threshold=0.72 and hybrid routing were chosen based on marketing task patterns, targeting INSIGHT_DEPTH
2026-04-02 14:48:02	C:\Users\PC\Documents\GitHub\cex\P01_knowledge\examples\p12_dispatch_rule_create_dispatch_rule_for_marketing_routing.md	2	0.0	0.00	crash	compile fail: Add concrete examples of failed routing scenarios and edge cases to deepen insights about marketing task patterns and routing failure modes, targeting INSIGHT_DEPTH
2026-04-02 14:48:32	C:\Users\PC\Documents\GitHub\cex\P01_knowledge\examples\p12_dispatch_rule_create_dispatch_rule_for_marketing_routing.md	3	0.0	0.00	crash	compile fail: Add insight about the psychological/linguistic variability patterns that make marketing routing uniquely challenging, targeting INSIGHT_DEPTH
2026-04-02 14:49:06	C:\Users\PC\Documents\GitHub\cex\P01_knowledge\examples\p12_dispatch_rule_create_dispatch_rule_for_marketing_routing.md	4	0.0	0.00	crash	compile fail: Replace technical rationale with deeper behavioral insights about marketing language evasion patterns and psychological resistance mechanisms that create routing challenges, targeting INSIGHT_DEPTH
2026-04-02 14:49:42	C:\Users\PC\Documents\GitHub\cex\P01_knowledge\examples\p12_dispatch_rule_create_dispatch_rule_for_marketing_routing.md	5	0.0	0.00	crash	compile fail: Add specific examples of euphemistic marketing language patterns within existing rationale to make insights more concrete and actionable, targeting INSIGHT_DEPTH
2026-04-02 14:51:43	C:\Users\PC\Documents\GitHub\cex\P01_knowledge\examples\p06_input_schema_create_schema_contract_for_marketing_data_model.md	1	9.1	1.00	keep	analyzed: reduce_prose: convert long prose sections into tables or bullet lists
2026-04-02 14:53:57	C:\Users\PC\Documents\GitHub\cex\P01_knowledge\examples\p05_formatter_create_output_template_for_marketing_reports.md	1	9.1	1.00	keep	analyzed: reduce_prose: convert long prose sections into tables or bullet lists
2026-04-02 14:55:46	C:\Users\PC\Documents\GitHub\cex\P01_knowledge\examples\p03_prompt_template_create_prompt_template_for_marketing_tasks.md	1	9.2	0.99	keep	analyzed: reduce_prose: convert long prose sections into tables or bullet lists
2026-04-02 14:58:08	C:\Users\PC\Documents\GitHub\cex\P01_knowledge\examples\p01_knowledge_card_create_agent_for_knowledge_nucleus.md	1	9.2	1.00	keep	analyzed: reduce_prose: convert long prose sections into tables or bullet lists
2026-04-02 14:59:33	C:\Users\PC\Documents\GitHub\cex\P01_knowledge\examples\p03_system_prompt_create_system_prompt_for_knowledge_nucleus.md	1	9.0	0.94	keep	polished formatting (whitespace cleanup)
2026-04-02 15:00:56	C:\Users\PC\Documents\GitHub\cex\P01_knowledge\examples\p01_knowledge_card_create_knowledge_card_about_knowledge_best_practices.md	1	0.0	0.00	crash	compile fail after: tldr flagged for manual review
2026-04-02 15:00:56	C:\Users\PC\Documents\GitHub\cex\P01_knowledge\examples\p01_knowledge_card_create_knowledge_card_about_knowledge_best_practices.md	2	0.0	0.00	crash	compile fail after: tldr flagged for manual review
2026-04-02 15:00:57	C:\Users\PC\Documents\GitHub\cex\P01_knowledge\examples\p01_knowledge_card_create_knowledge_card_about_knowledge_best_practices.md	3	0.0	0.00	crash	compile fail after: tldr flagged for manual review
2026-04-02 15:02:18	C:\Users\PC\Documents\GitHub\cex\P01_knowledge\examples\p01_knowledge_card_create_knowledge_card_about_knowledge_best_practices.md	1	0.0	0.00	crash	compile fail: Enhance the Density Boosting table with concrete markdown examples showing actual before/after transformations to improve COMPLETENESS
2026-04-02 15:03:26	C:\Users\PC\Documents\GitHub\cex\P01_knowledge\examples\p01_knowledge_card_create_knowledge_card_about_knowledge_best_practices.md	2	0.0	0.00	crash	compile fail: Enhance the frontmatter section with more complete field descriptions and validation examples to improve COMPLETENESS dimension
2026-04-02 15:04:44	C:\Users\PC\Documents\GitHub\cex\P01_knowledge\examples\p01_knowledge_card_create_knowledge_card_about_knowledge_best_practices.md	3	0.0	0.00	crash	compile fail: Add more density boosting techniques to complete the table, targeting COMPLETENESS dimension with additional common transformation patterns
2026-04-02 15:06:08	C:\Users\PC\Documents\GitHub\cex\P01_knowledge\examples\p01_knowledge_card_create_knowledge_card_about_knowledge_best_practices.md	4	0.0	0.00	crash	compile fail: Add missing density boosting techniques (hedging removal, question conversion, workflow formatting) to complete the patterns table and improve COMPLETENESS dimension
2026-04-02 15:07:42	C:\Users\PC\Documents\GitHub\cex\P01_knowledge\examples\p01_knowledge_card_create_knowledge_card_about_knowledge_best_practices.md	5	0.0	0.00	crash	compile fail: Expand the Application section with more complete step-by-step guidance including validation commands and practical examples to improve COMPLETENESS dimension
2026-04-02 15:12:04	C:\Users\PC\Documents\GitHub\cex\P01_knowledge\examples\p12_workflow_create_workflow_for_knowledge_pipeline.md	1	9.0	0.98	keep	polished formatting (whitespace cleanup)
2026-04-02 15:16:41	C:\Users\PC\Documents\GitHub\cex\P01_knowledge\examples\p07_scoring_rubric_create_scoring_rubric_for_knowledge_evaluation.md	1	9.1	1.00	keep	polished formatting (whitespace cleanup)
2026-04-02 15:18:05	C:\Users\PC\Documents\GitHub\cex\P01_knowledge\examples\p12_dispatch_rule_create_dispatch_rule_for_knowledge_routing.md	1	9.0	1.00	keep	added density_score: 1.0
2026-04-02 15:19:29	C:\Users\PC\Documents\GitHub\cex\P01_knowledge\examples\p06_input_schema_create_schema_contract_for_knowledge_data_model.md	1	9.1	1.00	keep	analyzed: reduce_prose: convert long prose sections into tables or bullet lists
2026-04-02 15:21:38	C:\Users\PC\Documents\GitHub\cex\P01_knowledge\examples\p05_formatter_create_output_template_for_knowledge_reports.md	1	9.1	1.00	keep	analyzed: reduce_prose: convert long prose sections into tables or bullet lists
2026-04-02 15:23:08	C:\Users\PC\Documents\GitHub\cex\P01_knowledge\examples\p03_prompt_template_create_prompt_template_for_knowledge_tasks.md	1	9.1	0.99	keep	analyzed: reduce_prose: convert long prose sections into tables or bullet lists
2026-04-02 15:23:11	C:\Users\PC\Documents\GitHub\cex\N02_marketing\memory\copy_optimization_insights.md	1	9.0	1.00	keep	added density_score: 1.0
2026-04-02 15:23:13	C:\Users\PC\Documents\GitHub\cex\N04_knowledge\output\self_review_2026-04-02.md	1	8.8	1.00	keep	added density_score: 1.0
2026-04-02 15:23:13	C:\Users\PC\Documents\GitHub\cex\N04_knowledge\output\self_review_2026-04-02.md	2	8.8	1.00	discard	tldr flagged for manual review
2026-04-02 15:23:13	C:\Users\PC\Documents\GitHub\cex\N04_knowledge\output\self_review_2026-04-02.md	3	8.8	1.00	discard	tldr flagged for manual review
2026-04-02 15:23:41	C:\Users\PC\Documents\GitHub\cex\N04_knowledge\output\self_review_2026-04-02.md	0	9.0	1.00	skip	already at target
2026-04-02 15:23:43	C:\Users\PC\Documents\GitHub\cex\N02_marketing\orchestration\cross_nucleus_handoffs.md	1	9.0	1.00	keep	added density_score: 1.0
2026-04-02 15:23:44	C:\Users\PC\Documents\GitHub\cex\N02_marketing\memory\campaign_performance_memory.md	1	9.0	1.00	keep	added density_score: 1.0
2026-04-02 15:23:45	C:\Users\PC\Documents\GitHub\cex\N02_marketing\config\ab_testing_framework.md	1	9.0	1.00	keep	added density_score: 1.0
2026-04-02 15:23:47	C:\Users\PC\Documents\GitHub\cex\N02_marketing\config\brand_override_config.md	1	9.0	1.00	keep	added density_score: 1.0
2026-04-02 15:23:48	C:\Users\PC\Documents\GitHub\cex\N02_marketing\artifacts\email_sequence_template.md	1	9.0	0.92	keep	added density_score: 0.92
2026-04-02 15:23:50	C:\Users\PC\Documents\GitHub\cex\N02_marketing\output\self_review_2026-04-02.md	1	8.9	1.00	keep	added density_score: 1.0
2026-04-02 15:23:50	C:\Users\PC\Documents\GitHub\cex\N02_marketing\output\self_review_2026-04-02.md	2	8.9	1.00	discard	tldr flagged for manual review
2026-04-02 15:23:50	C:\Users\PC\Documents\GitHub\cex\N02_marketing\output\self_review_2026-04-02.md	3	8.9	1.00	discard	tldr flagged for manual review
2026-04-02 15:25:43	C:\Users\PC\Documents\GitHub\cex\N02_marketing\output\self_review_2026-04-02.md	1	9.0	1.00	keep	Add root cause analysis section explaining WHY gaps exist to transform inventory into strategic insights, targeting INSIGHT_DEPTH dimension
2026-04-02 15:25:45	C:\Users\PC\Documents\GitHub\cex\N04_knowledge\memory\rag_pipeline_memory.md	1	8.9	1.00	keep	added density_score: 1.0
2026-04-02 15:25:45	C:\Users\PC\Documents\GitHub\cex\N04_knowledge\memory\rag_pipeline_memory.md	2	8.9	1.00	discard	tldr flagged for manual review
2026-04-02 15:25:46	C:\Users\PC\Documents\GitHub\cex\N04_knowledge\memory\rag_pipeline_memory.md	3	8.9	1.00	discard	tldr flagged for manual review
2026-04-02 15:26:09	C:\Users\PC\Documents\GitHub\cex\N04_knowledge\memory\rag_pipeline_memory.md	0	9.0	1.00	skip	already at target
2026-04-02 15:26:11	C:\Users\PC\Documents\GitHub\cex\N04_knowledge\memory\knowledge_memory_index.md	1	8.8	1.00	keep	added density_score: 1.0
2026-04-02 15:26:11	C:\Users\PC\Documents\GitHub\cex\N04_knowledge\memory\knowledge_memory_index.md	2	8.8	1.00	discard	tldr flagged for manual review
2026-04-02 15:26:12	C:\Users\PC\Documents\GitHub\cex\N04_knowledge\memory\knowledge_memory_index.md	3	8.8	1.00	discard	tldr flagged for manual review
2026-04-02 15:26:35	C:\Users\PC\Documents\GitHub\cex\N04_knowledge\memory\knowledge_memory_index.md	0	9.0	1.00	skip	already at target
2026-04-02 15:26:36	C:\Users\PC\Documents\GitHub\cex\N02_marketing\prompts\brand_voice_templates.md	1	9.0	1.00	keep	added density_score: 1.0
2026-04-02 15:26:38	C:\Users\PC\Documents\GitHub\cex\N01_intelligence\output\self_review_2026-04-02.md	1	8.7	0.81	keep	added density_score: 0.81
2026-04-02 15:26:38	C:\Users\PC\Documents\GitHub\cex\N01_intelligence\output\self_review_2026-04-02.md	2	8.7	0.81	discard	tldr flagged for manual review
2026-04-02 15:26:38	C:\Users\PC\Documents\GitHub\cex\N01_intelligence\output\self_review_2026-04-02.md	3	8.7	0.81	discard	tldr flagged for manual review
2026-04-02 15:27:53	C:\Users\PC\Documents\GitHub\cex\N01_intelligence\output\self_review_2026-04-02.md	1	8.9	0.79	discard	Add architectural analysis section examining why gaps exist and their systemic implications to increase insight depth beyond mere cataloging.
2026-04-02 15:28:42	C:\Users\PC\Documents\GitHub\cex\N01_intelligence\output\self_review_2026-04-02.md	2	8.9	0.84	discard	Add root cause analysis and systemic implications to existing gap descriptions to increase insight depth beyond surface-level cataloging
2026-04-02 15:29:26	C:\Users\PC\Documents\GitHub\cex\N01_intelligence\output\self_review_2026-04-02.md	3	8.9	0.83	discard	Condense wordy explanations in CRITICAL and WARN gaps sections to eliminate redundant phrasing while preserving analytical insights, targeting S05 dimension.
2026-04-02 15:30:11	C:\Users\PC\Documents\GitHub\cex\N01_intelligence\output\self_review_2026-04-02.md	4	8.9	0.79	discard	Add architectural drift analysis to P09 gap explanation to increase insight depth beyond surface-level issue identification
2026-04-02 15:31:14	C:\Users\PC\Documents\GitHub\cex\N01_intelligence\output\self_review_2026-04-02.md	5	9.0	0.78	keep	Replace "Cross-Nucleus Issues" section with "Systemic Patterns" analysis that examines what local gaps reveal about architecture consistency and auto-healing mechanisms, targeting INSIGHT_DEPTH.
2026-04-02 15:31:15	C:\Users\PC\Documents\GitHub\cex\N04_knowledge\schemas\naming_convention_mapping.md	1	8.9	1.00	keep	added density_score: 1.0
2026-04-02 15:31:15	C:\Users\PC\Documents\GitHub\cex\N04_knowledge\schemas\naming_convention_mapping.md	2	8.9	1.00	discard	tldr flagged for manual review
2026-04-02 15:31:16	C:\Users\PC\Documents\GitHub\cex\N04_knowledge\schemas\naming_convention_mapping.md	3	8.9	1.00	discard	tldr flagged for manual review
2026-04-02 15:31:40	C:\Users\PC\Documents\GitHub\cex\N04_knowledge\schemas\naming_convention_mapping.md	0	9.0	1.00	skip	already at target
2026-04-02 15:31:41	C:\Users\PC\Documents\GitHub\cex\N04_knowledge\quality\scoring_rubric_knowledge.md	1	9.0	1.00	keep	polished formatting (whitespace cleanup)
2026-04-02 15:31:42	C:\Users\PC\Documents\GitHub\cex\N04_knowledge\output\output_embedding_batch.md	1	9.0	1.00	keep	analyzed: add_template: output templates need a ## Template section
2026-04-02 15:31:44	C:\Users\PC\Documents\GitHub\cex\N01_intelligence\memory\embedding_config_intelligence.md	1	9.1	0.99	keep	added density_score: 0.99
2026-04-02 15:31:45	C:\Users\PC\Documents\GitHub\cex\N04_knowledge\output\output_sql_migration.md	1	9.1	1.00	keep	analyzed: reduce_prose: convert long prose sections into tables or bullet lists
2026-04-02 15:31:46	C:\Users\PC\Documents\GitHub\cex\N01_intelligence\quality\scoring_rubric_intelligence.md	1	9.0	1.00	keep	polished formatting (whitespace cleanup)
2026-04-02 15:31:47	C:\Users\PC\Documents\GitHub\cex\N01_intelligence\schemas\research_depth_levels.md	1	9.0	1.00	keep	analyzed: add_field_table: schemas need a field/type/description table
2026-04-02 15:31:49	C:\Users\PC\Documents\GitHub\cex\N04_knowledge\output\output_finetune_dataset.md	1	9.0	1.00	keep	analyzed: add_template: output templates need a ## Template section
2026-04-02 15:31:50	C:\Users\PC\Documents\GitHub\cex\N04_knowledge\feedback\quality_gate_knowledge.md	1	9.1	1.00	keep	polished formatting (whitespace cleanup)
2026-04-02 15:31:51	C:\Users\PC\Documents\GitHub\cex\N01_intelligence\schemas\source_quality_contract.md	1	9.0	1.00	keep	polished formatting (whitespace cleanup)
2026-04-02 15:31:52	C:\Users\PC\Documents\GitHub\cex\N01_intelligence\schemas\trend_detection_contract.md	1	9.0	1.00	keep	polished formatting (whitespace cleanup)
2026-04-02 15:31:54	C:\Users\PC\Documents\GitHub\cex\N01_intelligence\output\output_source_dossier.md	1	9.1	1.00	keep	polished formatting (whitespace cleanup)
2026-04-02 15:31:55	C:\Users\PC\Documents\GitHub\cex\N04_knowledge\schemas\export_format_contract.md	1	9.0	1.00	keep	polished formatting (whitespace cleanup)
2026-04-02 15:31:56	C:\Users\PC\Documents\GitHub\cex\N04_knowledge\schemas\database_schema_contract.md	1	9.1	1.00	keep	analyzed: reduce_prose: convert long prose sections into tables or bullet lists
2026-04-02 15:31:58	C:\Users\PC\Documents\GitHub\cex\N01_intelligence\output\output_research_brief.md	1	9.1	1.00	keep	polished formatting (whitespace cleanup)
2026-04-02 15:31:59	C:\Users\PC\Documents\GitHub\cex\N01_intelligence\memory\rag_source_intelligence.md	1	9.1	1.00	keep	added density_score: 1.0
2026-04-02 15:32:00	C:\Users\PC\Documents\GitHub\cex\N04_knowledge\schemas\freshness_contract.md	1	9.0	1.00	keep	analyzed: add_field_table: schemas need a field/type/description table
2026-04-02 15:32:01	C:\Users\PC\Documents\GitHub\cex\N04_knowledge\knowledge\rag_source_knowledge.md	1	9.0	0.91	keep	added density_score: 0.91
2026-04-02 15:32:03	C:\Users\PC\Documents\GitHub\cex\N01_intelligence\schemas\competitive_analysis_contract.md	1	9.0	1.00	keep	polished formatting (whitespace cleanup)
2026-04-02 15:32:04	C:\Users\PC\Documents\GitHub\cex\N01_intelligence\orchestration\dispatch_rule_intelligence.md	1	9.1	0.95	keep	added density_score: 0.95
2026-04-02 15:32:05	C:\Users\PC\Documents\GitHub\cex\N04_knowledge\output\output_knowledge_card.md	1	9.0	1.00	keep	analyzed: reduce_prose: convert long prose sections into tables or bullet lists
2026-04-02 15:32:07	C:\Users\PC\Documents\GitHub\cex\N04_knowledge\output\output_gap_report.md	1	9.0	1.00	keep	polished formatting (whitespace cleanup)
2026-04-02 15:32:08	C:\Users\PC\Documents\GitHub\cex\N04_knowledge\orchestration\workflow_knowledge.md	1	9.0	1.00	keep	polished formatting (whitespace cleanup)
2026-04-02 15:32:09	C:\Users\PC\Documents\GitHub\cex\N01_intelligence\feedback\quality_gate_intelligence.md	1	9.0	1.00	keep	polished formatting (whitespace cleanup)
2026-04-02 15:32:10	C:\Users\PC\Documents\GitHub\cex\N01_intelligence\architecture\agent_card_intelligence.md	1	9.0	1.00	keep	polished formatting (whitespace cleanup)
2026-04-02 15:32:12	C:\Users\PC\Documents\GitHub\cex\N02_marketing\orchestration\p12_wf_weekly_fashion_content.md	1	9.1	1.00	keep	polished formatting (whitespace cleanup)
2026-04-02 15:32:13	C:\Users\PC\Documents\GitHub\cex\N04_knowledge\schemas\kc_structure_contract.md	1	9.1	1.00	keep	polished formatting (whitespace cleanup)
2026-04-02 15:32:14	C:\Users\PC\Documents\GitHub\cex\N01_intelligence\knowledge\embedding_config_intelligence.md	1	9.0	0.97	keep	added density_score: 0.97
2026-04-02 15:32:16	C:\Users\PC\Documents\GitHub\cex\N01_intelligence\schemas\research_brief_contract.md	1	9.0	1.00	keep	polished formatting (whitespace cleanup)
2026-04-02 15:32:17	C:\Users\PC\Documents\GitHub\cex\N01_intelligence\prompts\system_prompt_intelligence.md	1	9.0	1.00	keep	polished formatting (whitespace cleanup)
2026-04-02 15:32:18	C:\Users\PC\Documents\GitHub\cex\N01_intelligence\output\output_market_snapshot.md	1	9.1	1.00	keep	analyzed: reduce_prose: convert long prose sections into tables or bullet lists
2026-04-02 15:32:20	C:\Users\PC\Documents\GitHub\cex\N01_intelligence\output\output_swot_analysis.md	1	9.0	1.00	keep	polished formatting (whitespace cleanup)
2026-04-02 15:32:21	C:\Users\PC\Documents\GitHub\cex\N01_intelligence\quality\quality_gate_intelligence.md	1	8.9	0.92	keep	added density_score: 0.92
2026-04-02 15:32:21	C:\Users\PC\Documents\GitHub\cex\N01_intelligence\quality\quality_gate_intelligence.md	2	8.9	0.92	discard	polished formatting (whitespace cleanup)
2026-04-02 15:32:22	C:\Users\PC\Documents\GitHub\cex\N01_intelligence\quality\quality_gate_intelligence.md	3	8.9	0.92	discard	polished formatting (whitespace cleanup)
2026-04-02 15:32:43	C:\Users\PC\Documents\GitHub\cex\N01_intelligence\quality\quality_gate_intelligence.md	0	9.0	0.92	skip	already at target
2026-04-02 15:32:45	C:\Users\PC\Documents\GitHub\cex\N01_intelligence\output\output_trend_report.md	1	9.0	1.00	keep	polished formatting (whitespace cleanup)
2026-04-02 15:32:46	C:\Users\PC\Documents\GitHub\cex\N01_intelligence\schemas\citation_format_contract.md	1	9.0	1.00	keep	polished formatting (whitespace cleanup)
2026-04-02 15:32:47	C:\Users\PC\Documents\GitHub\cex\N01_intelligence\orchestration\workflow_intelligence.md	1	9.1	1.00	keep	polished formatting (whitespace cleanup)
2026-04-02 15:32:49	C:\Users\PC\Documents\GitHub\cex\N04_knowledge\output\output_taxonomy_map.md	1	9.0	1.00	keep	polished formatting (whitespace cleanup)
2026-04-02 15:32:50	C:\Users\PC\Documents\GitHub\cex\N01_intelligence\output\output_benchmark_report.md	1	9.0	1.00	keep	polished formatting (whitespace cleanup)
2026-04-02 15:32:51	C:\Users\PC\Documents\GitHub\cex\N04_knowledge\schemas\embedding_contract.md	1	9.0	1.00	keep	analyzed: add_field_table: schemas need a field/type/description table
2026-04-02 15:32:53	C:\Users\PC\Documents\GitHub\cex\N04_knowledge\prompts\system_prompt_knowledge.md	1	9.1	1.00	keep	polished formatting (whitespace cleanup)
2026-04-02 15:32:54	C:\Users\PC\Documents\GitHub\cex\N01_intelligence\output\output_executive_summary.md	1	9.1	1.00	keep	polished formatting (whitespace cleanup)
2026-04-02 15:32:55	C:\Users\PC\Documents\GitHub\cex\N04_knowledge\architecture\agent_card_knowledge.md	1	9.0	1.00	keep	polished formatting (whitespace cleanup)
2026-04-02 15:32:57	C:\Users\PC\Documents\GitHub\cex\N04_knowledge\agents\agent_knowledge.md	1	9.1	1.00	keep	polished formatting (whitespace cleanup)
2026-04-02 15:32:58	C:\Users\PC\Documents\GitHub\cex\N04_knowledge\knowledge\rag_source_supabase.md	1	9.1	1.00	keep	analyzed: reduce_prose: convert long prose sections into tables or bullet lists
2026-04-02 15:32:59	C:\Users\PC\Documents\GitHub\cex\N04_knowledge\knowledge\retriever_config_knowledge.md	1	9.1	0.91	keep	polished formatting (whitespace cleanup)
2026-04-02 15:33:01	C:\Users\PC\Documents\GitHub\cex\N04_knowledge\quality\quality_gate_knowledge.md	1	8.9	0.90	keep	added density_score: 0.9
2026-04-02 15:33:01	C:\Users\PC\Documents\GitHub\cex\N04_knowledge\quality\quality_gate_knowledge.md	2	8.9	0.90	discard	analyzed: reduce_prose: convert long prose sections into tables or bullet lists
2026-04-02 15:33:01	C:\Users\PC\Documents\GitHub\cex\N04_knowledge\quality\quality_gate_knowledge.md	3	8.9	0.90	discard	analyzed: reduce_prose: convert long prose sections into tables or bullet lists
2026-04-02 15:33:23	C:\Users\PC\Documents\GitHub\cex\N04_knowledge\quality\quality_gate_knowledge.md	0	9.0	0.90	skip	already at target
2026-04-02 15:33:25	C:\Users\PC\Documents\GitHub\cex\N04_knowledge\output\output_knowledge_graph.md	1	9.1	1.00	keep	polished formatting (whitespace cleanup)
2026-04-02 15:33:26	C:\Users\PC\Documents\GitHub\cex\N04_knowledge\schemas\taxonomy_contract.md	1	9.0	1.00	keep	analyzed: add_field_table: schemas need a field/type/description table
