timestamp	file	round	quality	density	status	description
2026-04-15 22:05:19	C:\Users\CEX\Documents\GitHub\cex\archetypes\builders\competitive-matrix-builder\bld_collaboration_competitive_matrix.md	1	8.9	0.88	keep	analyzed: increase_density: remove filler words, compress prose into tables
2026-04-15 22:05:19	C:\Users\CEX\Documents\GitHub\cex\archetypes\builders\competitive-matrix-builder\bld_config_competitive_matrix.md	1	8.6	0.93	keep	polished formatting (whitespace cleanup)
2026-04-15 22:05:19	C:\Users\CEX\Documents\GitHub\cex\archetypes\builders\competitive-matrix-builder\bld_examples_competitive_matrix.md	1	9.1	1.00	keep	polished formatting (whitespace cleanup)
2026-04-15 22:05:20	C:\Users\CEX\Documents\GitHub\cex\archetypes\builders\competitive-matrix-builder\bld_instruction_competitive_matrix.md	1	8.9	0.96	keep	analyzed: reduce_prose: convert long prose sections into tables or bullet lists
2026-04-15 22:05:20	C:\Users\CEX\Documents\GitHub\cex\archetypes\builders\competitive-matrix-builder\bld_knowledge_card_competitive_matrix.md	1	9.2	1.00	keep	analyzed: reduce_prose: convert long prose sections into tables or bullet lists
2026-04-15 22:05:20	C:\Users\CEX\Documents\GitHub\cex\archetypes\builders\competitive-matrix-builder\bld_manifest_competitive_matrix.md	1	8.8	0.81	keep	analyzed: increase_density: remove filler words, compress prose into tables
2026-04-15 22:05:21	C:\Users\CEX\Documents\GitHub\cex\archetypes\builders\competitive-matrix-builder\bld_memory_competitive_matrix.md	1	8.7	0.99	keep	polished formatting (whitespace cleanup)
2026-04-15 22:05:21	C:\Users\CEX\Documents\GitHub\cex\archetypes\builders\competitive-matrix-builder\bld_output_template_competitive_matrix.md	1	9.2	1.00	keep	analyzed: reduce_prose: convert long prose sections into tables or bullet lists
2026-04-15 22:05:21	C:\Users\CEX\Documents\GitHub\cex\archetypes\builders\competitive-matrix-builder\bld_quality_gate_competitive_matrix.md	1	9.0	1.00	keep	polished formatting (whitespace cleanup)
2026-04-15 22:05:22	C:\Users\CEX\Documents\GitHub\cex\archetypes\builders\competitive-matrix-builder\bld_schema_competitive_matrix.md	1	9.1	1.00	keep	analyzed: reduce_prose: convert long prose sections into tables or bullet lists
2026-04-15 22:05:22	C:\Users\CEX\Documents\GitHub\cex\archetypes\builders\competitive-matrix-builder\bld_system_prompt_competitive_matrix.md	1	9.0	0.81	keep	analyzed: reduce_prose: convert long prose sections into tables or bullet lists
2026-04-15 22:05:22	C:\Users\CEX\Documents\GitHub\cex\archetypes\builders\competitive-matrix-builder\bld_tools_competitive_matrix.md	1	8.9	1.00	keep	polished formatting (whitespace cleanup)
2026-04-15 22:05:22	C:\Users\CEX\Documents\GitHub\cex\archetypes\builders\compliance-checklist-builder\bld_architecture_compliance_checklist.md	1	9.0	1.00	keep	polished formatting (whitespace cleanup)
2026-04-15 22:05:23	C:\Users\CEX\Documents\GitHub\cex\archetypes\builders\compliance-checklist-builder\bld_collaboration_compliance_checklist.md	1	8.9	0.85	keep	analyzed: increase_density: remove filler words, compress prose into tables
2026-04-15 22:05:23	C:\Users\CEX\Documents\GitHub\cex\archetypes\builders\compliance-checklist-builder\bld_config_compliance_checklist.md	1	8.6	1.00	keep	polished formatting (whitespace cleanup)
2026-04-15 22:05:23	C:\Users\CEX\Documents\GitHub\cex\archetypes\builders\compliance-checklist-builder\bld_examples_compliance_checklist.md	1	8.9	1.00	keep	polished formatting (whitespace cleanup)
2026-04-15 22:05:24	C:\Users\CEX\Documents\GitHub\cex\archetypes\builders\compliance-checklist-builder\bld_instruction_compliance_checklist.md	1	8.9	0.97	keep	analyzed: reduce_prose: convert long prose sections into tables or bullet lists
2026-04-15 22:05:24	C:\Users\CEX\Documents\GitHub\cex\archetypes\builders\compliance-checklist-builder\bld_knowledge_card_compliance_checklist.md	1	9.2	0.99	keep	analyzed: reduce_prose: convert long prose sections into tables or bullet lists
2026-04-15 22:05:24	C:\Users\CEX\Documents\GitHub\cex\archetypes\builders\compliance-checklist-builder\bld_manifest_compliance_checklist.md	1	8.8	0.82	keep	analyzed: increase_density: remove filler words, compress prose into tables
2026-04-15 22:05:25	C:\Users\CEX\Documents\GitHub\cex\archetypes\builders\compliance-checklist-builder\bld_memory_compliance_checklist.md	1	8.7	0.98	keep	polished formatting (whitespace cleanup)
2026-04-15 22:05:25	C:\Users\CEX\Documents\GitHub\cex\archetypes\builders\compliance-checklist-builder\bld_output_template_compliance_checklist.md	1	8.8	1.00	keep	analyzed: reduce_prose: convert long prose sections into tables or bullet lists
2026-04-15 22:05:25	C:\Users\CEX\Documents\GitHub\cex\archetypes\builders\compliance-checklist-builder\bld_quality_gate_compliance_checklist.md	1	8.9	1.00	keep	polished formatting (whitespace cleanup)
2026-04-15 22:05:26	C:\Users\CEX\Documents\GitHub\cex\archetypes\builders\compliance-checklist-builder\bld_schema_compliance_checklist.md	1	9.1	1.00	keep	polished formatting (whitespace cleanup)
2026-04-15 22:05:26	C:\Users\CEX\Documents\GitHub\cex\archetypes\builders\compliance-checklist-builder\bld_system_prompt_compliance_checklist.md	1	8.8	0.80	keep	analyzed: increase_density: remove filler words, compress prose into tables
2026-04-15 22:05:26	C:\Users\CEX\Documents\GitHub\cex\archetypes\builders\compliance-checklist-builder\bld_tools_compliance_checklist.md	1	8.7	1.00	keep	polished formatting (whitespace cleanup)
2026-04-15 22:05:27	C:\Users\CEX\Documents\GitHub\cex\archetypes\builders\compliance-framework-builder\bld_architecture_compliance_framework.md	1	8.9	0.88	keep	analyzed: increase_density: remove filler words, compress prose into tables
2026-04-15 22:05:27	C:\Users\CEX\Documents\GitHub\cex\archetypes\builders\compliance-framework-builder\bld_collaboration_compliance_framework.md	1	8.9	0.88	keep	analyzed: increase_density: remove filler words, compress prose into tables
2026-04-15 22:05:27	C:\Users\CEX\Documents\GitHub\cex\archetypes\builders\compliance-framework-builder\bld_config_compliance_framework.md	1	8.6	0.93	keep	polished formatting (whitespace cleanup)
2026-04-15 22:05:28	C:\Users\CEX\Documents\GitHub\cex\archetypes\builders\compliance-framework-builder\bld_examples_compliance_framework.md	1	8.9	0.98	keep	polished formatting (whitespace cleanup)
2026-04-15 22:05:28	C:\Users\CEX\Documents\GitHub\cex\archetypes\builders\compliance-framework-builder\bld_instruction_compliance_framework.md	1	8.9	0.97	keep	analyzed: reduce_prose: convert long prose sections into tables or bullet lists
2026-04-15 22:05:28	C:\Users\CEX\Documents\GitHub\cex\archetypes\builders\compliance-framework-builder\bld_knowledge_card_compliance_framework.md	1	9.1	1.00	keep	polished formatting (whitespace cleanup)
2026-04-15 22:05:28	C:\Users\CEX\Documents\GitHub\cex\archetypes\builders\compliance-framework-builder\bld_manifest_compliance_framework.md	1	8.8	0.82	keep	analyzed: increase_density: remove filler words, compress prose into tables
2026-04-15 22:05:29	C:\Users\CEX\Documents\GitHub\cex\archetypes\builders\compliance-framework-builder\bld_memory_compliance_framework.md	1	8.7	0.96	keep	polished formatting (whitespace cleanup)
2026-04-15 22:05:29	C:\Users\CEX\Documents\GitHub\cex\archetypes\builders\compliance-framework-builder\bld_output_template_compliance_framework.md	1	9.1	1.00	keep	analyzed: reduce_prose: convert long prose sections into tables or bullet lists
2026-04-15 22:05:29	C:\Users\CEX\Documents\GitHub\cex\archetypes\builders\compliance-framework-builder\bld_quality_gate_compliance_framework.md	1	9.0	1.00	keep	polished formatting (whitespace cleanup)
2026-04-15 22:05:30	C:\Users\CEX\Documents\GitHub\cex\archetypes\builders\compliance-framework-builder\bld_schema_compliance_framework.md	1	9.1	1.00	keep	polished formatting (whitespace cleanup)
2026-04-15 22:05:30	C:\Users\CEX\Documents\GitHub\cex\archetypes\builders\compliance-framework-builder\bld_system_prompt_compliance_framework.md	1	8.8	0.80	keep	analyzed: increase_density: remove filler words, compress prose into tables
2026-04-15 22:05:30	C:\Users\CEX\Documents\GitHub\cex\archetypes\builders\compliance-framework-builder\bld_tools_compliance_framework.md	1	8.9	1.00	keep	polished formatting (whitespace cleanup)
2026-04-15 22:05:31	C:\Users\CEX\Documents\GitHub\cex\archetypes\builders\conformity-assessment-builder\bld_architecture_conformity_assessment.md	1	9.1	1.00	keep	analyzed: reduce_prose: convert long prose sections into tables or bullet lists
2026-04-15 22:05:31	C:\Users\CEX\Documents\GitHub\cex\archetypes\builders\conformity-assessment-builder\bld_collaboration_conformity_assessment.md	1	9.2	1.00	keep	polished formatting (whitespace cleanup)
2026-04-15 22:05:31	C:\Users\CEX\Documents\GitHub\cex\archetypes\builders\conformity-assessment-builder\bld_config_conformity_assessment.md	1	9.2	1.00	keep	analyzed: reduce_prose: convert long prose sections into tables or bullet lists
2026-04-15 22:05:32	C:\Users\CEX\Documents\GitHub\cex\archetypes\builders\conformity-assessment-builder\bld_examples_conformity_assessment.md	1	9.2	1.00	keep	analyzed: reduce_prose: convert long prose sections into tables or bullet lists
2026-04-15 22:05:32	C:\Users\CEX\Documents\GitHub\cex\archetypes\builders\conformity-assessment-builder\bld_instruction_conformity_assessment.md	1	9.1	1.00	keep	polished formatting (whitespace cleanup)
2026-04-15 22:05:32	C:\Users\CEX\Documents\GitHub\cex\archetypes\builders\conformity-assessment-builder\bld_knowledge_card_conformity_assessment.md	1	9.1	1.00	keep	polished formatting (whitespace cleanup)
2026-04-15 22:05:33	C:\Users\CEX\Documents\GitHub\cex\archetypes\builders\conformity-assessment-builder\bld_manifest_conformity_assessment.md	1	9.1	1.00	keep	polished formatting (whitespace cleanup)
2026-04-15 22:05:33	C:\Users\CEX\Documents\GitHub\cex\archetypes\builders\conformity-assessment-builder\bld_memory_conformity_assessment.md	1	9.2	0.99	keep	polished formatting (whitespace cleanup)
2026-04-15 22:05:33	C:\Users\CEX\Documents\GitHub\cex\archetypes\builders\conformity-assessment-builder\bld_output_template_conformity_assessment.md	1	9.1	1.00	keep	analyzed: reduce_prose: convert long prose sections into tables or bullet lists
2026-04-15 22:05:34	C:\Users\CEX\Documents\GitHub\cex\archetypes\builders\conformity-assessment-builder\bld_quality_gate_conformity_assessment.md	1	9.1	1.00	keep	polished formatting (whitespace cleanup)
2026-04-15 22:05:34	C:\Users\CEX\Documents\GitHub\cex\archetypes\builders\conformity-assessment-builder\bld_schema_conformity_assessment.md	1	9.1	1.00	keep	polished formatting (whitespace cleanup)
2026-04-15 22:05:34	C:\Users\CEX\Documents\GitHub\cex\archetypes\builders\conformity-assessment-builder\bld_system_prompt_conformity_assessment.md	1	9.1	0.97	keep	analyzed: reduce_prose: convert long prose sections into tables or bullet lists
2026-04-15 22:05:35	C:\Users\CEX\Documents\GitHub\cex\archetypes\builders\conformity-assessment-builder\bld_tools_conformity_assessment.md	1	9.2	1.00	keep	analyzed: reduce_prose: convert long prose sections into tables or bullet lists
2026-04-15 22:05:35	C:\Users\CEX\Documents\GitHub\cex\archetypes\builders\consolidation-policy-builder\bld_architecture_consolidation_policy.md	1	9.0	1.00	keep	polished formatting (whitespace cleanup)
2026-04-15 22:05:35	C:\Users\CEX\Documents\GitHub\cex\archetypes\builders\consolidation-policy-builder\bld_collaboration_consolidation_policy.md	1	9.1	0.99	keep	analyzed: reduce_prose: convert long prose sections into tables or bullet lists
2026-04-15 22:05:36	C:\Users\CEX\Documents\GitHub\cex\archetypes\builders\consolidation-policy-builder\bld_config_consolidation_policy.md	1	8.7	1.00	keep	polished formatting (whitespace cleanup)
2026-04-15 22:05:36	C:\Users\CEX\Documents\GitHub\cex\archetypes\builders\consolidation-policy-builder\bld_examples_consolidation_policy.md	1	8.9	1.00	keep	analyzed: reduce_prose: convert long prose sections into tables or bullet lists
2026-04-15 22:05:36	C:\Users\CEX\Documents\GitHub\cex\archetypes\builders\consolidation-policy-builder\bld_instruction_consolidation_policy.md	1	9.0	1.00	keep	analyzed: reduce_prose: convert long prose sections into tables or bullet lists
2026-04-15 22:05:36	C:\Users\CEX\Documents\GitHub\cex\archetypes\builders\consolidation-policy-builder\bld_knowledge_card_consolidation_policy.md	1	9.2	1.00	keep	analyzed: reduce_prose: convert long prose sections into tables or bullet lists
2026-04-15 22:05:37	C:\Users\CEX\Documents\GitHub\cex\archetypes\builders\consolidation-policy-builder\bld_manifest_consolidation_policy.md	1	8.9	0.86	keep	analyzed: reduce_prose: convert long prose sections into tables or bullet lists
2026-04-15 22:05:37	C:\Users\CEX\Documents\GitHub\cex\archetypes\builders\consolidation-policy-builder\bld_memory_consolidation_policy.md	1	8.9	0.96	keep	analyzed: reduce_prose: convert long prose sections into tables or bullet lists
2026-04-15 22:05:37	C:\Users\CEX\Documents\GitHub\cex\archetypes\builders\consolidation-policy-builder\bld_output_template_consolidation_policy.md	1	9.1	1.00	keep	analyzed: reduce_prose: convert long prose sections into tables or bullet lists
2026-04-15 22:05:38	C:\Users\CEX\Documents\GitHub\cex\archetypes\builders\consolidation-policy-builder\bld_quality_gate_consolidation_policy.md	1	9.0	1.00	keep	polished formatting (whitespace cleanup)
2026-04-15 22:05:38	C:\Users\CEX\Documents\GitHub\cex\archetypes\builders\consolidation-policy-builder\bld_schema_consolidation_policy.md	1	9.2	1.00	keep	analyzed: reduce_prose: convert long prose sections into tables or bullet lists
2026-04-15 22:05:38	C:\Users\CEX\Documents\GitHub\cex\archetypes\builders\consolidation-policy-builder\bld_system_prompt_consolidation_policy.md	1	9.0	0.82	keep	analyzed: reduce_prose: convert long prose sections into tables or bullet lists
2026-04-15 22:05:39	C:\Users\CEX\Documents\GitHub\cex\archetypes\builders\consolidation-policy-builder\bld_tools_consolidation_policy.md	1	9.0	1.00	keep	polished formatting (whitespace cleanup)
2026-04-15 22:05:39	C:\Users\CEX\Documents\GitHub\cex\archetypes\builders\content-filter-builder\bld_architecture_content_filter.md	1	8.9	0.88	keep	analyzed: increase_density: remove filler words, compress prose into tables
2026-04-15 22:05:39	C:\Users\CEX\Documents\GitHub\cex\archetypes\builders\content-filter-builder\bld_collaboration_content_filter.md	1	8.9	0.84	keep	analyzed: increase_density: remove filler words, compress prose into tables
2026-04-15 22:05:40	C:\Users\CEX\Documents\GitHub\cex\archetypes\builders\content-filter-builder\bld_config_content_filter.md	1	8.6	1.00	keep	polished formatting (whitespace cleanup)
2026-04-15 22:05:40	C:\Users\CEX\Documents\GitHub\cex\archetypes\builders\content-filter-builder\bld_examples_content_filter.md	1	8.9	1.00	keep	analyzed: reduce_prose: convert long prose sections into tables or bullet lists
2026-04-15 22:05:40	C:\Users\CEX\Documents\GitHub\cex\archetypes\builders\content-filter-builder\bld_instruction_content_filter.md	1	8.9	1.00	keep	analyzed: reduce_prose: convert long prose sections into tables or bullet lists
2026-04-15 22:05:41	C:\Users\CEX\Documents\GitHub\cex\archetypes\builders\content-filter-builder\bld_knowledge_card_content_filter.md	1	9.2	1.00	keep	polished formatting (whitespace cleanup)
2026-04-15 22:05:41	C:\Users\CEX\Documents\GitHub\cex\archetypes\builders\content-filter-builder\bld_manifest_content_filter.md	1	8.8	0.80	keep	analyzed: increase_density: remove filler words, compress prose into tables
2026-04-15 22:05:41	C:\Users\CEX\Documents\GitHub\cex\archetypes\builders\content-filter-builder\bld_memory_content_filter.md	1	8.7	0.94	keep	polished formatting (whitespace cleanup)
2026-04-15 22:05:42	C:\Users\CEX\Documents\GitHub\cex\archetypes\builders\content-filter-builder\bld_output_template_content_filter.md	1	9.1	1.00	keep	analyzed: reduce_prose: convert long prose sections into tables or bullet lists
2026-04-15 22:05:42	C:\Users\CEX\Documents\GitHub\cex\archetypes\builders\content-filter-builder\bld_quality_gate_content_filter.md	1	9.0	1.00	keep	polished formatting (whitespace cleanup)
2026-04-15 22:05:42	C:\Users\CEX\Documents\GitHub\cex\archetypes\builders\content-filter-builder\bld_schema_content_filter.md	1	9.1	1.00	keep	polished formatting (whitespace cleanup)
2026-04-15 22:05:43	C:\Users\CEX\Documents\GitHub\cex\archetypes\builders\content-filter-builder\bld_system_prompt_content_filter.md	1	8.9	0.77	keep	analyzed: increase_density: remove filler words, compress prose into tables
2026-04-15 22:05:43	C:\Users\CEX\Documents\GitHub\cex\archetypes\builders\content-filter-builder\bld_tools_content_filter.md	1	9.0	1.00	keep	polished formatting (whitespace cleanup)
2026-04-15 22:05:43	C:\Users\CEX\Documents\GitHub\cex\archetypes\builders\context-window-config-builder\bld_memory_context_window_config.md	1	8.8	1.00	keep	added density_score: 1.0
2026-04-15 22:05:43	C:\Users\CEX\Documents\GitHub\cex\archetypes\builders\contributor-guide-builder\bld_architecture_contributor_guide.md	1	9.1	1.00	keep	analyzed: reduce_prose: convert long prose sections into tables or bullet lists
2026-04-15 22:05:44	C:\Users\CEX\Documents\GitHub\cex\archetypes\builders\contributor-guide-builder\bld_collaboration_contributor_guide.md	1	8.7	0.84	keep	analyzed: increase_density: remove filler words, compress prose into tables
2026-04-15 22:05:44	C:\Users\CEX\Documents\GitHub\cex\archetypes\builders\contributor-guide-builder\bld_config_contributor_guide.md	1	8.6	0.93	keep	polished formatting (whitespace cleanup)
2026-04-15 22:05:44	C:\Users\CEX\Documents\GitHub\cex\archetypes\builders\contributor-guide-builder\bld_examples_contributor_guide.md	1	8.9	0.99	keep	analyzed: reduce_prose: convert long prose sections into tables or bullet lists
2026-04-15 22:05:45	C:\Users\CEX\Documents\GitHub\cex\archetypes\builders\contributor-guide-builder\bld_instruction_contributor_guide.md	1	9.1	1.00	keep	polished formatting (whitespace cleanup)
2026-04-15 22:05:45	C:\Users\CEX\Documents\GitHub\cex\archetypes\builders\contributor-guide-builder\bld_knowledge_card_contributor_guide.md	1	9.2	1.00	keep	analyzed: reduce_prose: convert long prose sections into tables or bullet lists
2026-04-15 22:05:45	C:\Users\CEX\Documents\GitHub\cex\archetypes\builders\contributor-guide-builder\bld_manifest_contributor_guide.md	1	8.8	0.85	keep	analyzed: increase_density: remove filler words, compress prose into tables
2026-04-15 22:05:46	C:\Users\CEX\Documents\GitHub\cex\archetypes\builders\contributor-guide-builder\bld_memory_contributor_guide.md	1	9.1	0.98	keep	polished formatting (whitespace cleanup)
2026-04-15 22:05:46	C:\Users\CEX\Documents\GitHub\cex\archetypes\builders\contributor-guide-builder\bld_output_template_contributor_guide.md	1	9.2	0.99	keep	analyzed: reduce_prose: convert long prose sections into tables or bullet lists
2026-04-15 22:05:46	C:\Users\CEX\Documents\GitHub\cex\archetypes\builders\contributor-guide-builder\bld_quality_gate_contributor_guide.md	1	8.9	1.00	keep	polished formatting (whitespace cleanup)
2026-04-15 22:05:47	C:\Users\CEX\Documents\GitHub\cex\archetypes\builders\contributor-guide-builder\bld_schema_contributor_guide.md	1	9.1	1.00	keep	polished formatting (whitespace cleanup)
2026-04-15 22:05:47	C:\Users\CEX\Documents\GitHub\cex\archetypes\builders\contributor-guide-builder\bld_system_prompt_contributor_guide.md	1	9.1	0.95	keep	polished formatting (whitespace cleanup)
2026-04-15 22:05:47	C:\Users\CEX\Documents\GitHub\cex\archetypes\builders\contributor-guide-builder\bld_tools_contributor_guide.md	1	9.1	1.00	keep	polished formatting (whitespace cleanup)
2026-04-15 22:05:48	C:\Users\CEX\Documents\GitHub\cex\archetypes\builders\cost-budget-builder\bld_architecture_cost_budget.md	1	9.1	1.00	keep	analyzed: reduce_prose: convert long prose sections into tables or bullet lists
2026-04-15 22:05:48	C:\Users\CEX\Documents\GitHub\cex\archetypes\builders\cost-budget-builder\bld_collaboration_cost_budget.md	1	9.1	1.00	keep	polished formatting (whitespace cleanup)
2026-04-15 22:05:48	C:\Users\CEX\Documents\GitHub\cex\archetypes\builders\cost-budget-builder\bld_config_cost_budget.md	1	9.1	1.00	keep	polished formatting (whitespace cleanup)
2026-04-15 22:05:49	C:\Users\CEX\Documents\GitHub\cex\archetypes\builders\cost-budget-builder\bld_examples_cost_budget.md	1	9.1	1.00	keep	analyzed: reduce_prose: convert long prose sections into tables or bullet lists
2026-04-15 22:05:49	C:\Users\CEX\Documents\GitHub\cex\archetypes\builders\cost-budget-builder\bld_instruction_cost_budget.md	1	9.0	0.79	keep	analyzed: reduce_prose: convert long prose sections into tables or bullet lists
2026-04-15 22:05:49	C:\Users\CEX\Documents\GitHub\cex\archetypes\builders\cost-budget-builder\bld_knowledge_card_cost_budget.md	1	9.2	1.00	keep	analyzed: reduce_prose: convert long prose sections into tables or bullet lists
2026-04-15 22:05:49	C:\Users\CEX\Documents\GitHub\cex\archetypes\builders\cost-budget-builder\bld_manifest_cost_budget.md	1	9.1	1.00	keep	analyzed: reduce_prose: convert long prose sections into tables or bullet lists
2026-04-15 22:05:50	C:\Users\CEX\Documents\GitHub\cex\archetypes\builders\cost-budget-builder\bld_memory_cost_budget.md	1	9.2	0.94	keep	analyzed: add_tags: minimum 3 tags required
2026-04-15 22:05:50	C:\Users\CEX\Documents\GitHub\cex\archetypes\builders\cost-budget-builder\bld_output_template_cost_budget.md	1	9.0	1.00	keep	analyzed: reduce_prose: convert long prose sections into tables or bullet lists
2026-04-15 22:05:50	C:\Users\CEX\Documents\GitHub\cex\archetypes\builders\cost-budget-builder\bld_quality_gate_cost_budget.md	1	9.1	1.00	keep	polished formatting (whitespace cleanup)
2026-04-15 22:05:51	C:\Users\CEX\Documents\GitHub\cex\archetypes\builders\cost-budget-builder\bld_schema_cost_budget.md	1	9.0	1.00	keep	polished formatting (whitespace cleanup)
