timestamp	file	round	quality	density	status	description
2026-04-15 22:07:00	C:\Users\CEX\Documents\GitHub\cex\archetypes\builders\fhir-agent-capability-builder\bld_architecture_fhir_agent_capability.md	1	9.0	1.00	keep	polished formatting (whitespace cleanup)
2026-04-15 22:07:00	C:\Users\CEX\Documents\GitHub\cex\archetypes\builders\fhir-agent-capability-builder\bld_collaboration_fhir_agent_capability.md	1	8.9	1.00	keep	polished formatting (whitespace cleanup)
2026-04-15 22:07:01	C:\Users\CEX\Documents\GitHub\cex\archetypes\builders\fhir-agent-capability-builder\bld_config_fhir_agent_capability.md	1	8.8	1.00	keep	analyzed: reduce_prose: convert long prose sections into tables or bullet lists
2026-04-15 22:07:01	C:\Users\CEX\Documents\GitHub\cex\archetypes\builders\fhir-agent-capability-builder\bld_examples_fhir_agent_capability.md	1	9.1	1.00	keep	analyzed: reduce_prose: convert long prose sections into tables or bullet lists
2026-04-15 22:07:01	C:\Users\CEX\Documents\GitHub\cex\archetypes\builders\fhir-agent-capability-builder\bld_instruction_fhir_agent_capability.md	1	8.9	1.00	keep	analyzed: reduce_prose: convert long prose sections into tables or bullet lists
2026-04-15 22:07:02	C:\Users\CEX\Documents\GitHub\cex\archetypes\builders\fhir-agent-capability-builder\bld_knowledge_card_fhir_agent_capability.md	1	9.2	1.00	keep	analyzed: reduce_prose: convert long prose sections into tables or bullet lists
2026-04-15 22:07:02	C:\Users\CEX\Documents\GitHub\cex\archetypes\builders\fhir-agent-capability-builder\bld_manifest_fhir_agent_capability.md	1	8.9	0.86	keep	analyzed: reduce_prose: convert long prose sections into tables or bullet lists
2026-04-15 22:07:02	C:\Users\CEX\Documents\GitHub\cex\archetypes\builders\fhir-agent-capability-builder\bld_memory_fhir_agent_capability.md	1	8.8	0.90	keep	polished formatting (whitespace cleanup)
2026-04-15 22:07:03	C:\Users\CEX\Documents\GitHub\cex\archetypes\builders\fhir-agent-capability-builder\bld_output_template_fhir_agent_capability.md	1	9.1	1.00	keep	analyzed: reduce_prose: convert long prose sections into tables or bullet lists
2026-04-15 22:07:03	C:\Users\CEX\Documents\GitHub\cex\archetypes\builders\fhir-agent-capability-builder\bld_quality_gate_fhir_agent_capability.md	1	9.0	1.00	keep	polished formatting (whitespace cleanup)
2026-04-15 22:07:03	C:\Users\CEX\Documents\GitHub\cex\archetypes\builders\fhir-agent-capability-builder\bld_schema_fhir_agent_capability.md	1	9.2	1.00	keep	analyzed: reduce_prose: convert long prose sections into tables or bullet lists
2026-04-15 22:07:03	C:\Users\CEX\Documents\GitHub\cex\archetypes\builders\fhir-agent-capability-builder\bld_system_prompt_fhir_agent_capability.md	1	9.0	0.81	keep	analyzed: reduce_prose: convert long prose sections into tables or bullet lists
2026-04-15 22:07:04	C:\Users\CEX\Documents\GitHub\cex\archetypes\builders\fhir-agent-capability-builder\bld_tools_fhir_agent_capability.md	1	9.0	1.00	keep	polished formatting (whitespace cleanup)
2026-04-15 22:07:04	C:\Users\CEX\Documents\GitHub\cex\archetypes\builders\finetune-config-builder\bld_architecture_finetune_config.md	1	9.1	1.00	keep	analyzed: reduce_prose: convert long prose sections into tables or bullet lists
2026-04-15 22:07:04	C:\Users\CEX\Documents\GitHub\cex\archetypes\builders\finetune-config-builder\bld_collaboration_finetune_config.md	1	9.1	0.99	keep	polished formatting (whitespace cleanup)
2026-04-15 22:07:05	C:\Users\CEX\Documents\GitHub\cex\archetypes\builders\finetune-config-builder\bld_config_finetune_config.md	1	9.1	1.00	keep	polished formatting (whitespace cleanup)
2026-04-15 22:07:05	C:\Users\CEX\Documents\GitHub\cex\archetypes\builders\finetune-config-builder\bld_examples_finetune_config.md	1	8.8	1.00	keep	analyzed: reduce_prose: convert long prose sections into tables or bullet lists
2026-04-15 22:07:05	C:\Users\CEX\Documents\GitHub\cex\archetypes\builders\finetune-config-builder\bld_instruction_finetune_config.md	1	8.8	0.82	keep	analyzed: reduce_prose: convert long prose sections into tables or bullet lists
2026-04-15 22:07:06	C:\Users\CEX\Documents\GitHub\cex\archetypes\builders\finetune-config-builder\bld_knowledge_card_finetune_config.md	1	9.0	1.00	keep	polished formatting (whitespace cleanup)
2026-04-15 22:07:06	C:\Users\CEX\Documents\GitHub\cex\archetypes\builders\finetune-config-builder\bld_manifest_finetune_config.md	1	9.1	1.00	keep	analyzed: reduce_prose: convert long prose sections into tables or bullet lists
2026-04-15 22:07:06	C:\Users\CEX\Documents\GitHub\cex\archetypes\builders\finetune-config-builder\bld_memory_finetune_config.md	1	9.0	0.96	keep	analyzed: add_tags: minimum 3 tags required
2026-04-15 22:07:07	C:\Users\CEX\Documents\GitHub\cex\archetypes\builders\finetune-config-builder\bld_output_template_finetune_config.md	1	9.1	1.00	keep	analyzed: reduce_prose: convert long prose sections into tables or bullet lists
2026-04-15 22:07:07	C:\Users\CEX\Documents\GitHub\cex\archetypes\builders\finetune-config-builder\bld_quality_gate_finetune_config.md	1	9.0	1.00	keep	polished formatting (whitespace cleanup)
2026-04-15 22:07:07	C:\Users\CEX\Documents\GitHub\cex\archetypes\builders\finetune-config-builder\bld_schema_finetune_config.md	1	8.9	1.00	keep	analyzed: reduce_prose: convert long prose sections into tables or bullet lists
2026-04-15 22:07:08	C:\Users\CEX\Documents\GitHub\cex\archetypes\builders\finetune-config-builder\bld_system_prompt_finetune_config.md	1	8.9	0.75	keep	analyzed: increase_density: remove filler words, compress prose into tables
2026-04-15 22:07:08	C:\Users\CEX\Documents\GitHub\cex\archetypes\builders\finetune-config-builder\bld_tools_finetune_config.md	1	9.2	1.00	keep	polished formatting (whitespace cleanup)
2026-04-15 22:07:08	C:\Users\CEX\Documents\GitHub\cex\archetypes\builders\fintech-vertical-builder\bld_architecture_fintech_vertical.md	1	9.0	1.00	keep	polished formatting (whitespace cleanup)
2026-04-15 22:07:09	C:\Users\CEX\Documents\GitHub\cex\archetypes\builders\fintech-vertical-builder\bld_collaboration_fintech_vertical.md	1	8.9	1.00	keep	polished formatting (whitespace cleanup)
2026-04-15 22:07:09	C:\Users\CEX\Documents\GitHub\cex\archetypes\builders\fintech-vertical-builder\bld_config_fintech_vertical.md	1	8.6	0.95	keep	polished formatting (whitespace cleanup)
2026-04-15 22:07:09	C:\Users\CEX\Documents\GitHub\cex\archetypes\builders\fintech-vertical-builder\bld_examples_fintech_vertical.md	1	9.0	0.92	keep	analyzed: reduce_prose: convert long prose sections into tables or bullet lists
2026-04-15 22:07:10	C:\Users\CEX\Documents\GitHub\cex\archetypes\builders\fintech-vertical-builder\bld_instruction_fintech_vertical.md	1	8.9	0.99	keep	analyzed: reduce_prose: convert long prose sections into tables or bullet lists
2026-04-15 22:07:10	C:\Users\CEX\Documents\GitHub\cex\archetypes\builders\fintech-vertical-builder\bld_knowledge_card_fintech_vertical.md	1	9.2	1.00	keep	polished formatting (whitespace cleanup)
2026-04-15 22:07:10	C:\Users\CEX\Documents\GitHub\cex\archetypes\builders\fintech-vertical-builder\bld_manifest_fintech_vertical.md	1	8.8	0.80	keep	analyzed: increase_density: remove filler words, compress prose into tables
2026-04-15 22:07:11	C:\Users\CEX\Documents\GitHub\cex\archetypes\builders\fintech-vertical-builder\bld_memory_fintech_vertical.md	1	8.7	0.99	keep	polished formatting (whitespace cleanup)
2026-04-15 22:07:11	C:\Users\CEX\Documents\GitHub\cex\archetypes\builders\fintech-vertical-builder\bld_output_template_fintech_vertical.md	1	8.9	1.00	keep	analyzed: reduce_prose: convert long prose sections into tables or bullet lists
2026-04-15 22:07:11	C:\Users\CEX\Documents\GitHub\cex\archetypes\builders\fintech-vertical-builder\bld_quality_gate_fintech_vertical.md	1	9.0	1.00	keep	polished formatting (whitespace cleanup)
2026-04-15 22:07:12	C:\Users\CEX\Documents\GitHub\cex\archetypes\builders\fintech-vertical-builder\bld_schema_fintech_vertical.md	1	9.1	1.00	keep	polished formatting (whitespace cleanup)
2026-04-15 22:07:12	C:\Users\CEX\Documents\GitHub\cex\archetypes\builders\fintech-vertical-builder\bld_system_prompt_fintech_vertical.md	1	9.0	0.80	keep	analyzed: reduce_prose: convert long prose sections into tables or bullet lists
2026-04-15 22:07:12	C:\Users\CEX\Documents\GitHub\cex\archetypes\builders\fintech-vertical-builder\bld_tools_fintech_vertical.md	1	8.9	1.00	keep	polished formatting (whitespace cleanup)
2026-04-15 22:07:12	C:\Users\CEX\Documents\GitHub\cex\archetypes\builders\github-issue-template-builder\bld_architecture_github_issue_template.md	1	9.0	0.88	keep	analyzed: increase_density: remove filler words, compress prose into tables
2026-04-15 22:07:13	C:\Users\CEX\Documents\GitHub\cex\archetypes\builders\github-issue-template-builder\bld_collaboration_github_issue_template.md	1	8.7	0.85	keep	analyzed: increase_density: remove filler words, compress prose into tables
2026-04-15 22:07:13	C:\Users\CEX\Documents\GitHub\cex\archetypes\builders\github-issue-template-builder\bld_config_github_issue_template.md	1	8.6	0.95	keep	polished formatting (whitespace cleanup)
2026-04-15 22:07:13	C:\Users\CEX\Documents\GitHub\cex\archetypes\builders\github-issue-template-builder\bld_examples_github_issue_template.md	1	9.0	0.97	keep	polished formatting (whitespace cleanup)
2026-04-15 22:07:14	C:\Users\CEX\Documents\GitHub\cex\archetypes\builders\github-issue-template-builder\bld_instruction_github_issue_template.md	1	8.9	0.94	keep	analyzed: reduce_prose: convert long prose sections into tables or bullet lists
2026-04-15 22:07:14	C:\Users\CEX\Documents\GitHub\cex\archetypes\builders\github-issue-template-builder\bld_knowledge_card_github_issue_template.md	1	9.1	0.99	keep	polished formatting (whitespace cleanup)
2026-04-15 22:07:14	C:\Users\CEX\Documents\GitHub\cex\archetypes\builders\github-issue-template-builder\bld_manifest_github_issue_template.md	1	8.8	0.84	keep	analyzed: increase_density: remove filler words, compress prose into tables
2026-04-15 22:07:15	C:\Users\CEX\Documents\GitHub\cex\archetypes\builders\github-issue-template-builder\bld_memory_github_issue_template.md	1	8.7	0.96	keep	polished formatting (whitespace cleanup)
2026-04-15 22:07:15	C:\Users\CEX\Documents\GitHub\cex\archetypes\builders\github-issue-template-builder\bld_output_template_github_issue_template.md	1	8.8	1.00	keep	analyzed: reduce_prose: convert long prose sections into tables or bullet lists
2026-04-15 22:07:15	C:\Users\CEX\Documents\GitHub\cex\archetypes\builders\github-issue-template-builder\bld_quality_gate_github_issue_template.md	1	9.0	1.00	keep	polished formatting (whitespace cleanup)
2026-04-15 22:07:16	C:\Users\CEX\Documents\GitHub\cex\archetypes\builders\github-issue-template-builder\bld_schema_github_issue_template.md	1	9.1	1.00	keep	polished formatting (whitespace cleanup)
2026-04-15 22:07:16	C:\Users\CEX\Documents\GitHub\cex\archetypes\builders\github-issue-template-builder\bld_system_prompt_github_issue_template.md	1	8.8	0.83	keep	analyzed: increase_density: remove filler words, compress prose into tables
2026-04-15 22:07:16	C:\Users\CEX\Documents\GitHub\cex\archetypes\builders\github-issue-template-builder\bld_tools_github_issue_template.md	1	8.9	1.00	keep	polished formatting (whitespace cleanup)
2026-04-15 22:07:17	C:\Users\CEX\Documents\GitHub\cex\archetypes\builders\govtech-vertical-builder\bld_architecture_govtech_vertical.md	1	9.0	1.00	keep	polished formatting (whitespace cleanup)
