timestamp	file	round	quality	density	status	description
2026-04-02 15:33:27	C:\Users\PC\Documents\GitHub\cex\N04_knowledge\tools\supabase_data_layer_tool.md	1	9.1	1.00	keep	polished formatting (whitespace cleanup)
2026-04-02 15:33:29	C:\Users\PC\Documents\GitHub\cex\N04_knowledge\orchestration\dispatch_rule_supabase.md	1	9.1	1.00	keep	analyzed: reduce_prose: convert long prose sections into tables or bullet lists
2026-04-02 15:33:30	C:\Users\PC\Documents\GitHub\cex\N04_knowledge\orchestration\dispatch_rule_knowledge.md	1	9.1	0.88	keep	analyzed: increase_density: remove filler words, compress prose into tables
2026-04-02 15:33:31	C:\Users\PC\Documents\GitHub\cex\N04_knowledge\output\output_kc_audit_report.md	1	9.1	1.00	keep	polished formatting (whitespace cleanup)
2026-04-02 15:33:33	C:\Users\PC\Documents\GitHub\cex\N04_knowledge\orchestration\workflow_supabase_setup.md	1	9.1	1.00	keep	polished formatting (whitespace cleanup)
2026-04-02 15:33:34	C:\Users\PC\Documents\GitHub\cex\N01_intelligence\agents\agent_intelligence.md	1	9.1	1.00	keep	polished formatting (whitespace cleanup)
2026-04-02 15:33:36	C:\Users\PC\Documents\GitHub\cex\N02_marketing\knowledge\kc_html_component_library.md	1	9.1	1.00	keep	analyzed: reduce_prose: convert long prose sections into tables or bullet lists
2026-04-02 15:33:37	C:\Users\PC\Documents\GitHub\cex\N02_marketing\output\output_email_template.md	1	9.1	1.00	keep	added density_score: 1.0
2026-04-02 15:33:38	C:\Users\PC\Documents\GitHub\cex\N02_marketing\output\landing_page_template.md	1	9.0	0.99	keep	analyzed: reduce_prose: convert long prose sections into tables or bullet lists
2026-04-02 15:33:40	C:\Users\PC\Documents\GitHub\cex\N01_intelligence\knowledge\rag_source_intelligence.md	1	9.1	0.97	keep	added density_score: 0.97
2026-04-02 15:33:41	C:\Users\PC\Documents\GitHub\cex\N01_intelligence\knowledge\knowledge_card_intelligence.md	1	9.0	0.94	keep	added density_score: 0.94
2026-04-02 15:33:43	C:\Users\PC\Documents\GitHub\cex\N02_marketing\knowledge\kc_accessibility_a11y.md	1	9.1	1.00	keep	analyzed: add_tags: minimum 3 tags required
2026-04-02 15:33:44	C:\Users\PC\Documents\GitHub\cex\N01_intelligence\output\output_competitive_grid.md	1	9.0	1.00	keep	polished formatting (whitespace cleanup)
2026-04-02 15:33:45	C:\Users\PC\Documents\GitHub\cex\N02_marketing\output\component_template.md	1	9.1	1.00	keep	analyzed: reduce_prose: convert long prose sections into tables or bullet lists
2026-04-02 15:33:47	C:\Users\PC\Documents\GitHub\cex\N02_marketing\schemas\tailwind_palette_contract.md	1	9.1	1.00	keep	analyzed: reduce_prose: convert long prose sections into tables or bullet lists
2026-04-02 15:33:48	C:\Users\PC\Documents\GitHub\cex\N01_intelligence\tools\research_pipeline_intelligence.md	1	9.1	1.00	keep	analyzed: reduce_prose: convert long prose sections into tables or bullet lists
2026-04-02 15:33:50	C:\Users\PC\Documents\GitHub\cex\N02_marketing\architecture\agent_card_marketing.md	1	9.2	1.00	keep	analyzed: reduce_prose: convert long prose sections into tables or bullet lists
2026-04-02 15:33:51	C:\Users\PC\Documents\GitHub\cex\N02_marketing\agents\agent_marketing.md	1	9.2	1.00	keep	analyzed: reduce_prose: convert long prose sections into tables or bullet lists
2026-04-02 15:33:52	C:\Users\PC\Documents\GitHub\cex\N04_knowledge\knowledge\chunk_strategy_knowledge.md	1	9.1	0.89	keep	added density_score: 0.89
2026-04-02 15:33:54	C:\Users\PC\Documents\GitHub\cex\N02_marketing\schemas\html_output_schema.md	1	9.1	1.00	keep	analyzed: reduce_prose: convert long prose sections into tables or bullet lists
2026-04-02 15:33:55	C:\Users\PC\Documents\GitHub\cex\N02_marketing\feedback\quality_gate_marketing.md	1	9.1	1.00	keep	analyzed: reduce_prose: convert long prose sections into tables or bullet lists
2026-04-02 15:33:57	C:\Users\PC\Documents\GitHub\cex\N01_intelligence\quality\p07_scoring_rubric_create_a_scoring_rubric_for_intelligence.md	1	9.1	1.00	keep	polished formatting (whitespace cleanup)
2026-04-02 15:33:58	C:\Users\PC\Documents\GitHub\cex\N01_intelligence\knowledge\knowledge_card_source_catalog.md	1	9.1	1.00	keep	polished formatting (whitespace cleanup)
2026-04-02 15:34:00	C:\Users\PC\Documents\GitHub\cex\N01_intelligence\knowledge\knowledge_card_research_methods.md	1	9.2	1.00	keep	analyzed: reduce_prose: convert long prose sections into tables or bullet lists
2026-04-02 15:34:01	C:\Users\PC\Documents\GitHub\cex\N02_marketing\tools\social_publisher_marketing.md	1	9.1	1.00	keep	analyzed: reduce_prose: convert long prose sections into tables or bullet lists
2026-04-02 15:34:02	C:\Users\PC\Documents\GitHub\cex\N01_intelligence\prompts\prompt_template_intelligence.md	1	9.1	0.94	keep	added density_score: 0.94
2026-04-02 15:34:04	C:\Users\PC\Documents\GitHub\cex\N02_marketing\schemas\responsive_breakpoints.md	1	9.1	1.00	keep	analyzed: reduce_prose: convert long prose sections into tables or bullet lists
2026-04-02 15:34:05	C:\Users\PC\Documents\GitHub\cex\N01_intelligence\orchestration\dispatch_rule_research_pipeline.md	1	9.1	1.00	keep	analyzed: reduce_prose: convert long prose sections into tables or bullet lists
2026-04-02 15:34:07	C:\Users\PC\Documents\GitHub\cex\N02_marketing\output\output_visual_report.md	1	9.2	1.00	keep	analyzed: reduce_prose: convert long prose sections into tables or bullet lists
2026-04-02 15:34:08	C:\Users\PC\Documents\GitHub\cex\N02_marketing\output\output_style_guide.md	1	9.1	0.96	keep	analyzed: reduce_prose: convert long prose sections into tables or bullet lists
2026-04-02 15:34:09	C:\Users\PC\Documents\GitHub\cex\N02_marketing\output\output_social_card.md	1	9.1	1.00	keep	analyzed: reduce_prose: convert long prose sections into tables or bullet lists
2026-04-02 15:34:11	C:\Users\PC\Documents\GitHub\cex\N02_marketing\prompts\action_prompt_marketing.md	1	9.1	1.00	keep	analyzed: reduce_prose: convert long prose sections into tables or bullet lists
2026-04-02 15:34:12	C:\Users\PC\Documents\GitHub\cex\N04_knowledge\knowledge\knowledge_card_supabase_data_layer.md	1	9.1	1.00	keep	polished formatting (whitespace cleanup)
2026-04-02 15:34:14	C:\Users\PC\Documents\GitHub\cex\N02_marketing\schemas\design_token_contract.md	1	9.1	1.00	keep	analyzed: reduce_prose: convert long prose sections into tables or bullet lists
2026-04-02 15:34:15	C:\Users\PC\Documents\GitHub\cex\N02_marketing\schemas\a11y_checklist.md	1	9.1	1.00	keep	analyzed: reduce_prose: convert long prose sections into tables or bullet lists
2026-04-02 15:34:16	C:\Users\PC\Documents\GitHub\cex\N04_knowledge\knowledge\knowledge_card_knowledge.md	1	9.2	0.90	keep	polished formatting (whitespace cleanup)
2026-04-02 15:34:18	C:\Users\PC\Documents\GitHub\cex\N02_marketing\orchestration\dispatch_rule_social_publisher.md	1	9.1	1.00	keep	analyzed: reduce_prose: convert long prose sections into tables or bullet lists
2026-04-02 15:34:19	C:\Users\PC\Documents\GitHub\cex\N02_marketing\orchestration\dispatch_rule_marketing.md	1	9.1	1.00	keep	added density_score: 1.0
2026-04-02 15:34:21	C:\Users\PC\Documents\GitHub\cex\N02_marketing\knowledge\knowledge_card_social_publishing.md	1	9.1	1.00	keep	polished formatting (whitespace cleanup)
2026-04-02 15:34:22	C:\Users\PC\Documents\GitHub\cex\N02_marketing\orchestration\workflow_marketing.md	1	9.1	1.00	keep	analyzed: reduce_prose: convert long prose sections into tables or bullet lists
2026-04-02 15:34:24	C:\Users\PC\Documents\GitHub\cex\N02_marketing\output\output_dashboard_ui.md	1	9.1	1.00	keep	analyzed: reduce_prose: convert long prose sections into tables or bullet lists
2026-04-02 15:34:25	C:\Users\PC\Documents\GitHub\cex\N04_knowledge\knowledge\embedding_config_supabase.md	1	9.1	1.00	keep	analyzed: reduce_prose: convert long prose sections into tables or bullet lists
2026-04-02 15:34:27	C:\Users\PC\Documents\GitHub\cex\N04_knowledge\knowledge\embedding_config_knowledge.md	1	9.1	0.91	keep	added density_score: 0.91
2026-04-02 15:35:54	C:\Users\PC\Documents\GitHub\cex\P01_knowledge\examples\p01_knowledge_card_create_knowledge_card_about_competitive_intelligence_osint_t.md	1	9.2	1.00	keep	analyzed: reduce_prose: convert long prose sections into tables or bullet lists
2026-04-02 15:37:23	C:\Users\PC\Documents\GitHub\cex\P01_knowledge\examples\p01_knowledge_card_create_knowledge_card_about_market_research_data_triangulati.md	1	0.0	0.00	crash	compile fail after: tldr flagged for manual review
2026-04-02 15:37:23	C:\Users\PC\Documents\GitHub\cex\P01_knowledge\examples\p01_knowledge_card_create_knowledge_card_about_market_research_data_triangulati.md	2	0.0	0.00	crash	compile fail after: analyzed: increase_density: remove filler words, compress prose into tables
2026-04-02 15:37:24	C:\Users\PC\Documents\GitHub\cex\P01_knowledge\examples\p01_knowledge_card_create_knowledge_card_about_market_research_data_triangulati.md	3	0.0	0.00	crash	compile fail after: analyzed: increase_density: remove filler words, compress prose into tables
2026-04-02 15:39:28	C:\Users\PC\Documents\GitHub\cex\P01_knowledge\examples\p01_knowledge_card_create_knowledge_card_about_market_research_data_triangulati.md	1	0.0	0.00	crash	compile fail: Add cross-references to research methods, validation frameworks, and source triangulation artifacts to create knowledge graph connections and improve S09 score.
2026-04-02 15:40:31	C:\Users\PC\Documents\GitHub\cex\P01_knowledge\examples\p01_knowledge_card_create_knowledge_card_about_market_research_data_triangulati.md	2	0.0	0.00	crash	compile fail: Add cross-references to related knowledge cards in the linked_artifacts.related field to improve S09 cross-reference score
2026-04-02 15:41:16	C:\Users\PC\Documents\GitHub\cex\P01_knowledge\examples\p01_knowledge_card_create_knowledge_card_about_market_research_data_triangulati.md	3	0.0	0.00	crash	compile fail: Add specific quantitative details, sample sizes, and concrete benchmarks to improve S01 factual concreteness score
2026-04-02 15:41:48	C:\Users\PC\Documents\GitHub\cex\P01_knowledge\examples\p01_knowledge_card_create_knowledge_card_about_market_research_data_triangulati.md	4	0.0	0.00	crash	compile fail: Improve card type classification by making domain more specific from "market_research" to "research_methodology" to better categorize this methodology-focused knowledge card
2026-04-02 15:42:16	C:\Users\PC\Documents\GitHub\cex\P01_knowledge\examples\p01_knowledge_card_create_knowledge_card_about_market_research_data_triangulati.md	5	0.0	0.00	crash	compile fail: Add inline cross-references and a "Related Frameworks" section to improve S09 cross-reference connections without modifying the problematic linked_artifacts field
2026-04-02 15:44:00	C:\Users\PC\Documents\GitHub\cex\P01_knowledge\examples\p01_knowledge_card_create_knowledge_card_about_trend_detection_with_time_series.md	1	9.2	1.00	keep	analyzed: reduce_prose: convert long prose sections into tables or bullet lists
2026-04-02 15:45:43	C:\Users\PC\Documents\GitHub\cex\P01_knowledge\examples\p01_knowledge_card_create_knowledge_card_about_source_credibility_scoring_frame.md	1	0.0	0.00	crash	compile fail after: tldr flagged for manual review
2026-04-02 15:45:44	C:\Users\PC\Documents\GitHub\cex\P01_knowledge\examples\p01_knowledge_card_create_knowledge_card_about_source_credibility_scoring_frame.md	2	9.2	1.00	keep	polished formatting (whitespace cleanup)
2026-04-02 15:47:00	C:\Users\PC\Documents\GitHub\cex\P01_knowledge\examples\p06_input_schema_create_schema_contract_for_benchmark_comparison_data_model.md	1	9.1	1.00	keep	analyzed: reduce_prose: convert long prose sections into tables or bullet lists
2026-04-02 15:49:07	C:\Users\PC\Documents\GitHub\cex\P01_knowledge\examples\p04_research_pipeline_create_output_template_for_weekly_market_intelligence_brief.md	1	9.1	1.00	keep	added density_score: 1.0
2026-04-02 15:50:19	C:\Users\PC\Documents\GitHub\cex\P01_knowledge\examples\p01_knowledge_card_create_knowledge_card_about_conversion_copywriting_framework.md	1	9.2	1.00	keep	analyzed: reduce_prose: convert long prose sections into tables or bullet lists
2026-04-02 15:51:29	C:\Users\PC\Documents\GitHub\cex\P01_knowledge\examples\p01_knowledge_card_create_knowledge_card_about_brand_voice_consistency_across_c.md	1	0.0	0.00	crash	compile fail after: tldr flagged for manual review
2026-04-02 15:51:29	C:\Users\PC\Documents\GitHub\cex\P01_knowledge\examples\p01_knowledge_card_create_knowledge_card_about_brand_voice_consistency_across_c.md	2	9.1	1.00	keep	polished formatting (whitespace cleanup)
2026-04-02 15:52:55	C:\Users\PC\Documents\GitHub\cex\P01_knowledge\examples\p01_knowledge_card_create_knowledge_card_about_a_b_testing_for_content_optimiza.md	1	0.0	0.00	crash	compile fail after: tldr flagged for manual review
2026-04-02 15:52:56	C:\Users\PC\Documents\GitHub\cex\P01_knowledge\examples\p01_knowledge_card_create_knowledge_card_about_a_b_testing_for_content_optimiza.md	2	9.2	1.00	keep	analyzed: reduce_prose: convert long prose sections into tables or bullet lists
2026-04-02 15:54:41	C:\Users\PC\Documents\GitHub\cex\P01_knowledge\examples\p01_knowledge_card_create_knowledge_card_about_seo_content_strategy_for_e_comme.md	1	9.2	1.00	keep	analyzed: reduce_prose: convert long prose sections into tables or bullet lists
2026-04-02 15:56:05	C:\Users\PC\Documents\GitHub\cex\P01_knowledge\examples\p04_social_publisher_create_output_template_for_social_media_content_calendar.md	1	9.1	1.00	keep	analyzed: reduce_prose: convert long prose sections into tables or bullet lists
2026-04-02 15:57:13	C:\Users\PC\Documents\GitHub\cex\P01_knowledge\examples\p06_input_schema_create_schema_contract_for_campaign_performance_metrics.md	1	0.0	0.00	crash	compile fail after: tldr flagged for manual review
2026-04-02 15:57:14	C:\Users\PC\Documents\GitHub\cex\P01_knowledge\examples\p06_input_schema_create_schema_contract_for_campaign_performance_metrics.md	2	9.1	1.00	keep	analyzed: fix_frontmatter: missing title
2026-04-02 16:00:05	C:\Users\PC\Documents\GitHub\cex\P01_knowledge\examples\p01_knowledge_card_create_knowledge_card_about_multi_agent_orchestration_patter.md	1	0.0	0.00	crash	compile fail after: tldr flagged for manual review
2026-04-02 16:00:06	C:\Users\PC\Documents\GitHub\cex\P01_knowledge\examples\p01_knowledge_card_create_knowledge_card_about_multi_agent_orchestration_patter.md	2	9.1	1.00	keep	analyzed: reduce_prose: convert long prose sections into tables or bullet lists
2026-04-02 16:01:27	C:\Users\PC\Documents\GitHub\cex\P01_knowledge\examples\p01_knowledge_card_create_knowledge_card_about_artifact_quality_evaluation_meth.md	1	9.2	1.00	keep	analyzed: reduce_prose: convert long prose sections into tables or bullet lists
2026-04-02 16:03:28	C:\Users\PC\Documents\GitHub\cex\P01_knowledge\examples\p01_knowledge_card_create_knowledge_card_about_llm_output_parsing_and_validatio.md	1	0.0	0.00	crash	compile fail after: tldr flagged for manual review
2026-04-02 16:03:29	C:\Users\PC\Documents\GitHub\cex\P01_knowledge\examples\p01_knowledge_card_create_knowledge_card_about_llm_output_parsing_and_validatio.md	2	9.2	1.00	keep	analyzed: reduce_prose: convert long prose sections into tables or bullet lists
2026-04-02 16:05:00	C:\Users\PC\Documents\GitHub\cex\P01_knowledge\examples\p06_input_schema_create_schema_contract_for_builder_specification_format.md	1	9.1	1.00	keep	analyzed: reduce_prose: convert long prose sections into tables or bullet lists
2026-04-02 16:07:40	C:\Users\PC\Documents\GitHub\cex\P01_knowledge\examples\p05_formatter_create_output_template_for_artifact_creation_report.md	1	8.6	1.00	keep	analyzed: fix_frontmatter: missing title
2026-04-02 16:09:15	C:\Users\PC\Documents\GitHub\cex\P01_knowledge\examples\p01_knowledge_card_create_knowledge_card_about_rag_chunking_strategies_comparis.md	1	0.0	0.00	crash	compile fail after: tldr flagged for manual review
2026-04-02 16:09:15	C:\Users\PC\Documents\GitHub\cex\P01_knowledge\examples\p01_knowledge_card_create_knowledge_card_about_rag_chunking_strategies_comparis.md	2	0.0	0.00	crash	compile fail after: tldr flagged for manual review
2026-04-02 16:09:16	C:\Users\PC\Documents\GitHub\cex\P01_knowledge\examples\p01_knowledge_card_create_knowledge_card_about_rag_chunking_strategies_comparis.md	3	0.0	0.00	crash	compile fail after: tldr flagged for manual review
2026-04-02 16:10:30	C:\Users\PC\Documents\GitHub\cex\P01_knowledge\examples\p01_knowledge_card_create_knowledge_card_about_rag_chunking_strategies_comparis.md	1	0.0	0.00	crash	compile fail: Add comprehensive "Configuration & Tuning" section with specific parameters, thresholds, and troubleshooting for each chunking strategy to improve completeness coverage
2026-04-02 16:11:21	C:\Users\PC\Documents\GitHub\cex\P01_knowledge\examples\p01_knowledge_card_create_knowledge_card_about_rag_chunking_strategies_comparis.md	2	0.0	0.00	crash	compile fail: Add specific performance benchmarks and detailed implementation guidance to Strategy Implementation Phases section to improve completeness dimension
2026-04-02 16:12:35	C:\Users\PC\Documents\GitHub\cex\P01_knowledge\examples\p01_knowledge_card_create_knowledge_card_about_rag_chunking_strategies_comparis.md	3	0.0	0.00	crash	compile fail: Enhance Strategy Implementation Phases section with specific decision criteria and validation checkpoints to improve completeness dimension
2026-04-02 16:16:10	C:\Users\PC\Documents\GitHub\cex\P01_knowledge\examples\p01_knowledge_card_create_knowledge_card_about_rag_chunking_strategies_comparis.md	1	0.0	0.00	crash	compile fail after: tldr flagged for manual review
2026-04-02 16:16:10	C:\Users\PC\Documents\GitHub\cex\P01_knowledge\examples\p01_knowledge_card_create_knowledge_card_about_rag_chunking_strategies_comparis.md	2	0.0	0.00	crash	compile fail after: tldr flagged for manual review
2026-04-02 16:16:10	C:\Users\PC\Documents\GitHub\cex\P01_knowledge\examples\p01_knowledge_card_create_knowledge_card_about_rag_chunking_strategies_comparis.md	3	0.0	0.00	crash	compile fail after: tldr flagged for manual review
2026-04-02 16:17:26	C:\Users\PC\Documents\GitHub\cex\P01_knowledge\examples\p01_knowledge_card_create_knowledge_card_about_rag_chunking_strategies_comparis.md	1	0.0	0.00	crash	compile fail: Add specific performance benchmarks and counter-intuitive failure modes section to improve insight depth with concrete data points
2026-04-02 16:20:02	C:\Users\PC\Documents\GitHub\cex\P01_knowledge\examples\p01_knowledge_card_create_knowledge_card_about_vector_embedding_model_selection.md	1	0.0	0.00	crash	compile fail after: tldr flagged for manual review
2026-04-02 16:20:02	C:\Users\PC\Documents\GitHub\cex\P01_knowledge\examples\p01_knowledge_card_create_knowledge_card_about_vector_embedding_model_selection.md	2	9.1	1.00	keep	polished formatting (whitespace cleanup)
2026-04-02 16:21:50	C:\Users\PC\Documents\GitHub\cex\P01_knowledge\examples\p01_knowledge_card_create_knowledge_card_about_knowledge_graph_construction_fro.md	1	0.0	0.00	crash	compile fail after: tldr flagged for manual review
2026-04-02 16:21:50	C:\Users\PC\Documents\GitHub\cex\P01_knowledge\examples\p01_knowledge_card_create_knowledge_card_about_knowledge_graph_construction_fro.md	2	9.1	1.00	keep	analyzed: reduce_prose: convert long prose sections into tables or bullet lists
2026-04-02 16:23:26	C:\Users\PC\Documents\GitHub\cex\P01_knowledge\examples\p01_knowledge_card_create_knowledge_card_about_fine_tuning_dataset_preparation.md	1	0.0	0.00	crash	compile fail after: tldr flagged for manual review
2026-04-02 16:23:26	C:\Users\PC\Documents\GitHub\cex\P01_knowledge\examples\p01_knowledge_card_create_knowledge_card_about_fine_tuning_dataset_preparation.md	2	0.0	0.00	crash	compile fail after: tldr flagged for manual review
2026-04-02 16:23:26	C:\Users\PC\Documents\GitHub\cex\P01_knowledge\examples\p01_knowledge_card_create_knowledge_card_about_fine_tuning_dataset_preparation.md	3	0.0	0.00	crash	compile fail after: tldr flagged for manual review
2026-04-02 16:24:21	C:\Users\PC\Documents\GitHub\cex\P01_knowledge\examples\p01_knowledge_card_create_knowledge_card_about_fine_tuning_dataset_preparation.md	1	0.0	0.00	crash	compile fail: Add "Common Failure Modes" section with specific perplexity thresholds and real-world pitfalls to increase insight depth beyond standard documentation
2026-04-02 16:24:45	C:\Users\PC\Documents\GitHub\cex\P01_knowledge\examples\p01_knowledge_card_create_knowledge_card_about_fine_tuning_dataset_preparation.md	2	0.0	0.00	crash	compile fail: Add advanced validation techniques and perplexity-based quality indicators to deepen insights beyond basic documentation
2026-04-02 16:25:25	C:\Users\PC\Documents\GitHub\cex\P01_knowledge\examples\p01_knowledge_card_create_knowledge_card_about_fine_tuning_dataset_preparation.md	3	0.0	0.00	crash	compile fail: Replace basic Quality Metrics table with sophisticated metrics including semantic diversity scores and distribution skewness to provide deeper practitioner insights
2026-04-02 16:26:33	C:\Users\PC\Documents\GitHub\cex\P01_knowledge\examples\p01_knowledge_card_create_knowledge_card_about_fine_tuning_dataset_preparation.md	4	9.0	1.00	keep	Add specific cost optimization calculations and performance benchmarks to provide deeper practical insights beyond standard documentation
2026-04-02 16:28:05	C:\Users\PC\Documents\GitHub\cex\P01_knowledge\examples\p01_knowledge_card_create_knowledge_card_about_supabase_pgvector_setup_for_rag.md	1	9.2	1.00	keep	analyzed: reduce_prose: convert long prose sections into tables or bullet lists
2026-04-02 16:29:19	C:\Users\PC\Documents\GitHub\cex\P01_knowledge\examples\p07_eval_dataset_create_schema_contract_for_training_dataset_quality_metrics.md	1	9.1	0.88	keep	added density_score: 0.88
2026-04-02 16:34:36	C:\Users\PC\Documents\GitHub\cex\P01_knowledge\examples\p01_knowledge_card_create_knowledge_card_about_docker_containerization_for_ai_s.md	1	0.0	0.00	crash	compile fail after: tldr flagged for manual review
