timestamp	file	round	quality	density	status	description
2026-04-01 21:24:34	C:\Users\PC\Documents\GitHub\cex\N01_intelligence\output\output_swot_analysis.md	0	8.7	1.00	skip	already at target
2026-04-01 21:24:35	C:\Users\PC\Documents\GitHub\cex\N02_marketing\output\output_dashboard_ui.md	0	8.9	1.00	skip	already at target
2026-04-01 21:24:35	C:\Users\PC\Documents\GitHub\cex\N01_intelligence\output\output_benchmark_report.md	0	8.7	1.00	skip	already at target
2026-04-01 21:24:35	C:\Users\PC\Documents\GitHub\cex\N02_marketing\output\output_social_card.md	0	8.9	1.00	skip	already at target
2026-04-01 21:24:35	C:\Users\PC\Documents\GitHub\cex\N01_intelligence\output\output_executive_summary.md	0	8.7	1.00	skip	already at target
2026-04-01 21:24:36	C:\Users\PC\Documents\GitHub\cex\N02_marketing\orchestration\dispatch_rule_social_publisher.md	0	8.9	1.00	skip	already at target
2026-04-01 21:24:36	C:\Users\PC\Documents\GitHub\cex\N01_intelligence\output\output_market_snapshot.md	0	8.7	1.00	skip	already at target
2026-04-01 21:24:36	C:\Users\PC\Documents\GitHub\cex\N02_marketing\orchestration\workflow_marketing.md	0	8.9	1.00	skip	already at target
2026-04-01 21:24:37	C:\Users\PC\Documents\GitHub\cex\N04_knowledge\knowledge\retriever_config_knowledge.md	0	8.8	0.86	skip	already at target
2026-04-01 21:24:37	C:\Users\PC\Documents\GitHub\cex\N04_knowledge\knowledge\knowledge_card_knowledge.md	0	8.9	0.84	skip	already at target
2026-04-01 21:24:37	C:\Users\PC\Documents\GitHub\cex\N04_knowledge\knowledge\rag_source_supabase.md	0	8.8	1.00	skip	already at target
2026-04-01 21:24:38	C:\Users\PC\Documents\GitHub\cex\N04_knowledge\knowledge\embedding_config_supabase.md	0	8.9	1.00	skip	already at target
2026-04-01 21:24:38	C:\Users\PC\Documents\GitHub\cex\N04_knowledge\architecture\agent_card_knowledge.md	0	8.8	1.00	skip	already at target
2026-04-01 21:24:38	C:\Users\PC\Documents\GitHub\cex\N02_marketing\output\output_style_guide.md	0	8.9	0.96	skip	already at target
2026-04-01 21:24:38	C:\Users\PC\Documents\GitHub\cex\N04_knowledge\agents\agent_knowledge.md	0	8.8	1.00	skip	already at target
2026-04-01 21:24:39	C:\Users\PC\Documents\GitHub\cex\N04_knowledge\knowledge\knowledge_card_supabase_data_layer.md	0	8.9	1.00	skip	already at target
2026-04-01 21:24:39	C:\Users\PC\Documents\GitHub\cex\N02_marketing\schemas\tailwind_palette_contract.md	0	8.8	1.00	skip	already at target
2026-04-01 21:24:40	C:\Users\PC\Documents\GitHub\cex\N04_knowledge\orchestration\dispatch_rule_knowledge.md	0	8.8	0.88	skip	already at target
2026-04-01 21:24:40	C:\Users\PC\Documents\GitHub\cex\N04_knowledge\tools\supabase_data_layer_tool.md	0	8.8	1.00	skip	already at target
2026-04-01 21:24:41	C:\Users\PC\Documents\GitHub\cex\N04_knowledge\quality\quality_gate_knowledge.md	0	8.8	0.90	skip	already at target
2026-04-01 21:24:42	C:\Users\PC\Documents\GitHub\cex\N04_knowledge\schemas\taxonomy_contract.md	0	8.8	1.00	skip	already at target
2026-04-01 21:24:42	C:\Users\PC\Documents\GitHub\cex\N04_knowledge\output\output_knowledge_graph.md	0	8.8	1.00	skip	already at target
2026-04-01 21:24:43	C:\Users\PC\Documents\GitHub\cex\N04_knowledge\orchestration\dispatch_rule_supabase.md	0	8.8	1.00	skip	already at target
2026-04-01 21:24:44	C:\Users\PC\Documents\GitHub\cex\N04_knowledge\orchestration\workflow_supabase_setup.md	0	8.8	1.00	skip	already at target
2026-04-01 21:24:44	C:\Users\PC\Documents\GitHub\cex\N04_knowledge\output\output_kc_audit_report.md	0	8.8	1.00	skip	already at target
2026-04-01 21:24:45	C:\Users\PC\Documents\GitHub\cex\N02_marketing\output\landing_page_template.md	0	8.8	0.99	skip	already at target
2026-04-01 21:24:45	C:\Users\PC\Documents\GitHub\cex\N01_intelligence\knowledge\rag_source_intelligence.md	0	8.8	0.94	skip	already at target
2026-04-01 21:24:46	C:\Users\PC\Documents\GitHub\cex\N01_intelligence\output\output_competitive_grid.md	0	8.8	1.00	skip	already at target
2026-04-01 21:24:47	C:\Users\PC\Documents\GitHub\cex\N02_marketing\output\output_email_template.md	0	8.8	1.00	skip	already at target
2026-04-01 21:29:01	C:\Users\PC\Documents\GitHub\cex\N04_knowledge\quality\scoring_rubric_knowledge.md	1	8.5	1.00	discard	polished formatting (whitespace cleanup)
2026-04-01 21:29:01	C:\Users\PC\Documents\GitHub\cex\N04_knowledge\quality\scoring_rubric_knowledge.md	2	8.5	1.00	discard	polished formatting (whitespace cleanup)
2026-04-01 21:29:01	C:\Users\PC\Documents\GitHub\cex\N04_knowledge\quality\scoring_rubric_knowledge.md	3	8.5	1.00	discard	polished formatting (whitespace cleanup)
2026-04-01 21:29:21	C:\Users\PC\Documents\GitHub\cex\N04_knowledge\quality\scoring_rubric_knowledge.md	1	8.6	1.00	keep	Add Usage Guidelines section to improve actionability with when-to-use guidance and application examples
2026-04-01 21:29:46	C:\Users\PC\Documents\GitHub\cex\N04_knowledge\quality\scoring_rubric_knowledge.md	2	8.7	1.00	keep	Add concrete scoring examples section showing what each score level looks like in practice for better actionability
2026-04-01 21:30:19	C:\Users\PC\Documents\GitHub\cex\N04_knowledge\quality\scoring_rubric_knowledge.md	3	8.8	1.00	keep	Add Quick Reference section with rapid scoring checklist to improve actionability and workflow efficiency
2026-04-01 21:30:52	C:\Users\PC\Documents\GitHub\cex\N04_knowledge\quality\scoring_rubric_knowledge.md	4	8.8	1.00	discard	Convert Usage Guidelines "How to score" bullets into dense table format for improved actionability
2026-04-01 21:31:26	C:\Users\PC\Documents\GitHub\cex\N04_knowledge\quality\scoring_rubric_knowledge.md	5	8.8	1.00	discard	Add missing Freshness dimension examples to complete scoring examples coverage for all 5 weighted dimensions
2026-04-01 21:31:27	C:\Users\PC\Documents\GitHub\cex\N04_knowledge\output\output_sql_migration.md	1	8.5	0.93	discard	analyzed: reduce_prose: convert long prose sections into tables or bullet lists
2026-04-01 21:31:27	C:\Users\PC\Documents\GitHub\cex\N04_knowledge\output\output_sql_migration.md	2	8.5	0.93	discard	analyzed: reduce_prose: convert long prose sections into tables or bullet lists
2026-04-01 21:31:28	C:\Users\PC\Documents\GitHub\cex\N04_knowledge\output\output_sql_migration.md	3	8.5	0.93	discard	analyzed: reduce_prose: convert long prose sections into tables or bullet lists
2026-04-01 21:31:48	C:\Users\PC\Documents\GitHub\cex\N04_knowledge\output\output_sql_migration.md	1	8.7	1.00	keep	Add Usage section with variable population guide and real example to improve actionability
2026-04-01 21:32:12	C:\Users\PC\Documents\GitHub\cex\N04_knowledge\output\output_sql_migration.md	2	8.8	1.00	keep	Add Validation section with specific verification steps after migration to improve actionability
2026-04-01 21:32:40	C:\Users\PC\Documents\GitHub\cex\N04_knowledge\output\output_sql_migration.md	3	8.8	1.00	discard	Add Troubleshooting section with common migration issues and solutions to improve actionability
2026-04-01 21:33:09	C:\Users\PC\Documents\GitHub\cex\N04_knowledge\output\output_sql_migration.md	4	8.9	1.00	keep	Add concrete example showing fully populated SQL output to improve actionability and understanding
2026-04-01 21:33:40	C:\Users\PC\Documents\GitHub\cex\N04_knowledge\output\output_sql_migration.md	5	8.9	1.00	discard	Add SQL escaping guidance for BODY variable to prevent injection errors in practice
2026-04-01 21:33:40	C:\Users\PC\Documents\GitHub\cex\N04_knowledge\output\output_embedding_batch.md	1	8.5	1.00	discard	analyzed: add_template: output templates need a ## Template section
2026-04-01 21:33:41	C:\Users\PC\Documents\GitHub\cex\N04_knowledge\output\output_embedding_batch.md	2	8.5	1.00	discard	analyzed: add_template: output templates need a ## Template section
2026-04-01 21:33:41	C:\Users\PC\Documents\GitHub\cex\N04_knowledge\output\output_embedding_batch.md	3	8.5	1.00	discard	analyzed: add_template: output templates need a ## Template section
2026-04-01 21:33:59	C:\Users\PC\Documents\GitHub\cex\N04_knowledge\output\output_embedding_batch.md	1	8.7	1.00	keep	Add Usage section with concrete scenarios and implementation examples to improve actionability
2026-04-01 21:34:19	C:\Users\PC\Documents\GitHub\cex\N04_knowledge\output\output_embedding_batch.md	2	8.8	1.00	keep	Add Anti-Patterns section to improve actionability by showing common mistakes to avoid
2026-04-01 21:34:45	C:\Users\PC\Documents\GitHub\cex\N04_knowledge\output\output_embedding_batch.md	3	8.8	1.00	discard	Expand Pipeline section with specific implementation steps and configuration details to improve actionability
2026-04-01 21:35:11	C:\Users\PC\Documents\GitHub\cex\N04_knowledge\output\output_embedding_batch.md	4	8.8	1.00	discard	Add Schema section with field validation criteria to improve actionability for systems consuming this output format
2026-04-01 21:35:42	C:\Users\PC\Documents\GitHub\cex\N04_knowledge\output\output_embedding_batch.md	5	8.8	1.00	discard	Enhance Batch Metadata section with operational metrics and processing details to improve actionability
2026-04-01 21:35:43	C:\Users\PC\Documents\GitHub\cex\N01_intelligence\memory\embedding_config_intelligence.md	1	8.5	0.88	discard	added density_score: 0.88
2026-04-01 21:35:43	C:\Users\PC\Documents\GitHub\cex\N01_intelligence\memory\embedding_config_intelligence.md	2	8.5	0.88	discard	added density_score: 0.88
2026-04-01 21:35:43	C:\Users\PC\Documents\GitHub\cex\N01_intelligence\memory\embedding_config_intelligence.md	3	8.5	0.88	discard	added density_score: 0.88
2026-04-01 21:36:04	C:\Users\PC\Documents\GitHub\cex\N01_intelligence\memory\embedding_config_intelligence.md	1	8.7	0.94	keep	Add Usage Guidelines section with when-to-use scenarios and concrete examples to improve actionability
2026-04-01 21:36:29	C:\Users\PC\Documents\GitHub\cex\N01_intelligence\memory\embedding_config_intelligence.md	2	8.8	0.97	keep	Add Performance Benchmarks section with specific metrics to improve actionability and validation
2026-04-01 21:36:52	C:\Users\PC\Documents\GitHub\cex\N01_intelligence\memory\embedding_config_intelligence.md	3	8.9	0.99	keep	Convert Model Rationale section to structured table format for improved density and scanability
2026-04-01 21:37:18	C:\Users\PC\Documents\GitHub\cex\N01_intelligence\memory\embedding_config_intelligence.md	4	8.9	1.00	discard	Convert Chunking Strategy section from prose to structured table format for improved density
2026-04-01 21:37:51	C:\Users\PC\Documents\GitHub\cex\N01_intelligence\memory\embedding_config_intelligence.md	5	8.9	1.00	discard	Add Anti-Patterns subsection to Usage Guidelines to improve actionability with specific pitfalls to avoid
2026-04-01 21:37:52	C:\Users\PC\Documents\GitHub\cex\N01_intelligence\output\output_source_dossier.md	1	8.6	1.00	discard	polished formatting (whitespace cleanup)
2026-04-01 21:37:53	C:\Users\PC\Documents\GitHub\cex\N01_intelligence\output\output_source_dossier.md	2	8.6	1.00	discard	polished formatting (whitespace cleanup)
2026-04-01 21:37:53	C:\Users\PC\Documents\GitHub\cex\N01_intelligence\output\output_source_dossier.md	3	8.6	1.00	discard	polished formatting (whitespace cleanup)
2026-04-01 21:38:11	C:\Users\PC\Documents\GitHub\cex\N01_intelligence\output\output_source_dossier.md	1	8.7	1.00	keep	Add Usage Guidelines section with when-to-use scenarios and quality criteria to improve actionability
2026-04-01 21:38:35	C:\Users\PC\Documents\GitHub\cex\N01_intelligence\output\output_source_dossier.md	2	8.8	1.00	keep	Add validation checklist section to provide concrete quality verification steps
2026-04-01 21:39:03	C:\Users\PC\Documents\GitHub\cex\N01_intelligence\output\output_source_dossier.md	3	8.9	1.00	keep	Add concrete example section showing a filled-out source dossier to improve actionability with real-world demonstration
2026-04-01 21:39:37	C:\Users\PC\Documents\GitHub\cex\N01_intelligence\output\output_source_dossier.md	4	8.9	1.00	discard	Convert Quality Criteria from bullet list to detailed table with specific examples to improve density and actionability
2026-04-01 21:40:11	C:\Users\PC\Documents\GitHub\cex\N01_intelligence\output\output_source_dossier.md	5	8.9	1.00	discard	Convert Quality Criteria bullet list to compact scoring table for improved density and quick reference
2026-04-01 21:40:12	C:\Users\PC\Documents\GitHub\cex\N04_knowledge\schemas\database_schema_contract.md	1	8.6	1.00	discard	analyzed: add_field_table: schemas need a field/type/description table
2026-04-01 21:40:12	C:\Users\PC\Documents\GitHub\cex\N04_knowledge\schemas\database_schema_contract.md	2	8.6	1.00	discard	analyzed: add_field_table: schemas need a field/type/description table
2026-04-01 21:40:12	C:\Users\PC\Documents\GitHub\cex\N04_knowledge\schemas\database_schema_contract.md	3	8.6	1.00	discard	analyzed: add_field_table: schemas need a field/type/description table
2026-04-01 21:40:32	C:\Users\PC\Documents\GitHub\cex\N04_knowledge\schemas\database_schema_contract.md	1	8.8	1.00	keep	Add Table Relationships section with practical query patterns to improve actionability
2026-04-01 21:41:00	C:\Users\PC\Documents\GitHub\cex\N04_knowledge\schemas\database_schema_contract.md	2	8.9	1.00	keep	Add Constraints & Validation section with business rules and data integrity constraints to improve implementation guidance
2026-04-01 21:41:30	C:\Users\PC\Documents\GitHub\cex\N04_knowledge\schemas\database_schema_contract.md	3	8.9	1.00	discard	Add Setup & Migration section with step-by-step implementation order to improve deployment actionability
2026-04-01 21:42:02	C:\Users\PC\Documents\GitHub\cex\N04_knowledge\schemas\database_schema_contract.md	4	8.9	1.00	discard	Add Performance & Indexing section with specific guidance on index usage and query optimization patterns
2026-04-01 21:42:35	C:\Users\PC\Documents\GitHub\cex\N04_knowledge\schemas\database_schema_contract.md	5	8.9	1.00	discard	Add Security & Access Control section with RLS policy examples to improve Supabase-specific implementation guidance
2026-04-01 21:42:36	C:\Users\PC\Documents\GitHub\cex\N01_intelligence\output\output_research_brief.md	1	8.6	1.00	discard	polished formatting (whitespace cleanup)
2026-04-01 21:42:36	C:\Users\PC\Documents\GitHub\cex\N01_intelligence\output\output_research_brief.md	2	8.6	1.00	discard	polished formatting (whitespace cleanup)
2026-04-01 21:42:36	C:\Users\PC\Documents\GitHub\cex\N01_intelligence\output\output_research_brief.md	3	8.6	1.00	discard	polished formatting (whitespace cleanup)
2026-04-01 21:42:49	C:\Users\PC\Documents\GitHub\cex\N01_intelligence\output\output_research_brief.md	1	8.6	1.00	discard	Add when_to_use field to frontmatter for better completeness and guidance
2026-04-01 21:43:09	C:\Users\PC\Documents\GitHub\cex\N01_intelligence\output\output_research_brief.md	2	8.7	1.00	keep	Add Usage Guidelines section with when-to-use scenarios, examples, and anti-patterns to improve actionability
2026-04-01 21:43:30	C:\Users\PC\Documents\GitHub\cex\N01_intelligence\output\output_research_brief.md	3	8.8	1.00	keep	Expand Example Requests section into a comprehensive table format showing good vs bad research briefs across different categories to improve actionability and density
2026-04-01 21:43:58	C:\Users\PC\Documents\GitHub\cex\N01_intelligence\output\output_research_brief.md	4	8.8	1.00	discard	Add Depth Levels section to explain L1/L2/L3 research depths referenced in template for better actionability
2026-04-01 21:44:28	C:\Users\PC\Documents\GitHub\cex\N01_intelligence\output\output_research_brief.md	5	8.9	1.00	keep	Add Complete Example section showing a fully filled-out research brief to improve actionability
2026-04-01 21:44:29	C:\Users\PC\Documents\GitHub\cex\N01_intelligence\schemas\source_quality_contract.md	1	8.6	1.00	discard	polished formatting (whitespace cleanup)
2026-04-01 21:44:30	C:\Users\PC\Documents\GitHub\cex\N01_intelligence\schemas\source_quality_contract.md	2	8.6	1.00	discard	polished formatting (whitespace cleanup)
2026-04-01 21:44:30	C:\Users\PC\Documents\GitHub\cex\N01_intelligence\schemas\source_quality_contract.md	3	8.6	1.00	discard	polished formatting (whitespace cleanup)
2026-04-01 21:44:49	C:\Users\PC\Documents\GitHub\cex\N01_intelligence\schemas\source_quality_contract.md	1	8.7	1.00	keep	Add "Usage Examples" section with concrete source scoring examples to improve actionability and demonstrate practical application of the schema.
2026-04-01 21:45:12	C:\Users\PC\Documents\GitHub\cex\N01_intelligence\schemas\source_quality_contract.md	2	8.8	1.00	keep	Add Implementation Guidelines section with when-to-use scenarios, anti-patterns, and workflow guidance to improve actionability
2026-04-01 21:45:36	C:\Users\PC\Documents\GitHub\cex\N01_intelligence\schemas\source_quality_contract.md	3	8.8	1.00	discard	Add bias assessment criteria table to provide concrete guidance for evaluating source bias levels
2026-04-01 21:46:03	C:\Users\PC\Documents\GitHub\cex\N01_intelligence\schemas\source_quality_contract.md	4	8.8	1.00	discard	Add Quality Gates section with concrete thresholds and decision criteria for source acceptance/rejection
2026-04-01 21:46:29	C:\Users\PC\Documents\GitHub\cex\N01_intelligence\schemas\source_quality_contract.md	5	8.8	1.00	discard	Add bias scoring values to clarify the reliability formula calculation
2026-04-01 21:46:30	C:\Users\PC\Documents\GitHub\cex\N01_intelligence\schemas\trend_detection_contract.md	1	8.6	1.00	discard	polished formatting (whitespace cleanup)
2026-04-01 21:46:30	C:\Users\PC\Documents\GitHub\cex\N01_intelligence\schemas\trend_detection_contract.md	2	8.6	1.00	discard	polished formatting (whitespace cleanup)
2026-04-01 21:46:31	C:\Users\PC\Documents\GitHub\cex\N01_intelligence\schemas\trend_detection_contract.md	3	8.6	1.00	discard	polished formatting (whitespace cleanup)
2026-04-01 21:46:50	C:\Users\PC\Documents\GitHub\cex\N01_intelligence\schemas\trend_detection_contract.md	1	8.8	1.00	keep	Add Usage Guidelines section with when-to-use scenarios and anti-patterns to improve actionability
2026-04-01 21:47:13	C:\Users\PC\Documents\GitHub\cex\N01_intelligence\schemas\trend_detection_contract.md	2	8.8	1.00	discard	Replace brief examples with comprehensive table showing complete trend signal records to improve density and actionability
2026-04-01 21:47:35	C:\Users\PC\Documents\GitHub\cex\N01_intelligence\schemas\trend_detection_contract.md	3	8.8	1.00	discard	Expand confidence mapping with detailed assessment criteria and add validation checklist
2026-04-01 21:47:58	C:\Users\PC\Documents\GitHub\cex\N01_intelligence\schemas\trend_detection_contract.md	4	8.8	1.00	discard	Add Impact Assessment guidelines to make business impact evaluation more specific and actionable
2026-04-01 21:48:25	C:\Users\PC\Documents\GitHub\cex\N01_intelligence\schemas\trend_detection_contract.md	5	8.8	1.00	discard	Add "So What Guidelines" section to explain how to write effective business implications since this is a key actionability field
2026-04-01 21:48:26	C:\Users\PC\Documents\GitHub\cex\N04_knowledge\feedback\quality_gate_knowledge.md	1	8.6	1.00	discard	polished formatting (whitespace cleanup)
2026-04-01 21:48:26	C:\Users\PC\Documents\GitHub\cex\N04_knowledge\feedback\quality_gate_knowledge.md	2	8.6	1.00	discard	polished formatting (whitespace cleanup)
2026-04-01 21:48:26	C:\Users\PC\Documents\GitHub\cex\N04_knowledge\feedback\quality_gate_knowledge.md	3	8.6	1.00	discard	polished formatting (whitespace cleanup)
2026-04-01 21:48:48	C:\Users\PC\Documents\GitHub\cex\N04_knowledge\feedback\quality_gate_knowledge.md	1	8.8	1.00	keep	Add Usage Guidelines section with when-to-use scenarios, implementation steps, and concrete examples to improve actionability
2026-04-01 21:49:13	C:\Users\PC\Documents\GitHub\cex\N04_knowledge\feedback\quality_gate_knowledge.md	2	8.8	1.00	discard	Add troubleshooting section with specific remediation steps for each gate failure to improve actionability
2026-04-01 21:49:41	C:\Users\PC\Documents\GitHub\cex\N04_knowledge\feedback\quality_gate_knowledge.md	3	8.8	1.00	discard	Add Anti-Patterns section with concrete examples of what NOT to do to improve actionability and complement existing guidelines
2026-04-01 21:50:16	C:\Users\PC\Documents\GitHub\cex\N04_knowledge\feedback\quality_gate_knowledge.md	4	8.9	1.00	keep	Add Validation Workflow section with step-by-step process to improve actionability and provide clear implementation guidance
2026-04-01 21:50:56	C:\Users\PC\Documents\GitHub\cex\N04_knowledge\feedback\quality_gate_knowledge.md	5	8.9	1.00	discard	Convert Pass/Fail examples into comprehensive table showing specific examples for each quality dimension
2026-04-01 21:50:57	C:\Users\PC\Documents\GitHub\cex\N04_knowledge\output\output_finetune_dataset.md	1	8.6	0.99	discard	analyzed: add_template: output templates need a ## Template section
2026-04-01 21:50:57	C:\Users\PC\Documents\GitHub\cex\N04_knowledge\output\output_finetune_dataset.md	2	8.6	0.99	discard	analyzed: add_template: output templates need a ## Template section
2026-04-01 21:50:57	C:\Users\PC\Documents\GitHub\cex\N04_knowledge\output\output_finetune_dataset.md	3	8.6	0.99	discard	analyzed: add_template: output templates need a ## Template section
2026-04-01 21:51:18	C:\Users\PC\Documents\GitHub\cex\N04_knowledge\output\output_finetune_dataset.md	1	8.8	1.00	keep	Add Usage Guidelines section with when-to-use scenarios and anti-patterns to improve actionability
2026-04-01 21:51:37	C:\Users\PC\Documents\GitHub\cex\N04_knowledge\output\output_finetune_dataset.md	2	8.8	1.00	discard	Convert Generation Rules from bullet points to structured table for better density and scannability
2026-04-01 21:52:04	C:\Users\PC\Documents\GitHub\cex\N04_knowledge\output\output_finetune_dataset.md	3	8.8	1.00	discard	Add Quality Control section with specific validation steps and metrics to improve actionability
2026-04-01 21:52:37	C:\Users\PC\Documents\GitHub\cex\N04_knowledge\output\output_finetune_dataset.md	4	8.8	1.00	discard	Add more diverse, concrete examples across different domains to improve actionability and demonstrate versatility
